D-Bridge & Kabuki present: New Forms,2016-10-20T00:00:00.000,2016-10-20T23:59:00.000,2016-10-21T10:00:00.000,"Kabuki, Addison Groove, Soulmind",Watergate,/events/881809,28
Frank Music,2016-10-20T00:00:00.000,2016-10-20T23:00:00.000,2016-10-21T06:00:00.000,"Markus Mutzenbacher, Johannes Albert, Iron Curtis",Farbfernseher,/events/887759,21
we.Love.Mexikaner mit Ale Castro,2016-10-20T00:00:00.000,2016-10-20T19:00:00.000,2016-10-21T06:00:00.000,Ale Castro,Minimal Bar,/events/884576,20
White Lie Invite Nagababa DJ Jim Panse,2016-10-20T00:00:00.000,2016-10-20T21:00:00.000,2016-10-21T04:00:00.000,,Repeat,/events/888713,18
Thirsty Thursday *Special Autumn Edition*,2016-10-20T00:00:00.000,2016-10-20T23:59:00.000,2016-10-21T09:00:00.000,"Marina Semren, KasBer, Sascha Sander, Polytoxikomanie",Chalet,/events/890256,18
Trapaholic Thursday,2016-10-20T00:00:00.000,2016-10-20T19:00:00.000,2016-10-21T04:00:00.000,,Promenaden Eck,/events/884640,11
Thursday Proggy Meets Psychedelic Theatre,2016-10-20T00:00:00.000,2016-10-20T23:00:00.000,2016-10-21T07:00:00.000,,Magdalena,/events/888105,10
THX vs Love Hangover,2016-10-20T00:00:00.000,2016-10-20T23:00:00.000,2016-10-21T05:00:00.000,"Radio Slave, Capablanca",Ballhaus Berlin,/events/888641,10
Dub Isotope,2016-10-19T00:00:00.000,2016-10-19T21:00:00.000,2016-10-20T23:59:00.000,Isotope,Stereo 33,/events/891403,9
Step Higher - Drum & Bass / Goa & Psy,2016-10-20T00:00:00.000,2016-10-20T23:00:00.000,2016-10-21T07:00:00.000,Upzet,Void Club,/events/892663,8
Donnerdogge,2016-10-20T00:00:00.000,2016-10-20T23:59:00.000,2016-10-21T15:00:00.000,"Ale Castro, Chris Hanke",Golden Gate,/events/884453,6
Freiräume Erobern - von Berlin bis Nach Athen,2016-10-20T00:00:00.000,2016-10-20T22:00:00.000,2016-10-21T06:00:00.000,,Humboldthain Club,/events/888887,5
Elektronischer Donnerstag: Suruba,2016-10-20T00:00:00.000,2016-10-20T23:00:00.000,2016-10-21T08:00:00.000,"Projekt Gestalten, Spencer Reed",Schwuz,/events/883843,4
As Usual. /// with Fred Ross & Steve Challier,2016-10-20T00:00:00.000,2016-10-20T22:00:00.000,2016-10-21T06:00:00.000,Steve Challier,Crack Bellmer,/events/887917,4
Jerusalem in my Heart,2016-10-20T00:00:00.000,2016-10-20T19:30:00.000,2016-10-20T23:59:00.000,Jerusalem In My Heart,ehemaliges Stummfilmkino Delphi,/events/880241,2
Sweet Music,2016-10-20T00:00:00.000,2016-10-20T18:00:00.000,2016-10-21T02:00:00.000,Femalemacho,Solar,/events/886861,2
Elektrodonnerstag,2016-10-20T00:00:00.000,2016-10-20T22:00:00.000,2016-10-21T09:00:00.000,"Grace Thompson, Grace Thompson",Der Weiße Hase,/events/890527,2
Gavlyn & Reverie /w. DJ Lara & That Fuckin Sara,2016-10-20T00:00:00.000,2016-10-20T20:00:00.000,2016-10-20T23:00:00.000,,YAAM Berlin,/events/884817,1
Ray Mann,2016-10-20T00:00:00.000,2016-10-20T22:00:00.000,2016-10-21T02:00:00.000,Ray Mann,Cake Club,/events/886517,1
Bubaka: Kaitaro 'live',2016-10-20T00:00:00.000,2016-10-20T21:00:00.000,2016-10-21T05:00:00.000,Kaitaro,HRD Bar,/events/889600,1
Thank you Thursday,2016-10-20T00:00:00.000,2016-10-20T19:00:00.000,2016-10-21T04:00:00.000,KNIPP,Süss War Gestern,/events/875706,22
Lebe Lieber Ungewöhnlich,2016-10-20T00:00:00.000,2016-10-20T23:00:00.000,2016-10-21T09:00:00.000,Holger Pohl,AVA Club,/events/881579,9
"Home Again with Dubspeeka, Kevin Knapp, Michael Bibi",2016-10-21T00:00:00.000,2016-10-21T23:59:00.000,2016-10-22T11:30:00.000,"Dubspeeka, Kevin Knapp, Michael Bibi, Thabo, Distale, Renzky, Michael Stach",Ritter Butzke,/events/862602,187
Killekill: Umwelt Album Release,2016-10-21T00:00:00.000,2016-10-21T22:00:00.000,2016-10-22T22:00:00.000,"Umwelt, Alienata, Moralez, Morah, DJ Flush, Kuno, Voitax, Monya, Swarm Intelligence, Paàl, INVIA",Griessmuehle,/events/881286,128
Birgit und der Wolf,2016-10-21T00:00:00.000,2016-10-21T23:59:00.000,2016-10-22T10:00:00.000,"Jan Oberlaender, Wonkers, Heimlich Knüller, Jamaica Suk, Yannick Robyns, Rocko Garoni, Grey Pantone, Andi de Luxe",Birgit,/events/877801,120
Colours Of Bass: Troyboi,2016-10-21T00:00:00.000,2016-10-21T23:30:00.000,2016-10-22T08:00:00.000,"TroyBoi, Soulmind, Grzly Adams, Genys",Gretchen,/events/879746,119
"Luvthang Pres: Solar, Fort Romeau & Nummer",2016-10-21T00:00:00.000,2016-10-21T23:00:00.000,2016-10-22T08:00:00.000,"Solar, Fort Romeau, Nummer, Andi Gee",Prince Charles,/events/873617,118
Bordel des Arts - Detection & Reflection,2016-10-20T00:00:00.000,2016-10-20T22:00:00.000,2016-10-21T23:59:00.000,"Teenage Mutants, Mutlu, Leon Licht, #INSTANTBONER, Sokool, WAYNETTE, Andlee, Ryan Mathiesen, Mike Book, Casimir von Oettingen, Electronic Elephant, Nikklaas, Daniel Archut, Chroma, L'amitie, Carsten Conrad, Martin K, Magnutze, Daensen, Rafaele Castiglione, Sam Shure, JurieMember, Timboletti, Robin Dey",Renate,/events/865443,94
Finest Friday,2016-10-21T00:00:00.000,2016-10-21T23:59:00.000,2016-10-22T12:00:00.000,"D.C.DJ Soulmind, Lakuti, Louie Vega, Tama Sumo",Berghain | Panorama Bar | Säule,/events/879856,86
Trueledge,2016-10-21T00:00:00.000,2016-10-21T23:59:00.000,2016-10-22T08:00:00.000,"DJ Pete, Tim Xavier, Danny Isola, Kamue",Arena Club,/events/832562,85
Walls Pres. 5 Years Wall Music with Samuel L Session & Dino Sabatini,2016-10-21T00:00:00.000,2016-10-21T23:59:00.000,2016-10-22T12:00:00.000,"Samuel L Session, Dino Sabatini, Mike Wall, Sansui, Christian Rütz, Alvaro Suarez",Lokschuppen Berlin,/events/856896,84
Echoes.08,2016-10-21T00:00:00.000,2016-10-21T23:59:00.000,2016-10-22T13:00:00.000,"Convextion, Mike Huckaby, Refracted, Stojche, Xosar, Shawn O'Sullivan, Via App, Blush Response, Mischa",Tresor / Globus,/events/880463,76
Deep Vibes,2016-10-21T00:00:00.000,2016-10-21T23:00:00.000,2016-10-22T06:00:00.000,,TBA - Berlin,/events/881039,46
Joyce Muniz Album Release Party with Jozif & Shir Khan,2016-10-21T00:00:00.000,2016-10-21T23:59:00.000,2016-10-22T10:00:00.000,"Joyce Muniz, jozif, Shir Khan, High Had",Chalet,/events/849719,37
"Henriette House /w. Vlad Caia, Ody Arts, Quell & More",2016-10-21T00:00:00.000,2016-10-21T23:59:00.000,2016-10-22T12:00:00.000,"Vlad Caia, Randall M, ODY arts, Interplay, Sebastian Plössner, Quell, Klaaar, Miimo",Renate,/events/885643,36
"Charité with Kotelett & Zadak, Edward Ean & Mr. Schug uvm.",2016-10-21T00:00:00.000,2016-10-21T23:59:00.000,2016-10-22T09:45:00.000,"Kotelett&Zadak, Kotelett, Edward Ean, Mr.Schug, Sabrina Mue, Welldone, Audio.Noise, Oliver Olschgo",Burg Schnabel,/events/889510,36
Watergate Nacht,2016-10-21T00:00:00.000,2016-10-21T23:59:00.000,2016-10-22T11:00:00.000,"Tiefschwarz, La Fleur, Matthias Meyer, Jimi Jules, Tom Peters, Sebastian Wilck",Watergate,/events/882995,35
"Humboldthain Heat with m50, Niro, Marius Reisser, DJ Smut",2016-10-21T00:00:00.000,2016-10-21T23:59:00.000,2016-10-22T09:00:00.000,"m50, Niro Perrone, Marius Reisser",Humboldthain Club,/events/879340,34
"Incubation / Andre Kronert, Joton, Eduardo De La Calle",2016-10-21T00:00:00.000,2016-10-21T23:59:00.000,2016-10-22T10:00:00.000,"Andre Kronert, Joton, Juerga, Eduardo de la Calle, Norman Methner",Magdalena,/events/873218,34
Which way to the Stars w/ Keep Schtum & Boogiemann,2016-10-21T00:00:00.000,2016-10-21T22:00:00.000,2016-10-22T07:00:00.000,"Stan Tropic, Boogiemann",Crack Bellmer,/events/881745,31
"Grafiti Tapes with Luca Lozano, Mr. Ho and Omega III",2016-10-21T00:00:00.000,2016-10-21T23:59:00.000,2016-10-22T06:00:00.000,"Luca Lozano, Mr. Ho, Omega III",OHM,/events/883773,28
Plastic House,2016-10-21T00:00:00.000,2016-10-21T23:00:00.000,2016-10-22T07:00:00.000,"Mimi, Rudee",Bohnengold,/events/886074,27
Tune In,2016-10-21T00:00:00.000,2016-10-21T23:59:00.000,2016-10-22T12:00:00.000,"Audio Werner, Voigtmann, Marc Schneider, Jichael Mackson",Hoppetosse,/events/885157,22
Katermukke,2016-10-21T00:00:00.000,2016-10-21T23:59:00.000,2016-10-22T12:00:00.000,"Sascha Cawa, Click | Click, vom Feisten, Lukas Endhardt",Kater Blau,/events/889341,22
Dazed State,2016-10-21T00:00:00.000,2016-10-21T23:59:00.000,2016-10-22T11:00:00.000,"Luis Hill, Manel Cluny, rusky",TBA - Berlin,/events/878330,21
Suena Hermosa Labelnight mit Alex Rath & Tanz Unter Freunden,2016-10-21T00:00:00.000,2016-10-21T19:00:00.000,2016-10-22T08:00:00.000,"Alex Rath, Tanz Unter Freunden",Minimal Bar,/events/884889,20
"Lost Again w:/ Vizard, Dave Dinger, Holger Nielson uvm",2016-10-21T00:00:00.000,2016-10-21T23:59:00.000,2016-10-22T12:00:00.000,"Vizard, Lars Moston, Dave Dinger, M.Rux",Polygon Club,/events/887834,19
"Lorem Ipse with Youand:Themachines, Jordan Peak, Nadine Hennig",2016-10-21T00:00:00.000,2016-10-21T23:59:00.000,2016-10-22T10:00:00.000,"youAND:THEMACHINES, youANDme, Jordan Peak, Nadine Hennig, Damian.Thorn",[ipsə],/events/889087,19
Süsser Pornokellerbumms,2016-10-21T00:00:00.000,2016-10-21T20:00:00.000,2016-10-22T09:00:00.000,Don Brazo,Süss War Gestern,/events/892516,14
Gate-Toasted,2016-10-21T00:00:00.000,2016-10-21T23:59:00.000,2016-10-22T10:00:00.000,"Bela Bang, Rocko Garoni",Golden Gate,/events/884457,13
We Love Dance Moves with David Roeglin and Relent,2016-10-21T00:00:00.000,2016-10-21T19:00:00.000,2016-10-22T08:00:00.000,"ROEGLIN, Relent",Promenaden Eck,/events/884642,13
Signs - A Psychedelic Progressive Trance Journey,2016-10-21T00:00:00.000,2016-10-21T23:00:00.000,2016-10-22T12:00:00.000,"Landmark, Second Side, Kaspar Krug, NK Porter",Der Weiße Hase,/events/891148,13
Free Party - Drum & Bass / Techno & House,2016-10-21T00:00:00.000,2016-10-21T23:00:00.000,2016-10-22T08:00:00.000,"Upzet, Tommy Lexxus, Tomax",Void Club,/events/892665,12
Ballroom Records Label Showcase,2016-10-21T00:00:00.000,2016-10-21T23:00:00.000,2016-10-22T06:00:00.000,"Bara Bröst, AlBird, Ale Castro, vom Feisten",Weekend,/events/888598,11
Adrian Sherwood & Dennis Bovell,2016-10-21T00:00:00.000,2016-10-21T20:00:00.000,2016-10-21T23:59:00.000,Dennis Bovell,YAAM Berlin,/events/867126,11
Elektrotüte,2016-10-21T00:00:00.000,2016-10-21T23:59:00.000,2016-10-22T12:00:00.000,"BreakNtune, JayKosy, Martin Telemann, Till Krimsen, Jason Lemm, Tami Ha, Klaus & Achim Selbst",M-BIA,/events/883157,10
All Night Long,2016-10-21T00:00:00.000,2016-10-21T23:00:00.000,2016-10-22T03:00:00.000,,Fuchsbau,/events/886474,9
Acido/Sued Night 01,2016-10-21T00:00:00.000,2016-10-21T23:00:00.000,2016-10-22T06:00:00.000,"Dynamo Dreesen, SVN",Acud Macht NEU,/events/888017,9
Akustik Akrobaten Bday & Heimat Showcase,2016-10-21T00:00:00.000,2016-10-21T23:00:00.000,2016-10-23T08:00:00.000,"Marcus Meya, Andree Wischnewski, Jonathan Ranzinger, Mathias Birnbaum, Frau LiLa, Marc van Tosh, Tanz Unter Freunden, Grey Pantone, Arbizu",Kulturhaus Kili,/events/891501,8
Schau 16: After Show Party,2016-10-21T00:00:00.000,2016-10-21T21:30:00.000,2016-10-22T06:00:00.000,Marlon Beatt,Kultstätte Keller,/events/891586,7
Nachtwache,2016-10-21T00:00:00.000,2016-10-21T22:00:00.000,2016-10-22T06:30:00.000,"Joal, Bruno Otranto, Rui Trintaeum",60 Hz,/events/891730,7
Electro Swing Revolution,2016-10-21T00:00:00.000,2016-10-21T23:00:00.000,2016-10-22T05:00:00.000,"The Carlson Two, Justin Fidèle",Frannz Club,/events/882675,6
ein Freitag mit Jan Brauer & Julian v. Hopffgarten,2016-10-21T00:00:00.000,2016-10-21T23:00:00.000,2016-10-22T06:00:00.000,"Brandt Brauer Frick, Julian v. Hopffgarten",Farbfernseher,/events/889683,6
HOT Topic x Mess,2016-10-21T00:00:00.000,2016-10-21T23:00:00.000,2016-10-22T08:00:00.000,"Hyperaktivist, Kate Miller, Jon Dark",Schwuz,/events/883844,2
Nordic Beats,2016-10-21T00:00:00.000,2016-10-21T18:00:00.000,2016-10-22T03:00:00.000,The Henrik Maneuver,Solar,/events/886862,2
Spaceship,2016-10-21T00:00:00.000,2016-10-21T18:00:00.000,2016-10-22T06:00:00.000,"Phonatic, JANEIN, Reka, Neele",Mensch Meier,/events/889178,2
Time for Some Action,2016-10-21T00:00:00.000,2016-10-21T23:00:00.000,2016-10-22T08:00:00.000,"Feindsoul, Feiertag",Cassiopeia,/events/881811,1
Soda Club,2016-10-21T00:00:00.000,2016-10-21T23:00:00.000,2016-10-22T07:00:00.000,,Soda Club,/events/883385,1
Electronic Nights with Diana Rada & Samuel Gieben,2016-10-21T00:00:00.000,2016-10-21T23:00:00.000,2016-10-22T08:00:00.000,"Diana Rada, Samuel Gieben",Beate Uwe,/events/890125,1
Shlomped,2016-10-21T00:00:00.000,2016-10-21T22:00:00.000,2016-10-22T05:00:00.000,"Hunni'd Jaws, WAKE",Repeat,/events/893935,1
MNE Debut Album Release Concert,2016-10-21T00:00:00.000,2016-10-21T19:00:00.000,2016-10-22T23:59:00.000,Miss Natasha Enquist,ehemaliges Stummfilmkino Delphi,/events/862349,1
"Scope presents: Andreas Lutz, Klara Ravat & Nenad Popov",2016-10-21T00:00:00.000,2016-10-21T20:00:00.000,2016-10-22T22:00:00.000,Andreas Lutz,Spektrum,/events/1036159,1
Electro Vibez by DJ Catattack,2016-10-21T00:00:00.000,2016-10-21T21:30:00.000,2016-10-22T05:00:00.000,,Kara Kas Bar,/events/893913,0
Buttons 34h,2016-10-21T00:00:00.000,2016-10-21T23:59:00.000,2016-10-23T10:00:00.000,"Akirahawks, Bézier, Honey Soundsystem, Doc Sleep, Jacob Meehan, Stanley Schmidt, Paolo Di Nola, Paul Sinh, Shingo Suwa, Mike Starr, Jerome Sydenham, DAHRAXT, Madalba",://about blank,/events/872210,61
Klubnacht,2016-10-22T00:00:00.000,2016-10-22T23:59:00.000,2016-10-24T06:00:00.000,"Jeroen Search, Cleric, Len Faki, Lewis Fautzi, Matrixxman, Regal, Roman Poncet, Setaoc Mass, UBX127, DJ LAG, Midland, Nan Kolè, Nick Höppner, PARAMIDA, Partok, Tim Sweeney",Berghain | Panorama Bar | Säule,/events/879858,214
Soulection - The Sound of Tomorrow ,2016-10-22T00:00:00.000,2016-10-22T23:45:00.000,2016-10-23T06:00:00.000,"Joe Kay, The Whooligan",[ipsə],/events/891575,167
Birgit ist Techno,2016-10-22T00:00:00.000,2016-10-22T22:00:00.000,2016-10-23T10:00:00.000,"DJ Emerson, Namito, Stefan Biniak, Daniel Schumann, Pascale Voltaire, Lucas Tesoin, Frieda Who?, Bazy, Mondee",Birgit,/events/875227,132
Exquisite Feierei / 2 Floors,2016-10-22T00:00:00.000,2016-10-22T23:59:00.000,2016-10-23T15:00:00.000,"Barem, Bloody Mary, Click | Click, Marvin Hey, Michael Placke, Lilly Deupré",Lokschuppen Berlin,/events/888028,131
Killekill: Umwelt Album Release,2016-10-21T00:00:00.000,2016-10-21T22:00:00.000,2016-10-22T22:00:00.000,"Umwelt, Alienata, Moralez, Morah, DJ Flush, Kuno, Voitax, Monya, Swarm Intelligence, Paàl, INVIA",Griessmuehle,/events/881286,128
"Texture with Baltra, TRP, Annanan, I/O & Zulian",2016-10-22T00:00:00.000,2016-10-22T23:59:00.000,2016-10-23T10:00:00.000,"Baltra, TRP, annanan, I/O, Zulian",Arena Club,/events/885772,104
"Our Hobby Is Different x Tropical Goth w./ Prosumer, The Horrorist, Richard Zepezauer, Shredder",2016-10-22T00:00:00.000,2016-10-22T22:00:00.000,2016-10-23T22:00:00.000,"Prosumer, Richard Zepezauer, Elbee Bad, Bastus, The Horrorist, Zanias",Griessmuehle,/events/887698,102
Buttons 34h,2016-10-22T00:00:00.000,2016-10-22T23:59:00.000,2016-10-23T10:00:00.000,"Akirahawks, Bézier, Honey Soundsystem, Doc Sleep, Jacob Meehan, Stanley Schmidt, Paolo Di Nola, Paul Sinh, Shingo Suwa, Mike Starr, Jerome Sydenham, DAHRAXT, Madalba",://about blank,/events/879994,59
"Hirschgarten with Julian Perez, Guy From Downstairs, Devan & Alex Giordano",2016-10-22T00:00:00.000,2016-10-22T23:59:00.000,2016-10-23T10:00:00.000,"Julian Perez, Guy From Downstairs, Devan",Chalet,/events/879685,47
Tresor.Klubnacht,2016-10-22T00:00:00.000,2016-10-22T23:59:00.000,2016-10-23T12:00:00.000,"Federico Molinari, Janina, Handmade, Philippe Petit, Lenny Posso, HGR",Tresor / Globus,/events/885061,42
Abstraktal Dimension 3rd Edtion,2016-10-22T00:00:00.000,2016-10-22T23:59:00.000,2016-10-23T08:00:00.000,"Resonance, Drafted, 14anger, CH-01, Kaczorek",Burg Schnabel,/events/887872,42
"Metro /w. Chymera, Slg, John Osborn, J Choirboy & More",2016-10-22T00:00:00.000,2016-10-22T23:59:00.000,2016-10-23T12:00:00.000,"John Osborn, J Choirboy, Sebastian Voigt, Chymera, SLG, Foehn & Jerome, Michal Zietara, Maxâge, Sebastian Galvani, Flo Scheuer",Renate,/events/880920,40
Samurai Music Feat. Clarity,2016-10-22T00:00:00.000,2016-10-22T23:59:00.000,2016-10-23T06:00:00.000,"Clarity, Presha",OHM,/events/880871,39
"Kosmonaut Meets Keller Label mit Philip Bader, Aparde, Acud, uvm",2016-10-22T00:00:00.000,2016-10-22T23:59:00.000,2016-10-23T12:00:00.000,"Philip Bader, Aparde, Acud, Swam:Thing, Marion Cobretti, Nicorus",Polygon Club,/events/881843,39
Nacht 22,2016-10-22T00:00:00.000,2016-10-22T23:00:00.000,2016-10-23T08:00:00.000,"Sub Human Bros, Langtunes, Iman Deeper, Daisuke Pak, Sam Z",AVA Club,/events/889397,37
S•a•s•o•m•o mit Audiojack / Scsi-9 / Sven Dohse / Dirty Doering / Ninze / Urubu Marinka u.v.a,2016-10-22T00:00:00.000,2016-10-22T23:59:00.000,2016-10-24T23:59:00.000,"JWL, SCSI-9, Audiojack, Cem Orlow, Amine K, Nils Ohrmann, Raphael Hofman, Dirty Doering, Krink, Sven Dohse, The Sorry Entertainers, David Mears, Caleesi, URUBU Marinka, Lotte Ahoi, Ninze, Geju, Burnhard, Josephine Wedekind, Stan Starry, Andreas Rauscher",Kater Blau,/events/886039,36
Colours Afterhour,2016-10-22T00:00:00.000,2016-10-22T08:00:00.000,2016-10-22T22:00:00.000,"ANFS, 3.14, Jackie G, Adlas, DJ Ion, Karschau, Tymotica",Griessmuehle,/events/892969,35
3000grad on Tour,2016-10-22T00:00:00.000,2016-10-22T23:00:00.000,2016-10-23T11:00:00.000,"Jpattersson, Dole & Kom, Green Lake Project, Seth Schwarz, Kollektiv Ost, Just Emma, Timboletti",Ritter Butzke,/events/879231,30
Upon You,2016-10-22T00:00:00.000,2016-10-22T23:59:00.000,2016-10-23T11:00:00.000,"Gregor Tresher, Marco Resmann, Ruede Hagelstein, Martin Landsky, Echonomist, Gunnar Stiller",Watergate,/events/882996,30
Beate Uwe Hitparade,2016-10-22T00:00:00.000,2016-10-22T23:00:00.000,2016-10-23T08:00:00.000,Phat Beat,Beate Uwe,/events/881383,28
Roundqube Musik & Friends,2016-10-22T00:00:00.000,2016-10-22T19:00:00.000,2016-10-23T07:00:00.000,"Francesco Passantino, BioN, Saša",Minimal Bar,/events/882526,26
Boom'n Bust,2016-10-22T00:00:00.000,2016-10-22T23:59:00.000,2016-10-23T12:00:00.000,"Cesar Merveille, Daniele Papini, Daylomar, Maxi Storrs, Tod Louie, Solaris, Argenis Brito",Hoppetosse,/events/880458,25
Magnetic Field Feat. Daniel Stefanik & Sven Tasnadi,2016-10-22T00:00:00.000,2016-10-22T23:00:00.000,2016-10-23T11:00:00.000,"Daniel Stefanik, Sven Tasnadi, Honschu Lee, Wardita, Der Eggert, Ohdus, Jensson",Void Club,/events/886846,25
True Class Aka Trujillo & Claas Brieler,2016-10-22T00:00:00.000,2016-10-22T23:00:00.000,2016-10-23T06:00:00.000,"True Class, Trujillo",Bohnengold,/events/886134,19
Most Wanted: Schlachthofbronx & Friends,2016-10-22T00:00:00.000,2016-10-22T23:30:00.000,2016-10-23T08:00:00.000,"Schlachthofbronx, Delfonic, R0byn",Gretchen,/events/880898,18
Thomas Lizzara & Stereo Expressand Joerns Big Birthday,2016-10-22T00:00:00.000,2016-10-22T23:59:00.000,2016-10-23T10:00:00.000,"Thomas Lizzara, Stereo Express, Pretty Pink, Vanessa Sukowski, Zusan, Annett Gapstream",Magdalena,/events/890080,18
Kellergedeck,2016-10-22T00:00:00.000,2016-10-22T20:00:00.000,2016-10-23T10:00:00.000,"Foolik, Superstrobe, Der Kosmonaut, Minijob",Kultstätte Keller,/events/886093,16
Süsser Pornokellerbumms,2016-10-22T00:00:00.000,2016-10-22T20:00:00.000,2016-10-23T09:00:00.000,"Sven Swade, Pornbugs",Süss War Gestern,/events/892518,16
Awesome Tapes From Africa,2016-10-22T00:00:00.000,2016-10-22T22:00:00.000,2016-10-23T04:00:00.000,"Awesome Tapes From Africa, Lamin Fofana",Acud Macht NEU,/events/888532,14
All Night with Dacapo and Modern Cults,2016-10-22T00:00:00.000,2016-10-22T19:00:00.000,2016-10-23T08:00:00.000,,Promenaden Eck,/events/884645,13
Diggin Deep,2016-10-22T00:00:00.000,2016-10-22T22:00:00.000,2016-10-23T07:00:00.000,Danny Russell,L.U.X.,/events/891896,11
Fish N Slips with Wiesel's Birthday,2016-10-22T00:00:00.000,2016-10-22T23:59:00.000,2016-10-23T10:00:00.000,"Killa, The Chosen Two, 100Tons",Golden Gate,/events/884459,9
The New Vibe,2016-10-22T00:00:00.000,2016-10-22T23:00:00.000,2016-10-23T18:00:00.000,"Superstrobe, Fritz Fridulin, Marc van Tosh, John Kotti",M-BIA,/events/883009,8
Akustik Akrobaten Bday & Heimat Showcase,2016-10-21T00:00:00.000,2016-10-21T23:00:00.000,2016-10-23T08:00:00.000,"Marcus Meya, Andree Wischnewski, Jonathan Ranzinger, Mathias Birnbaum, Frau LiLa, Marc van Tosh, Tanz Unter Freunden, Grey Pantone, Arbizu",Kulturhaus Kili,/events/891501,8
ein Samstag mit We are Now,2016-10-22T00:00:00.000,2016-10-22T23:00:00.000,2016-10-23T06:00:00.000,Convex Shape,Farbfernseher,/events/889686,7
All is Lost V,2016-10-22T00:00:00.000,2016-10-22T23:00:00.000,2016-10-23T06:00:00.000,Dahu,Weekend,/events/893451,7
Rave Against The Machine,2016-10-22T00:00:00.000,2016-10-22T23:00:00.000,2016-10-23T08:00:00.000,"Stazma The Junglechrist, Audiotist, Hitori Tori",Urban Spree,/events/876968,7
Sequential State Of Mind,2016-10-22T00:00:00.000,2016-10-22T20:00:00.000,2016-10-23T07:00:00.000,"Bobby Starrr, Mandel Turner",Crack Bellmer,/events/892976,6
Music Hospital present '' Vinyl All Night Long '' with Secret Act & Phat Beat,2016-10-22T00:00:00.000,2016-10-22T23:59:00.000,2016-10-23T05:15:00.000,Phat Beat,Emma Pea,/events/880376,5
"Fairys, Unicorns & Freaks",2016-10-22T00:00:00.000,2016-10-22T23:00:00.000,2016-10-23T03:30:00.000,Tom Nowa,Radio The Label Bar,/events/892569,5
Houssound,2016-10-22T00:00:00.000,2016-10-22T22:00:00.000,2016-10-23T02:00:00.000,Rotarydisco76,Mein Haus Am See,/events/875408,3
5vor12 Tokyo Redlight,2016-10-22T00:00:00.000,2016-10-22T10:00:00.000,2016-10-22T23:59:00.000,Bee Lincoln,Golden Gate,/events/884458,3
Heimat Meets Akustik Akrobaten,2016-10-22T00:00:00.000,2016-10-22T23:00:00.000,2016-10-23T07:30:00.000,"Grey Pantone, Arbizu",Kili Lounge,/events/893219,3
If I Ruled The World - an ode to Hiphop,2016-10-22T00:00:00.000,2016-10-22T20:00:00.000,2016-10-23T05:00:00.000,Klaas von Karlos,Panke,/events/892454,2
A Place to be Album Official presentation,2016-10-22T00:00:00.000,2016-10-22T18:00:00.000,2016-10-22T23:00:00.000,"daar, Karras Martínez, Godog",Hotel Riu Plaza Berlin,/events/893817,2
Soda Club,2016-10-22T00:00:00.000,2016-10-22T23:00:00.000,2016-10-23T07:00:00.000,,Soda Club,/events/883386,1
The Breaks UK Special,2016-10-22T00:00:00.000,2016-10-22T23:00:00.000,2016-10-23T06:00:00.000,Resoul,Cassiopeia,/events/886661,1
The Sweet Heat,2016-10-22T00:00:00.000,2016-10-22T18:00:00.000,2016-10-23T03:00:00.000,,Solar,/events/886863,1
"Banlieue Records with Judaah, Vio Dj & Benoit B",2016-10-22T00:00:00.000,2016-10-22T23:59:00.000,2016-10-23T06:00:00.000,"Judaah, Vio DJ, Benoit B",Sameheads,/events/887111,1
Eau De MuF,2016-10-22T00:00:00.000,2016-10-22T23:00:00.000,2016-10-23T07:00:00.000,"Francesca Lombardo, Phil Fuldner, Langenberg",Musik & Frieden,/events/890846,1
Masa (Manege 8),2016-10-22T00:00:00.000,2016-10-22T22:00:00.000,2016-10-23T02:00:00.000,,Nachbeben,/events/892587,1
Beats & Bites Autumn Edition,2016-10-22T00:00:00.000,2016-10-22T18:00:00.000,2016-10-23T02:00:00.000,Jav Alleciardi,Wombat's City Hostel Berlin,/events/892707,1
MNE Debut Album Release Concert,2016-10-21T00:00:00.000,2016-10-21T19:00:00.000,2016-10-22T23:59:00.000,Miss Natasha Enquist,ehemaliges Stummfilmkino Delphi,/events/862349,1
"Scope presents: Andreas Lutz, Klara Ravat & Nenad Popov",2016-10-21T00:00:00.000,2016-10-21T20:00:00.000,2016-10-22T22:00:00.000,Andreas Lutz,Spektrum,/events/1036159,1
Dirty Dancing Party ,2016-10-22T00:00:00.000,2016-10-22T23:00:00.000,2016-10-23T06:00:00.000,,YAAM Berlin,/events/884818,0
Buttons 34h,2016-10-21T00:00:00.000,2016-10-21T23:59:00.000,2016-10-23T10:00:00.000,"Akirahawks, Bézier, Honey Soundsystem, Doc Sleep, Jacob Meehan, Stanley Schmidt, Paolo Di Nola, Paul Sinh, Shingo Suwa, Mike Starr, Jerome Sydenham, DAHRAXT, Madalba",://about blank,/events/872210,61
Rumors,2016-10-22T00:00:00.000,2016-10-22T23:59:00.000,2016-10-23T06:00:00.000,,Subversiv e.V.,/events/868157,51
Klubnacht,2016-10-22T00:00:00.000,2016-10-22T23:59:00.000,2016-10-24T06:00:00.000,"Jeroen Search, Cleric, Len Faki, Lewis Fautzi, Matrixxman, Regal, Roman Poncet, Setaoc Mass, UBX127, DJ LAG, Midland, Nan Kolè, Nick Höppner, PARAMIDA, Partok, Tim Sweeney",Berghain | Panorama Bar | Säule,/events/879858,214
"Our Hobby Is Different x Tropical Goth w./ Prosumer, The Horrorist, Richard Zepezauer, Shredder",2016-10-22T00:00:00.000,2016-10-22T22:00:00.000,2016-10-23T22:00:00.000,"Prosumer, Richard Zepezauer, Elbee Bad, Bastus, The Horrorist, Zanias",Griessmuehle,/events/887698,102
S•a•s•o•m•o mit Audiojack / Scsi-9 / Sven Dohse / Dirty Doering / Ninze / Urubu Marinka u.v.a,2016-10-22T00:00:00.000,2016-10-22T23:59:00.000,2016-10-24T23:59:00.000,"JWL, SCSI-9, Audiojack, Cem Orlow, Amine K, Nils Ohrmann, Raphael Hofman, Dirty Doering, Krink, Sven Dohse, The Sorry Entertainers, David Mears, Caleesi, URUBU Marinka, Lotte Ahoi, Ninze, Geju, Burnhard, Josephine Wedekind, Stan Starry, Andreas Rauscher",Kater Blau,/events/886039,36
Daniel Boon All Night Long,2016-10-23T00:00:00.000,2016-10-23T22:00:00.000,2016-10-24T06:00:00.000,Daniel Boon,Magdalena,/events/873382,22
Lazy.Sunday mit Aramis & Freunde,2016-10-23T00:00:00.000,2016-10-23T19:00:00.000,2016-10-24T06:00:00.000,Sven Laux,Minimal Bar,/events/884895,20
Wild at Gate,2016-10-23T00:00:00.000,2016-10-23T10:00:00.000,2016-10-23T23:59:00.000,"Joal, Dennis Calmer, Andrea Chiovelli, Bruno Otranto, Lilithh",Golden Gate,/events/884463,18
Magnetic Field - Official Afterhour,2016-10-23T00:00:00.000,2016-10-23T10:00:00.000,2016-10-24T23:00:00.000,"Hochkultur54, Honschu Lee",Burg Schnabel,/events/891149,18
"Sonntagskinder with Fabe, James Flavour & Ma.to",2016-10-23T00:00:00.000,2016-10-23T23:59:00.000,2016-10-24T10:00:00.000,"Fabe, James Flavour, Dirt Crew, Ma.to",Chalet,/events/881874,17
Absolem Rondo,2016-10-23T00:00:00.000,2016-10-23T22:00:00.000,2016-10-24T09:00:00.000,"Lee Jones, Lee Jokes, Sqim, Nummer",Lokschuppen Berlin,/events/874148,15
Sunday Groove with Anthony Burke,2016-10-23T00:00:00.000,2016-10-23T19:00:00.000,2016-10-24T04:00:00.000,,Promenaden Eck,/events/884647,13
After Hour,2016-10-23T00:00:00.000,2016-10-23T10:00:00.000,2016-10-24T22:00:00.000,"Dejvid Kavazovic, Dejvid, Benjamin Knows, Welldone",Magdalena,/events/877719,12
