The Groove: Live,2023-11-14T00:00:00.000,2023-11-14T22:00:00.000,2023-11-15T01:00:00.000,The_Groove,Mein Haus Am See,/events/1808875,1
Black Hole Gallery + Art-Bar Night,2023-11-14T00:00:00.000,2023-11-14T12:00:00.000,2023-11-14T20:00:00.000,Lorem,P61 Gallery,/events/1795781,0
Opera on Tap,2023-11-14T00:00:00.000,2023-11-14T20:00:00.000,2023-11-14T22:00:00.000,,Prachtwerk Berlin,/events/1801084,0
DJ Night,2023-11-14T00:00:00.000,2023-11-14T23:00:00.000,2023-11-15T06:00:00.000,Abuxar,Abuxar,/events/1808684,0
Barry Can't Swim,2023-11-15T00:00:00.000,2023-11-15T20:00:00.000,2023-11-15T23:59:00.000,Barry Can't Swim,Kantine am Berghain,/events/1747395,211
Berlin Fundraiser for Palestine Support,2023-11-08T00:00:00.000,2023-11-08T14:00:00.000,2023-11-15T22:00:00.000,"Juliana Huxtable, Robert Owens, Altinbas, Sally C, Oldyungmayn, CCL, Call Super, Miura",Giri,/events/1804486,137
POPPERS MONSTER,2023-11-15T00:00:00.000,2023-11-15T20:00:00.000,2023-11-16T04:00:00.000,"Dornika, BLEACH.LIVE",Monster Ronson's Ichiban Karaoke,/events/1798778,120
Techno Mittwoch:TURBINE/TUNNEL,2023-11-15T00:00:00.000,2023-11-15T23:00:00.000,2023-11-16T08:00:00.000,"Stëh, multibliss, s:mash, ohnezwiebeln, C.R.MINE",AVA Club,/events/1774095,94
Launch Party - Winter Wunderland Mitte Berlin - INSPIRED BY QUEERS - FOR EVERYONE,2023-11-15T00:00:00.000,2023-11-15T16:30:00.000,2023-11-15T23:00:00.000,LADY $UKA,Gestrandet An Der Jannowitzbrücke,/events/1785415,71
Tresor New Faces hosted by Marina George,2023-11-15T00:00:00.000,2023-11-15T23:00:00.000,2023-11-16T09:00:00.000,"B-VERS, Danny Wabbit, Marina George, Mike Konstantinidis",Tresor / Globus,/events/1784564,54
Radio Alhara presents SANAM in Berlin,2023-11-15T00:00:00.000,2023-11-15T20:00:00.000,2023-11-15T23:00:00.000,,Urban Spree,/events/1804983,53
Rave am Mittwoch,2023-11-15T00:00:00.000,2023-11-15T23:00:00.000,2023-11-16T07:00:00.000,"DaSoMaZo, Kopflos, Mikadoo (2), Foxy L.",M-BIA,/events/1800508,52
"Spread The Groove: Klix, Acidfinky, Olivia Sugar, Balthazar Martinez",2023-11-15T00:00:00.000,2023-11-15T20:00:00.000,2023-11-16T03:00:00.000,"Klix (3), Acidfinky, Olivia Sugar, Balthazar Martinez",Repeat,/events/1804882,34
WEDNESDAY hosted by Redlight,2023-11-15T00:00:00.000,2023-11-15T22:00:00.000,2023-11-16T06:00:00.000,"Etiennette, Sam Paradise, Annina",Crack Bellmer,/events/1802383,30
Symbiotikka at KitKat Club,2023-11-15T00:00:00.000,2023-11-15T22:00:00.000,2023-11-16T07:00:00.000,"DJ Jordan, Anna Tur, Isabelle Beaucamp, A.N.I.",KitKatClub,/events/1792557,22
'Out Of Nowhere' LP Refuge Worldwide Takeover,2023-11-15T00:00:00.000,2023-11-15T19:00:00.000,2023-11-15T22:00:00.000,"Guava, Acidfinky",Refuge Worldwide / Oona Bar,/events/1799829,7
CONCERT: Starving Weirdos + Don't DJ,2023-11-15T00:00:00.000,2023-11-15T20:00:00.000,2023-11-15T23:30:00.000,DON'T DJ,arkaoda Berlin,/events/1804915,4
Black Hole Gallery + Art-Bar Night,2023-11-15T00:00:00.000,2023-11-15T12:00:00.000,2023-11-15T20:00:00.000,Lorem,P61 Gallery,/events/1795780,3
mittendrin mit DJ Ryder,2023-11-15T00:00:00.000,2023-11-15T18:00:00.000,2023-11-16T04:00:00.000,,Minimal Bar,/events/1786546,2
Sky-Bar Warmup - Free Entrance - Feat. Funky Electronica,2023-11-15T00:00:00.000,2023-11-15T18:30:00.000,2023-11-16T01:00:00.000,,Solar,/events/1810557,0
Tresor presents: Moritz von Oswald - 'Silencio' Release Concert,2023-11-16T00:00:00.000,2023-11-16T20:30:00.000,2023-11-16T22:00:00.000,Moritz von Oswald,St. Thomas Kirche,/events/1798490,971
Re:mise Closing Weekend,2023-11-16T00:00:00.000,2023-11-16T23:00:00.000,2023-11-21T09:00:00.000,"Nothing Left, Axciid, Pomah, Lis Absoluta, PSMT, Tinco, MSKD, Alhena_, Karashò, Neoma, Morion, Joe Shmoo, Bélavie, KLOE, ONNY CHO, Stef de Haan, Cybersex, Zoanthropiia, Anterist, Jeffrey (DE), DJ Saunameister, Neri J, Tilman Riddelt, D-JIL, 131bpm, Camilla Rae, Devoye, karete bu, Lovefoxy, Maryisonacid, Sekucci, Stella Zekri, Acidfinky, DJ HENTAI, Ott (DE), H369, Indigo Plateaux, Multifun, SACID, Opium Hum, Trancemaster Krause, Alexander Kowalski, BLACK ANTHEM RESTORE, Esther Dune, WAYNETTE",Re:mise,/events/1799865,681
OBXENE Re:mise CLOSING+RESIDENTS NIGHT,2023-11-16T00:00:00.000,2023-11-16T23:00:00.000,2023-11-17T09:30:00.000,"Nothing Left, Axciid, Pomah, Lis Absoluta, PSMT, Tinco, MSKD, Alhena_, Karashò, Neoma, Morion, Sakser, Joe Shmoo",Re:mise,/events/1761076,308
COLLE DER FOMENTO LIVE in Berlin,2023-11-16T00:00:00.000,2023-11-16T19:00:00.000,2023-11-16T23:59:00.000,,TBA - Kreuzberg,/events/1748706,209
Expeditions,2023-11-16T00:00:00.000,2023-11-16T23:59:00.000,2023-11-17T08:00:00.000,"Camea, Decka, Florian Meindl, Aria Santillana, David Silver",://about blank,/events/1650608,208
Jaakko Eino Kalevi release concert / Support by Lover Buffet ,2023-11-16T00:00:00.000,2023-11-16T20:00:00.000,2023-11-17T01:00:00.000,,arkaoda Berlin,/events/1768972,197
Renate X Speechless X Berlin House Music,2023-11-16T00:00:00.000,2023-11-16T23:00:00.000,2023-11-17T08:00:00.000,"Marit, Max Telaer, Jana Falcon, Habibi Grooves, Pascale Voltaire, Manu Strasse, ELV/RA, Nanno, ONNY CHO, Leon Licht",Renate,/events/1706079,209
HEELIX [Pilot Party],2023-11-16T00:00:00.000,2023-11-16T22:00:00.000,2023-11-17T06:00:00.000,"Matriark, vp allowed, Seqta, TSUNIMAN",OST,/events/1799526,167
DLV - ALL NIGHT LONG,2023-11-16T00:00:00.000,2023-11-16T23:00:00.000,2023-11-17T07:00:00.000,DLV,ÆDEN,/events/1770416,166
"Thursdate: Aterral with Black Loops, Carlo, Turkish",2023-11-16T00:00:00.000,2023-11-16T23:00:00.000,2023-11-17T09:00:00.000,"Black Loops, Carlo, Turkish",Watergate,/events/1799055,121
Boiler Room Festival Berlin - Thursday,2023-11-16T00:00:00.000,2023-11-16T21:00:00.000,2023-11-17T03:00:00.000,"LSDXOXO, Mura Masa, Pongo, MCR-T, Miss Bashful, Dæmon, Meg10, ABIBA, Cakes Da Killa, George Riley, JADA, Arthi",TBA,/events/1794642,97
Raumvier,2023-11-16T00:00:00.000,2023-11-16T22:00:00.000,2023-11-17T07:00:00.000,"Erosive, Huamaniser, Lukr Range, The Shredder, Dj Iryna",KitKatClub,/events/1800368,72
"System Revival pres. DJ Pete b2b Charlton, XDB and Diamin",2023-11-16T00:00:00.000,2023-11-16T22:00:00.000,2023-11-17T05:30:00.000,"Charlton, DJ Pete, XDB, Diamin",OHM,/events/1779572,57
upstairs,2023-11-16T00:00:00.000,2023-11-16T20:00:00.000,2023-11-17T04:00:00.000,"Oszillo, Adrian Ernst, Ferris B., Ateş Sönmez",Limited M. F. Bar,/events/1807271,41
SÄULE,2023-11-16T00:00:00.000,2023-11-16T22:00:00.000,2023-11-17T03:00:00.000,"Alva, Technokool, Yamour",Berghain | Panorama Bar | Säule,/events/1764244,34
All Night Long: Janna N & Kallaloo,2023-11-16T00:00:00.000,2023-11-16T23:00:00.000,2023-11-17T05:00:00.000,"Janna N, Kallaloo",Bulbul Berlin,/events/1794131,29
No Shade & friends prom night edition,2023-11-16T00:00:00.000,2023-11-16T21:00:00.000,2023-11-17T05:00:00.000,"Organ Tapes, Panasiagirl, Chickenmilk dot com, 4D:8K_GUARDEDTRIPZ, Silvio Dj, blastah, Eleftheria",Sameheads,/events/1805030,25
Silly Little Rave,2023-11-16T00:00:00.000,2023-11-16T22:00:00.000,2023-11-17T06:00:00.000,"Vitling, Otto Vlotto, FunkyKid, Heath Swedger",Zur Klappe,/events/1797939,22
"g_sv presents: Kilo Vee, ALEX WANG (live), trngs (live), Softmatter, TRYCE, 10_r3n",2023-11-16T00:00:00.000,2023-11-16T21:00:00.000,2023-11-17T04:00:00.000,"Kilo Vee, ALEX WANG, trngs, Softmatter, TRYCE",Acud Macht NEU,/events/1798108,22
Tom Tam Club,2023-11-16T00:00:00.000,2023-11-16T22:00:00.000,2023-11-17T06:00:00.000,"Tomoki Tamura, Mat Fink",Paloma,/events/1790241,20
THE UNKNOWN,2023-11-16T00:00:00.000,2023-11-16T22:00:00.000,2023-11-17T02:00:00.000,Dicso_Muzek,Zu Mir Oder Zu Dir,/events/1791634,18
d.OHA!se / rave thursday,2023-11-16T00:00:00.000,2023-11-16T23:00:00.000,2023-11-17T08:00:00.000,"deKai, DAV3",Der Weiße Hase,/events/1794785,25
Fellice Records invites …,2023-11-16T00:00:00.000,2023-11-16T20:30:00.000,2023-11-17T02:00:00.000,"Arnaud Denzler, effgee, unpaid intern",Repeat,/events/1807354,13
"rearrange with Scoopsi, die Rote Dora, The Hand",2023-11-16T00:00:00.000,2023-11-16T22:00:00.000,2023-11-17T06:00:00.000,"Scoopsi, die Rote Dora",Crack Bellmer,/events/1803901,12
Globus Invites…hosted by Maryisonacid,2023-11-16T00:00:00.000,2023-11-16T23:00:00.000,2023-11-17T09:00:00.000,"Maryisonacid, Mx. Sür, Z Lovecraft, John Collins (US)",Tresor / Globus,/events/1784569,11
Latitude In-Store Sessions with Mechatronica,2023-11-16T00:00:00.000,2023-11-16T18:00:00.000,2023-11-16T22:00:00.000,"Charlie, Mejle, Milan Hermess, Parand",Latitude Record Store,/events/1803340,9
Hidden Variables,2023-11-16T00:00:00.000,2023-11-16T23:59:00.000,2023-11-17T13:00:00.000,"Lasha Guruli, Marcus Holder, Casimir von Oettingen, Dojas",Golden Gate,/events/1798615,7
electronic.thursday mit Pablo Cornejo (Chile),2023-11-16T00:00:00.000,2023-11-16T18:00:00.000,2023-11-17T06:00:00.000,Pablo Cornejo,Minimal Bar,/events/1774013,4
Black Hole Gallery + Art-Bar Night,2023-11-16T00:00:00.000,2023-11-16T12:00:00.000,2023-11-16T20:00:00.000,Lorem,P61 Gallery,/events/1801794,4
Humbi Kult Sessions#27 Deck2Deck QUIZ,2023-11-16T00:00:00.000,2023-11-16T19:00:00.000,2023-11-17T04:00:00.000,,Humboldthain Club,/events/1808027,3
Chantals House of Shame,2023-11-16T00:00:00.000,2023-11-16T23:00:00.000,2023-11-17T07:00:00.000,,Lokschuppen Berlin,/events/1810545,3
Tausend ELECTRONICA - TITHEY SCHULZ,2023-11-16T00:00:00.000,2023-11-16T21:00:00.000,2023-11-17T04:00:00.000,,Tausend,/events/1800396,2
"Meet Me, or Die w/Konrad Ritter",2023-11-16T00:00:00.000,2023-11-16T20:00:00.000,2023-11-16T23:00:00.000,"Konrad Ritter, Saumeth",Astral Junction,/events/1807217,1
Sky-Bar Warmup - Free Entrance - feat. Format Analog,2023-11-16T00:00:00.000,2023-11-16T18:30:00.000,2023-11-17T01:00:00.000,,Solar,/events/1810559,1
Old CCCP Invites: The Groove,2023-11-16T00:00:00.000,2023-11-16T22:30:00.000,2023-11-17T03:00:00.000,The_Groove,Old CCCP,/events/1808874,0
"RSO YEAR TWO with Peggy Gou, Floating Points & Matisa",2023-11-17T00:00:00.000,2023-11-17T22:00:00.000,2023-11-18T09:00:00.000,"Peggy Gou, Floating Points, Matisa",RSO.BERLIN,/events/1791340,3702
Re:mise Closing Weekend,2023-11-16T00:00:00.000,2023-11-16T23:00:00.000,2023-11-21T09:00:00.000,"Nothing Left, Axciid, Pomah, Lis Absoluta, PSMT, Tinco, MSKD, Alhena_, Karashò, Neoma, Morion, Joe Shmoo, Bélavie, KLOE, ONNY CHO, Stef de Haan, Cybersex, Zoanthropiia, Anterist, Jeffrey (DE), DJ Saunameister, Neri J, Tilman Riddelt, D-JIL, 131bpm, Camilla Rae, Devoye, karete bu, Lovefoxy, Maryisonacid, Sekucci, Stella Zekri, Acidfinky, DJ HENTAI, Ott (DE), H369, Indigo Plateaux, Multifun, SACID, Opium Hum, Trancemaster Krause, Alexander Kowalski, BLACK ANTHEM RESTORE, Esther Dune, WAYNETTE",Re:mise,/events/1799865,681
"BLUR VOL.003 w / Ephy Pinkman, Schicktanz, ROJI, Butschi & Marc Moeller",2023-11-17T00:00:00.000,2023-11-17T23:00:00.000,2023-11-18T08:00:00.000,"Ephy Pinkman, Schicktanz, ROJI, Marc Moeller, Butschi, Nanno, dj.da.li, Atzenernst",Void Club,/events/1726735,449
Toy Tonics Jam w/ COEO,2023-11-17T00:00:00.000,2023-11-17T22:00:00.000,2023-11-18T08:00:00.000,"COEO, Kapote, Ella Knight, Ric Piccolo, Furor Exótica, Athlete Whippet, Vanta Vii",OST,/events/1784446,406
"TETE VIDE x Aurōra w/ Laze, djbounty3000,  Aasi & Young Lychee",2023-11-17T00:00:00.000,2023-11-17T23:00:00.000,2023-11-18T09:00:00.000,"djbounty3000, 0megavybe, Laze, Ben Derris, Young Lychee, DJ Henk, Aasi, Salush, Zenit, fumi.(DE), MZA_, dj hesss, crøwblar, DJ Thai Take Away, djvonnebenan, no.salt",Lokschuppen Berlin,/events/1770174,355
NIGHTMARES ON WAX (DJ-Set),2023-11-17T00:00:00.000,2023-11-17T23:59:00.000,2023-11-18T06:00:00.000,"Nightmares on Wax, Femdelic, Marc Hype, ARN4L2",Gretchen,/events/1766136,307
"Renate with Ksenia Kamikaza, Miro Ló, Loa Szala, Hurtado, Annechoic, Medus, VIDO",2023-11-17T00:00:00.000,2023-11-17T23:00:00.000,2023-11-18T08:00:00.000,"Hurtado, Ksenia Kamikaza, Annechoic, Medus, VIDO, Loa Szala, Maison Blanche, Tour-Maubourg, Mira Ló",Renate,/events/1773829,298
"W21 YEARS PRESENTS: Andhim, Biesmans, Cincity, Ede, JANE RYSE",2023-11-17T00:00:00.000,2023-11-17T23:00:00.000,2023-11-18T10:00:00.000,"Andhim, Biesmans, Cincity, Ede, JANE RYSE",Watergate,/events/1796591,259
FURIOSA Gay Latin Party - Shakira Edition,2023-11-17T00:00:00.000,2023-11-17T23:59:00.000,2023-11-18T05:00:00.000,,Lido Berlin,/events/1798941,236
"Cartel Room w/  MATRAKK, Floor Force One, Sancris, Saara, hrmny ",2023-11-17T00:00:00.000,2023-11-17T23:00:00.000,2023-11-18T08:00:00.000,"MATRAKK, Floor Force One, Sancris, Saara, Wachbär, Insolvenz, hrmny",M-BIA,/events/1775740,210
"BRVTAL VISION w/ Samantha Togni, Might Be Twins, The Brvtalist, Minuit Machine, Skelesys",2023-11-17T00:00:00.000,2023-11-17T23:00:00.000,2023-11-18T09:00:00.000,"Samantha Togni, Might Be Twins, The Brvtalist, Genetica, BRAIS, Minuit Machine, Neu-Romancer, Skelesys",OXI,/events/1775703,187
Juliana Huxtable presents Tongue in the Mind,2023-11-17T00:00:00.000,2023-11-17T20:00:00.000,2023-11-18T02:00:00.000,"Juliana Huxtable, Via App",Trauma Bar und Kino,/events/1773822,170
Inline,2023-11-17T00:00:00.000,2023-11-17T23:00:00.000,2023-11-18T09:00:00.000,"Mathys Lenne, Ôneyra, MZR///",ÆVE,/events/1799805,166
YOUR LOVE,2023-11-17T00:00:00.000,2023-11-17T22:00:00.000,2023-11-18T07:00:00.000,"Lakuti, Lil' Louis, Maurice Fulton, Tama Sumo",Berghain | Panorama Bar | Säule,/events/1764243,106
"Solo Ansamblis (LT, Artoffact Records) live at 8MM ",2023-11-17T00:00:00.000,2023-11-17T19:00:00.000,2023-11-17T22:00:00.000,,8MM,/events/1793553,99
Boiler Room Festival Berlin - Friday,2023-11-17T00:00:00.000,2023-11-17T23:30:00.000,2023-11-18T10:00:00.000,"Hudson Mohawke, Nikki Nair, Interplanetary Criminal, Main Phase, salute, Ahadadream, Lady Shaka, Dre Ngozi, AZIEZ, Nico Adomako, Kelman Duran, DJ Plead, rRoxymore, Ehua, Perera Elsewhere, Hanaby, AUCO, Neana, NAS TEA, Azu Tiwaline, Toumba, Gabber Modus Operandi, Bint7alal",TBA,/events/1796363,95
TEARS: Spaßamt,2023-11-17T00:00:00.000,2023-11-17T22:00:00.000,2023-11-18T05:00:00.000,"DJ Sickleave, DJ Sauerkraut, Okayshades, Kunstloses Brot, IntoPixel, ADDYADDYADDY, VJ Product Manager",Fitzroy,/events/1804438,92
Tresor Celebrates 10 Years of Pinkman Records,2023-11-17T00:00:00.000,2023-11-17T23:00:00.000,2023-11-18T12:00:00.000,"Charlie, Franz Scala, Luca dell'Orso, Marsman, Bailey Ibbs, Cleric, Denise Rabe, Ina Kacz",Tresor / Globus,/events/1784570,89
://blank friday | secondo piatti,2023-11-17T00:00:00.000,2023-11-17T23:00:00.000,2023-11-18T10:00:00.000,,://about blank,/events/1787664,80
uturn by Dejawie,2023-11-17T00:00:00.000,2023-11-17T23:00:00.000,2023-11-18T11:00:00.000,"50.000 kiloJoulez, Blame the Booker, DiskoJochen, Eric Brwn, piater., Stiefel One, Susi & Proll",Mensch Meier,/events/1797705,78
Sneaker Social Club with Slimzee & Jon E Cash,2023-11-17T00:00:00.000,2023-11-17T23:59:00.000,2023-11-18T07:00:00.000,"Slimzee, Jo Rae, Appleblim, Low End Activist",OHM,/events/1788574,76
RaveHeart,2023-11-17T00:00:00.000,2023-11-17T23:00:00.000,2023-11-18T11:00:00.000,"Josephine Wedekind, Yetti Meißner, Nnamael, Sika Akis, Felidae, Nat SuPrise, Mean Deen",Der Weiße Hase,/events/1794791,76
The Mystic Rose meets EAT STATIC,2023-11-17T00:00:00.000,2023-11-17T22:00:00.000,2023-11-18T10:00:00.000,"Eat Static, Musiphile, Musiphile, yingyang",KitKatClub,/events/1787906,68
Lecken... goes on sabbatical,2023-11-17T00:00:00.000,2023-11-17T23:00:00.000,2023-11-18T12:00:00.000,"Carmen 16, DJ Shannon, Ōtone, PaarTanz, Punani, Skankstasy, Sparkly Pony",ÆDEN,/events/1802185,68
LIBIDOH,2023-11-17T00:00:00.000,2023-11-17T22:00:00.000,2023-11-18T06:00:00.000,"Pravilova, Anina Owly, Thomas Klipps, Erebos",Insomnia,/events/1690846,67
RAVEHEIM,2023-11-17T00:00:00.000,2023-11-17T23:00:00.000,2023-11-18T06:00:00.000,"Alles_oder_Nada, DJ Pix, Athina, XHOUSTED, FNTA",Recede Club Berlin,/events/1805051,63
"You Mean So Much #10: Eva Crystaltips, Trujillo, sweetestcape, Habitat Shaking, Flaaviø",2023-11-17T00:00:00.000,2023-11-17T23:00:00.000,2023-11-18T06:00:00.000,"Eva Crystaltips, Trujillo, sweetestcape, Habitat Shaking, Flaaviø",Bulbul Berlin,/events/1794133,61
Delululand,2023-11-17T00:00:00.000,2023-11-17T23:00:00.000,2023-11-18T08:00:00.000,"SHOKI287, charli/e, Beqqi",Humboldthain Club,/events/1805804,52
"Alchemy Room: with Viktor Kampf , D/n, Ghongg",2023-11-17T00:00:00.000,2023-11-17T23:00:00.000,2023-11-18T06:00:00.000,"Viktor Kampf, D/n, Ghongg, Daniel Jaramillo, Bee Lincoln",AVA Club,/events/1793863,49
KURZSTRECKE 2,2023-11-17T00:00:00.000,2023-11-17T22:00:00.000,2023-11-18T10:00:00.000,"Marabou, Kimyon, Casimir von Oettingen, KimPalm",Kater Blau,/events/1798600,45
Rhythm Research Showcase & RC04 Release Party,2023-11-17T00:00:00.000,2023-11-17T23:00:00.000,2023-11-18T08:00:00.000,"Marco Maldarella, Ritual Cycles, Cardioactive, Bmbmnd, Surt",Beate Uwe,/events/1789928,35
Basic Spirit - 'In memory of Jamie Tiller',2023-11-17T00:00:00.000,2023-11-17T22:00:00.000,2023-11-18T07:00:00.000,"Tornado Wallace, Suzanne Kraft, PLO Man, JM Moser, Bell Towers, Fantastic Man, David Fogarty",Sameheads,/events/1808221,34
Humanoid 11 (5 Years),2023-11-17T00:00:00.000,2023-11-17T23:00:00.000,2023-11-18T07:00:00.000,"Philth, PRTCL, SpecOne",Zur Klappe,/events/1789736,32
"Nuovo Testamento + Disaster Fatigue (+ afterparty with Marko König, Nic Sleazy...) // Urban Spr",2023-11-17T00:00:00.000,2023-11-17T20:00:00.000,2023-11-18T05:00:00.000,"Marko König, Philipp Strobel",Urban Spree,/events/1792584,31
Circular Music with Oliver Raumklang & Tanz Unter Freunden,2023-11-17T00:00:00.000,2023-11-17T18:00:00.000,2023-11-18T06:00:00.000,"Oliver Raumklang, Tanz Unter Freunden",Minimal Bar,/events/1743773,26
Partisan x Lemaia,2023-11-17T00:00:00.000,2023-11-17T23:00:00.000,2023-11-18T12:00:00.000,"Alexia Glensy, Alex Dima, Astral Travel, OTIS (3), Man/Ipulate, LAMALICE, Massaï",Hoppetosse,/events/1790462,24
Matt Sassari & Jan Oberlaender,2023-11-17T00:00:00.000,2023-11-17T22:00:00.000,2023-11-18T09:00:00.000,"Matt Sassari, Jan Oberlaender, Human Rias, Vlad Yaki, anschi",Ritter Butzke,/events/1791508,24
"Süss mit Nikklaas, Better Call Paul, Karlito, Bambule Soundsystem",2023-11-17T00:00:00.000,2023-11-17T19:00:00.000,2023-11-18T07:00:00.000,"Nikklaas, Better Call Paul, Karlito",Süss War Gestern,/events/1797160,24
SLIME - for queers and friends,2023-11-17T00:00:00.000,2023-11-17T23:00:00.000,2023-11-18T11:00:00.000,"cristian zanotti, zikade, CHRISPY, DJ BONEY S",TBA,/events/1804324,24
ROMY,2023-11-17T00:00:00.000,2023-11-17T21:00:00.000,2023-11-17T23:59:00.000,Romy,Schwuz,/events/1773949,20
ACID TEARS x ARKAODA,2023-11-17T00:00:00.000,2023-11-17T22:00:00.000,2023-11-18T06:00:00.000,"Betonkust, BOBBIE*, Levente, Ofra",arkaoda Berlin,/events/1803964,20
Danse Tragicomica with Wasn & Wunderwaffel,2023-11-17T00:00:00.000,2023-11-17T22:00:00.000,2023-11-18T06:00:00.000,Wasn & Wunderwaffel,Crack Bellmer,/events/1802389,17
Fantastic Friends + Afterhour,2023-11-17T00:00:00.000,2023-11-17T23:59:00.000,2023-11-18T23:59:00.000,"Primãrie, Cora M., JoweL, Nicolas Duvoisin, Nils Twachtmann, Giorgio Maulini",Golden Gate,/events/1798621,12
The Evolution Will Not Be Gentrified,2023-11-17T00:00:00.000,2023-11-17T22:00:00.000,2023-11-18T06:00:00.000,"michi dt, Genys, Dj Quien, DJ mndwzrd",Panke,/events/1796947,10
Back to the Oldschool Vol. II,2023-11-17T00:00:00.000,2023-11-17T23:00:00.000,2023-11-18T07:00:00.000,"Curt Cocain, Upzet",Void Hall,/events/1801701,10
Noema Release Party with Mehmet Aslan,2023-11-17T00:00:00.000,2023-11-17T21:00:00.000,2023-11-18T02:00:00.000,"Noema, Mehmet Aslan",Orangerie Neukölln,/events/1803156,8
Dimensionless Unity Invites Frau Braun & Lavan,2023-11-17T00:00:00.000,2023-11-17T23:30:00.000,2023-11-18T08:00:00.000,"Dimensionless Unity, Frau Braun, Lavan",Paloma,/events/1787396,7
Pillow Princess Winter Cosyness ♡ Vinyl only all night long,2023-11-17T00:00:00.000,2023-11-17T20:00:00.000,2023-11-18T00:00:00.000,"ilbroccolovolante, Kidcat",Frollein Langner,/events/1805740,7
Houseland,2023-11-17T00:00:00.000,2023-11-17T22:00:00.000,2023-11-18T06:00:00.000,"Dennis Beutler, Bombata, Peet Flower",Bohnengold,/events/1786918,6
basscomesaveme presents Haghbin.Dub & Fisherman on King David Soundsystem,2023-11-17T00:00:00.000,2023-11-17T22:00:00.000,2023-11-18T05:00:00.000,"Fisherman, Longfingah",KVU - Kirche von Unten,/events/1790628,6
Chemistry Club,2023-11-17T00:00:00.000,2023-11-17T20:00:00.000,2023-11-18T06:00:00.000,bad_dubs,Zum Böhmischen Dorf,/events/1802707,6
Bellies Rave,2023-11-17T00:00:00.000,2023-11-17T22:00:00.000,2023-11-18T07:00:00.000,,TBA - secret location email belliesberlin@gmail.com,/events/1809954,6
Black Hole Gallery + Art-Bar Night,2023-11-17T00:00:00.000,2023-11-17T12:00:00.000,2023-11-17T23:30:00.000,Lorem,P61 Gallery,/events/1795798,5
KOX presents KLUB 17,2023-11-17T00:00:00.000,2023-11-17T22:00:00.000,2023-11-18T10:00:00.000,"faceblindbabe, Gino Kampari, Tina von Kugler",TBA - Secret Location - Neukölln,/events/1811210,4
MR. S TURNS 34,2023-11-17T00:00:00.000,2023-11-17T21:00:00.000,2023-11-18T06:00:00.000,"Asem Shama, StinaFrancina, Berghson, Mal.Da",TBA - Berlin,/events/1602763,4
Techno Moon Night - Friday,2023-11-17T00:00:00.000,2023-11-17T22:00:00.000,2023-11-18T06:00:00.000,Daora,Soda Club,/events/1788764,3
King Kong Kicks • Badehaus Berlin,2023-11-17T00:00:00.000,2023-11-17T23:30:00.000,2023-11-18T05:00:00.000,,Badehaus Berlin,/events/1771020,2
The Dispo Spaceship - High Holy Dispo Mass,2023-11-17T00:00:00.000,2023-11-17T22:00:00.000,2023-11-18T06:00:00.000,"Filippo Moscatello, Benji DF",Paloma,/events/1794646,2
Fluctua Night Vol.II,2023-11-17T00:00:00.000,2023-11-17T19:00:00.000,2023-11-17T23:00:00.000,,Fluxbau,/events/1796660,2
"BERLIN GLOBAL meets Lea Streisand, die Brauseboys und DJ Pablo Cornejo",2023-11-17T00:00:00.000,2023-11-17T17:00:00.000,2023-11-17T21:00:00.000,Pablo Cornejo,Humboldt Forum,/events/1806723,2
BLUES BUMPS - ALiX - Laura Guidi - Sector 7G,2023-11-17T00:00:00.000,2023-11-17T21:00:00.000,2023-11-18T03:00:00.000,,BLO-Ateliers,/events/1807827,1
Sky-Bar Warmup - feat. We Love Vinyl,2023-11-17T00:00:00.000,2023-11-17T18:30:00.000,2023-11-18T02:00:00.000,,Solar,/events/1810561,1
"RSO YEAR TWO with Oscar Mulero, Bambounou, Laure Croft b2b Lacchesi, Lena Willikens, Matrixxman",2023-11-18T00:00:00.000,2023-11-18T23:59:00.000,2023-11-20T12:00:00.000,"Adriana Lopez, CONCEPTUAL, Frederic., DJ Hyperdrive, Laure Croft, Lorenzo Lacchesi, Lacchesi, Lawrence Lee, Mohajer, Lewis Fautzi, Matrixxman, Oscar Mulero, Ribé, UFO95, Bambounou, Jesse G, Lena Willikens, Pariah, Mor Elian",RSO.BERLIN,/events/1791342,2305
6 YEARS NAKT,2023-11-18T00:00:00.000,2023-11-18T21:00:00.000,2023-11-19T09:00:00.000,"NIKOLINA_, Acierate, PRADA 2000, Mødze, Specific Objects, DJ.P, Jordan.nsx, Luli Panasci, Hieronymus, Julliana Kiddo, TEØH, Et Cetera",MaHalla,/events/1791334,972
"Legion x Dusk Records w/ Ansome, Grace Dahl, Lobster, Under Black Helmet",2023-11-18T00:00:00.000,2023-11-18T23:00:00.000,2023-11-19T10:00:00.000,"Alex Friday, Ansome, ARTISAN, Lady Maru, CALLE, Under Black Helmet, Grace Dahl, K49 (1), Lobster (NL), Unwucht",MUENZE,/events/1782467,715
Re:mise Closing Weekend,2023-11-16T00:00:00.000,2023-11-16T23:00:00.000,2023-11-21T09:00:00.000,"Nothing Left, Axciid, Pomah, Lis Absoluta, PSMT, Tinco, MSKD, Alhena_, Karashò, Neoma, Morion, Joe Shmoo, Bélavie, KLOE, ONNY CHO, Stef de Haan, Cybersex, Zoanthropiia, Anterist, Jeffrey (DE), DJ Saunameister, Neri J, Tilman Riddelt, D-JIL, 131bpm, Camilla Rae, Devoye, karete bu, Lovefoxy, Maryisonacid, Sekucci, Stella Zekri, Acidfinky, DJ HENTAI, Ott (DE), H369, Indigo Plateaux, Multifun, SACID, Opium Hum, Trancemaster Krause, Alexander Kowalski, BLACK ANTHEM RESTORE, Esther Dune, WAYNETTE",Re:mise,/events/1799865,681
Candyflip,2023-11-18T00:00:00.000,2023-11-18T22:00:00.000,2023-11-19T09:00:00.000,"Antonym, MLZ, John Mood, TRIS, Vall Du Son, SaltySis, KLING&KLANG, no.salt, dj hesss, Bélavie, ONNY CHO, OTG(1), SLANY, Dynamic Experience, maedchenballern",ÆDEN,/events/1803427,530
"Renate with Nick Beringer, Solus, Johannes Albert, Baby B, Liza Aikin, Znzl ",2023-11-18T00:00:00.000,2023-11-18T23:00:00.000,2023-11-19T08:00:00.000,"Liza Aikin, Znzl, CTSD, Nick Beringer, Roni Amitai, Casimir von Oettingen, Johannes Albert, Leon Licht",Renate,/events/1773850,426
Klubnacht,2023-11-18T00:00:00.000,2023-11-18T23:59:00.000,2023-11-20T08:00:00.000,"Terence Fixmer, Barker, Chami, DJ Red, Fadi Mohem, Nihad Tule, The Lady Machine, Volvox, CYRK, Eris Drew, Nick Höppner, Norman Nodge, Ogazón, Sedef Adasï, Virginia, KiNK",Berghain | Panorama Bar | Säule,/events/1764235,314
BRVTAL GENER4TION X Suicide Club,2023-11-18T00:00:00.000,2023-11-18T23:00:00.000,2023-11-19T09:00:00.000,"Lobsta B, Prauze, Elon Bass, SIKOTI, Blayde, Druckvoll",Lokschuppen Berlin,/events/1752526,309
Boiler Room Festival Berlin - Saturday,2023-11-18T00:00:00.000,2023-11-18T23:30:00.000,2023-11-19T10:00:00.000,"Call Super, Octave One, Underground Resistance, BASHKKA, Nat Wendell, Natalie Robinson, JAXX TMS, No Plastic, horsegiirL, Cryptofauna, Estella Boersma, Daria Kolosova, DJ AYA, Riva, Money Lang, Otis (BE), Golin, Oli XL, Europa (1), nunguja",TBA,/events/1795423,218
"SOLID x Burial Soil: Regal, Eliza Feliz, P. Vanillaboy, ttyfal, UrbnMowgli, Ravn Jonassen",2023-11-18T00:00:00.000,2023-11-18T23:00:00.000,2023-11-19T10:00:00.000,"Regal, Eliza Feliz, P.Vanillaboy, ttyfal, UrbnMowgli, Ravn Jonassen",Watergate,/events/1797409,194
UNORDNUNGSAMT // Birthday Bash,2023-11-18T00:00:00.000,2023-11-18T23:00:00.000,2023-11-19T07:00:00.000,"Apoena, Juan Neira, AOIFE, Freigeist",Void Hall,/events/1800111,147
"THE BOX [FLINTA* House Night] Groove, Disco, Funk",2023-11-18T00:00:00.000,2023-11-18T21:00:00.000,2023-11-19T04:00:00.000,"Katy De Jesus, ZOE., Jana Falcon, SHANNIN",Chausseestrasse 131,/events/1792939,132
