"Mother's Finest Sunday with Joy Orbison, LNS & DJ Sotofett, Franklin De Costa",2018-06-17T00:00:00.000,2018-06-17T09:00:00.000,2018-06-18T08:00:00.000,"Joy Orbison, LNS, DJ Sotofett, Franklin De Costa, Jon Rust, Qzen",Griessmuehle,/events/1113233,128
Buttons Birthday Extravaganza,2018-06-15T00:00:00.000,2018-06-15T23:59:00.000,2018-06-17T22:00:00.000,"Severino, Paolo Di Nola, Jacob Meehan, The Neighbourhood Character, Akirahawks, Oceanic, John F.M., Kiernan Laveaux, Garrett David, Stanley Schmidt, Leibniz, Marieu, DAHRAXT, Linda Lazarov, Darwin, Madalba, Shingo Suwa",://about blank,/events/1057278,62
"Ship happens! - Schiffbruch ins Blaue with Mira, Dubspeeka, Smash TV, Sascha Cawa and More",2018-06-17T00:00:00.000,2018-06-17T12:00:00.000,2018-06-18T12:00:00.000,"Burnhard, C-More, Dubspeeka, Josephine Wedekind, Mira, Niemand & Keiner, Public Emely, Sascha Cawa, Smash TV, Struppie",Kater Blau,/events/1105260,33
"Last Rave with Italoboyz, David Jach",2018-06-17T00:00:00.000,2018-06-17T23:00:00.000,2018-06-18T10:00:00.000,"Italoboyz, David Jach, Pascale Voltaire, high.co.coon",Lokschuppen Berlin,/events/1116177,33
Sasomo mit Schiffbruch - Dubspeeka / Mira / Midas 104 / Oliver Klostermann / Nayan Soukie,2018-06-16T00:00:00.000,2018-06-16T23:59:00.000,2018-06-18T12:00:00.000,"Max Grabke, Manuel Sahagun, Christ Burstein, Public Emely, C-More, Sascha Cawa, Smash TV, Dubspeeka, Burnhard, Niemand & Keiner, Oliver Klostermann, Midas 104, Mira, Struppie, Nigel Perera, Josephine Wedekind",Kater Blau,/events/1105824,30
Buttons Birthday Extravaganza - Day 2,2018-06-16T00:00:00.000,2018-06-16T00:00:00.000,2018-06-17T22:00:00.000,"Severino, Paolo Di Nola, Jacob Meehan, The Neighbourhood Character, Akirahawks, Oceanic, John F.M., Kiernan Laveaux, Garrett David, Stanley Schmidt, Leibniz, Marieu, DAHRAXT, Linda Lazarov, Darwin, Madalba, Shingo Suwa",://about blank,/events/1102918,29
Buttons Birthday Extravaganza - Day 3,2018-06-17T00:00:00.000,2018-06-17T00:00:00.000,2018-06-17T22:00:00.000,"Severino, Paolo Di Nola, Jacob Meehan, The Neighbourhood Character, Akirahawks, Oceanic, John F.M., Kiernan Laveaux, Garrett David, Stanley Schmidt, Leibniz, DAHRAXT, Linda Lazarov, Darwin, Madalba, Shingo Suwa",://about blank,/events/1102921,28
Black.Round.Ipse,2018-06-17T00:00:00.000,2018-06-17T14:00:00.000,2018-06-18T10:00:00.000,"S.A.M., Cosmjn, Foehn & Jerome, Joe Seff",[ipsə],/events/1123445,27
"Olayinka, Marie Midori, Mario Urien, Still Deep & Bernat",2018-06-17T00:00:00.000,2018-06-17T14:00:00.000,2018-06-18T22:00:00.000,"Ben Olayinka, Marie Midori, Still Deep, Joan Bernat, Mario Urien",Chalet,/events/1123500,27
A t m o _ s p h ä r e # 6 + Klangkunst —LAB # 14,2018-06-17T00:00:00.000,2018-06-17T20:00:00.000,2018-06-18T02:00:00.000,,Modular+,/events/1122325,18
Sonntagsklub mit Camp Oberlogga,2018-06-17T00:00:00.000,2018-06-17T23:00:00.000,2018-06-18T10:00:00.000,"Chlass, Dub Resort",AVA Club,/events/1117866,17
"Fluff with Alien D, Deadlift, Tarrou, Roadkill",2018-06-17T00:00:00.000,2018-06-17T15:00:00.000,2018-06-17T22:00:00.000,"Alien D, Deadlift, Tarrou",TBA - Berlin,/events/1119444,11
Sunday Ritual - Housedanceclass,2018-06-17T00:00:00.000,2018-06-17T16:00:00.000,2018-06-18T21:00:00.000,Yuval,Crack Bellmer,/events/1121730,5
Sundaze Open Air,2018-06-17T00:00:00.000,2018-06-17T14:00:00.000,2018-06-18T08:00:00.000,"Just Jerry, Hot Suprise",Polygon Club,/events/1122869,4
Absolem Rondo - Summer Edition - Open Air,2018-06-17T00:00:00.000,2018-06-17T14:00:00.000,2018-06-17T23:00:00.000,"Lee Jokes, Hashimizu",Lokschuppen Berlin,/events/1123566,2
Vinyl Society,2018-06-17T00:00:00.000,2018-06-17T12:00:00.000,2018-06-18T06:00:00.000,"Alci, Konrad Black, Luc Ringeisen, DeWalta",Club der Visionaere,/events/1123904,2
Electric River - Ton im Strom,2018-06-17T00:00:00.000,2018-06-17T18:00:00.000,2018-06-19T12:00:00.000,"Im Modus, KLOUD, KLOUD, Mr. Galonga, André Carré, Maak, DJ Hedges",Open Air,/events/1129663,1
GMF 0617,2018-06-17T00:00:00.000,2018-06-17T23:00:00.000,2018-06-18T06:00:00.000,Maringo,GMF,/events/1112144,1
Sunday Selection,2018-06-17T00:00:00.000,2018-06-17T23:00:00.000,2018-06-18T06:00:00.000,,Cassiopeia,/events/1113020,1
Nachspiel Sunday-Night-Club,2018-06-17T00:00:00.000,2018-06-17T23:00:00.000,2018-06-18T08:00:00.000,,KitKatClub,/events/1117246,1
House Of Coito // Summer EDT,2018-06-17T00:00:00.000,2018-06-17T22:00:00.000,2018-06-18T06:00:00.000,Jungle Mind,Ficken 3000,/events/1118020,1
Reso Macht süß,2018-06-17T00:00:00.000,2018-06-17T14:00:00.000,2018-06-18T02:00:00.000,"Sarah Wild, Katzenohr",Zuckerzauber,/events/1122455,1
Lazy.Sunday mit Juliet,2018-06-17T00:00:00.000,2018-06-17T19:00:00.000,2018-06-18T06:00:00.000,,Minimal Bar,/events/1104666,21
Electric Monday,2018-06-18T00:00:00.000,2018-06-18T23:00:00.000,2018-06-19T07:00:00.000,Diana May,KitKatClub,/events/1107189,60
Hallo Montag - Open Air #08 with Soul Clap all day Long,2018-06-18T00:00:00.000,2018-06-18T14:00:00.000,2018-06-19T02:00:00.000,"Soul Clap, Kolja Gerstenberg",[ipsə],/events/1073745,52
House of Waxx,2018-06-18T00:00:00.000,2018-06-18T23:59:00.000,2018-06-19T09:00:00.000,"Nathan Jonson, Beaner, Banoffee Pies, Karima F",Tresor / Globus,/events/1112478,47
"Olayinka, Marie Midori, Mario Urien, Still Deep & Bernat",2018-06-17T00:00:00.000,2018-06-17T14:00:00.000,2018-06-18T22:00:00.000,"Ben Olayinka, Marie Midori, Still Deep, Joan Bernat, Mario Urien",Chalet,/events/1123500,27
Nice One,2018-06-18T00:00:00.000,2018-06-18T20:00:00.000,2018-06-19T06:00:00.000,"Merve Mercury, Alfret",Crack Bellmer,/events/1121740,8
Monday Mood,2018-06-18T00:00:00.000,2018-06-18T20:00:00.000,2018-06-19T04:30:00.000,,Süss War Gestern,/events/1110118,6
Sunday Ritual - Housedanceclass,2018-06-17T00:00:00.000,2018-06-17T16:00:00.000,2018-06-18T21:00:00.000,Yuval,Crack Bellmer,/events/1121730,5
Luckison,2018-06-18T00:00:00.000,2018-06-18T15:00:00.000,2018-06-19T06:00:00.000,"Valentino Kanzyani, Ian F, Mayell, Tim Kern, Tzena",Club der Visionaere,/events/1124021,4
Electric River - Ton im Strom,2018-06-17T00:00:00.000,2018-06-17T18:00:00.000,2018-06-19T12:00:00.000,"Im Modus, KLOUD, KLOUD, Mr. Galonga, André Carré, Maak, DJ Hedges",Open Air,/events/1129663,1
Berlin Skyline,2018-06-18T00:00:00.000,2018-06-18T18:00:00.000,2018-06-19T02:00:00.000,DJ Vela,Solar,/events/1123896,1
Manic.Monday mit Daza & Jaramillo,2018-06-18T00:00:00.000,2018-06-18T19:00:00.000,2018-06-19T05:00:00.000,"DAZA, Daniel Jaramillo",Minimal Bar,/events/1104668,19
Encore.une.Fois *Techno Edition*,2018-06-19T00:00:00.000,2018-06-19T23:59:00.000,2018-06-20T12:00:00.000,"Franklin De Costa, CYRK, Sierra Sam, Pascal Hetzel, Lilly Deupré",Lokschuppen Berlin,/events/1119934,101
The Unknown presents Patzki,2018-06-19T00:00:00.000,2018-06-19T22:00:00.000,2018-06-20T02:00:00.000,,Mein Haus Am See,/events/1101408,18
Cure Music Showcase,2018-06-19T00:00:00.000,2018-06-19T15:00:00.000,2018-06-20T06:00:00.000,"Dani Casarano, Felipe Valenzuela, Lamache, Max Vaahs, Momo Trosman, Zendid",Club der Visionaere,/events/1114785,15
"Pachamama with Caapi El Mesti, Maru Ten and Luu Sierra",2018-06-19T00:00:00.000,2018-06-19T20:00:00.000,2018-06-20T06:00:00.000,"Maru Ten, Luu Sierra, Caapi El Mesti",Crack Bellmer,/events/1114895,13
Open Decks & Tischtennis + WM Public Viewing,2018-06-19T00:00:00.000,2018-06-19T20:00:00.000,2018-06-20T04:00:00.000,,Humboldthain Club,/events/1121246,11
Tuesday Tales,2018-06-19T00:00:00.000,2018-06-19T20:00:00.000,2018-06-20T05:00:00.000,,Süss War Gestern,/events/1113751,6
"The Divine Comedy with Ale Castro, Red Pig Flower and More",2018-06-19T00:00:00.000,2018-06-19T23:59:00.000,2018-06-20T10:00:00.000,"Ale Castro, Red pig flower, Lenny Posso, Louis Dinkgrefe",Chalet,/events/1124828,3
Super Tuesday,2018-06-19T00:00:00.000,2018-06-19T23:00:00.000,2018-06-20T06:00:00.000,,Cassiopeia,/events/1113013,2
Electronica Berlin,2018-06-19T00:00:00.000,2018-06-19T18:00:00.000,2018-06-20T02:00:00.000,Gari Marcos,Solar,/events/1120707,1
White Night & Arcansas Dave,2018-06-19T00:00:00.000,2018-06-19T20:00:00.000,2018-06-19T23:30:00.000,White Night,Prachtwerk Berlin,/events/1123189,1
"No Hype (Openair/Indoor) - André Lodemann, Cotumo, Oscar Ozz, John Mehnert",2018-06-19T00:00:00.000,2018-06-19T16:00:00.000,2018-06-20T08:00:00.000,"André Lodemann, Cotumo, Oscar OZZ",[ipsə],/events/1119484,42
Down - Eric Cloutier All Night Pt. 2,2018-06-20T00:00:00.000,2018-06-20T23:00:00.000,2018-06-21T06:00:00.000,Eric Cloutier,Paloma,/events/1111256,63
Tresor New Faces,2018-06-20T00:00:00.000,2018-06-20T23:59:00.000,2018-06-21T10:00:00.000,"Scarlet, Billie Jo, Mischa, Miss Italia",Tresor / Globus,/events/1109267,40
Mittwoch: The Gathering,2018-06-20T00:00:00.000,2018-06-20T23:59:00.000,2018-06-21T10:00:00.000,"Seuil, Z@p, Cobert, Lion Bakman",Watergate,/events/1117372,34
Techno Mittwoch,2018-06-20T00:00:00.000,2018-06-20T23:00:00.000,2018-06-21T10:00:00.000,"Bee Lincoln, Didier Dlb, Sam Ey",AVA Club,/events/1115186,32
No Disco Future,2018-06-20T00:00:00.000,2018-06-20T15:00:00.000,2018-06-21T06:00:00.000,"Edward, Brawther, Monty Luke, Janina, Thomas Melchior",Club der Visionaere,/events/1111019,27
The Wømb x Griessmühle,2018-06-20T00:00:00.000,2018-06-20T22:30:00.000,2018-06-21T07:00:00.000,"Justine Perry, Mss Vtk, Neven",Griessmuehle,/events/1123573,25
The Unknown presents Maurice Mino & Patzki,2018-06-20T00:00:00.000,2018-06-20T20:00:00.000,2018-06-21T05:00:00.000,Maurice Mino,Süss War Gestern,/events/1100726,22
Slowmojo #26 with Oliver Klostermann & Moji,2018-06-20T00:00:00.000,2018-06-20T20:00:00.000,2018-06-21T06:00:00.000,"Oliver Klostermann, Moji Taali, Moji",Crack Bellmer,/events/1121746,13
Symbiotikka,2018-06-20T00:00:00.000,2018-06-20T23:00:00.000,2018-06-21T07:00:00.000,"Chris Knipp, Match Hoffman",KitKatClub,/events/1113671,8
Deuster's Top Hits,2018-06-20T00:00:00.000,2018-06-20T23:00:00.000,2018-06-21T05:00:00.000,DJ Flush,Farbfernseher,/events/1117536,6
Mark Van Hoen Live,2018-06-20T00:00:00.000,2018-06-20T21:00:00.000,2018-06-21T02:00:00.000,"Mark Van Hoen, BlasCO, Marta De Pascalis",Monarch,/events/1119008,4
Experiminimal,2018-06-20T00:00:00.000,2018-06-20T21:00:00.000,2018-06-21T02:45:00.000,,Maze,/events/1125043,2
Mittendrin mit Friedrich Raphael,2018-06-20T00:00:00.000,2018-06-20T19:00:00.000,2018-06-21T06:00:00.000,Friedrich Raphael,Minimal Bar,/events/1125830,2
RED City Radio,2018-06-20T00:00:00.000,2018-06-20T20:00:00.000,2018-06-20T23:00:00.000,,Cassiopeia,/events/1113005,1
Deep Vibes Berlin,2018-06-20T00:00:00.000,2018-06-20T18:00:00.000,2018-06-21T02:00:00.000,Mike La Funk,Solar,/events/1120746,1
Tabernacle Findings,2018-06-20T00:00:00.000,2018-06-20T19:00:00.000,2018-06-20T23:00:00.000,"Daniel Andréasson, VC-118A, Andrew Ingram",Echo Bücher,/events/1123179,1
Concrete BLN,2018-06-20T00:00:00.000,2018-06-20T23:30:00.000,2018-06-21T06:00:00.000,Phantom Warrior,Cassiopeia,/events/1125391,1
Laura L _ Noise-Experimental,2018-06-20T00:00:00.000,2018-06-20T23:00:00.000,2018-06-21T01:00:00.000,,Eschschloraque,/events/1125721,1
Leon Vynehall presents Nothing is Still (Live),2018-06-21T00:00:00.000,2018-06-21T20:00:00.000,2018-06-22T00:00:00.000,Leon Vynehall,Kulturbrauerei,/events/1107422,86
Bordel Des Arts - In The Zone - 26h,2018-06-21T00:00:00.000,2018-06-21T22:00:00.000,2018-06-22T23:59:00.000,"David Keno, Ron Flatter, Kotelett&Zadak, Kotelett, Jake the Rapper, Sam Shure, Mila Stern, The Reason Y, Beth Lydi, Galen, Anthony Mansfield, Sokool, Mike Book, Daniel Jaeger, Alexander Aurel, Beddermann & Dahlmann, Casimir von Oettingen, Electronic Elephant, freedomB, Viktor Talking Machine, vom Feisten, Pedro Arbulu, Joseph Disco, Leving, Martin Ka, Bako, Los Cabra, JurieMember, Daensen, Henheimer",Renate,/events/1087972,75
W/LD • Monkey Safari & Reboot & More,2018-06-21T00:00:00.000,2018-06-21T14:00:00.000,2018-06-22T08:00:00.000,"Reboot, Monkey Safari, Nandu, Sonnensysteme",[ipsə],/events/1120741,64
"Fête de la Musique with Anika, Moderna, Local Suicide & More",2018-06-21T00:00:00.000,2018-06-21T23:59:00.000,2018-06-22T10:00:00.000,"Anika, Moderna, Local Suicide, Eddie Galavan, Michael Douglas",Chalet,/events/1117273,54
Martyn Album Launch,2018-06-21T00:00:00.000,2018-06-21T22:00:00.000,2018-06-22T05:00:00.000,"Martyn, Doc Scott, Head High, Virginia",Berghain | Panorama Bar | Säule,/events/1104604,50
Fête de la Musique & de la Nuit x Carbonate Open Air,2018-06-21T00:00:00.000,2018-06-21T16:00:00.000,2018-06-22T08:00:00.000,"Dollkraut, Acid Washed, Africaine 808, Cyranotaurus Cortex, 22Rockets",Else,/events/1121934,48
Point Blank - Resom Invites,2018-06-21T00:00:00.000,2018-06-21T23:59:00.000,2018-06-22T08:00:00.000,"Gatto Fritto, Gwenan, Resom",://about blank,/events/1121496,46
Fête de la Musique Berlin: Griessmühlen Block Party Plus Wax Treatment Open Air Floor,2018-06-21T00:00:00.000,2018-06-21T14:00:00.000,2018-06-21T22:00:00.000,"S Ruston, Darwin, Golden Medusa, Matias Aguayo, Mark Ernestus, Tikiman, DJ Pete, CGB, Killa",Griessmuehle,/events/1121659,45
"Ritter Butzke - Unter Freiem Himmel w/ Andhim, Niconé & Dirty Doering",2018-06-21T00:00:00.000,2018-06-21T18:00:00.000,2018-06-22T23:59:00.000,"Andhim, Niconé, Dirty Doering, Matthias Schuell, Prismode, Sam Shure, Toni Haupt, HRRSN, Markus Klee, Turkish",Ritter Butzke,/events/1108210,39
Fête de la Musique,2018-06-21T00:00:00.000,2018-06-21T16:00:00.000,2018-06-22T04:00:00.000,"Dr. Chimpanzee, Herr Locher, Dojas, Marvin Hey, Aaron All",Birgit,/events/1118872,39
Per Forma: Live Balance,2018-06-21T00:00:00.000,2018-06-21T23:00:00.000,2018-06-22T10:00:00.000,"X Tin, LADA, Dasha Rush, Lars Hemmerling, Byetone, Robert Lippok, Peter Kirn, Prequel Tapes, PRCDRL",Arena Club,/events/1121504,39
Thursdate,2018-06-21T00:00:00.000,2018-06-21T23:59:00.000,2018-06-22T11:00:00.000,"Patrice Bäumel, Ruede Hagelstein",Watergate,/events/1109157,24
Wataj Party pt. Sette with DJ SCM,2018-06-21T00:00:00.000,2018-06-21T23:00:00.000,2018-06-22T06:00:00.000,DJ SCM,Paloma,/events/1101443,22
"Féte de la Musique: Der Dritte Raum, youANDme, Marcus Meinhardt, Mary Jane",2018-06-21T00:00:00.000,2018-06-21T15:00:00.000,2018-06-22T04:00:00.000,"Der Dritte Raum, youANDme, Marcus Meinhardt, Mary Jane",Sage Beach Berlin,/events/1115271,22
Donnerdogge,2018-06-21T00:00:00.000,2018-06-21T23:59:00.000,2018-06-22T12:00:00.000,"Ray Okpara, Tato Piatti, Phil2, Edgar Peng",Golden Gate,/events/1115453,22
Fête de la Nuit - Dnb & Psy,2018-06-21T00:00:00.000,2018-06-21T22:00:00.000,2018-06-22T07:00:00.000,Enantion,Void Club,/events/1108385,21
Fete De La Musique&de La Nuit-Blockparty ft Daedelus+Deadbeat + Max Graef + Tereza...,2018-06-21T00:00:00.000,2018-06-21T16:00:00.000,2018-06-22T07:00:00.000,"Daedelus, Deadbeat, Delfonic, Eli Pavel, Kutmah, Max Graef, Soulmind, Symbiz, Tereza, The Bug, Survey, Mc Jamie White, Mad Zach",Gretchen,/events/1109174,21
The Unknown presents Aamcee & Chris Kernig,2018-06-21T00:00:00.000,2018-06-21T20:00:00.000,2018-06-22T03:00:00.000,"Aamcee, Chris Kernig",Zu Mir Oder Zu Dir,/events/1100719,17
Sneaky Man Show,2018-06-21T00:00:00.000,2018-06-21T23:00:00.000,2018-06-22T05:00:00.000,"Hideto Omura, Tomoki Tamura",Farbfernseher,/events/1118345,16
Kybele Solstice: Fête de la Musique,2018-06-21T00:00:00.000,2018-06-21T16:00:00.000,2018-06-22T06:00:00.000,"ANDI.ANDEAN, Cris Kai",Crack Bellmer,/events/1124366,16
DCMB Showcase at Fête de la Musique,2018-06-21T00:00:00.000,2018-06-21T22:00:00.000,2018-06-22T08:00:00.000,"Bazeja, Memo., MIESO, Sanja Lapsin",Birgit,/events/1123621,14
Bad Life Choices 2,2018-06-21T00:00:00.000,2018-06-21T23:59:00.000,2018-06-22T08:15:00.000,"annanan, Therese Terror, Valance Jones",Griessmuehle,/events/1122532,13
DIE Jungen Wilden,2018-06-21T00:00:00.000,2018-06-21T23:00:00.000,2018-06-22T10:00:00.000,Andree Wischnewski,AVA Club,/events/1115212,11
la Fête Triste de la Musique by Aufnahme + Wiedergabe,2018-06-21T00:00:00.000,2018-06-21T22:00:00.000,2018-06-22T07:00:00.000,"Templer, Philipp Strobel, Rendered",Urban Spree,/events/1123250,11
Fête de la Monkeytown,2018-06-21T00:00:00.000,2018-06-21T21:00:00.000,2018-06-22T06:00:00.000,,OHM,/events/1124040,9
Liquid Thursday,2018-06-21T00:00:00.000,2018-06-21T15:00:00.000,2018-06-22T06:00:00.000,"Tyler Friedman, Samuel Rohrer, Wareika, André Galluzzi, Laylla Dane",Club der Visionaere,/events/1125177,9
Daisy Dans Open Air,2018-06-21T00:00:00.000,2018-06-21T12:00:00.000,2018-06-21T22:00:00.000,"Hendrixen, Carlos Chravez",Volkspark Friedrichshain,/events/1090959,8
Goys´n´birls: Mid Summer Madness,2018-06-21T00:00:00.000,2018-06-21T23:59:00.000,2018-06-22T10:00:00.000,"Shumi, Larry Tee, Robert Owens, Mike Starr, Sexy Lazer",Kater Blau,/events/1121140,7
Siegfried Kärcher's Klängbilder,2018-06-21T00:00:00.000,2018-06-21T20:00:00.000,2018-06-22T03:00:00.000,"Wintermute, Poltergeist",Liquid Sky Berlin - #LSB02,/events/1113325,6
"Oqko at Acud with Wilted Woman, astvaldur, Lukas Grundmann and More",2018-06-21T00:00:00.000,2018-06-21T21:00:00.000,2018-06-22T02:00:00.000,"astvaldur, Wilted Woman, smog [oqko]",Acud Macht NEU,/events/1121364,5
Anomalie ART & Meier Music,2018-06-21T00:00:00.000,2018-06-21T13:00:00.000,2018-06-22T04:00:00.000,,Mensch Meier,/events/1122148,4
Fette Musik,2018-06-21T00:00:00.000,2018-06-21T12:00:00.000,2018-06-21T22:00:00.000,"Miro Pajic, Matheiu, Flo Pirke, Bee Lincoln, Kevin Domanski",Zum Umsteiger,/events/1126444,4
NEU Pberg Fête Edition,2018-06-21T00:00:00.000,2018-06-21T18:00:00.000,2018-06-22T02:00:00.000,"John Loveless, Jonathan Mendiola",Bar 21,/events/1118400,3
Clæp Visions presents: Flight Mode Disco Runway,2018-06-21T00:00:00.000,2018-06-21T21:30:00.000,2018-06-22T06:00:00.000,Ion Vulcan,Kaffee Burger,/events/1124288,3
Rooftop Summer Special/Fete de la Musique,2018-06-21T00:00:00.000,2018-06-21T17:00:00.000,2018-06-22T23:00:00.000,,NENI Berlin / Monkey Bar,/events/1098338,2
Fête de la Musique Späti Open Air with Small Talk Records,2018-06-21T00:00:00.000,2018-06-21T16:00:00.000,2018-06-21T22:00:00.000,"Christa Belle, Deniz Arslan, Ben Olayinka",TBA - Berlin,/events/1123411,2
John T. Gast & MC Boli,2018-06-21T00:00:00.000,2018-06-21T21:00:00.000,2018-06-21T23:00:00.000,John T. Gast,Roter Salon,/events/1124401,2
Electronic.Thursday mit Atree,2018-06-21T00:00:00.000,2018-06-21T19:00:00.000,2018-06-22T06:00:00.000,Atree,Minimal Bar,/events/1125834,2
Fett,2018-06-21T00:00:00.000,2018-06-21T17:00:00.000,2018-06-22T02:00:00.000,dinaLiks,Wildenbruch Bar,/events/1126173,2
After-Work Session,2018-06-21T00:00:00.000,2018-06-21T17:00:00.000,2018-06-21T23:00:00.000,Sharevari,Reinhard Bär Restaurant und Café,/events/1117266,1
Blackalicious Berlin,2018-06-21T00:00:00.000,2018-06-21T18:00:00.000,2018-06-22T02:00:00.000,,Solar,/events/1120752,1
"Driftmachine & Tatu Rönkkö (Liima, Efterklang) DJs: Fitz & Savy Sev",2018-06-21T00:00:00.000,2018-06-21T20:00:00.000,2018-06-22T02:00:00.000,"Driftmachine, Tatu, Efterklang, DJ Fitz",arkaoda Berlin,/events/1122434,1
Currywurst & Champagner,2018-06-21T00:00:00.000,2018-06-21T12:00:00.000,2018-06-21T22:00:00.000,"Opti, Donatello",Hometown.berlin,/events/1125647,1
"Klubnacht with Cassy, Josh Wink, Dj QU, Amir Alexander and More",2018-06-22T00:00:00.000,2018-06-22T20:00:00.000,2018-06-23T12:00:00.000,"Cassy, Josh Wink, DJ Qu, Amir Alexander, Michael Zucker, Bloody Mary, Nadine Hennig, Damian.Thorn",[ipsə],/events/1075737,236
"Savour The Moment /w. Neil Landstrumm, Pablo Mateo, Samo DJ, Lux & More",2018-06-22T00:00:00.000,2018-06-22T23:59:00.000,2018-06-23T12:00:00.000,"Neil Landstrumm, Pablo Mateo, Wrong Copy, Samo DJ, Lux., Marlon Hoffstadt, Strip Steve, Opal Sunn, Hiroaki OBA, Opium Hum, JM Moser, Golesworthy, HouseWork, Timecop, Sarj, caasun, Philipp Schultheis",Renate,/events/1091012,185
"Deep Fried 43 - Jonas Kopp, Trus'me, Claudio PRC & More",2018-06-22T00:00:00.000,2018-06-22T22:00:00.000,2018-06-23T22:00:00.000,"Jonas Kopp, Claudio PRC, Emika, Trus'me, John Barera, Esther Duijn, Steven Pieters, Norman Methner, Frühschoppen Team",Griessmuehle,/events/1116176,167
3'Hi x Boy Better Know,2018-06-22T00:00:00.000,2018-06-22T22:30:00.000,2018-06-23T06:00:00.000,,Prince Charles,/events/1116144,144
Staub XXL,2018-06-22T00:00:00.000,2018-06-22T23:59:00.000,2018-06-23T22:00:00.000,,://about blank,/events/1098204,127
9 Years suicide circus Non Stop Birthday Weekend (Open Air + Club),2018-06-22T00:00:00.000,2018-06-22T23:59:00.000,2018-06-25T10:00:00.000,"Aerea Negrot, Axiom (CL), Cynthia Stern, Alexander Kowalski, Dinamite, DJ Jauche, DJ Krime, DJ TLR, Errorbeauty, Frank Lorber, Gebrüder Teichmann, Haubitz, HGR, Housemeister, Jammin' Unit, Otto Von Schirach, Púca, Silicone Soul, Tanith, Lee Jokes, Robert Deckstar, Daniel Dreier, Tashi Luis, Lee Jones, Aquarius Heaven, Sqim, Bürger Pe",Lokschuppen Berlin,/events/1110407,125
Solid-Grounded Festival 2018,2018-06-22T00:00:00.000,2018-06-22T14:00:00.000,2018-06-24T18:00:00.000,"Pär Grindvik, Zenker Brothers, Stenny, Andrea, Oliver Deutschmann, Marcel Heese, Asquith, Route 8, Deadbeat, Binny, Jonas Palzer, Gian, D-IX, Damien Eie, DJ speedway, Iron Curtis, Steve Challier, Frederic., Discult Soundsystem, stevn.aint.leavn, Beddermann & Dahlmann, Kontny & Stache, Marc Brauner, Nostique, Ellosophy, Leving, Binto, DJ Ronny Lite, Daito, 65 Shapeshifters, Linko, Linko",TBA - Berlin,/events/1081183,114
Finest Friday,2018-06-22T00:00:00.000,2018-06-22T23:59:00.000,2018-06-23T12:00:00.000,"Boo Williams, Lakuti, Tama Sumo",Berghain | Panorama Bar | Säule,/events/1111340,102
"Nachtrausch with 2pole, Bondi Live, Danito & Athina",2018-06-22T00:00:00.000,2018-06-22T23:59:00.000,2018-06-23T10:00:00.000,"2pole, Danito & Athina, Athina, Rob Me, Thomas Maschitzke, Lukas Meunier",Ritter Butzke,/events/1114525,95
Bordel Des Arts - In The Zone - 26h,2018-06-21T00:00:00.000,2018-06-21T22:00:00.000,2018-06-22T23:59:00.000,"David Keno, Ron Flatter, Kotelett&Zadak, Kotelett, Jake the Rapper, Sam Shure, Mila Stern, The Reason Y, Beth Lydi, Galen, Anthony Mansfield, Sokool, Mike Book, Daniel Jaeger, Alexander Aurel, Beddermann & Dahlmann, Casimir von Oettingen, Electronic Elephant, freedomB, Viktor Talking Machine, vom Feisten, Pedro Arbulu, Joseph Disco, Leving, Martin Ka, Bako, Los Cabra, JurieMember, Daensen, Henheimer",Renate,/events/1087972,75
"Music Lab with Brett Johnson, Ida Daugaard, Andrea Di Rocco and More",2018-06-22T00:00:00.000,2018-06-22T20:00:00.000,2018-06-23T10:00:00.000,"Brett Johnson, Ida Daugaard, Wide Awake, Andrea Di Rocco",Chalet,/events/1116335,64
beatrausch Pres. Sweaty Palms X Brudi Love,2018-06-22T00:00:00.000,2018-06-22T23:00:00.000,2018-06-23T06:00:00.000,"Sweaty Palms, Albrecht Wassersleben, Karima F, Basco, Phonatic, Rudolph Beuys",Paloma,/events/1121614,61
Tresor.Klubnacht,2018-06-22T00:00:00.000,2018-06-22T23:59:00.000,2018-06-23T12:00:00.000,"Gerd, Iron Curtis, Steve Challier, Steve Bicknell, Kastil, Pacou, Marcel Heese",Tresor / Globus,/events/1115069,51
"Midsommar Rave with Foolik, Adhs, Georg Stuby & More",2018-06-22T00:00:00.000,2018-06-22T23:00:00.000,2018-06-23T10:00:00.000,"Foolik, Georg Stuby, A.D.H.S., Andi de Luxe",Birgit,/events/1098583,41
"Ritter Butzke - Unter Freiem Himmel w/ Andhim, Niconé & Dirty Doering",2018-06-21T00:00:00.000,2018-06-21T18:00:00.000,2018-06-22T23:59:00.000,"Andhim, Niconé, Dirty Doering, Matthias Schuell, Prismode, Sam Shure, Toni Haupt, HRRSN, Markus Klee, Turkish",Ritter Butzke,/events/1108210,39
"Gruppenzwang - w. Shir Khan, Agent, KC Wray, Gabriel I",2018-06-22T00:00:00.000,2018-06-22T23:59:00.000,2018-06-23T08:00:00.000,"Agent, Shir Khan, KC Wray, Gabriel I",Polygon Club,/events/1126765,31
Suzaku,2018-06-22T00:00:00.000,2018-06-22T23:00:00.000,2018-06-23T07:00:00.000,"Batty, Katapult Duo, Five Ten, Sense of Sun, Kamyar Keramati, Langtunes, Vincent Kenway",Humboldthain Club,/events/1122376,26
Dancing For Mental Health with Andrea Gemolotto,2018-06-22T00:00:00.000,2018-06-22T23:00:00.000,2018-06-23T07:00:00.000,"Andrea Gemolotto, Leo Mas, Tom Bolas, Budino",Sameheads,/events/1102505,25
Wanted - Yannick Robyns / Attan / Dede / John-E / Chantal / Deejames / Glove,2018-06-22T00:00:00.000,2018-06-22T23:59:00.000,2018-06-23T12:00:00.000,"Attan, John-E, Glove, Dede, Yannick Robyns, Deejames",Kater Blau,/events/1109179,22
"Small Black Dots Invites Casa Voyager, Phi and Polarity",2018-06-22T00:00:00.000,2018-06-22T15:00:00.000,2018-06-23T06:00:00.000,"Driss Bennis, Jalil, Vid Vai, Kosta, Luca Piermattei, Gabro, Alex Picone",Club der Visionaere,/events/1118309,20
"Behind The Iron Gate with N1L, Rugilė, Marius Georgescu & Galas",2018-06-22T00:00:00.000,2018-06-22T23:59:00.000,2018-06-23T08:00:00.000,"N1L, Marius Georgescu",OHM,/events/1116232,19
Hermetic Tribe // Mentalism,2018-06-22T00:00:00.000,2018-06-22T23:59:00.000,2018-06-23T10:00:00.000,"Wallis, Halv Drøm, Horia H, Orbital Plane",Arena Club,/events/1121477,15
Noise is the Message,2018-06-22T00:00:00.000,2018-06-22T23:00:00.000,2018-06-23T08:00:00.000,,Void Club,/events/1113578,14
Disco Spektrum - Open Turntables & Club Night,2018-06-22T00:00:00.000,2018-06-22T20:00:00.000,2018-06-23T06:00:00.000,"White Lie, Brennero",Crack Bellmer,/events/1117660,14
Ultra Light Plus,2018-06-22T00:00:00.000,2018-06-22T23:00:00.000,2018-06-23T08:00:00.000,"Excell, Syrtaki, Thomas Hoffmann",Zur Klappe,/events/1119958,14
Slimed,2018-06-22T00:00:00.000,2018-06-22T22:00:00.000,2018-06-23T06:15:00.000,Sequiin,Loophole,/events/1124775,14
We Love Dance Moves with Gerne Records & David Roeglin,2018-06-22T00:00:00.000,2018-06-22T19:00:00.000,2018-06-23T07:00:00.000,"DJ Serio, Ebrian, ROEGLIN",Promenaden Eck,/events/1118576,12
Watergate VS Warung,2018-06-22T00:00:00.000,2018-06-22T23:59:00.000,2018-06-23T12:00:00.000,"Renato Ratier, Marco Resmann, Fran Bortolossi, Leo Janeiro, Eli Iwasa",Watergate,/events/1109159,10
