Donnerdogge,2024-04-11T00:00:00.000,2024-04-11T23:59:00.000,2024-04-12T13:00:00.000,"Cotumo, Click | Click, DJ Zurückbleiben Bitte, Radio Marrakech",Golden Gate,/events/1892219,17
THE UNKNOWN,2024-04-11T00:00:00.000,2024-04-11T19:00:00.000,2024-04-12T02:00:00.000,,Zu Mir Oder Zu Dir,/events/1889453,17
Marla at Klunkekranich,2024-04-11T00:00:00.000,2024-04-11T16:00:00.000,2024-04-12T01:00:00.000,"Elli.on, Loganic, Dirty Lemon, Fanfarrosa",Klunkerkranich,/events/1899204,16
Art|Diccton / meets d.OHA!se,2024-04-11T00:00:00.000,2024-04-11T23:00:00.000,2024-04-12T08:00:00.000,"Ozzy Riot, VLT (FI), Wiebe Roose, ED2000",Der Weiße Hase,/events/1895795,21
electronic.thursday mit Kat Kat Tat,2024-04-11T00:00:00.000,2024-04-11T18:00:00.000,2024-04-12T06:00:00.000,Kat Kat Tat,Minimal Bar,/events/1868278,13
METACUTS,2024-04-11T00:00:00.000,2024-04-11T21:00:00.000,2024-04-12T04:00:00.000,"BarbNerdy, Bassdee, Paulawar",Panke,/events/1897324,9
Tausend ELECTRONICA - Marvel Gold,2024-04-11T00:00:00.000,2024-04-11T22:00:00.000,2024-04-12T04:00:00.000,Marvel Gold,Tausend,/events/1898981,9
Hanno Leichtmann + Rachel Lyn,2024-04-11T00:00:00.000,2024-04-11T20:00:00.000,2024-04-11T22:00:00.000,Rachel Lyn,Silent Green,/events/1881779,7
Paradox by XMAGINE,2024-04-10T00:00:00.000,2024-04-10T21:00:00.000,2024-04-14T06:00:00.000,"FTRXPRS, Michele Tedeschi, Tom Pavicich, Sam Gittis",Repeat,/events/1900646,6
Ghostly Kisses,2024-04-11T00:00:00.000,2024-04-11T20:00:00.000,2024-04-11T23:00:00.000,,Frannz Club,/events/1825976,6
Chantals House of Shame,2024-04-11T00:00:00.000,2024-04-11T23:00:00.000,2024-04-12T06:00:00.000,,Lokschuppen Berlin,/events/1901172,4
ThursdayVibeZz,2024-04-11T00:00:00.000,2024-04-11T23:00:00.000,2024-04-12T05:00:00.000,ziehmore,Recede Club Berlin,/events/1902067,3
Piros Thursdays::,2024-04-11T00:00:00.000,2024-04-11T18:00:00.000,2024-04-12T03:00:00.000,Pablo Cornejo,Club der Visionaere,/events/1902626,3
PSYCHO BDAY,2024-04-11T00:00:00.000,2024-04-11T22:00:00.000,2024-04-12T07:00:00.000,,KitKatClub,/events/1903285,3
Joy Anonymous,2024-04-11T00:00:00.000,2024-04-11T20:00:00.000,2024-04-11T23:59:00.000,,Säälchen,/events/1868268,3
IGWITM presents Finer Things,2024-04-11T00:00:00.000,2024-04-11T19:30:00.000,2024-04-11T23:59:00.000,Helina,BER,/events/1892779,2
Ossios / Jeremy Black / BobbyBrim / World Wild Web,2024-04-11T00:00:00.000,2024-04-11T22:00:00.000,2024-04-12T06:00:00.000,"Ossios, worldwildweb, Jeremy Black",Sameheads,/events/1894464,2
Calimas Hütte,2024-04-11T00:00:00.000,2024-04-11T22:00:00.000,2024-04-12T04:00:00.000,Calima,Ritter Butzke,/events/1899797,2
TRUFFLE 101 launch,2024-04-11T00:00:00.000,2024-04-11T18:00:00.000,2024-04-11T23:59:00.000,Oliver.r,TORTE BAR,/events/1899823,2
"THRESHOLD: Aethereal Arthropod, Queer Falafel, Soft Fantasy, ELAYN, Jealous Orgasm",2024-04-11T00:00:00.000,2024-04-11T21:00:00.000,2024-04-12T04:00:00.000,ELAYN,90mil,/events/1901333,2
test event,2024-04-10T00:00:00.000,2024-04-10T23:00:00.000,2024-04-14T06:00:00.000,,Monarch,/events/1901565,2
Electro Vibes,2024-04-11T00:00:00.000,2024-04-11T19:00:00.000,2024-04-11T23:00:00.000,Maringo,Liquidrom,/events/1902106,2
Sky-Bar Warmup - Free Entrance - Soulful Vibes & Electronica,2024-04-11T00:00:00.000,2024-04-11T18:00:00.000,2024-04-12T01:00:00.000,,Solar,/events/1889750,1
Laguna Fortuna,2024-04-11T00:00:00.000,2024-04-11T19:00:00.000,2024-04-12T02:30:00.000,,Humboldthain Club,/events/1903165,0
Alt Rock Folk from Scotland: James Michael Rodgers,2024-04-11T00:00:00.000,2024-04-11T19:30:00.000,2024-04-12T03:00:00.000,,Petersburg Art Space,/events/1884669,0
Shameless/Limitless: Jae Tyler / Arthur J. Reptilian / Nochteff,2024-04-11T00:00:00.000,2024-04-11T19:00:00.000,2024-04-12T01:00:00.000,,Loophole,/events/1891071,0
UNHOLY x WELCOME BACK DEVIL,2024-04-12T00:00:00.000,2024-04-12T21:00:00.000,2024-04-13T09:00:00.000,"Shlømo, DYEN, Krl Mx, Peligre, Alex Farell, NOTMYTYPE (2)",Astra Kulturhaus,/events/1841653,2493
SYNOID Weekender,2024-04-12T00:00:00.000,2024-04-12T23:59:00.000,2024-04-15T12:00:00.000,"Acierate, Afem Syko, Alva, Antigone, AYLIN IDAH, Kim She, Benjamin Damage, Chemtrailz, Drazzit, Echoes Of October, Epikur, K. Luisa, Keepsakes, Lucia Lu, Madda Chantal, Parallx, Pernox, ROÜGE, SHADYLINES, Takaaki Itoh, Theo Nasa, Valerie Ace, WNDRLST",RSO.BERLIN,/events/1868046,2119
From All Sides: Festival of Spatial Sound,2024-04-10T00:00:00.000,2024-04-10T17:00:00.000,2024-04-13T22:00:00.000,"DUALDISK, Icaro, Martina Bertoni, Nino Theys, Parallel Processing",Funkhaus Berlin,/events/1892761,608
Candyflip x NEUTRUM,2024-04-12T00:00:00.000,2024-04-12T23:00:00.000,2024-04-13T09:00:00.000,"MATRAKK, DJ Sonnenbrand, David Strasser, snoritz, Amøn, alemiko, cell1, DJ Flink",Lokschuppen Berlin,/events/1838184,507
"Toy Tonics Jam w/ Dan Shake b2b Myd, Sam Ruffillo, JAXX TMS b2b yung_womb",2024-04-12T00:00:00.000,2024-04-12T22:00:00.000,2024-04-13T08:00:00.000,"Dan Shake, Myd, JAXX TMS, yung_womb, Sam Ruffillo, Piek, Divorce, Jeyrototo",OST,/events/1882534,473
"Straat 264 x THE AOS with Meg10, Janis Zielinski, Upper90, EloTrance, TSAVAGE and more",2024-04-12T00:00:00.000,2024-04-12T23:00:00.000,2024-04-13T08:00:00.000,"Meg10, Janis Zielinski, Upper90, EloTrance, TSAVAGE, EliaHaze, DJ SOURCE, Shmonèss",Humboldthain Club,/events/1883972,474
"Bliss  u.r.trax, Cromby, Regal86, DJ Saliva",2024-04-12T00:00:00.000,2024-04-12T23:00:00.000,2024-04-13T09:00:00.000,"u.r.trax, Dj Saliva, Regal86, guuc20459, Menki, OSKAR., Cromby, Aroma Pitch, E.LINA, Annyrock",ÆDEN,/events/1864711,243
Orbit Berlin x Paradis Artificiel,2024-04-12T00:00:00.000,2024-04-12T23:00:00.000,2024-04-13T08:00:00.000,"Mode_1, Bconscious, Gforty, G.oss, James Smyth, Guido Iacovitti, Flight Mode (DE), Jezero, Kobzev",M01,/events/1885930,239
"MIT DIR Zwischenraum & Zeit w/ Peter Groskreutz, Philipp Kempnich, Reyneke, RachelRaw, Multifun",2024-04-12T00:00:00.000,2024-04-12T19:00:00.000,2024-04-14T12:00:00.000,"Philipp Kempnich, Rachel Raw, Onory, Rufus Rabatz, - C2C -, Paqueta, Rosa Kante, KLATTE, Spicy Sweets, Mwaah, Anna Almani, Peter Groskreutz, TraumaMia, Söriös / Q.rios, BARTi, Phauna, Marco Liebreiz, Schwirri, Frieda Karlssøn, Cleos, Multifun, HEDDA, CHOREOPHILA",Abstrakt,/events/1883741,232
"Denis Sulta & HoneyLuv: Kristin Velvet, The Honey Tapes, Kevin STN, Infamous Ali, Marit",2024-04-12T00:00:00.000,2024-04-12T23:00:00.000,2024-04-13T12:00:00.000,"Denis Sulta, HoneyLuv, Kristin Velvet, The Honey Tapes, Kevin STN, Infamous Ali, Marit",Watergate,/events/1887283,200
"Birgits Frühlingserwachen mit Pascale Voltaire, Mona Moore, Bianka Banks, Intaktogene, uvm",2024-04-12T00:00:00.000,2024-04-12T19:00:00.000,2024-04-13T08:00:00.000,"MUKKIMIAU, Mona Moore, Intaktogene, Pascale Voltaire, Timish, Bianka Banks, Anya and Selin, Leon Licht",Birgit,/events/1843502,222
"Renate Klubnacht with DJ Fett Burger, Jana Falcon, Galaxaura, Purita D, SEDVS, Sasa Strauss",2024-04-12T00:00:00.000,2024-04-12T17:00:00.000,2024-04-13T08:00:00.000,"Nhouse, Solco privato, Galaxaura, SEDVS, Sasa Strauss (DE), Femdelic, DJ Fett Burger, Jana Falcon, Acid Washed, Purita D",Renate,/events/1820649,180
NMA Invites: Family & Friends V1,2024-04-12T00:00:00.000,2024-04-12T22:30:00.000,2024-04-13T06:00:00.000,"Atzenernst, elmar, Baby Kallax, Kallax, jetfunk",60 Hz,/events/1890151,178
DYNAMIC,2024-04-12T00:00:00.000,2024-04-12T23:00:00.000,2024-04-13T09:00:00.000,"coochieandfriendz, DJ Ferrari (2), Gretchen Bazooka, OUTOFORDERB2B, DJ Rakita, V (NYC), Zoë Alhosni",OXI,/events/1867189,176
Ritmo Gabar #002 with Carly Zeng and Jessica Nightlife,2024-04-12T00:00:00.000,2024-04-12T23:59:00.000,2024-04-13T06:30:00.000,"Carly Zeng, Jessica Nightlife, B.bby",Lark,/events/1871794,152
about bridges not walls,2024-04-12T00:00:00.000,2024-04-12T23:59:00.000,2024-04-13T10:00:00.000,"BKMN, Eluzid, End Train, goldie (2), karete bu, Vilma",://about blank,/events/1854587,151
 ŠAMAŠ,2024-04-12T00:00:00.000,2024-04-12T23:00:00.000,2024-04-13T09:00:00.000,"Viscerale, KTK (DE), TEHOTU, Gina Demarchi, Al Aslan, Oktobr, Omar.D, saHHar, Opal",Anomalie Art Club,/events/1884623,134
Superluminal x Discarded Gems,2024-04-12T00:00:00.000,2024-04-12T23:00:00.000,2024-04-13T11:00:00.000,"Unai Trotti, Antwork, Ancut, Log _In",Hoppetosse,/events/1886652,134
Antrieb #22,2024-04-12T00:00:00.000,2024-04-12T23:00:00.000,2024-04-13T11:00:00.000,"Tiefundton, Ochs & Klick, Drauf & Dran DJ Team, Felix Reichelt, Kaminka Merel, Marcus Meya",Der Weiße Hase,/events/1878683,120
EXCiTE meets Schwerelos,2024-04-12T00:00:00.000,2024-04-12T23:00:00.000,2024-04-13T08:00:00.000,"Ben Green, Haennson, Ida Scheppert, Lukas Edler, MEEMA, Missing.DJ, Sommersonnenwende, Upzet, Yannick, b0ys_cry",Void Club,/events/1885696,101
Limousine Dream,2024-04-12T00:00:00.000,2024-04-12T22:00:00.000,2024-04-13T06:00:00.000,"Ron Obvious, Coast 2 Coast, Gene On Earth, The Ghost, KRN, Peach, Sugar Free",Berghain | Panorama Bar | Säule,/events/1853367,89
Cutloose & Friends,2024-04-12T00:00:00.000,2024-04-12T23:00:00.000,2024-04-13T06:00:00.000,"noa boiler, Joshi Reinard, Misha Jaru",Privatclub,/events/1869970,87
xTrance / Hardtrance & Groove,2024-04-12T00:00:00.000,2024-04-12T23:00:00.000,2024-04-13T09:00:00.000,"Louis Harshman, Carotin, Felix Schall, Popsen",M-BIA,/events/1892213,77
Alchemy Room,2024-04-12T00:00:00.000,2024-04-12T23:00:00.000,2024-04-13T08:00:00.000,"Don Andres, BECKSHAM, Dei Funk, dj boyfriend, BFAM, Lisa Cropp, Diana Orion",AVA Club,/events/1883175,75
KURZSTRECKE 14,2024-04-12T00:00:00.000,2024-04-12T22:00:00.000,2024-04-13T10:00:00.000,"Tobi Neumann, Max Marlon, Franziska Berns, Henriku",Kater Blau,/events/1884035,60
Tresor meets Blake Baxter,2024-04-12T00:00:00.000,2024-04-12T23:00:00.000,2024-04-13T12:00:00.000,"Blake Baxter, The Neighbourhood Character, Developer, Marmosets, Milena Glowacka, Volpe",Tresor / Globus,/events/1875640,55
Aimé You invites,2024-04-12T00:00:00.000,2024-04-12T22:00:00.000,2024-04-13T09:00:00.000,"Aimé You, Daisy Weweh, ATTA (GER)",Ritter Butzke,/events/1878864,52
"Bulbul Berlin invites Broncos Hannover: dj loverence, Margiela, Balearic Banana, Nikklaas & BCP",2024-04-12T00:00:00.000,2024-04-12T23:00:00.000,2024-04-13T06:00:00.000,"dj loverence, Balearic Banana, Nikklaas, Better Call Paul",Bulbul Berlin,/events/1880186,52
Einmusik,2024-04-12T00:00:00.000,2024-04-12T22:00:00.000,2024-04-13T09:00:00.000,"Einmusik, SKIY, Cosmic Minds (DE)",Ritter Butzke,/events/1829114,44
"Spread The Groove (Hinter den Alpen): Daniel Wang, Enzio Etchaberri, Balthazar Martinez",2024-04-12T00:00:00.000,2024-04-12T20:00:00.000,2024-04-13T03:00:00.000,"Daniel Wang, Enzio Etchaberri, Balthazar Martinez",Klunkerkranich,/events/1898401,42
decompression,2024-04-12T00:00:00.000,2024-04-12T23:00:00.000,2024-04-13T07:00:00.000,"11:68PM, Candy Jones, Luca Mariaux, paisa",Fitzroy,/events/1882636,41
Trip the Light presents Al Wootton (Trule / Livity Sound),2024-04-12T00:00:00.000,2024-04-12T23:00:00.000,2024-04-13T07:00:00.000,"Al Wootton, Akiï, Blossom Hill, Lyndon Lewis",Zur Klappe,/events/1840805,40
SUBLAND - Sub:Vi0LenZ 8 with Hard Drum & Bass - Crossbreed - Breakcore,2024-04-12T00:00:00.000,2024-04-12T23:00:00.000,2024-04-13T06:00:00.000,"Slave To Society, KRYTIKA, Fexomat, VVET., STEEZY, Sonair, Acriter",Panke,/events/1879857,36
ALLE IM GLEICHEN BOOT,2024-04-12T00:00:00.000,2024-04-12T18:00:00.000,2024-04-13T06:00:00.000,Maximus.,Freischwimmer,/events/1894805,33
Love Circus,2024-04-12T00:00:00.000,2024-04-12T23:00:00.000,2024-04-13T06:00:00.000,"Omi on Acid, Gino Kampari, Jose Puerto, Lena Brysch, Rhast",DAS Institut,/events/1886571,32
Darker Sounds of a Present Future II,2024-04-12T00:00:00.000,2024-04-12T21:00:00.000,2024-04-13T02:00:00.000,"The Allegorist, Nundale, Exan",Acud Macht NEU,/events/1877217,30
Dj Workshop,2024-04-10T00:00:00.000,2024-04-10T18:00:00.000,2024-04-17T22:00:00.000,,Funkhaus Berlin,/events/1901353,26
Klubnacht + Afterhour,2024-04-12T00:00:00.000,2024-04-12T23:59:00.000,2024-04-13T23:59:00.000,"metaverde, Nadine Hennig, Jased, Nils Ohrmann, Phonatic, George P., Monday Edition",Golden Gate,/events/1892225,25
"ferrari rot, Zeynep, Blu:sh",2024-04-12T00:00:00.000,2024-04-12T22:00:00.000,2024-04-13T07:00:00.000,"ferrari rot, Zeynep, Blu:sh",Sameheads,/events/1890770,24
Sonntagsinstitut pres. Aquatic Travellers Vol. 4,2024-04-12T00:00:00.000,2024-04-12T23:30:00.000,2024-04-13T08:00:00.000,"adodo, Black Mirror Park, bb:fm",Paloma,/events/1861155,22
Somewhere Press x Slowfoam,2024-04-12T00:00:00.000,2024-04-12T19:00:00.000,2024-04-13T03:00:00.000,"Slowfoam, Alliyah Enyo, Baptist Goth, Chantal Michelle, Pablo Diserens, André Pahl, Man Rei",90mil,/events/1882681,17
SWAK,2024-04-12T00:00:00.000,2024-04-12T23:59:00.000,2024-04-13T06:00:00.000,"ALISSAZADDI, Bloomfeld, Oldyungmayn, mx.pinky",OHM,/events/1889896,17
sturmfrei Oaky & Andi de Luxe,2024-04-12T00:00:00.000,2024-04-12T18:00:00.000,2024-04-13T06:00:00.000,"Oaky, Andi de Luxe",Minimal Bar,/events/1868284,16
OUT OF ORDER w/ Ines Cartas,2024-04-12T00:00:00.000,2024-04-12T23:00:00.000,2024-04-13T08:00:00.000,Ines Cartas,Beate Uwe,/events/1880964,16
Blachord presents: The House Trip,2024-04-12T00:00:00.000,2024-04-12T22:00:00.000,2024-04-13T01:00:00.000,Blachord,Mein Haus Am See,/events/1903062,15
"Agua Dulce: Ale Hop (guitar, electronics) & Laura Robles (cajón)",2024-04-12T00:00:00.000,2024-04-12T19:30:00.000,2024-04-12T22:00:00.000,"ALCATRAZ, Lamento",Galiläakirche,/events/1894345,14
Flashback Friday! The kinky 90's-00's party,2024-04-12T00:00:00.000,2024-04-12T22:00:00.000,2024-04-13T06:00:00.000,,Insomnia,/events/1872360,11
"FRIDAY with Bobby Soulo, Anjawah and Aria Santillana",2024-04-12T00:00:00.000,2024-04-12T20:00:00.000,2024-04-13T06:00:00.000,"Anjawah, Aria Santillana",Promenaden Eck,/events/1890736,9
"Disco Drops with Neobeo, Paqueta, Nigel Nagel",2024-04-12T00:00:00.000,2024-04-12T22:00:00.000,2024-04-13T06:00:00.000,"Neobeo, Paqueta, Nigel Nagel",Crack Bellmer,/events/1893816,8
[con]fusion #02,2024-04-12T00:00:00.000,2024-04-12T23:00:00.000,2024-04-13T07:00:00.000,"Anton Quasi, Yoru, TBA",Void Hall,/events/1897760,8
Paradox by XMAGINE,2024-04-10T00:00:00.000,2024-04-10T21:00:00.000,2024-04-14T06:00:00.000,"FTRXPRS, Michele Tedeschi, Tom Pavicich, Sam Gittis",Repeat,/events/1900646,6
Bananas,2024-04-12T00:00:00.000,2024-04-12T22:00:00.000,2024-04-13T06:00:00.000,"Akirahawks, Hideto Omura",Paloma,/events/1884970,5
Sky-Bar Warmup - Free Entrance - Soulful Vibes & House,2024-04-12T00:00:00.000,2024-04-12T18:00:00.000,2024-04-13T02:00:00.000,,Solar,/events/1889752,5
Shameless/Limitless: Mirrors For Princes,2024-04-12T00:00:00.000,2024-04-12T19:00:00.000,2024-04-13T04:00:00.000,,8MM,/events/1891080,4
Euphoric Elephants - Album Release Party,2024-04-12T00:00:00.000,2024-04-12T21:00:00.000,2024-04-13T03:00:00.000,,BLO-Ateliers,/events/1898956,3
Fridays:,2024-04-12T00:00:00.000,2024-04-12T18:00:00.000,2024-04-13T05:00:00.000,"Francesco Passantino, himeee, Dan Beaven",Club der Visionaere,/events/1902732,3
test event,2024-04-10T00:00:00.000,2024-04-10T23:00:00.000,2024-04-14T06:00:00.000,,Monarch,/events/1901565,2
FUNKY SOUL,2024-04-12T00:00:00.000,2024-04-12T21:00:00.000,2024-04-13T06:00:00.000,"Dominik Szczepaniak, Mat Fink, Mini Nik",Repeat,/events/1903541,2
Parabólica Nights,2024-04-12T00:00:00.000,2024-04-12T22:00:00.000,2024-04-13T02:00:00.000,,Palabra Bar,/events/1903603,2
Filthy Pleasures,2024-04-12T00:00:00.000,2024-04-12T22:00:00.000,2024-04-13T05:00:00.000,Fab.s,Mysliwska,/events/1889781,2
Revolver Party - SUPERQUEEROS,2024-04-12T00:00:00.000,2024-04-12T23:00:00.000,2024-04-13T06:00:00.000,"Karsten Sollors, 2FARO, Feel .MA",KitKatClub,/events/1968704,1
.:trains with Marie Tjong Ayong & YYARD,2024-04-12T00:00:00.000,2024-04-12T20:30:00.000,2024-04-13T03:00:00.000,YYARD,Orangerie Neukölln,/events/1899947,1
"Renate Garden Season Opening, hosted by Orbit Berlin & Paradis Artificiel",2024-04-12T00:00:00.000,2024-04-12T17:00:00.000,2024-04-12T22:00:00.000,,Renate,/events/1904688,1
[con]fusion #02,2024-04-12T00:00:00.000,2024-04-12T23:00:00.000,2024-04-13T07:00:00.000,"Geostatic, Anton Quasi, Yoru, Bass, PM",Void Club,/events/1971329,0
Stimmen in Aspik - Die Schlager-Party,2024-04-12T00:00:00.000,2024-04-12T21:00:00.000,2024-04-13T05:00:00.000,,Hafenbar Berlin,/events/1897950,0
11 Jahre Design By Accident,2024-04-12T00:00:00.000,2024-04-12T21:00:00.000,2024-04-13T04:00:00.000,,Eschschloraque,/events/1899531,0
Techno Moon Night - Friday,2024-04-12T00:00:00.000,2024-04-12T22:00:00.000,2024-04-13T06:00:00.000,Gerrit X,Soda Club,/events/1877651,0
SYNOID Weekender,2024-04-12T00:00:00.000,2024-04-12T23:59:00.000,2024-04-15T12:00:00.000,"Acierate, Afem Syko, Alva, Antigone, AYLIN IDAH, Kim She, Benjamin Damage, Chemtrailz, Drazzit, Echoes Of October, Epikur, K. Luisa, Keepsakes, Lucia Lu, Madda Chantal, Parallx, Pernox, ROÜGE, SHADYLINES, Takaaki Itoh, Theo Nasa, Valerie Ace, WNDRLST",RSO.BERLIN,/events/1868046,2119
"Climate 24 hours: Pearson Sound, DJ Python b2b Nick León, Surusinghe",2024-04-13T00:00:00.000,2024-04-13T23:59:00.000,2024-04-14T23:59:00.000,"Pearson Sound, DJ Python, Nick León, INVT, Skee Mask, Angel D'lite, Surusinghe, Kia (AU)",Backsteinboot,/events/1871993,1508
"Sven Väth with Damiano von Erckert, Maurizio Schmitz, Greta Spark",2024-04-13T00:00:00.000,2024-04-13T23:00:00.000,2024-04-14T13:00:00.000,"Sven Vath, Damiano von Erckert, Maurizio Schmitz, Greta Spark",Watergate,/events/1874727,772
"DUALISM w/ Lukas Meunier, Dallaniel, Aexhy, Dj Ritalino, Belavie, Ponygirl, H369",2024-04-13T00:00:00.000,2024-04-13T23:00:00.000,2024-04-14T10:00:00.000,"Aexhy, alemiko, Bélavie, Dallaniel, DJ ritalino, H369, Hang Aoki, Julliana Kiddo, Lukas Meunier, ONNY CHO, Ponygirl",://about blank,/events/1868203,768
"FLOORWÄRTS w/ DJ GUESTLIST, PLATTENLIEFERANT, MC KNEIPENKRIEGER x TIGER104er (live) uvm",2024-04-13T00:00:00.000,2024-04-13T23:00:00.000,2024-04-14T09:00:00.000,"DJ GUESTLIST, Plattenlieferant, DJ Powerbank, páthos, tamarawrx3, LUPENKO, Dexy's Midnight, DiskoJochen, dj yolo, DJ TIPSTER",Lokschuppen Berlin,/events/1870614,666
On x Zalando Energy Experience ,2024-04-13T00:00:00.000,2024-04-13T17:00:00.000,2024-04-13T23:59:00.000,"Anna Amato, JAXX TMS",Lapidarium,/events/1889076,609
From All Sides: Festival of Spatial Sound,2024-04-10T00:00:00.000,2024-04-10T17:00:00.000,2024-04-13T22:00:00.000,"DUALDISK, Icaro, Martina Bertoni, Nino Theys, Parallel Processing",Funkhaus Berlin,/events/1892761,608
XXXXXXXXXXXXXXXXXX,2024-04-13T00:00:00.000,2024-04-13T23:00:00.000,2024-04-14T09:00:00.000,"Lukas Firtzer, Juliana Yamasaki, Kamafaka, Filou (DE), .Cheka, LØUS, FREEGO, XIMA",Bar25,/events/1860575,512
Wilderness Open Air with Niki Sadeki,2024-04-13T00:00:00.000,2024-04-13T15:00:00.000,2024-04-13T22:00:00.000,"Niki Sadeki, Franz Matthews, SEIUN, ONNI",Sage Beach Berlin,/events/1886683,441
"Magnetic Field Berlin Feat. Jean Yann on 4 floors (Psytrance, Techno, House, Disko)",2024-04-13T00:00:00.000,2024-04-13T23:00:00.000,2024-04-14T09:00:00.000,"Æ Problæm, Asem Shama, Mike Väth, Modulatos, Philippe Autuori, Josiane, LeVe, Robert Owens, Mad Shivers, Konstantin Scharf, Oliver Raumklang",Void Club,/events/1870453,404
"Fête de l'amour w/ PRADA2000, DJ Local B, Twinflames & many more ",2024-04-13T00:00:00.000,2024-04-13T23:59:00.000,2024-04-14T08:00:00.000,"DJ Local B, futurristic, Krash Cora, PRADA 2000, Stinny Stone, Twinflames, A.N.I., SaltySis",Humboldthain Club,/events/1871845,332
"2 Years Hypersoft: Maara, Spray, Bambi, Bliss Inc., DJ Zozi + more (22h Nonstop + Open Air)",2024-04-13T00:00:00.000,2024-04-13T23:59:00.000,2024-04-14T23:59:00.000,"annna (2), Bliss Inc., Julie Desire, DJ TEETH, E-Talking, Jolly (1), Lastvuska, Maara, Running Hot, Spray, TPR DJ, young oldmann",OXI,/events/1852049,330
Klubnacht,2024-04-13T00:00:00.000,2024-04-13T23:59:00.000,2024-04-15T07:00:00.000,"Colin Benders, STERAC, Anika Kunst, Boris, Fadi Mohem, Steffi, Tasha, Truncate, Binh, Gerd Janson, Moxie, Pablo Bozzi, PARAMIDA, Roi Perez, Victor (DE)",Berghain | Panorama Bar | Säule,/events/1853370,255
"MIT DIR Zwischenraum & Zeit w/ Peter Groskreutz, Philipp Kempnich, Reyneke, RachelRaw, Multifun",2024-04-12T00:00:00.000,2024-04-12T19:00:00.000,2024-04-14T12:00:00.000,"Philipp Kempnich, Rachel Raw, Onory, Rufus Rabatz, - C2C -, Paqueta, Rosa Kante, KLATTE, Spicy Sweets, Mwaah, Anna Almani, Peter Groskreutz, TraumaMia, Söriös / Q.rios, BARTi, Phauna, Marco Liebreiz, Schwirri, Frieda Karlssøn, Cleos, Multifun, HEDDA, CHOREOPHILA",Abstrakt,/events/1883741,232
ATR PARTY - 'Fernet and Pisco',2024-04-13T00:00:00.000,2024-04-13T23:59:00.000,2024-04-14T05:30:00.000,,Lido Berlin,/events/1881792,216
HARDGROOVES WAREHOUSERAVE,2024-04-13T00:00:00.000,2024-04-13T23:00:00.000,2024-04-14T09:00:00.000,"Regent, KVLR, Caniche, ALIS.",Napoleon Komplex,/events/1841887,211
"Renate Klubnacht with Rudeboy, CRANZ, Ady Toledano, Juan Ramos, Alessia Ceruti, Johana Jost",2024-04-13T00:00:00.000,2024-04-13T23:00:00.000,2024-04-14T08:00:00.000,"J.Rozz, CRANZ, Ady Toledano, Alessia Ceruti, Evan Tail, Juan Ramos, Johana Jost, Kotelett",Renate,/events/1820650,191
STAUB,2024-04-13T00:00:00.000,2024-04-13T10:00:00.000,2024-04-13T23:00:00.000,,://about blank,/events/1844808,178
Plaid *live,2024-04-13T00:00:00.000,2024-04-13T19:30:00.000,2024-04-13T23:00:00.000,Plaid,Gretchen,/events/1813698,171
"RECYCLE presents: HOSPITALITY BERLIN feat. Fred V, Nu:Tone, Anaïs, [IVY]",2024-04-13T00:00:00.000,2024-04-13T23:59:00.000,2024-04-14T07:00:00.000,"Fred V, Nu:Tone, Survey, Dynamite MC, Mc Jamie White, JAMera, Dub Isotope",Gretchen,/events/1855203,166
Daytimers #1,2024-04-13T00:00:00.000,2024-04-13T23:00:00.000,2024-04-14T07:00:00.000,"Abibi, Arnav, Sita Shah, SHIR.IN, Temujin, Triqi, Imad, yungfya",Fitzroy,/events/1883220,143
Shameless,2024-04-13T00:00:00.000,2024-04-13T23:00:00.000,2024-04-14T09:00:00.000,"Kaater, Acid Mo, K-Roll, PyjamaMama",AVA Club,/events/1889395,135
Noire Berlin Vol.7,2024-04-13T00:00:00.000,2024-04-13T21:00:00.000,2024-04-14T04:30:00.000,"DJ PayPaul, Aimé You, DOS (3)",60 Hz,/events/1896562,98
Hedomanie: S3X Positive Techno 2 Dance Floors: CyberPunk: The Offspring ,2024-04-13T00:00:00.000,2024-04-13T22:00:00.000,2024-04-14T06:00:00.000,"Wiebe Roose, Ozzy Riot, VLT (FI), Concrete Panther",Insomnia,/events/1833293,95
10y KlangSubsTanz/FBB x Secret Keller RaVe / 3 Floors ,2024-04-13T00:00:00.000,2024-04-13T23:00:00.000,2024-04-14T13:00:00.000,"Marc Eisenberg, V (NYC), Better Call Paul, AHAB, smeik",TBA - Underground Rave ,/events/1884158,88
r:nøcturn / RAW Techno / Dr. Motte,2024-04-13T00:00:00.000,2024-04-13T23:00:00.000,2024-04-14T11:00:00.000,"Dr. Motte, Haito, Maschine, Sika Akis, Somaphon",Der Weiße Hase,/events/1877646,83
BLVSH x EVOLVE,2024-04-13T00:00:00.000,2024-04-13T23:00:00.000,2024-04-14T08:00:00.000,"VINVAR, olesia, Stina Francina, ISA (ES), DJ SKIN, Agata (PL), Mademoisel, HyperLili",M01,/events/1888020,80
"DESSERT with Sarah Wild, Mike Starr, Handmade",2024-04-13T00:00:00.000,2024-04-13T23:00:00.000,2024-04-14T09:00:00.000,"Sarah Wild, Mike Starr, Tom Peters, Handmade, Primal State",Kreuzwerk,/events/1877392,73
Body Language - Charity Edition,2024-04-13T00:00:00.000,2024-04-13T23:00:00.000,2024-04-14T08:00:00.000,,ZENNER,/events/1896553,64
Tresor meets Deep in the Box,2024-04-13T00:00:00.000,2024-04-13T23:00:00.000,2024-04-14T12:00:00.000,"Arno aka Einzelkind, Barbara Preisinger, Fletcher, Melchior Productions Ltd, Erika, Fireground, Julia Govor, Shaleen",Tresor / Globus,/events/1875682,64
"Progressive Movement with Atype, Hidden Secret, Patrick Arbez uvm",2024-04-13T00:00:00.000,2024-04-13T23:00:00.000,2024-04-14T09:00:00.000,"Atype, DJ Junior (2), Daora, Patrick Arbez, Mikadoo (2), TØM-Y",M-BIA,/events/1871852,61
LANGSTRECKE 12,2024-04-13T00:00:00.000,2024-04-13T22:00:00.000,2024-04-14T10:00:00.000,"Thomass Jackson, Stella Stellar, Jana Falcon, Joyce Muniz, Oliver Klostermann, Sascha Cawa, Bekka, Sqim, Nils Ohrmann, Rosa Kante, Steve Challier",Kater Blau,/events/1884040,61
NIMH presents: Not At My Lake,2024-04-13T00:00:00.000,2024-04-13T13:00:00.000,2024-04-13T23:59:00.000,"Almost Famous, Smau, groovyjuri, Marit, INGI (1), FLEMISH  FETISH, Käthe & Haes, DJ Eivissa",TBA - Secret Location,/events/1890476,54
Rhythm Section BERLIN,2024-04-13T00:00:00.000,2024-04-13T23:59:00.000,2024-04-14T07:30:00.000,"Bradley Zero, Gramrcy, Tereza, MLE (UK)",OHM,/events/1823072,51
"synthetika geburtstag in berlin with Souci, 0megavybe, Giiovaaz, 44smoki",2024-04-13T00:00:00.000,2024-04-13T23:00:00.000,2024-04-14T07:00:00.000,"Souci, 0megavybe, Giiovaaz",Zur Klappe,/events/1892676,42
Lush #4,2024-04-13T00:00:00.000,2024-04-13T21:00:00.000,2024-04-14T07:00:00.000,"Natalie Robinson, Nat Wendell, Katy De Jesus, Fonclair, Amowia",TBA - Secret Location,/events/1887127,40
FEMQUENCY DJ Workshop,2024-04-13T00:00:00.000,2024-04-13T16:00:00.000,2024-04-13T22:00:00.000,"TraumaMia, Haana Peony",Klunkerkranich,/events/1878312,35
POWERNAP,2024-04-13T00:00:00.000,2024-04-13T20:00:00.000,2024-04-14T02:00:00.000,"GTI, Captain WAP, tamypro, sprintf, ADO (DE)",Kwia,/events/1899252,32
"Bouncy Social Club: Robert Drewek, Club Jérome, Léontine, charlie kloos, mangoman",2024-04-13T00:00:00.000,2024-04-13T23:00:00.000,2024-04-14T06:00:00.000,"Robert Drewek, Club Jerome, Léontine, charlie kloos",Bulbul Berlin,/events/1880187,30
"Moonstompers: Bruno Schmidt, Fonte, Tau Car, Jack D",2024-04-13T00:00:00.000,2024-04-13T11:00:00.000,2024-04-14T19:00:00.000,"Bruno Schmidt, Fonte, Tau Car, Jack D",Fitzroy,/events/1893977,28
Dj Workshop,2024-04-10T00:00:00.000,2024-04-10T18:00:00.000,2024-04-17T22:00:00.000,,Funkhaus Berlin,/events/1901353,26
