Analogmusiq presentzzzz 'Discontinuous Reverberation Polyrhythmics,2018-06-14T00:00:00.000,2018-06-14T20:00:00.000,2018-06-15T03:00:00.000,,Liquid Sky Berlin - #LSB02,/events/1119662,10
Artificial TV,2018-06-14T00:00:00.000,2018-06-14T23:00:00.000,2018-06-15T05:00:00.000,,Farbfernseher,/events/1118137,9
"3 Years Der Weiße Hase, 3 Days Rave",2018-06-14T00:00:00.000,2018-06-14T23:00:00.000,2018-06-17T15:00:00.000,"Mathias Birnbaum, Tanz Unter Freunden, DJ Jordan, Oliver Raumklang, Maschine, DJ Doorkeeper, Don Tom",Der Weiße Hase,/events/1099793,8
as usual. // with Koljah and Bee Lincoln,2018-06-14T00:00:00.000,2018-06-14T22:00:00.000,2018-06-15T06:00:00.000,"Koljah, Bee Lincoln",Crack Bellmer,/events/1117910,5
Boogiemann Soulski Meets E Da Boss: Instore Gig & Talk,2018-06-14T00:00:00.000,2018-06-14T19:00:00.000,2018-06-14T21:30:00.000,,OYE Kreuzkoelln,/events/1120585,2
The Freakouternational Vintage Vinyl Night,2018-06-14T00:00:00.000,2018-06-14T22:00:00.000,2018-06-15T04:30:00.000,Coco Maria,Monarch,/events/1105272,1
After-Work Session,2018-06-14T00:00:00.000,2018-06-14T17:00:00.000,2018-06-14T23:00:00.000,Sharevari,Reinhard Bär Restaurant und Café,/events/1117262,1
Balearic Beach Berlin,2018-06-14T00:00:00.000,2018-06-14T18:00:00.000,2018-06-15T02:00:00.000,Mandragora,Solar,/events/1120701,1
"Islaja, La Tourette ",2018-06-14T00:00:00.000,2018-06-14T20:00:00.000,2018-06-14T23:45:00.000,La Tourette,arkaoda Berlin,/events/1122426,1
High In The Sky Soul Party with The Lips,2018-06-14T00:00:00.000,2018-06-14T21:00:00.000,2018-06-14T23:59:00.000,,Kaffee Burger,/events/1122806,0
Livestock Electronics Workshop & Modular Beginner Workshop,2018-06-14T00:00:00.000,2018-06-14T18:00:00.000,2018-06-14T22:00:00.000,,SchneidersLaden,/events/1122863,0
Electronic.Thursday mit Wojtech,2018-06-14T00:00:00.000,2018-06-14T19:00:00.000,2018-06-15T06:00:00.000,,Minimal Bar,/events/1104657,18
J.A.W with Theo Parrish All Night Long (8h Extended set),2018-06-15T00:00:00.000,2018-06-15T23:00:00.000,2018-06-16T07:00:00.000,Theo Parrish,Prince Charles,/events/1090446,629
"Wasted Unicorns Sommerfest with Aka Aka, David Dorad, Leon Licht",2018-06-15T00:00:00.000,2018-06-15T23:59:00.000,2018-06-16T12:00:00.000,"AKA AKA, David Dorad, Channel X, Leon Licht, Empro, Sam Shure, deKai, Marcel Freigeist, Pauli Pocket, A.D.H.S., Ninetyfour.",Ritter Butzke,/events/1103728,395
"SYNOID w./ Johannes Heil, Bas Mooy & Setaoc Mass",2018-06-15T00:00:00.000,2018-06-15T22:00:00.000,2018-06-16T22:00:00.000,"Johannes Heil, Bas Mooy, Setaoc Mass, Kamikaze Space Programme, PVS, Lunatik, Acierate, Tham, Ninette, Charlie, The Vandelays, Tigergun, scheib",Griessmuehle,/events/1110317,133
Tresor.Klubnacht,2018-06-15T00:00:00.000,2018-06-15T23:59:00.000,2018-06-16T12:00:00.000,"Second Woman, Moritz von Oswald, Janina, Stojche, Blush Response, Ancient Methods, P.E.A.R.L., Marc Ash",Tresor / Globus,/events/1111447,100
Birgit Bordeaux with Jan Oberlaender & Daniel Boon,2018-06-15T00:00:00.000,2018-06-15T23:00:00.000,2018-06-16T10:00:00.000,"Jan Oberlaender, Manel Cluny, Polytoxikomanie, Cotumo, Daniel Boon, Mondee",Birgit,/events/1092951,92
Buttons Birthday Extravaganza,2018-06-15T00:00:00.000,2018-06-15T23:59:00.000,2018-06-17T22:00:00.000,"Severino, Paolo Di Nola, Jacob Meehan, The Neighbourhood Character, Akirahawks, Oceanic, John F.M., Kiernan Laveaux, Garrett David, Stanley Schmidt, Leibniz, Marieu, DAHRAXT, Linda Lazarov, Darwin, Madalba, Shingo Suwa",://about blank,/events/1057278,62
Mannequin Records Nacht VI,2018-06-15T00:00:00.000,2018-06-15T23:59:00.000,2018-06-16T08:00:00.000,"Richard Fearless, Exterminador, JASSS, Alessandro Adriani, Key Clef",Berghain | Panorama Bar | Säule,/events/1111334,43
Archived,2018-06-15T00:00:00.000,2018-06-15T23:00:00.000,2018-06-16T09:00:00.000,"Jesse G, RJ Sturm, Smitti91",TBA - Secret Location,/events/1117491,43
"Metro /w. Bodin & Jacob, Patrick Klein, Juli N More & More",2018-06-15T00:00:00.000,2018-06-15T23:59:00.000,2018-06-16T12:00:00.000,"Patrick Klein, Bodin&Jacob, Martyné, Noema, Michal Zietara, Sado Opera",Renate,/events/1109158,40
WALLS /w. Edit Select and More (Open Air & Club),2018-06-15T00:00:00.000,2018-06-15T23:59:00.000,2018-06-16T10:00:00.000,"KETCH, Hawkinson, Oliver Raumklang",Lokschuppen Berlin,/events/1109209,40
"Music Lab with Max Graef, Dilby, Gunnar Stiller and More TBA",2018-06-15T00:00:00.000,2018-06-15T23:59:00.000,2018-06-16T10:00:00.000,"Max Graef, Dilby, Gunnar Stiller, Mario Urien",Chalet,/events/1123335,39
Niejeliebt Openair&warehouse,2018-06-15T00:00:00.000,2018-06-15T22:00:00.000,2018-06-16T10:00:00.000,"Foolik, Raphael Hofman, Fabian Vieregge, Martin Ka, Kontny & Stache, Sánchéz & Sztuka",[ipsə],/events/1116404,42
Sleepers Fractal Disruption,2018-06-15T00:00:00.000,2018-06-15T23:59:00.000,2018-06-16T09:00:00.000,,OHM,/events/1039504,33
U•l•t•r•a•m•a•r•i•n•e - Audiojack / Kotelett & Zadak / Peter Schumann / Ben Hoo / Baba Robijn,2018-06-15T00:00:00.000,2018-06-15T23:59:00.000,2018-06-16T12:00:00.000,"Peter Schumann, Audiojack, Kotelett&Zadak, Kotelett, Ben Hoo",Kater Blau,/events/1103385,30
We Love Dance Moves with Nikklaas & Phil-In,2018-06-15T00:00:00.000,2018-06-15T19:00:00.000,2018-06-16T07:00:00.000,Nikklaas,Promenaden Eck,/events/1118572,29
Blockrave Festival,2018-06-15T00:00:00.000,2018-06-15T23:00:00.000,2018-06-16T22:00:00.000,"MARCEL db, Boudi Boudin, BB Deng, Tocadisco, vom Feisten, Felidae, Daniel Jaeger, Alex Gallus, Hartojo",Polygon Club,/events/1117029,23
Rauschen,2018-06-15T00:00:00.000,2018-06-15T23:59:00.000,2018-06-16T12:00:00.000,"Julian Jeweil, Daniel Stefanik, Stephan Hinz, Clint Stewart, Robin Drimalski",Watergate,/events/1114955,20
"Which way to the Stars???? with Zambon,Afronautica and boogiemann",2018-06-15T00:00:00.000,2018-06-15T22:00:00.000,2018-06-16T07:00:00.000,"Zambon, Afronautica, Boogiemann",Crack Bellmer,/events/1108090,19
Epochē #2 -,2018-06-15T00:00:00.000,2018-06-15T21:00:00.000,2018-06-16T04:00:00.000,"Otto Lebowski, Vincent Kenway, Kaloustian, vig0",Repeat,/events/1112090,18
"Raudel:Related with Dave Dinger, Shlomsen, Gitte Verführt, uvm.",2018-06-15T00:00:00.000,2018-06-15T23:00:00.000,2018-06-16T09:00:00.000,"Dave Dinger, Gitte Verfuehrt, Shlomsen, Sohomo, Suse",Humboldthain Club,/events/1118169,14
Tanz Zum Platzen (Techno / Dnb),2018-06-15T00:00:00.000,2018-06-15T23:00:00.000,2018-06-16T08:00:00.000,"Yves Meyer, Modulatos",Void Club,/events/1120340,12
://About What w./ Barbara Hofmann & cf2000,2018-06-15T00:00:00.000,2018-06-15T23:00:00.000,2018-06-16T07:00:00.000,"Barbara Hofmann, cf2000",Farbfernseher,/events/1118899,9
HOT Topic x Von Seepferdchen & Schränken feat. Sookee x Lecken,2018-06-15T00:00:00.000,2018-06-15T23:00:00.000,2018-06-16T08:00:00.000,"Killa, PHROND",Schwuz,/events/1119925,9
"3 Years Der Weiße Hase, 3 Days Rave",2018-06-14T00:00:00.000,2018-06-14T23:00:00.000,2018-06-17T15:00:00.000,"Mathias Birnbaum, Tanz Unter Freunden, DJ Jordan, Oliver Raumklang, Maschine, DJ Doorkeeper, Don Tom",Der Weiße Hase,/events/1099793,8
Sued,2018-06-15T00:00:00.000,2018-06-15T23:00:00.000,2018-06-16T06:00:00.000,SVN,Paloma,/events/1112604,8
Improvisational Synth Collective presents..... - Jamsession at Lsb02,2018-06-15T00:00:00.000,2018-06-15T20:00:00.000,2018-06-16T06:00:00.000,,Liquid Sky Berlin - #LSB02,/events/1113162,7
Deviate,2018-06-15T00:00:00.000,2018-06-15T23:00:00.000,2018-06-16T06:00:00.000,"Ziaflow, Lebowski",Panke,/events/1119449,6
"Hainmat with Oscar OZZ, Paale, Josh Reid, Cueve",2018-06-15T00:00:00.000,2018-06-15T23:59:00.000,2018-06-16T10:00:00.000,"Oscar OZZ, Josh Reid, Cueve",AVA Club,/events/1122997,6
"Süss mit Jake the Rapper, Miomio u.v.m",2018-06-15T00:00:00.000,2018-06-15T20:00:00.000,2018-06-16T08:00:00.000,"Jake the Rapper, Karsten Schmidt",Süss War Gestern,/events/1121843,5
"Ah, Bubbles",2018-06-15T00:00:00.000,2018-06-15T23:59:00.000,2018-06-16T12:00:00.000,Koljah,Golden Gate,/events/1115450,4
OST Über Kopf,2018-06-15T00:00:00.000,2018-06-15T23:59:00.000,2018-06-16T10:00:00.000,"Daensen, Emde, Gwen Wayne, Schou",Mensch Meier,/events/1122147,4
"3 Years Der Weiße Hase with Jorden, Stempelman & More",2018-06-15T00:00:00.000,2018-06-15T23:00:00.000,2018-06-16T12:00:00.000,"DJ Jordan, Oliver Raumklang",Der Weiße Hase,/events/1113085,3
The Golden Night,2018-06-15T00:00:00.000,2018-06-15T23:00:00.000,2018-06-16T08:00:00.000,"Marco Loco, Dennis Beutler",Bohnengold,/events/1117796,3
Mystic Friday - Record Release From Ismir's new Album,2018-06-15T00:00:00.000,2018-06-15T23:00:00.000,2018-06-16T12:00:00.000,,KitKatClub,/events/1120159,3
Fridays::,2018-06-15T00:00:00.000,2018-06-15T15:00:00.000,2018-06-16T06:00:00.000,"Jackbox, Falko Brocksieper, Whoann",Club der Visionaere,/events/1123914,3
Electro Swing Revolution,2018-06-15T00:00:00.000,2018-06-15T23:00:00.000,2018-06-16T05:00:00.000,Justin Fidèle,Frannz Club,/events/1109707,2
Tanzhalle,2018-06-15T00:00:00.000,2018-06-15T23:00:00.000,2018-06-16T06:00:00.000,"DJ Freshfluke, Hoe_mies, Skinny J",Cassiopeia,/events/1119358,2
Kotti Crew Night,2018-06-15T00:00:00.000,2018-06-15T23:00:00.000,2018-06-16T08:00:00.000,,Paloma,/events/1120666,2
Baile Funk Berlin: MC Carol,2018-06-15T00:00:00.000,2018-06-15T22:00:00.000,2018-06-16T07:00:00.000,Dj Rafael,Gretchen,/events/1121912,2
Maturre Invites Endzeit [Anfang],2018-06-15T00:00:00.000,2018-06-15T18:00:00.000,2018-06-15T23:59:00.000,,Gr_und,/events/1066179,1
Cosmic Grooves by Dieta Berliner,2018-06-15T00:00:00.000,2018-06-15T22:00:00.000,2018-06-16T05:00:00.000,Dieta Berliner,Monarch,/events/1097931,1
Rock & Rave Circle,2018-06-15T00:00:00.000,2018-06-15T23:59:00.000,2018-06-16T06:00:00.000,"Headman, Robi Insinna, Dora Pan, Paul Hanford",Beate Uwe,/events/1107064,1
Back 2 Rosis,2018-06-15T00:00:00.000,2018-06-15T23:00:00.000,2018-06-16T10:00:00.000,"Hermann Hellwig, Ole Niedermauntel, Götze & Wohlfahrt",Rosi's,/events/1108804,1
Ladies Night,2018-06-15T00:00:00.000,2018-06-15T23:00:00.000,2018-06-16T06:00:00.000,John Kotti,Soda Club,/events/1112387,1
Zef Party,2018-06-15T00:00:00.000,2018-06-15T23:00:00.000,2018-06-16T08:00:00.000,,Badehaus Berlin,/events/1116998,1
#Slowestguysinuniverse,2018-06-15T00:00:00.000,2018-06-15T23:00:00.000,2018-06-16T08:00:00.000,,Anita Berber,/events/1119175,1
Stranger Funk,2018-06-15T00:00:00.000,2018-06-15T19:00:00.000,2018-06-16T02:00:00.000,,Klunkerkranich,/events/1120586,1
Vibes Party,2018-06-15T00:00:00.000,2018-06-15T23:00:00.000,2018-06-16T07:00:00.000,,Musik & Frieden,/events/1120676,1
New Ambient Berlin,2018-06-15T00:00:00.000,2018-06-15T18:00:00.000,2018-06-16T02:30:00.000,,Solar,/events/1120702,1
Banana Rot,2018-06-15T00:00:00.000,2018-06-15T21:00:00.000,2018-06-16T00:00:00.000,,IPA Bar,/events/1121742,1
Daniel Higgs & Paul Wallfisch / DJs: Low Bat & Lina,2018-06-15T00:00:00.000,2018-06-15T20:00:00.000,2018-06-16T06:00:00.000,,arkaoda Berlin,/events/1122430,1
Die Letzte Party vor dem Aufstieg,2018-06-15T00:00:00.000,2018-06-15T23:00:00.000,2018-06-16T07:00:00.000,"Manel Cluny, Animal Swing Kids, Herr Locher, Dr. Chimpanzee, Sooma",Kultstätte Keller,/events/1124438,1
tba,2018-06-15T00:00:00.000,2018-06-15T23:59:00.000,2018-06-16T12:00:00.000,,TBA - Berlin,/events/1069146,38
Meet.the.Sound mit ELA H. & Freunde,2018-06-15T00:00:00.000,2018-06-15T19:00:00.000,2018-06-16T07:00:00.000,"Ela H., Jaxxon Under",Minimal Bar,/events/1107438,17
"[CANCELLED] Schnabelhaft with Matchy, Sokool uvm.",2018-06-15T00:00:00.000,2018-06-15T23:59:00.000,2018-06-16T14:00:00.000,"Matchy, Sokool, Lars Moston, miAs, Polytoxikomanie, Manel Cluny, Fusy, Mark Mohs",Burg Schnabel,/events/1103478,6
Avant-Garde Porn by Pornceptual,2018-06-16T00:00:00.000,2018-06-16T22:30:00.000,2018-06-17T12:00:00.000,"Claire Morgan, Anja Zaube, Alienata, Curses, Ena Lind, Rydim, Jamaica Suk, Projekt Gestalten, Lipstick Trash, Budino, Sankt Göran, Sciarada",MUENZE,/events/1101231,1485
Shitlabel / 3 Floors Open Air & Indoor,2018-06-16T00:00:00.000,2018-06-16T23:59:00.000,2018-06-17T12:00:00.000,"Alton Miller, BLACK ANTHEM RESTORE, Bodycode, Portable, Derek Plaslaiko, Inverse Element, Jerome Sydenham, Lady Blacktronika, Femanyst, Natascha Kann, Signal Deluxe",Mensch Meier,/events/1110887,347
"The Industry x Disk with Monolake Live, Lena Willikens, Batu, Don't DJ Live, Phuong Dan",2018-06-16T00:00:00.000,2018-06-16T22:00:00.000,2018-06-17T12:00:00.000,"Monolake, Lena Willikens, Batu, Miriam Schulte, DON'T DJ, Phuong Dan, Harmonious Thelonious, towLie, Marylou",Griessmuehle,/events/1103409,317
Birgit ist Techno Summeredition - Open Air & Club,2018-06-16T00:00:00.000,2018-06-16T23:00:00.000,2018-06-17T10:00:00.000,"Thomas Schumacher, Nils Hoffmann, Boy Next Door, Dahu, Jonas Woehl, Bongo & Pusk, Pascale Voltaire, Nikklaas, Anton Johnsen, Suspekt, Mad Son",Birgit,/events/1093629,183
"SYNOID w./ Johannes Heil, Bas Mooy & Setaoc Mass",2018-06-15T00:00:00.000,2018-06-15T22:00:00.000,2018-06-16T22:00:00.000,"Johannes Heil, Bas Mooy, Setaoc Mass, Kamikaze Space Programme, PVS, Lunatik, Acierate, Tham, Ninette, Charlie, The Vandelays, Tigergun, scheib",Griessmuehle,/events/1110317,133
Klubnacht,2018-06-16T00:00:00.000,2018-06-16T23:59:00.000,2018-06-18T06:00:00.000,"Colin Benders, Ben Klock, Boris, Diskonnected, Diwa, Matrixxman, Qiu, Ryan Elliott, Rex the Dog, GIDEÖN, Hammer, Massimiliano Pagliara, nd_baumecker, Soundstream, Tony Humphries",Berghain | Panorama Bar | Säule,/events/1111337,131
"Tresor x Lets Watch Ufos with Helena Hauff, Sunil Sharpe, Delta Funktionen",2018-06-16T00:00:00.000,2018-06-16T23:59:00.000,2018-06-17T12:00:00.000,"VC-118A, Delta Funktionen, Rhyw, Reka, Helena Hauff, Sunil Sharpe",Tresor / Globus,/events/1114888,105
Betriebsfeier on Tour - Durch die Welt der Anomalie,2018-06-16T00:00:00.000,2018-06-16T22:00:00.000,2018-06-17T12:00:00.000,"Empro, Ben Bear, Smash TV, Coco, SiD, Bee Lincoln, Bianka Banks, Konstantin Unwohl",Anomalie Art Club,/events/1091955,79
Buttons Birthday Extravaganza,2018-06-15T00:00:00.000,2018-06-15T23:59:00.000,2018-06-17T22:00:00.000,"Severino, Paolo Di Nola, Jacob Meehan, The Neighbourhood Character, Akirahawks, Oceanic, John F.M., Kiernan Laveaux, Garrett David, Stanley Schmidt, Leibniz, Marieu, DAHRAXT, Linda Lazarov, Darwin, Madalba, Shingo Suwa",://about blank,/events/1057278,62
Festival Berlin-Wannsee,2018-06-16T00:00:00.000,2018-06-16T14:00:00.000,2018-06-17T09:00:00.000,"TheStain, Tymotica, Vincent Kenway, Otto Lebowski, Bollwaerk",Insel Lindwerder,/events/1107314,55
Let's Discult #6 -Open Air-,2018-06-16T00:00:00.000,2018-06-16T10:00:00.000,2018-06-16T22:00:00.000,"H30H, Minijob, Denise Bauer, Discult Soundsystem",Scube Park Columbia,/events/1090077,45
"Oben Unten Überall /w. Decius, Iron Curtis, Alison Swing & More",2018-06-16T00:00:00.000,2018-06-16T23:59:00.000,2018-06-17T12:00:00.000,"Anri, Sabine Hoffmann, Iron Curtis, The Vandelays, Alison Swing, Robert Etzold, RifRaf",Renate,/events/1117889,36
Backyard Sessions Open Air,2018-06-16T00:00:00.000,2018-06-16T17:00:00.000,2018-06-16T23:59:00.000,Phonatic,Paloma Sommerlager,/events/1119575,32
Sasomo mit Schiffbruch - Dubspeeka / Mira / Midas 104 / Oliver Klostermann / Nayan Soukie,2018-06-16T00:00:00.000,2018-06-16T23:59:00.000,2018-06-18T12:00:00.000,"Max Grabke, Manuel Sahagun, Christ Burstein, Public Emely, C-More, Sascha Cawa, Smash TV, Dubspeeka, Burnhard, Niemand & Keiner, Oliver Klostermann, Midas 104, Mira, Struppie, Nigel Perera, Josephine Wedekind",Kater Blau,/events/1105824,30
Buttons Birthday Extravaganza - Day 2,2018-06-16T00:00:00.000,2018-06-16T00:00:00.000,2018-06-17T22:00:00.000,"Severino, Paolo Di Nola, Jacob Meehan, The Neighbourhood Character, Akirahawks, Oceanic, John F.M., Kiernan Laveaux, Garrett David, Stanley Schmidt, Leibniz, Marieu, DAHRAXT, Linda Lazarov, Darwin, Madalba, Shingo Suwa",://about blank,/events/1102918,29
Elevate Showcase,2018-06-16T00:00:00.000,2018-06-16T18:00:00.000,2018-06-17T10:00:00.000,"Ed Herbst, Maik Yells, Peer Du, Porter, stevn.aint.leavn, Walker",[ipsə],/events/1121871,27
Sunset Sessions auf dem Dach,2018-06-16T00:00:00.000,2018-06-16T18:00:00.000,2018-06-17T03:00:00.000,"Jay Skelly, Boogiemann, Figu Ds, Bonnie Ford",TBA - Berlin,/events/1111007,25
ELEVE - Woody '92 & Spekki Webu,2018-06-16T00:00:00.000,2018-06-16T23:00:00.000,2018-06-17T07:00:00.000,"Spekki Webu, Sigward, Leerinc",Sameheads,/events/1101797,22
"Nachtblumen with Inland, X tin, Andy Chiu and Lucas Vazz",2018-06-16T00:00:00.000,2018-06-16T23:59:00.000,2018-06-17T11:00:00.000,"Inland, Lucas Vazz, Andy Chiu, X Tin",Arena Club,/events/1116775,22
Stereophonic - Intersect / Indoor + Garden,2018-06-16T00:00:00.000,2018-06-16T23:59:00.000,2018-06-17T10:00:00.000,"Wirrwarr, Chami, Hermann Hellwig, Julian B., Brascon, Kaldera",Polygon Club,/events/1093824,22
Dreams of Neon with Vcs2600 *Live,2018-06-16T00:00:00.000,2018-06-16T23:00:00.000,2018-06-17T09:00:00.000,"Opium Hum, Marius Reisser, Undermind, Lazercat, Blender (2), Niki Pop, Naks",Humboldthain Club,/events/1101212,18
"Grafiti Tapes with Luca Lozano, Mr. Ho and Gassy",2018-06-16T00:00:00.000,2018-06-16T23:59:00.000,2018-06-17T07:00:00.000,"Luca Lozano, Mr. Ho",OHM,/events/1116619,17
"Clubnight with Vincenzo, Justin Massei, Bill Mango and More",2018-06-16T00:00:00.000,2018-06-16T21:00:00.000,2018-06-17T10:00:00.000,"Vincenzo, Justin Massei, Bill Mango",Chalet,/events/1124313,17
Sisyphos,2018-06-16T00:00:00.000,2018-06-16T21:00:00.000,2018-06-17T09:00:00.000,Gabriel I,Sisyphos,/events/1117036,16
Nachtklub,2018-06-16T00:00:00.000,2018-06-16T23:59:00.000,2018-06-17T12:00:00.000,"Marc Romboy, Martin Eyerer, Luna City Express, Stassy & Wilck, Dennis Kuhl",Watergate,/events/1115736,14
In•sight,2018-06-16T00:00:00.000,2018-06-16T21:00:00.000,2018-06-17T08:00:00.000,"Avos, Ethel, Langtunes, Gulp, Yannik",Loftus Hall,/events/1117802,14
Enter the Void (Psytrance / Techno),2018-06-16T00:00:00.000,2018-06-16T23:00:00.000,2018-06-17T08:00:00.000,,Void Club,/events/1120339,14
All Night Long with Andi de Luxe,2018-06-16T00:00:00.000,2018-06-16T19:00:00.000,2018-06-17T07:00:00.000,Andi de Luxe,Promenaden Eck,/events/1118573,12
Bubble Bath 2,2018-06-16T00:00:00.000,2018-06-16T22:00:00.000,2018-06-17T08:00:00.000,"Josh?Who, Mohammed Al Hamza",Zur Klappe,/events/1122854,11
Venganza,2018-06-16T00:00:00.000,2018-06-16T23:59:00.000,2018-06-17T12:00:00.000,"Lee Douglas, Matisa, Joey Quinones",Lokschuppen Berlin,/events/1111794,9
Let it be at Kinky Woods,2018-06-16T00:00:00.000,2018-06-16T22:00:00.000,2018-06-17T06:00:00.000,"LetKolben, AantiGen",Crack Bellmer,/events/1116597,9
"3 Years Der Weiße Hase, 3 Days Rave",2018-06-14T00:00:00.000,2018-06-14T23:00:00.000,2018-06-17T15:00:00.000,"Mathias Birnbaum, Tanz Unter Freunden, DJ Jordan, Oliver Raumklang, Maschine, DJ Doorkeeper, Don Tom",Der Weiße Hase,/events/1099793,8
Fjernstyrt with Jarle Bråthen,2018-06-16T00:00:00.000,2018-06-16T23:00:00.000,2018-06-17T07:00:00.000,Jarle Bråthen,Bohnengold,/events/1115142,8
ॐ Basanta with Ranji - Blue Tunes ॐ,2018-06-16T00:00:00.000,2018-06-16T23:00:00.000,2018-06-17T10:00:00.000,"DJ Jordan, Till Krimsen",ASeven,/events/1105544,7
Hose Hoch,2018-06-16T00:00:00.000,2018-06-16T23:59:00.000,2018-06-17T12:00:00.000,"Thodoris Triantafillou, Kotelett&Zadak, Kotelett",Golden Gate,/events/1115452,7
House Jams Vol. 3 with DJ Kriton & Bassdee,2018-06-16T00:00:00.000,2018-06-16T21:00:00.000,2018-06-17T05:00:00.000,"DJ Kriton, Bassdee",Acud Macht NEU,/events/1118382,7
"Skinnerbox, Jake Thake Rapper, Red Robin, Elliver, Dieter Polen",2018-06-16T00:00:00.000,2018-06-16T12:00:00.000,2018-06-17T00:00:00.000,"Skinnerbox, Jake the Rapper, Red Robin, Elliver",Hometown.berlin,/events/1120675,7
Noisy Glance,2018-06-16T00:00:00.000,2018-06-16T12:00:00.000,2018-06-17T06:00:00.000,"Topper, Daniele Papini",Club der Visionaere,/events/1113495,6
"Süss mit fujiKATO, Nippl u.v.m",2018-06-16T00:00:00.000,2018-06-16T20:00:00.000,2018-06-17T08:00:00.000,"fujiKATO, Satoshi Yamamura, SvP",Süss War Gestern,/events/1121844,6
Carbon,2018-06-16T00:00:00.000,2018-06-16T21:00:00.000,2018-06-17T04:00:00.000,"Dj Malloy, Danny Russell",Repeat,/events/1121908,6
Sheldon Drake presentz 'Neuronale,2018-06-16T00:00:00.000,2018-06-16T20:00:00.000,2018-06-17T06:00:00.000,Sheldon Drake,Liquid Sky Berlin - #LSB02,/events/1113164,5
Weeeirdos Takeover Paloma Bar,2018-06-16T00:00:00.000,2018-06-16T23:00:00.000,2018-06-17T05:00:00.000,"James Booth, LOLSNAKE",Paloma,/events/1120025,5
Jambutek - Berlin Showcase,2018-06-16T00:00:00.000,2018-06-16T23:00:00.000,2018-06-17T06:00:00.000,"Asvajit, Nigel Perera, Pawas",Loophole,/events/1122734,5
De Ambassade presenteert Love Stream,2018-06-16T00:00:00.000,2018-06-16T23:00:00.000,2018-06-17T07:00:00.000,"Gratts, De Ambassade",Farbfernseher,/events/1115062,4
"3 Years Der Weiße Hase with K.Paul, Flavo, Doorkeeper & More",2018-06-16T00:00:00.000,2018-06-16T23:00:00.000,2018-06-17T12:00:00.000,"Maschine, DJ Doorkeeper, Don Tom",Der Weiße Hase,/events/1113077,3
Motion the Dance,2018-06-16T00:00:00.000,2018-06-16T22:00:00.000,2018-06-17T05:00:00.000,Afronautica,Monarch,/events/1114435,3
Atze Ton at Nachtschicht & Friends,2018-06-16T00:00:00.000,2018-06-16T23:00:00.000,2018-06-17T10:00:00.000,Atze Ton,AVA Club,/events/1122998,3
Eclectic Culture X with Coco Maria & Burda,2018-06-16T00:00:00.000,2018-06-16T22:00:00.000,2018-06-17T05:00:00.000,"Coco Maria, Nikoslav Nachhall",Panke,/events/1123061,3
Circus Bizarre,2018-06-16T00:00:00.000,2018-06-16T22:00:00.000,2018-06-17T06:00:00.000,"Boudi Boudin & Salomé, Boudi Boudin, Monty",Insomnia,/events/1102306,2
Livermori Vol. 1,2018-06-16T00:00:00.000,2018-06-16T20:30:00.000,2018-06-17T09:00:00.000,Màquina Corrupta,Urban Spree,/events/1116638,2
Family Affairs / Open Air Release Party,2018-06-16T00:00:00.000,2018-06-16T15:30:00.000,2018-06-16T22:00:00.000,"Zambon, TiTLEZ",Rosengarten Berlin,/events/1117103,2
Kreuzberger Nächte Sind Lang,2018-06-16T00:00:00.000,2018-06-16T23:00:00.000,2018-06-17T06:00:00.000,"Aber, Raw D",Festsaal Kreuzberg,/events/1117821,2
John Loveless,2018-06-16T00:00:00.000,2018-06-16T22:00:00.000,2018-06-17T05:00:00.000,John Loveless,Transit Bar,/events/1118391,2
Rosé Sunset Party,2018-06-16T00:00:00.000,2018-06-16T19:00:00.000,2018-06-17T00:00:00.000,"Tiefschwarz, Norman Methner",Haubentaucher,/events/1120066,2
Bassport Pres. Audite,2018-06-16T00:00:00.000,2018-06-16T23:00:00.000,2018-06-17T07:30:00.000,"audite, Survey",Rosi's,/events/1120571,2
Günter Schickert & Pyrolator / ML & Vincent Manfuoco & Frans Ambient,2018-06-16T00:00:00.000,2018-06-16T21:00:00.000,2018-06-17T06:00:00.000,,arkaoda Berlin,/events/1122432,2
Ambient Modular Sessions 002,2018-06-16T00:00:00.000,2018-06-16T21:00:00.000,2018-06-17T00:00:00.000,VASE,Motif Wein,/events/1124636,2
High Fidelity Club,2018-06-16T00:00:00.000,2018-06-16T23:00:00.000,2018-06-17T06:00:00.000,MARCEL db,Soda Club,/events/1112397,1
Irrenhouse – Party,2018-06-16T00:00:00.000,2018-06-16T23:00:00.000,2018-06-17T07:00:00.000,"Spencer Reed, La Schmock",Musik & Frieden,/events/1116699,1
Dizzy Wright – The Golden State OF Mind Tour 2018,2018-06-16T00:00:00.000,2018-06-16T20:00:00.000,2018-06-16T23:30:00.000,,Cassiopeia,/events/1119360,1
A Night with Oracy and Jan,2018-06-16T00:00:00.000,2018-06-16T23:59:00.000,2018-06-17T06:00:00.000,Oracy,Paloma,/events/1120141,1
Pendletons / Lucid Paradise / Reel2reel,2018-06-16T00:00:00.000,2018-06-16T22:00:00.000,2018-06-17T05:00:00.000,,Tausend,/events/1120590,1
Relaxed Soulful Grooves,2018-06-16T00:00:00.000,2018-06-16T18:00:00.000,2018-06-17T02:00:00.000,,Solar,/events/1120704,1
Klirrrrr Festival - Queer Cultures of Conflict,2018-06-16T00:00:00.000,2018-06-16T18:00:00.000,2018-06-17T02:00:00.000,"Golden Diskó Ship, Juba",District Berlin,/events/1121663,1
Berlinizer I Summer Opening,2018-06-16T00:00:00.000,2018-06-16T19:00:00.000,2018-06-17T06:00:00.000,"Felix Cornelsen, Ed Ed, Steppi",House of Weekend,/events/1122635,1
The Jazz Cabbage Grand Ball,2018-06-16T00:00:00.000,2018-06-16T23:59:00.000,2018-06-17T07:00:00.000,"Strip Steve, Joe Cleen, Matthias Zimmermann",Beate Uwe,/events/1123700,1
"Kellergedeck: Sabrina Mue, Ivorie, Von Stolzing",2018-06-16T00:00:00.000,2018-06-16T22:00:00.000,2018-06-17T07:00:00.000,"Sabrina Mue, Von Stolzing",Kultstätte Keller,/events/1124371,1
Bantu's Diary,2018-06-16T00:00:00.000,2018-06-16T23:30:00.000,2018-06-17T06:00:00.000,,st.Georg,/events/1124762,1
Urban Botanic Grooves,2018-06-16T00:00:00.000,2018-06-16T18:00:00.000,2018-06-17T01:30:00.000,Dieta Berliner,Darwin's Lab im Bikini Berlin,/events/1126176,1
Gelatinezone,2018-06-16T00:00:00.000,2018-06-16T22:00:00.000,2018-06-17T04:00:00.000,,Eschschloraque,/events/1121701,0
"Spotlight with Thomas Lizzara, Stereo Express and More",2018-06-16T00:00:00.000,2018-06-16T23:59:00.000,2018-06-17T11:00:00.000,"Thomas Lizzara, Stereo Express, Kaiser Souzai, Dennis Beutler, Swaytone, Grace Thompson, Marcus Meya, AlBird",Ritter Butzke,/events/1098988,184
we.Love.Mexikaner mit Ale Castro & Friends,2018-06-16T00:00:00.000,2018-06-16T19:00:00.000,2018-06-17T06:00:00.000,Ale Castro,Minimal Bar,/events/1104662,17
"Else Dance Party /w. Magda, ItaloJohnson, Fango & More",2018-06-17T00:00:00.000,2018-06-17T14:00:00.000,2018-06-18T06:00:00.000,"Magda, ItaloJohnson, Fango, Justin Van Der Volgen, Budino",Else,/events/1119019,157
Klubnacht,2018-06-16T00:00:00.000,2018-06-16T23:59:00.000,2018-06-18T06:00:00.000,"Colin Benders, Ben Klock, Boris, Diskonnected, Diwa, Matrixxman, Qiu, Ryan Elliott, Rex the Dog, GIDEÖN, Hammer, Massimiliano Pagliara, nd_baumecker, Soundstream, Tony Humphries",Berghain | Panorama Bar | Säule,/events/1111337,131
