ATR PARTY - DIA DEL AMIGO! // FREUNDESTAG,2024-07-20T00:00:00.000,2024-07-20T23:59:00.000,2024-07-21T05:30:00.000,,Lido Berlin,/events/1946966,207
You Mean So Much - Open Air & Indoor (Donation Based),2024-07-20T00:00:00.000,2024-07-20T12:00:00.000,2024-07-21T04:00:00.000,"Mendel, Sanctuary, Femdelic, Furor Exótica, Bacci, Ciao Caio, hi.fí, Meriem S, Flaaviø, Jelle from the Block",Revier Südost,/events/1897844,147
"Renate Klubnacht  with E.LINA, Sarj, Daniel Meister, Jon Starks, Dario Mass, Norwin P.",2024-07-20T00:00:00.000,2024-07-20T16:00:00.000,2024-07-21T08:00:00.000,"Sparkling Water Dreams, Posture, Jon Starks, Frozilla, Dario Mass, E.LINA, distilled noise, Daniel Meister, Norwin P., spargelzeit, Sarj, Naga DJ",Renate,/events/1944573,136
Interphase Sonnendeck - Open Air,2024-07-20T00:00:00.000,2024-07-20T12:00:00.000,2024-07-20T22:00:00.000,"DJ Spit, 41ISSA, Carly Zeng, ATTA (GER), Silent G, DJ OVER N OUT, RST98",Malzfabrik,/events/1938801,126
"Birgits Weekender with Núria, Karim Alkhayat, Sayuri, Languages Showcase, uvm",2024-07-19T00:00:00.000,2024-07-19T22:00:00.000,2024-07-21T08:00:00.000,"Mike Koglin, Michael Ritter, Othertune, MoodFreak, NOMAS.T, Diana Orion, Denifitiv Manu, Leon Licht, Bøgen, Sayuri (GER), TraumaMia, Gizmo & Mac, NÚRIA (DE), Karim Alkhayat, Thomas Haak",Birgit,/events/1928170,117
SYNTHESIS,2024-07-20T00:00:00.000,2024-07-20T23:00:00.000,2024-07-21T07:00:00.000,"Samuel L Session, ODA HALITI, AOIFE, Bin Okin, Sarkha, Mechanic Slave, der KØCH, Millhouse, Thian, Ilyas S",M01,/events/1931189,114
Tresor Klubnacht,2024-07-20T00:00:00.000,2024-07-20T23:00:00.000,2024-07-21T06:00:00.000,"Mareena, .VRIL, Esther Dune, Function, Mary Yuzovskaya, Ryan James Ford",Tresor / Globus,/events/1939978,107
Circular Music *Open Air* with finest house-music played by vinyl only,2024-07-20T00:00:00.000,2024-07-20T15:00:00.000,2024-07-20T23:00:00.000,"Anton Kubikov, Freund der Familie, Oliver Raumklang, DJ with Soul",Gestrandet An Der Jannowitzbrücke,/events/1959376,97
BLVSH for Gaza,2024-07-20T00:00:00.000,2024-07-20T22:00:00.000,2024-07-21T06:00:00.000,"Acidfinky, Aalia Iraki, YOUN3S",Crack Bellmer,/events/1949600,96
KLAMINKA,2024-07-20T00:00:00.000,2024-07-20T22:00:00.000,2024-07-21T08:00:00.000,"DJ ALKARLINE, Carl Hang, MIO (ES)",Bi Nuu,/events/1959132,94
KlubNacht,2024-07-20T00:00:00.000,2024-07-20T23:00:00.000,2024-07-21T09:00:00.000,"SIKXTO, Kopflos, RTDV, MARC JOAN, Jordan.nsx, A.I.F.O.S., Segun, DaSoMaZo, Filialleiter, DTEXX",AVA Club,/events/1950073,91
"SECRET OPEN AIR - Atree, Rubi, Judy Free, Alina, Carlos Candela, SPL (Live)",2024-07-20T00:00:00.000,2024-07-20T12:00:00.000,2024-07-20T22:00:00.000,"rubi*, Judy Free, ALINA (3), Atree, Carlos Candela, Side Project Live",TBA,/events/1941726,82
TANGA: Identities,2024-07-20T00:00:00.000,2024-07-20T23:59:00.000,2024-07-21T08:00:00.000,"ALP (DE), Khloe, Mama Yha Yha, RÆZA",Fitzroy,/events/1961041,74
IN A (CHEEKY) MOOD,2024-07-20T00:00:00.000,2024-07-20T23:00:00.000,2024-07-21T06:00:00.000,"LO-LOW, JCow, yungfya, HEDDA, faceblindbabe, lil ja",Acud Macht NEU,/events/1924351,74
Oracool Label Showcase,2024-07-20T00:00:00.000,2024-07-20T18:00:00.000,2024-07-21T00:00:00.000,"Stanislav Tolkachev, Koloah, Adelina, N.Y.N, Travis or Alice, Christopher Bo",Giri,/events/1956240,62
Pink Noise Generation,2024-07-20T00:00:00.000,2024-07-20T23:00:00.000,2024-07-21T12:00:00.000,"SGT (1), Briain, VCO, DAHRAXT, dergloeckner, Guiamm, Jonas Xenon, IMPAKT. (GER), Mython, Pixelflowers, Secret Act",OHM,/events/1958566,54
BERLIN SOUNDS 4,2024-07-20T00:00:00.000,2024-07-20T17:00:00.000,2024-07-20T22:00:00.000,,Badehaus Berlin,/events/1950999,53
://clubgarten - have it all [free entry & open air],2024-07-20T00:00:00.000,2024-07-20T14:00:00.000,2024-07-20T22:00:00.000,"Daniel Paul, Ed Herbst, Lena Brumby",://about blank,/events/1964144,52
Tekk Attack,2024-07-20T00:00:00.000,2024-07-20T23:00:00.000,2024-07-21T11:00:00.000,"maniaclina, Shorty",Der Weiße Hase,/events/1958063,46
EINFACH TECHNO,2024-07-20T00:00:00.000,2024-07-20T23:00:00.000,2024-07-21T09:00:00.000,"edgarwilles, emaenu (2), Jaszaloth, Sievert Serviert, SIKXTO, ZOEVITA",Void Hall,/events/1932906,46
"IT'S A HOUSE THING: Nikklaas, Jean-Jez, Pietro Baldini b2b Simon Pinola, bapi",2024-07-20T00:00:00.000,2024-07-20T23:00:00.000,2024-07-21T06:00:00.000,"Nikklaas, Jean-Jez, Simon Pinola, bapi",Bulbul Berlin,/events/1949278,43
Sink Your Booty // BOAT PARTY & OPEN AIR,2024-07-20T00:00:00.000,2024-07-20T14:00:00.000,2024-07-20T23:59:00.000,"Felino Only, oscargvz, Ser Silvestre",TBA,/events/1960486,43
Danny Avila & Kaufmann,2024-07-20T00:00:00.000,2024-07-20T22:00:00.000,2024-07-21T09:00:00.000,"Danny Avila, Kaufmann",Ritter Butzke,/events/1922872,42
METANOIA LOCAL RHYTHM,2024-07-20T00:00:00.000,2024-07-20T22:00:00.000,2024-07-22T01:00:00.000,"Rafiki, SHA (DE), Surreal (DE), Coss, Peter Schumann, David Benjamin, Kabeljo, Mcfly, Zettka, Joshua Jesse",Kater Blau,/events/1952375,37
Rhythm Research presents Metapattern,2024-07-20T00:00:00.000,2024-07-20T23:00:00.000,2024-07-21T06:00:00.000,"Metapattern, Art Lapinsch, Surt, Ana Malo, Ritual Cycles, Reticent, Das Baby, 8-AN, John Fick, Chinita Mami, Vidarr",Humboldthain Club,/events/1952049,36
BHALABASA with Total Balance & Grace Thompson,2024-07-20T00:00:00.000,2024-07-20T23:00:00.000,2024-07-21T08:00:00.000,"Texo, Daora, Grace Thompson",M-BIA,/events/1955076,34
Enter the Void #61,2024-07-20T00:00:00.000,2024-07-20T23:00:00.000,2024-07-21T07:00:00.000,"Soniq, Psypher, Icaro, Enantion",Void Club,/events/1954909,31
Monkey Safari (all night long),2024-07-20T00:00:00.000,2024-07-20T22:00:00.000,2024-07-21T09:00:00.000,Monkey Safari,Ritter Butzke,/events/1952281,27
4th BRUITAL BERLIN FURORE,2024-07-19T00:00:00.000,2024-07-19T19:00:00.000,2024-07-21T07:00:00.000,"Supersimmetria, hypnoskull, bitchcraft, Salvo (CA), Samin Son",Backsteinboot,/events/1914026,25
SWOON,2024-07-20T00:00:00.000,2024-07-20T21:00:00.000,2024-07-21T03:00:00.000,"Evalyn, Sióg, Pppainterrr, Triqi",Orangerie Neukölln,/events/1955364,23
Noisy Glance,2024-07-20T00:00:00.000,2024-07-20T12:00:00.000,2024-07-21T08:00:00.000,"Daniele Papini, Topper, Tomas Station",Club der Visionaere,/events/1962970,21
SAD PROMPT ENGINEERING,2024-07-20T00:00:00.000,2024-07-20T22:00:00.000,2024-07-21T06:00:00.000,"Artur M Puga, Bungalovv, B E N N, CÁRPATOS, trngs",Panke,/events/1963916,21
Femme Bass Mafia presents: Bass Angels,2024-07-20T00:00:00.000,2024-07-20T23:00:00.000,2024-07-21T06:00:00.000,"Hanoosh, VIKMEDINAIT",Zur Klappe,/events/1962721,20
MIEZEKATZE,2024-07-20T00:00:00.000,2024-07-20T15:00:00.000,2024-07-20T20:00:00.000,,Kater Blau,/events/1961409,15
GRAVITY II,2024-07-20T00:00:00.000,2024-07-20T22:00:00.000,2024-07-21T07:00:00.000,,Recede Club Berlin,/events/1963382,14
SATURDAY with Thomas Haak and Waves of Pleasure,2024-07-20T00:00:00.000,2024-07-20T22:30:00.000,2024-07-21T06:00:00.000,"Thomas Haak, Waves of Pleasure",Promenaden Eck,/events/1946940,10
Röhrenclash,2024-07-20T00:00:00.000,2024-07-20T17:00:00.000,2024-07-21T06:00:00.000,"PRTCL, DJ Agem, Motul, Molecular Structures, Prinzenz",TBA - Ask your network/local basshead. ,/events/1956580,10
"FRISKY w Alison Swing, Bouffant Bouffant & E Molina",2024-07-20T00:00:00.000,2024-07-20T23:00:00.000,2024-07-21T06:00:00.000,"Bouffant Bouffant, E Molina, Alison Swing",Paloma,/events/1949462,9
Open Air,2024-07-20T00:00:00.000,2024-07-20T12:00:00.000,2024-07-20T22:00:00.000,,TBA - OA,/events/1904126,9
Sky-Bar Warmup - Free Entrance - Ibizasoulon Balearic House,2024-07-20T00:00:00.000,2024-07-20T18:00:00.000,2024-07-21T02:00:00.000,,Solar,/events/1958454,8
Summer Slow - Ambient Open Air,2024-07-20T00:00:00.000,2024-07-20T14:00:00.000,2024-07-20T22:00:00.000,"Margaux, Doron Eisenberg, Iana Go",SEZ,/events/1965002,8
Sonic Pluriverse Festival: Terapia,2024-07-20T00:00:00.000,2024-07-20T19:00:00.000,2024-07-21T00:00:00.000,Maryisonacid,Haus Der Kulturen Der Welt,/events/1918174,8
Naughty Nostalgia,2024-07-20T00:00:00.000,2024-07-20T22:00:00.000,2024-07-21T06:00:00.000,,Insomnia,/events/1929244,8
"TOP90s: 90s Pop, Eurodance, Trash *KONFETTI & GLITZER SPECIAL*",2024-07-20T00:00:00.000,2024-07-20T23:30:00.000,2024-07-21T06:00:00.000,,Badehaus Berlin,/events/1931441,8
"Friends & Things Vol. 1 with Hubble, Tim B2B Bako, Mila, Cez B2B Olivia ",2024-07-20T00:00:00.000,2024-07-20T22:00:00.000,2024-07-21T08:00:00.000,"Cez (1), Bako., Hubble",TBA - Neukolln (Ziegrasstrasse),/events/1963489,7
MAAYA GRAND OPENING WEEKEND (SATURDAY),2024-07-20T00:00:00.000,2024-07-20T12:00:00.000,2024-07-20T22:00:00.000,,Haubentaucher,/events/1964559,7
BURN Open Air,2024-07-20T00:00:00.000,2024-07-20T15:00:00.000,2024-07-21T22:00:00.000,"Sam Avram, TEMREN",TBA,/events/1967755,7
Straight4wardberlin / Techno Open Air,2024-07-20T00:00:00.000,2024-07-20T17:00:00.000,2024-07-21T06:00:00.000,,TBA,/events/1964019,6
IRRENHOUSE byNINA QUEER,2024-07-20T00:00:00.000,2024-07-20T22:00:00.000,2024-07-21T06:00:00.000,,Cassiopeia,/events/1944578,5
Braintehft Live,2024-07-20T00:00:00.000,2024-07-20T22:00:00.000,2024-07-21T06:00:00.000,"JacqNoise, Migz",Urban Spree,/events/1964679,5
Buriti Session - Pazsarinha & Fisher Live I Helio Pelosi & João Comazzi,2024-07-20T00:00:00.000,2024-07-20T15:00:00.000,2024-07-20T22:00:00.000,"DJ Hp76, João Comazzi",Unkompress,/events/1965492,5
Concert: Mavi Veloso – Travesti Biológica,2024-07-20T00:00:00.000,2024-07-20T20:00:00.000,2024-07-20T23:59:00.000,Mavi Veloso,KW Institute for Contemporary Art,/events/1947124,4
"SAVANNA w. Mayan, The Ex & The Lover (Isis b2b anahii), ZAHARA",2024-07-20T00:00:00.000,2024-07-20T16:00:00.000,2024-07-21T01:00:00.000,Mayan (PT),Klunkerkranich,/events/1960281,4
"Sunset Soirée: Empowerment Through Art. Drinks, live art, and celebrating body positivity",2024-07-20T00:00:00.000,2024-07-20T19:30:00.000,2024-07-20T23:00:00.000,,Freiluftkino Insel,/events/1965227,4
Avant Post – Open Air edition,2024-07-20T00:00:00.000,2024-07-20T21:00:00.000,2024-07-21T04:00:00.000,Pris V,Eschschloraque,/events/1951967,3
"EUFORIQUE x Klunkerkranich w. AMO, BIMBAU",2024-07-20T00:00:00.000,2024-07-20T20:00:00.000,2024-07-21T03:00:00.000,AMO,Klunkerkranich,/events/1960288,3
KiezBeats,2024-07-20T00:00:00.000,2024-07-20T15:00:00.000,2024-07-20T22:00:00.000,"Freulein P., Match Hoffman",Fimmel Veranstaltungsgarten,/events/1963515,3
sturmfrei mit Pablo Cornejo (Chile),2024-07-20T00:00:00.000,2024-07-20T18:00:00.000,2024-07-21T06:00:00.000,Pablo Cornejo,Minimal Bar,/events/1931629,3
Cosmovision Records Showcase - ¨Noche Ritual¨,2024-07-20T00:00:00.000,2024-07-20T23:00:00.000,2024-07-21T08:00:00.000,"Don Mescal, El Extravagante",Beate Uwe,/events/1946025,2
Klubnacht,2024-07-20T00:00:00.000,2024-07-20T23:59:00.000,2024-07-21T12:00:00.000,"Julie Marghilano, Hajdar Berisha, Stipo, Nils Ohrmann",Golden Gate,/events/1961912,2
UG PANDORA // 9 YEARS,2024-07-20T00:00:00.000,2024-07-20T16:00:00.000,2024-07-21T02:00:00.000,"jo:af, Automata, Makoto, Tunnel, Zona Interdunar",Untergeschoss der Pandora,/events/1967416,2
Valentino 45 - Musique Du Monde at Bar Tausend is taking place on 27th NOT on 20.7. cancelled,2024-07-20T00:00:00.000,2024-07-20T22:00:00.000,2024-07-21T04:00:00.000,,Tausend,/events/1956507,1
Chamuyo 'Flavor & Art',2024-07-20T00:00:00.000,2024-07-20T13:00:00.000,2024-07-21T23:00:00.000,E-Chord,TBA - Vagabund Brauerei,/events/1964047,1
Käptens Club Party - Disco pur,2024-07-20T00:00:00.000,2024-07-20T21:00:00.000,2024-07-21T05:00:00.000,,Hafenbar Berlin,/events/1964651,1
Weak Apple,2024-07-20T00:00:00.000,2024-07-20T21:00:00.000,2024-07-21T02:00:00.000,"Kloxii Li, B E N N, Heling, bianyachichi",Kwia,/events/1965763,1
Techno Moon Night,2024-07-20T00:00:00.000,2024-07-20T22:00:00.000,2024-07-21T06:00:00.000,,Soda Club,/events/1939843,0
Orientación (TangoTaqsimJazz),2024-07-20T00:00:00.000,2024-07-20T19:30:00.000,2024-07-20T22:00:00.000,,Galiläakirche,/events/1951153,0
Euforique X Klunkerkranich,2024-07-20T00:00:00.000,2024-07-20T20:00:00.000,2024-07-21T03:00:00.000,"Amo (NO), Bruna Colpa",Klunkerkranich,/events/1960445,0
Dora Pan - Live,2024-07-20T00:00:00.000,2024-07-20T21:00:00.000,2024-07-21T01:00:00.000,Dora Pan,House of Gin,/events/1964480,0
"Ecstatic Dance, Mantra Concert, Cacao & LOVE",2024-07-20T00:00:00.000,2024-07-20T19:00:00.000,2024-07-20T22:00:00.000,,Green Yoga SEZ,/events/1967651,0
Contact Improvisation at SEZ Dance into Contact (Female Led),2024-07-20T00:00:00.000,2024-07-20T14:00:00.000,2024-07-20T17:00:00.000,,Green Yoga SEZ,/events/1967656,0
"PRXMTY w/ DVS1, Oscar Mulero, Bambounou, Dasha Rush, Olympe4000 b2b Amor Satyr, Tijana T",2024-07-20T00:00:00.000,2024-07-20T23:59:00.000,2024-07-22T08:00:00.000,"Akua, Dasha Rush, DJ Red, DJ TOOL, DVS1, Neil Landstrumm, OPH, Oscar Mulero, Spekki Webu, Bambounou, DJ Hyaluron, mu”he, Olympe4000, Amor Satyr, Carlos Valdes, Danielle, Michal Zietara, Tijana T",RSO.BERLIN,/events/1941839,2430
"Else x Kimchi Records: Nicola Cruz, Vera, So-Fi, Chicaiza, Patamamba, 2Step Bec, ZEUS",2024-07-21T00:00:00.000,2024-07-21T14:00:00.000,2024-07-22T06:00:00.000,"Nicola Cruz, Vera, So-Fi, Chicaiza, Patamamba, ZEUS",Else,/events/1937942,1208
Dissident x Harmony Rec『Garden & Indoor』,2024-07-21T00:00:00.000,2024-07-21T14:00:00.000,2024-07-22T03:00:00.000,"Alfred Czital, marum, Carly Zeng, Peachonfuse, DJ Fart in the Club, Spekki Webu, Kia (AU), Yan (CZ), Zeynep",OXI,/events/1943586,325
Klubnacht,2024-07-20T00:00:00.000,2024-07-20T23:59:00.000,2024-07-22T06:00:00.000,"Amanda Mussi, Aurora Halal, Barker, MARRØN, Mary Lake, Pink Concrete, Ryan Elliott, Avalon Emerson, Denny Voltage, Fadi Mohem, Fiedel, Natalie Robinson, Paula Tape, Tedd Patterson",Berghain | Panorama Bar | Säule,/events/1920110,323
Nation of Gondwana Festival 2024,2024-07-19T00:00:00.000,2024-07-19T15:00:00.000,2024-07-21T21:00:00.000,"Aino DJ, AMORAL, Aurora Halal, Beda, Best Boy Electric, Caleesi, Sarah Kreis, Corios, Cotumo, Crille & Tamalt, Danielle, Danilo Plessow, DASCO, Dee Diggs, Der Dritte Raum, Di Linh, Dixon, DJ NORTHERN, Savsannah, DJ TOOL, Ellen Allien, Elliver, Emo Rugene, Felde, Ferdi, Galaxaura, Gerd Janson, GiGi FM, Hanaby, Hunee, JAXX TMS, Joel Mull, Julio Paradise, Gwen Wayne, Kleintierschaukel, LOLSNAKE, Luzi Gehrisch, LYDO, MAMI (AU), Marie Lung, Marie Montexier, Mary Lake, Maryisonacid, Menqui, Mimi Love, Monokrom (2), Narciss, Octave One, Octo Octa, OMOLOKO, Or:la, Paquita Gordon, Perra Inmunda, Phillip Jondo, Portable, Pose Dia, Punani, Rafush, Red Rooms, Rødhåd, Ruede Hagelstein, Sandilé, Shinedoe, Stella Zekri, Suse, Sven Dohse","Schönwalde-Glien, Grünefeld bei Berlin, Germany",/events/1912626,218
Mitmischen invites Lust Klub,2024-07-21T00:00:00.000,2024-07-21T17:00:00.000,2024-07-22T05:00:00.000,"Ariel (DE), Freya K., Anna Konda, Ramón Zappa, Kribs, ogtrues",Watergate,/events/1935691,206
TRIG,2024-07-21T00:00:00.000,2024-07-21T23:00:00.000,2024-07-22T08:00:00.000,"Viktor Kampf, Strasse 95, painzain",AVA Club,/events/1956035,99
cLaTTeR Night Open Air,2024-07-21T00:00:00.000,2024-07-21T23:00:00.000,2024-07-22T09:00:00.000,"Nina Berg, OLGA BIBER, Algerics, nuarrrrr",Lokschuppen Berlin,/events/1937060,97
Sonntags im gART.n by Haensen & Gretel,2024-07-21T00:00:00.000,2024-07-21T14:00:00.000,2024-07-21T22:00:00.000,"Alma Linda, Haensen&Gretel, Luis Rosenberg",gART.n,/events/1954134,56
INFECTED RHYTM,2024-07-21T00:00:00.000,2024-07-21T14:00:00.000,2024-07-21T22:00:00.000,"Manrick Stapez, Niall Kelly, Tiem, LUPENKO, SWOOSHER, PHLOXO, ØZ (1), Hell-ena",Recede Club Berlin,/events/1957927,54
Royal Highness,2024-07-21T00:00:00.000,2024-07-21T15:00:00.000,2024-07-22T03:00:00.000,"Henriku, travaspango, LINDHOUSE",Fitzroy,/events/1965366,47
METANOIA LOCAL RHYTHM,2024-07-20T00:00:00.000,2024-07-20T22:00:00.000,2024-07-22T01:00:00.000,"Rafiki, SHA (DE), Surreal (DE), Coss, Peter Schumann, David Benjamin, Kabeljo, Mcfly, Zettka, Joshua Jesse",Kater Blau,/events/1952375,37
Mind & Soul Open Air / Sage Beach,2024-07-21T00:00:00.000,2024-07-21T15:00:00.000,2024-07-21T22:00:00.000,"Thomas Lizzara, Lotte LAUT",Sage Beach Berlin,/events/1958530,31
"FREE OPEN AIR with Way Of Thinking, Pascale Voltaire, Moritz Butschek & Spirellie",2024-07-21T00:00:00.000,2024-07-21T15:00:00.000,2024-07-21T22:00:00.000,"Spirellie, Way Of Thinking, Pascale Voltaire, Moritz Butschek",Birgit,/events/1966515,27
Somnambul BLN,2024-07-21T00:00:00.000,2024-07-21T22:00:00.000,2024-07-22T07:00:00.000,"BOHO, Katzengold, Nakadia",KitKatClub,/events/1951236,23
Perfumed Freedom,2024-07-21T00:00:00.000,2024-07-21T12:00:00.000,2024-07-22T09:00:00.000,"Losoul, Shonky, Alexander Skancke, Richard Zepezauer, Foehn & Jerome",Club der Visionaere,/events/1962947,23
SIP! curated by Electric Eden,2024-07-21T00:00:00.000,2024-07-21T15:00:00.000,2024-07-22T22:00:00.000,"Fog Puma, CHEWCHEW, Noema, MAGIC JAMS",ZENNER,/events/1943466,17
New Beat Sunday,2024-07-21T00:00:00.000,2024-07-21T16:00:00.000,2024-07-22T00:00:00.000,"Liza Aikin, Aircraft, Philipp Strobel",Urban Spree,/events/1965559,13
Kultur & Strasse 2024,2024-07-21T00:00:00.000,2024-07-21T13:00:00.000,2024-07-21T22:00:00.000,,://about blank,/events/1964602,11
925 DAYSHIFT// Free Open Air In Kreuzberg with Flohmarkt,2024-07-21T00:00:00.000,2024-07-21T12:00:00.000,2024-07-21T18:00:00.000,"tomeitou, Domhof, Dom+",Yafo Kreuzberg,/events/1964667,11
Nachspiel,2024-07-21T00:00:00.000,2024-07-21T08:00:00.000,2024-07-21T18:00:00.000,,KitKatClub,/events/1930541,9
Sonic Pluriverse Festival: Terapia,2024-07-21T00:00:00.000,2024-07-21T19:00:00.000,2024-07-22T23:00:00.000,Nihiloxica,Haus Der Kulturen Der Welt,/events/1918183,8
BURN Open Air,2024-07-20T00:00:00.000,2024-07-20T15:00:00.000,2024-07-21T22:00:00.000,"Sam Avram, TEMREN",TBA,/events/1967755,7
Brave New Brunch,2024-07-21T00:00:00.000,2024-07-21T13:00:00.000,2024-07-21T18:00:00.000,"Moderna, Peter Invasion","TBA -  Studio C : Köpenicker Ch 4, 10317",/events/1949490,3
lazy.sunday mit Robot Girl,2024-07-21T00:00:00.000,2024-07-21T18:00:00.000,2024-07-22T04:00:00.000,Robot Girl,Minimal Bar,/events/1950213,2
VEGETARIAN SAGA V – THE GOURMET GAMBLE,2024-07-21T00:00:00.000,2024-07-21T14:00:00.000,2024-07-21T20:00:00.000,,MaHalla,/events/1957615,2
Ecstatic Dance & Cacao - Parents & Kids Edition,2024-07-21T00:00:00.000,2024-07-21T15:00:00.000,2024-07-21T17:30:00.000,,Green Yoga SEZ,/events/1964503,2
Chamuyo 'Flavor & Art',2024-07-20T00:00:00.000,2024-07-20T13:00:00.000,2024-07-21T23:00:00.000,E-Chord,TBA - Vagabund Brauerei,/events/1964047,1
Ecstatic Dance & Cacao,2024-07-21T00:00:00.000,2024-07-21T19:00:00.000,2024-07-21T21:30:00.000,,Green Yoga SEZ,/events/1964497,1
Hello World x BURRE,2024-07-21T00:00:00.000,2024-07-21T18:00:00.000,2024-07-22T00:00:00.000,"Bryozone, Kindracoma",Cashmere Radio,/events/1967394,1
SINGULARITY MONDAY RAVE ,2024-07-22T00:00:00.000,2024-07-22T23:00:00.000,2024-07-23T08:00:00.000,"JANEIN, Unhuman, BLACK ANTHEM RESTORE, Smashana",Watergate,/events/1950185,468
Electric Monday on 2 Floors @KitKat Club,2024-07-22T00:00:00.000,2024-07-22T22:00:00.000,2024-07-23T07:00:00.000,"Antikkka, ECE EKREN, Milk N Coffee, Frankie Flowerz, Ksenia Kamikaza, James Demon",KitKatClub,/events/1942662,90
SIP! curated by Electric Eden,2024-07-21T00:00:00.000,2024-07-21T15:00:00.000,2024-07-22T22:00:00.000,"Fog Puma, CHEWCHEW, Noema, MAGIC JAMS",ZENNER,/events/1943466,17
Sonic Pluriverse Festival: Terapia,2024-07-21T00:00:00.000,2024-07-21T19:00:00.000,2024-07-22T23:00:00.000,Nihiloxica,Haus Der Kulturen Der Welt,/events/1918183,8
Mondays::,2024-07-22T00:00:00.000,2024-07-22T15:00:00.000,2024-07-23T06:00:00.000,,Club der Visionaere,/events/1968059,7
Playhaus Afters,2024-07-22T00:00:00.000,2024-07-22T09:00:00.000,2024-07-22T17:00:00.000,"Charlie., Guliver, L'Attitude (GER)",Zur Klappe,/events/1962486,4
encore.une.fois / INDOOR RAVE + OPEN AIR CHILL GARDEN,2024-07-23T00:00:00.000,2024-07-23T23:00:00.000,2024-07-24T09:00:00.000,"Lucinee, DJ Saunameister, Inverse Element, turmanuma",OXI,/events/1950912,525
HART | 2 Floors & Garden,2024-07-23T00:00:00.000,2024-07-23T23:00:00.000,2024-07-24T09:00:00.000,,Der Weiße Hase,/events/1927585,84
16PITCH 1YR ANNIVERSARY,2024-07-23T00:00:00.000,2024-07-23T21:00:00.000,2024-07-24T05:00:00.000,"HiHat, DJ Henk, get no, LŸBRA, $EITAN777",Zur Klappe,/events/1888313,75
Walkin' Into Sunshine (Daytime at the Beach),2024-07-23T00:00:00.000,2024-07-23T15:00:00.000,2024-07-23T22:00:00.000,"Diskohengst, mojo (DE), mojo",Strandbad Plötzensee,/events/1961918,30
THE UNKNOWN,2024-07-23T00:00:00.000,2024-07-23T20:00:00.000,2024-07-24T03:30:00.000,Spirellie,Süss War Gestern,/events/1924220,26
Open Decks & Tischtennis,2024-07-23T00:00:00.000,2024-07-23T18:00:00.000,2024-07-24T04:00:00.000,,Humboldthain Club,/events/1916346,20
It's Ours,2024-07-23T00:00:00.000,2024-07-23T15:00:00.000,2024-07-24T06:00:00.000,"Adil Hiani, Memed Awad, Moruki, Ray Okpara, Sakro",Club der Visionaere,/events/1962939,14
embraceOurweird - Vinyl Stream Garden ,2024-07-23T00:00:00.000,2024-07-23T18:00:00.000,2024-07-23T22:00:00.000,SEBASTIAN_KEKS,TBA - Radio & Twitch,/events/1964359,7
BLAUES STÜNDCHEN w. Nhauel b2b Luna Sabre,2024-07-23T00:00:00.000,2024-07-23T17:00:00.000,2024-07-24T00:00:00.000,,Klunkerkranich,/events/1965447,5
go.play mit VINNO B2B PINOLA,2024-07-23T00:00:00.000,2024-07-23T18:00:00.000,2024-07-24T04:00:00.000,VINNO,Minimal Bar,/events/1938941,4
go.play mit ,2024-07-23T00:00:00.000,2024-07-23T18:00:00.000,2024-07-24T04:00:00.000,,TBA,/events/1919541,2
Art Bei Ton x Acquario,2024-07-24T00:00:00.000,2024-07-24T23:00:00.000,2024-07-25T08:00:00.000,"Blazej Malinowski, Viels, Outburst Knobs, Münch, Dixie, Lilith., Hypnotic Black Magic, Hal (DE), Pixelflowers",://about blank,/events/1874478,248
KAPITEL Berlin: EUPHORIA OPEN AIR (2 STAGES),2024-07-24T00:00:00.000,2024-07-24T23:00:00.000,2024-07-25T08:00:00.000,"CARGO (DE), HEDDA, Young Lychee, Bernossi, Blame the Booker, oulcan, Vlamassi, Berfu, Karmasakal, søsa, Cruxado, nicole lukiys",Lokschuppen Berlin,/events/1948009,217
TECHNO MITTWOCH: TUNNEL/TURBINE/GARDEN,2024-07-24T00:00:00.000,2024-07-24T23:00:00.000,2024-07-25T10:00:00.000,"Lovestory, E.P.L.E., Viktor Kampf, Basstronauten",AVA Club,/events/1924193,174
POPPERS on PRIDE,2024-07-24T00:00:00.000,2024-07-24T20:00:00.000,2024-07-25T04:00:00.000,BLEACH.LIVE,Monster Ronson's Ichiban Karaoke,/events/1830716,170
IMPULSE CØNTROL Label Showcase,2024-07-24T00:00:00.000,2024-07-24T18:00:00.000,2024-07-25T00:00:00.000,"B-VERS, Marina George, Ramsey Neville, Sebastian Bayne",Giri,/events/1965597,130
SYMBIOTIKKA at KitKat Club,2024-07-24T00:00:00.000,2024-07-24T22:00:00.000,2024-07-25T07:00:00.000,"Patrik Berg, DJ Jordan, Melanchromie",KitKatClub,/events/1947293,95
Rave am Mittwoch,2024-07-24T00:00:00.000,2024-07-24T23:00:00.000,2024-07-25T06:00:00.000,"A.I.F.O.S., DJ.11R, YESOLO",M-BIA,/events/1944060,85
Tresor New Faces,2024-07-24T00:00:00.000,2024-07-24T23:00:00.000,2024-07-25T06:00:00.000,"DJ Carlita, cheng nwsh, Jack Roland, dergloeckner, Lola Kay, sanguinica, Tizian [GER]",Tresor / Globus,/events/1939979,71
CÉU *live,2024-07-24T00:00:00.000,2024-07-24T19:30:00.000,2024-07-24T23:00:00.000,,Gretchen,/events/1874908,61
lip (service) edt.1,2024-07-24T00:00:00.000,2024-07-24T18:00:00.000,2024-07-25T02:00:00.000,"DJ AYA, DJ Fuckoff, Yazzus",TORTE BAR,/events/1964668,48
60waves x Laundry Room,2024-07-24T00:00:00.000,2024-07-24T15:00:00.000,2024-07-25T07:00:00.000,"Alessia Ceruti, Andy Kolwes, CHKLTE, Dana Ruh, Garrett David, Hugo Martinez",Club der Visionaere,/events/1964233,21
://sektgarten [free entry & open air],2024-07-24T00:00:00.000,2024-07-24T18:00:00.000,2024-07-24T23:00:00.000,"Violetta (DE), Lakkes",://about blank,/events/1969443,20
TTeo live,2024-07-24T00:00:00.000,2024-07-24T19:00:00.000,2024-07-24T23:59:00.000,"TTeo, Soulski",Klunkerkranich,/events/1959574,8
NATURAL pres AMBIENTES KOLLEKTIV - 2x Live-Act (An Immersive Sonic Experience),2024-07-24T00:00:00.000,2024-07-24T19:00:00.000,2024-07-25T21:00:00.000,"Saumeth, AMBIENTES KOLLEKTIV",Astral Junction,/events/1968737,8
STREETBEAT SPITWOCH,2024-07-24T00:00:00.000,2024-07-24T18:00:00.000,2024-07-24T23:30:00.000,,ÆDEN,/events/1967135,4
mittendrin mit Deacon Frost Jr,2024-07-24T00:00:00.000,2024-07-24T18:00:00.000,2024-07-25T04:00:00.000,,Minimal Bar,/events/1931635,4
Mexcian Dub Session,2024-07-24T00:00:00.000,2024-07-24T20:00:00.000,2024-07-25T00:00:00.000,"Tor.Ma in Dub, Sudden Reverb",YAAM Berlin,/events/1968717,3
MissVergnügen o.h.o,2024-07-24T00:00:00.000,2024-07-24T21:00:00.000,2024-07-25T04:00:00.000,MissVergnügen,Eschschloraque,/events/1952252,2
House of Lunacy - Midsummer Dreams,2024-07-25T00:00:00.000,2024-07-25T20:00:00.000,2024-07-26T11:00:00.000,"Cyranotaurus Cortex, Freudenthal, Goldenaxe, Stephan Licha, Exildiscount, KleinerDrei, Don Rogall, DJ NORTHERN, Captain Brexit, FridaY (DE)",Renate,/events/1938987,1863
shitlabel summer residence / 2 floors indoor rave + xxl chill garden / tickets at the door,2024-07-25T00:00:00.000,2024-07-25T23:00:00.000,2024-07-26T10:00:00.000,"The Brvtalist, Monoloc, Nothing Left, Skungal, BLACK ANTHEM RESTORE, Inverse Element",://about blank,/events/1881124,884
UNITY AT KITKAT CLUB,2024-07-25T00:00:00.000,2024-07-25T22:00:00.000,2024-07-26T08:00:00.000,"Foxy Roxy, alemiko, Markus Glanz",KitKatClub,/events/1909452,747
FAUVES X UNFAIR ☽  [2 STAGE INDOOR + GARDEN CHILL OUT],2024-07-25T00:00:00.000,2024-07-25T22:00:00.000,2024-07-26T10:00:00.000,"KUSS, KLING&KLANG, Shanda, Jon10, Aykan, Hayashi, .JKM, niclazik, TOBEATMKR, REV/, SEND HER, Sonia Michigan, Louisa Sonn, Erna (FR)",OXI,/events/1869542,664
Labess with Jamila & The Other Heroes,2024-07-25T00:00:00.000,2024-07-25T19:00:00.000,2024-07-26T00:00:00.000,,Gretchen,/events/1928520,474
