The Mystic Rose meets Electric Universe & Bodypainters United,2024-04-19T00:00:00.000,2024-04-19T22:00:00.000,2024-04-20T10:00:00.000,"Orpheuz, Somaphon",KitKatClub,/events/1887138,65
MODEM Teaser Berlin powered by xXETEXx,2024-04-19T00:00:00.000,2024-04-19T23:00:00.000,2024-04-20T10:00:00.000,"HypoGeo, Val Vashar, Yobovski, Josephine Wedekind",OST,/events/1850154,66
"Groove Street Berlin / elliephunk, Vault, ketuxx, Michael Gubaew, Rieke Lenz",2024-04-19T00:00:00.000,2024-04-19T22:00:00.000,2024-04-20T06:00:00.000,"elliephunk, ketuxx, Michael Gubaew, vault., Rieke Lenz",DAS Institut,/events/1891294,54
Backhaus Records Label Night,2024-04-19T00:00:00.000,2024-04-19T23:00:00.000,2024-04-20T07:00:00.000,"JANE (DE), mu”he, Bekkler, J-131",Void Hall,/events/1888305,52
Diskotek x UNDRCRWD party,2024-04-19T00:00:00.000,2024-04-19T22:00:00.000,2024-04-20T05:00:00.000,"Adine Frost, beta_phase, Blachord, DJ Marviosi, LilaLuci, LIZZN, Papa Hase, Seven Flowers",Mena Berlin,/events/1894927,50
"Sweet Meet: Max, Edoardo, Javier Gallardo",2024-04-19T00:00:00.000,2024-04-19T23:00:00.000,2024-04-20T06:00:00.000,"Edoardo (2), Javier Gallardo",Bulbul Berlin,/events/1880198,44
Alphabet Duet,2024-04-19T00:00:00.000,2024-04-19T23:00:00.000,2024-04-20T08:00:00.000,"Alfandi, Background Radiation, Croissant2002, Discopapi, DJ SWISHERMAN, John Mood, KVLR, Mareike Bautz",Humboldthain Club,/events/1888083,42
Hidden Empire,2024-04-19T00:00:00.000,2024-04-19T22:00:00.000,2024-04-21T09:00:00.000,"Hidden Empire, Coeus, Bianka Banks, Wolfson, Ele Luz",Ritter Butzke,/events/1836604,41
"Shinobies VOL II 春 @ Hoppetosse, Berlin",2024-04-19T00:00:00.000,2024-04-19T23:00:00.000,2024-04-20T12:00:00.000,"95 STEPS, Akatana, Hubble, Fabio Caria, Fanfarrosa, Kaloustian, Lansky Le Vrai, mod:al, Night No Tori, Schab, Suburbial, Thoma'",Hoppetosse,/events/1871140,37
Subverted. Label Night,2024-04-19T00:00:00.000,2024-04-19T22:00:00.000,2024-04-20T09:00:00.000,"Fluid, Nnamael, Mogano, Laura MRLS, JASSASS, WLLKR, FOKUS (Live)",TBA,/events/1838874,37
Patterns of Perception // Carrier + ophélie,2024-04-19T00:00:00.000,2024-04-19T23:59:00.000,2024-04-20T07:30:00.000,"Carrier, ophélie, Andreas Maan, Hysteria, Kim Bergstrand",OHM,/events/1889062,35
Twisting Paloma,2024-04-19T00:00:00.000,2024-04-19T23:00:00.000,2024-04-20T06:00:00.000,"ohmydais, Highrise, Strange Signals, Acidfinky",Paloma,/events/1817879,33
"B-FUNK RELEASEPARTY with Carl Hang, Wall Ra, Diskohengst, Will Spliff, Redblunted",2024-04-19T00:00:00.000,2024-04-19T21:00:00.000,2024-04-20T05:00:00.000,"Carl Hang, Wall Ra, Diskohengst, redblunted",Chausseestrasse 131,/events/1894807,27
Bantu's Diary,2024-04-13T00:00:00.000,2024-04-13T23:00:00.000,2024-04-21T05:00:00.000,,Fitzroy,/events/1904759,25
"Pandora 19.04. with Arutani *live, Kiki Kokolores & Coordese",2024-04-19T00:00:00.000,2024-04-19T23:00:00.000,2024-04-20T08:00:00.000,"Arutani, Francesco Rizzi, Adrian Schneider",Beate Uwe,/events/1885941,23
Apotheose - House of Heavens,2024-04-19T00:00:00.000,2024-04-19T22:00:00.000,2024-04-20T07:00:00.000,"deKai, Felix FX",Funkloch Berlin,/events/1894856,21
RaveHeart,2024-04-19T00:00:00.000,2024-04-19T23:00:00.000,2024-04-20T11:00:00.000,"BB Deng, Sika Akis, Kaminka Merel, DarK LiZZ, DAZA, Felidae, Paty Vapor",Der Weiße Hase,/events/1899266,26
Olsvangèr invites Evan Tail & Aqua Veen,2024-04-19T00:00:00.000,2024-04-19T20:00:00.000,2024-04-20T03:00:00.000,"Olsvangèr, Evan Tail, Aqua Veen",Orangerie Neukölln,/events/1905133,17
luca.and.friends. mit Luca ( Minimal Bar) & Freunde,2024-04-19T00:00:00.000,2024-04-19T18:00:00.000,2024-04-20T06:00:00.000,,Minimal Bar,/events/1869787,17
FRIDAY with M89 and Tiny Lions,2024-04-19T00:00:00.000,2024-04-19T20:00:00.000,2024-04-20T06:00:00.000,,Promenaden Eck,/events/1898325,13
Paranormal Passion,2024-04-19T00:00:00.000,2024-04-19T22:00:00.000,2024-04-20T06:00:00.000,Forbidden Kitty,Insomnia,/events/1901080,12
HOUSELAND,2024-04-19T00:00:00.000,2024-04-19T22:30:00.000,2024-04-20T06:00:00.000,"Dennis Beutler, Bombata, Peet Flower",Bohnengold,/events/1899228,11
Portals,2024-04-19T00:00:00.000,2024-04-19T20:00:00.000,2024-04-20T02:00:00.000,"Gabrielle Rose, Inès Cherifi, Apu Nanu",Kwia,/events/1898729,12
BeatGeeks pres.: Bring That Beat Back,2024-04-19T00:00:00.000,2024-04-19T21:00:00.000,2024-04-20T06:00:00.000,,Panke,/events/1874223,10
"Perfumed Garden with JD Twitch (Optimo), Jonas Friedlich, Nadia Wise, Alba acab, Bad Boy Baader",2024-04-19T00:00:00.000,2024-04-19T22:00:00.000,2024-04-20T08:00:00.000,"JD Twitch, Jonas Friedlich, Nadia Wise",Sameheads,/events/1897112,9
Klubnacht + Afterhour,2024-04-19T00:00:00.000,2024-04-19T23:59:00.000,2024-04-20T23:59:00.000,"Marko Nastic, youANDme, Brizman, Ocean Lam, David Delgado, Bee Lincoln",Golden Gate,/events/1901405,8
Vio PRG invites Club Roquette (FR),2024-04-19T00:00:00.000,2024-04-19T23:00:00.000,2024-04-20T06:00:00.000,"Vio PRG, Club Roquette",Paloma,/events/1885065,8
I LOVE REGGAETON,2024-04-19T00:00:00.000,2024-04-19T23:00:00.000,2024-04-20T06:00:00.000,,Avenue Berlin,/events/1885478,7
Indie Club Berlin • Badehaus Berlin,2024-04-19T00:00:00.000,2024-04-19T23:30:00.000,2024-04-20T06:00:00.000,,Badehaus Berlin,/events/1890802,7
ThursdayVibeZz **FREE ENTRY**,2024-04-18T00:00:00.000,2024-04-18T23:00:00.000,2024-04-21T05:00:00.000,SOCKET,Recede Club Berlin,/events/1906311,6
MostValuablePunany vol.3,2024-04-19T00:00:00.000,2024-04-19T18:00:00.000,2024-04-20T04:00:00.000,Paulinhx,Tante Frizzante,/events/1906515,5
Bantu's Diary,2024-04-19T00:00:00.000,2024-04-19T23:00:00.000,2024-04-20T06:00:00.000,,Fitzroy,/events/1888208,4
Sky-Bar Warmup - Free Entrance - Deep House & Electronica,2024-04-19T00:00:00.000,2024-04-19T18:00:00.000,2024-04-20T02:00:00.000,,Solar,/events/1889759,4
Süss am Freitag,2024-04-19T00:00:00.000,2024-04-19T22:00:00.000,2024-04-20T06:00:00.000,"Tobi Soul, AWSM",Süss War Gestern,/events/1904910,3
CANDY ROCKET,2024-04-19T00:00:00.000,2024-04-19T21:00:00.000,2024-04-20T04:00:00.000,Thomas Haak,Bredouille,/events/1881148,3
Vibes – After Work,2024-04-19T00:00:00.000,2024-04-19T20:00:00.000,2024-04-20T01:00:00.000,Stevo Bajski,St. Oberholz,/events/1906707,2
BLUES BUMPS - Nodarling - Ultrabonus - Sector 7G,2024-04-19T00:00:00.000,2024-04-19T21:00:00.000,2024-04-20T03:30:00.000,,BLO-Ateliers,/events/1907523,1
Valya Kan,2024-04-19T00:00:00.000,2024-04-19T21:00:00.000,2024-04-20T03:00:00.000,Valya Kan,Palabra Bar,/events/1906036,0
Davide & Martin,2024-04-19T00:00:00.000,2024-04-19T21:00:00.000,2024-04-20T04:00:00.000,,Eschschloraque,/events/1906087,0
Stimmen in Aspik - Die Schlager-Party,2024-04-19T00:00:00.000,2024-04-19T21:00:00.000,2024-04-20T05:00:00.000,,Hafenbar Berlin,/events/1906769,0
Techno Moon Night - Friday,2024-04-19T00:00:00.000,2024-04-19T22:00:00.000,2024-04-20T06:00:00.000,,Soda Club,/events/1877652,0
BCCO,2024-04-20T00:00:00.000,2024-04-20T23:00:00.000,2024-04-21T08:00:00.000,"Somewhen, MCR-T, future.666, DJ Hyperdrive, Julian Muller, slin, Tarkno, TONI BA",ZENNER,/events/1800287,2254
"PRXMTY x Mama Told Ya with Anetha, A Strange Wedding, IN2STELLAR, VEL and X CLUB",2024-04-20T00:00:00.000,2024-04-20T23:59:00.000,2024-04-22T08:00:00.000,"A Strange Wedding, ABSL, Anetha, Less Distress, Mac Declos, Shaven, UFO95, VEL (3), X CLUB., Baraka, DASCO, IN2STELLAR, Surf 2 Glory",RSO.BERLIN,/events/1878754,1600
"SOLD OUT - WohnzimmerTechno #420 w/ Kyrist, Sofie Sapuna, Exil der Schatten, Fab Massimo, A.N.I",2024-04-20T00:00:00.000,2024-04-20T23:00:00.000,2024-04-21T08:00:00.000,"Kyrist, Sofie Sapuna, Exil der Schatten, Schicktanz, A.N.I., Fab Massimo, Havali Sergec, Flanko, Elias Goldmund, Naicet, Till Antonio, Techmo, GEST (UK), Upzet",Void Club,/events/1839371,744
"fhainest w. 1luu, DJ Traytex, Floor Force One, MLZ, DJ Mischkonsum",2024-04-20T00:00:00.000,2024-04-20T23:00:00.000,2024-04-21T09:00:00.000,"1luu, Athina, Cara Elizabeth, DJ Mischkonsum, DJ Traytex, Enjoyvoid, Floor Force One, HØLLE (2), Louis Harshman, MLZ, SaltySis",Lokschuppen Berlin,/events/1847682,590
The Bug presents: PRESSURE // SOLD OUT,2024-04-20T00:00:00.000,2024-04-20T23:00:00.000,2024-04-21T05:30:00.000,"The Bug, Flowdan, Dillinja",Gretchen,/events/1864245,431
Toy Tonics presents ITALOMANIA,2024-04-20T00:00:00.000,2024-04-20T23:00:00.000,2024-04-21T08:00:00.000,"Delfonic, Moretz, Nadia Wise, Tommiboy, Alexander Arpeggio, Elazer",OXI,/events/1891910,321
"NUDE with Laurine b2b Cecilio, Konduku, SENERGI",2024-04-20T00:00:00.000,2024-04-20T22:00:00.000,2024-04-21T08:00:00.000,"Laurine, Cecilio, Konduku, SENERGI",Prince Charles,/events/1894552,309
Golosa - Twinkies Mary & Jane's celebration,2024-04-20T00:00:00.000,2024-04-20T23:00:00.000,2024-04-21T12:00:00.000,"Groove Daniel, KH38, La Schmock, LSN101, Annechoic, Manuela Mayoral, materia hache, Panduro DJs, Punktmidi, Sky Deep",://about blank,/events/1839145,242
"Renate Klubnacht w/ Vio PRG, S Ruston, Travis or Alice, Garo, Vinicius Honorio, Stephan Panev",2024-04-20T00:00:00.000,2024-04-20T23:00:00.000,2024-04-21T08:00:00.000,"Garo, Travis or Alice, Stephan Panev, Vio PRG, Club Roquette, S Ruston, Vinicius Honorio",Renate,/events/1842790,207
Klubnacht,2024-04-20T00:00:00.000,2024-04-20T23:59:00.000,2024-04-22T07:00:00.000,"Terence Fixmer, Aurora Halal, Don Williams, Efdemin, GiGi FM, Kwartz, Mary Yuzovskaya, Rødhåd, Frits Wentink, Luzie, Mr. Tophat, Mystery Affair, nd_baumecker, Violetta (DE), Yamour, Mathew Jonson",Berghain | Panorama Bar | Säule,/events/1853375,201
Rough Trade EU Berlin Opening Rave,2024-04-20T00:00:00.000,2024-04-20T22:00:00.000,2024-04-21T07:00:00.000,"Digitalism, Monolink, Kasper Bjørke, Local Suicide, Daniel Miller",Kreuzwerk,/events/1862276,198
XTROB: Revelation Resurgence #QUEER #TECHNO,2024-04-20T00:00:00.000,2024-04-20T23:00:00.000,2024-04-21T09:00:00.000,"Zomkrad, BIXBITA, Juan Cernadas, Belén Zer",TBA - Secret Location,/events/1893958,197
It's Ours: Birthday Cruise,2024-04-20T00:00:00.000,2024-04-20T23:00:00.000,2024-04-21T11:00:00.000,"Marko Nastic, Moruki, Nick Curly, Okain, Ray Okpara, Rossko, Sebo K",Hoppetosse,/events/1887282,189
HENGE + Support: Captain Zorx,2024-04-20T00:00:00.000,2024-04-20T19:30:00.000,2024-04-20T23:00:00.000,HENGE,Privatclub,/events/1867028,161
Indiskret Berlin,2024-04-20T00:00:00.000,2024-04-20T23:00:00.000,2024-04-21T08:00:00.000,"Concentio, Confred, Intaktogene, Katzengold, Marius Holm, Pajüh, Rabauke",M01,/events/1893682,139
Sound System Culture: As it Sounds Conference & Festival,2024-04-18T00:00:00.000,2024-04-18T17:00:00.000,2024-04-21T20:00:00.000,"Infinite Livez, Rafush, Richard Akingbehin, Sarah Farina, Matwe, Nina Pixel",Kunstquartier Bethanien,/events/1891935,126
"Birgits Spring Weekender with Mehr is Mehr, Katzengold, Blake Strange, Banausen Kollektiv ",2024-04-19T00:00:00.000,2024-04-19T22:00:00.000,2024-04-21T08:00:00.000,"Dr. Honey, Katzengold, Fabian Vieregge, Nat SuPrise, Daniel Kirchner, Ben Green, Frau Anne Manow, Olek, Housecall, Dorian Bonaparte, Bruno Otranto, Blake Strange, Mehr is Mehr",Birgit,/events/1852442,122
Tresor Klubnacht,2024-04-20T00:00:00.000,2024-04-20T23:00:00.000,2024-04-21T12:00:00.000,"Claudio PRC, JSR, Saphileaum, Decka, Madalba, Wata Igarashi, Zara",Tresor / Globus,/events/1875651,105
FULL CIRCLE,2024-04-20T00:00:00.000,2024-04-20T22:00:00.000,2024-04-21T23:59:00.000,"Caleesi, Sarah Kreis, Ruede Hagelstein, Sydka, meera (NO), Nacho Isa, Justin Marchacos, Thor Rixon, Milio, Gina Sabatini, LENI, bawab, Mira",Kater Blau,/events/1889849,99
Halbtrocken Invites - Bonzo´s Birthday Bash,2024-04-20T00:00:00.000,2024-04-20T23:00:00.000,2024-04-21T08:00:00.000,"Ben Derris, Tenacious T, BRT DJ, Vague, DJ FUCKYOURHYPE, DJ WASSERFALL, DJ FEELTOOMUCH, Markus Glanz, DJ Keyframe, Spielkamerad (2)",Humboldthain Club,/events/1877981,84
"8 Jahre Goanautika w./ Fabio Fusco, Day.Din, Klopfgeister, Lord of Psychedelics",2024-04-20T00:00:00.000,2024-04-20T22:00:00.000,2024-04-21T10:00:00.000,Momentune,ORWO Haus,/events/1866253,83
Freakquency with Altered State & Timo Mandl,2024-04-20T00:00:00.000,2024-04-20T23:00:00.000,2024-04-21T10:00:00.000,"Texo, Kopflos",M-BIA,/events/1868012,80
TECHNO MATRIARCHAT VOL.2,2024-04-20T00:00:00.000,2024-04-20T23:00:00.000,2024-04-21T09:00:00.000,"HNX (030), Ninalacool, Cat Vermillion, GVEMEACD, SELESSA T., LUV.DELUXE, LEYLA\ /NOUHEYLA",AVA Club,/events/1886879,73
15 Years of Posh Isolation Showcase,2024-04-20T00:00:00.000,2024-04-20T20:00:00.000,2024-04-20T23:59:00.000,"Croatian Amor, CTM (1), Vanity Productions, Rosa Anschütz",Silent Green,/events/1875717,70
"Gash Collective presents Elaine Howley (live), Vani-T, ELLLL, Lolz ",2024-04-20T00:00:00.000,2024-04-20T23:59:00.000,2024-04-21T08:00:00.000,"Vani-T, ELLLL, Lolz",OHM,/events/1881290,70
Walfisch Exil / Oldschool Party at Der Weiße H,2024-04-20T00:00:00.000,2024-04-20T23:00:00.000,2024-04-21T11:00:00.000,"Tanith, Der Würfler, Mike Dub",Der Weiße Hase,/events/1877631,69
FACILITATE,2024-04-20T00:00:00.000,2024-04-20T23:00:00.000,2024-04-21T07:00:00.000,"Dangermami, DJ Flounce, DJ NORTHERN, Sarah Farina",Zur Klappe,/events/1890772,63
"Sugaloop w./ Under Black Helmet, BXTR, DJ Physical",2024-04-20T00:00:00.000,2024-04-20T23:00:00.000,2024-04-21T08:00:00.000,"BXTR, DJ Physical, Skkin Velvet, Under Black Helmet, ANTNK, Bélavie, ISA (ES)",OST,/events/1900600,57
"House, Set & Match: hillymarilly b2b Love Operator, alegreO, VANEO b2b Toast Hawaii, RAY",2024-04-20T00:00:00.000,2024-04-20T23:00:00.000,2024-04-21T06:00:00.000,"hillymarilly, alegreO, Vaneo, Toast Hawaii",Bulbul Berlin,/events/1880201,54
Marek Hemmann,2024-04-20T00:00:00.000,2024-04-20T22:00:00.000,2024-04-21T09:00:00.000,"Marek Hemmann, Niconé, Svensøn",Ritter Butzke,/events/1829198,51
Hidden Empire,2024-04-19T00:00:00.000,2024-04-19T22:00:00.000,2024-04-21T09:00:00.000,"Hidden Empire, Coeus, Bianka Banks, Wolfson, Ele Luz",Ritter Butzke,/events/1836604,41
CTW Podcasts x Sameheads ❀ Supertonic DJs - Fandango DJs - Síofra b2b Maï-Linh,2024-04-20T00:00:00.000,2024-04-20T22:00:00.000,2024-04-21T07:00:00.000,"Arlanoa, DJ Bienveillance, Tania Just, Mark Gill, Murrin, Síofra, Maï-Linh",Sameheads,/events/1880487,40
"Hang Jack with Kallaloo, Janna N & mate in nine",2024-04-20T00:00:00.000,2024-04-20T20:30:00.000,2024-04-21T03:00:00.000,"Kallaloo, Janna N, mate in nine",Orangerie Neukölln,/events/1895852,34
daycare,2024-04-20T00:00:00.000,2024-04-20T11:00:00.000,2024-04-20T23:59:00.000,"xupid, Lyo., nadia (npc), JD Typo, eric.a",TBA,/events/1894530,33
forever unlimited,2024-04-20T00:00:00.000,2024-04-20T23:59:00.000,2024-04-21T08:00:00.000,"Sue Lèwig, Neve (2), SITSOPE, lealucifer, Mika Dj, DJ KOWBOJ, CUNT REMEMBER, Suresh",Fitzroy,/events/1902037,33
Teho & Romain Garcia,2024-04-20T00:00:00.000,2024-04-20T22:00:00.000,2024-04-21T09:00:00.000,"Teho, Romain Garcia, Robine",Ritter Butzke,/events/1838804,30
99CHANTS labelnight,2024-04-20T00:00:00.000,2024-04-20T18:00:00.000,2024-04-21T00:00:00.000,"David August, Nastya Vogan",Aktionshaus,/events/1906631,29
Naomi9 - 'Equinexus',2024-04-20T00:00:00.000,2024-04-20T21:00:00.000,2024-04-21T02:00:00.000,"Eddington Again, Neana, Hanaby",Studio dB,/events/1894403,25
Bantu's Diary,2024-04-13T00:00:00.000,2024-04-13T23:00:00.000,2024-04-21T05:00:00.000,,Fitzroy,/events/1904759,25
"DROP by HIFI/LOFI: Daddy Squad, Alemao, Franz Matthews",2024-04-20T00:00:00.000,2024-04-20T22:00:00.000,2024-04-21T06:00:00.000,"Daddy Squad, Franz Matthews",Crack Bellmer,/events/1888024,22
SATURDAY with Fassade and Phil-In,2024-04-20T00:00:00.000,2024-04-20T20:00:00.000,2024-04-21T06:00:00.000,,Promenaden Eck,/events/1896280,21
ANIMAL FARM,2024-04-20T00:00:00.000,2024-04-20T19:00:00.000,2024-04-21T01:00:00.000,"BENZA, Alex Nantaya, Pooja B, Gioski",Giri,/events/1905493,21
Kinktastisch Kinky Techno Dance & Play party,2024-04-20T00:00:00.000,2024-04-20T22:00:00.000,2024-04-21T06:00:00.000,,Insomnia,/events/1878030,21
basic needs,2024-04-20T00:00:00.000,2024-04-20T22:00:00.000,2024-04-21T10:30:00.000,"Alada, Authentically Plastic, Nsasi, Rafush, Skankstasy, Slim Soledad, Turkana, XD Erica",Blue Velvet,/events/1890860,19
Flo & justUS Bday Bash,2024-04-20T00:00:00.000,2024-04-20T23:00:00.000,2024-04-21T09:00:00.000,"ALXJ, Daniel Neuland, Dydaa Forne, justUS, Katzengold, Martin Ka, MILLA LOU, Rad.Lez, vom Feisten, White Zoo",Secret Location 030,/events/1886031,18
Coco the Coconut & Scout Wölfli feat. CherrYO!kie at Disco Bizarre,2024-04-20T00:00:00.000,2024-04-20T22:00:00.000,2024-04-21T08:00:00.000,"Coco the Coconut, Billy Idle",KitKatClub,/events/1906273,17
spread:,2024-04-20T00:00:00.000,2024-04-20T22:00:00.000,2024-04-21T10:00:00.000,"Richii, 0megavybe, Femalemacho, Multifun",TBA,/events/1901499,18
sturmfrei mit Jago K. & Freunde,2024-04-20T00:00:00.000,2024-04-20T18:00:00.000,2024-04-21T06:00:00.000,,Minimal Bar,/events/1869793,14
IRRENHOUSE - Lars Eidinger is back! by Nina Queer,2024-04-20T00:00:00.000,2024-04-20T23:00:00.000,2024-04-21T06:00:00.000,Lars Eidinger,Cassiopeia,/events/1887192,14
"Sticky with O-Wells, Candy Pollard",2024-04-20T00:00:00.000,2024-04-20T22:00:00.000,2024-04-21T06:00:00.000,"O-Wells, Candy Pollard",Paloma,/events/1886230,13
"Sweet Spot with Monkyman, Ligal Tamir",2024-04-20T00:00:00.000,2024-04-20T23:00:00.000,2024-04-21T07:00:00.000,"Monkyman, Ligal Tamir",Beate Uwe,/events/1859568,12
Eskalation on Fire,2024-04-20T00:00:00.000,2024-04-20T22:00:00.000,2024-04-21T06:00:00.000,"Epicx, Daora",DAS Institut,/events/1880571,12
Weser Ton at Blue Velvet,2024-04-20T00:00:00.000,2024-04-20T12:00:00.000,2024-04-20T22:00:00.000,"SAGAN, Tobha, Impérieux, HINNA, Buoy",Blue Velvet,/events/1897656,11
Team 80s • 80s Pop Disco // New Wave // NDW // Indie • Astra Berlin,2024-04-20T00:00:00.000,2024-04-20T23:30:00.000,2024-04-21T06:00:00.000,,Astra Kulturhaus,/events/1890877,9
se:edz,2024-04-20T00:00:00.000,2024-04-20T13:00:00.000,2024-04-20T23:59:00.000,Charonne,TBA - Lighthouse Plötzensee,/events/1897367,8
Klubnacht + Afterhour,2024-04-19T00:00:00.000,2024-04-19T23:59:00.000,2024-04-20T23:59:00.000,"Marko Nastic, youANDme, Brizman, Ocean Lam, David Delgado, Bee Lincoln",Golden Gate,/events/1901405,8
ATTUNE by Soneiro Collective Composed and spatialized in 4DSOUND,2024-04-20T00:00:00.000,2024-04-20T19:30:00.000,2024-04-20T23:30:00.000,Soneiro Collective,MONOM,/events/1887360,8
Klubnacht,2024-04-20T00:00:00.000,2024-04-20T23:59:00.000,2024-04-21T15:00:00.000,"Michael Melchner, Didier Dlb, Fanfarrosa, Otto Lebowski",Golden Gate,/events/1901410,7
ROOTZ UPRIZING #4,2024-04-20T00:00:00.000,2024-04-20T21:00:00.000,2024-04-21T05:00:00.000,,KVU - Kirche von Unten,/events/1883985,7
ThursdayVibeZz **FREE ENTRY**,2024-04-18T00:00:00.000,2024-04-18T23:00:00.000,2024-04-21T05:00:00.000,SOCKET,Recede Club Berlin,/events/1906311,6
FEMME TOP by Miss Ivanka T,2024-04-20T00:00:00.000,2024-04-20T23:00:00.000,2024-04-21T08:00:00.000,Felix Jaehn,Schwuz,/events/1902678,5
BOBBY BRIM (live) - ARCANE (live) - INTERNATIONAL BAUER - OSTERINSEL,2024-04-20T00:00:00.000,2024-04-20T19:00:00.000,2024-04-21T06:00:00.000,"Bærnd Anders, GAZZA (2)",Loophole,/events/1902985,5
Paloma Invites,2024-04-20T00:00:00.000,2024-04-20T23:30:00.000,2024-04-21T08:00:00.000,"LEFEU, Udda, Ronja",Paloma,/events/1874132,5
Süss am Samstag,2024-04-20T00:00:00.000,2024-04-20T22:00:00.000,2024-04-21T06:00:00.000,"Andi de Luxe, Oaky",Süss War Gestern,/events/1904912,3
Thomas Schumacher u.v.m. at FREUD Club,2024-04-20T00:00:00.000,2024-04-20T23:00:00.000,2024-04-21T06:00:00.000,Thomas Schumacher,Galerie Wedding - Raum für zeitgenössische Kunst,/events/1905880,3
Shatika - 5 € bis 0 Uhr,2024-04-20T00:00:00.000,2024-04-20T23:00:00.000,2024-04-21T08:00:00.000,"KOGO, Captain Paff, KRUSHED, Rukis, Rymen, Staubtornado",Recede Club Berlin,/events/1908015,2
CATS & BREAKKIES Record Release Show,2024-04-20T00:00:00.000,2024-04-20T20:00:00.000,2024-04-21T02:00:00.000,,Bi Nuu,/events/1861033,2
Affair On Air #6,2024-04-20T00:00:00.000,2024-04-20T18:00:00.000,2024-04-21T00:00:00.000,,THF Radio / Torhaus,/events/1868887,2
HOTBOX I GRAND OPENING,2024-04-20T00:00:00.000,2024-04-20T19:00:00.000,2024-04-21T03:00:00.000,,Amano East-Side,/events/1891001,2
Almacenes Ruiz & Márquez - Dj Set,2024-04-20T00:00:00.000,2024-04-20T21:00:00.000,2024-04-21T04:00:00.000,,Eschschloraque,/events/1899533,1
9th Floor presents: Sweet n' Groovie,2024-04-20T00:00:00.000,2024-04-20T21:00:00.000,2024-04-21T01:00:00.000,No Silver Bullet,Mein Haus Am See,/events/1905251,1
An Evening with the Department of Cosmic Affairs,2024-04-20T00:00:00.000,2024-04-20T20:00:00.000,2024-04-21T01:00:00.000,"Thomash, EXZ",Studio1111,/events/1905570,1
Käptens Club Party - Disco pur,2024-04-20T00:00:00.000,2024-04-20T21:00:00.000,2024-04-21T05:00:00.000,,Hafenbar Berlin,/events/1906771,1
Latitude In-Store Sessions with BLVSH,2024-04-20T00:00:00.000,2024-04-20T23:00:00.000,2024-04-21T06:00:00.000,"Acidfinky, INVERNO, Lily Ackerman, Valerie Ace",Spacehall Record Store,/events/1908405,1
Techno Moon Night - Saturday,2024-04-20T00:00:00.000,2024-04-20T22:00:00.000,2024-04-21T06:00:00.000,,Soda Club,/events/1877684,1
TACHELES: Thys N' Green & Scumdog,2024-04-20T00:00:00.000,2024-04-20T23:00:00.000,2024-04-21T06:00:00.000,,Prachtwerk Berlin,/events/1905883,0
Lunar Grooves,2024-04-20T00:00:00.000,2024-04-20T21:00:00.000,2024-04-21T03:00:00.000,Arnaldo Capo,Palabra Bar,/events/1906034,0
Vibes – After Work,2024-04-20T00:00:00.000,2024-04-20T20:00:00.000,2024-04-21T01:00:00.000,Pilar Jordan,St. Oberholz,/events/1906923,0
Fabrix 420,2024-04-20T00:00:00.000,2024-04-20T22:00:00.000,2024-04-21T06:00:00.000,,YAAM Berlin,/events/1907053,0
Demo Event,2024-04-20T00:00:00.000,2024-04-20T23:00:00.000,2024-04-21T06:00:00.000,,TBA,/events/1907187,0
Test,2024-04-20T00:00:00.000,2024-04-20T23:00:00.000,2024-04-21T06:00:00.000,,TBA,/events/1907203,0
Shantika - Progressive Trance x Techno,2024-04-20T00:00:00.000,2024-04-20T23:00:00.000,2024-04-21T06:00:00.000,"Rukis, Luzifer, Reesix, KOGO, Captain Paff, KRUSHED, Rymen, Staubtornado",TBA - recede Berlin ,/events/1908037,0
Pandora Underground,2024-04-20T00:00:00.000,2024-04-20T20:00:00.000,2024-04-21T01:00:00.000,"Zona Interdunar, Qualia, MATTAM",TBA - Pandora,/events/1937450,0
"PRXMTY x Mama Told Ya with Anetha, A Strange Wedding, IN2STELLAR, VEL and X CLUB",2024-04-20T00:00:00.000,2024-04-20T23:59:00.000,2024-04-22T08:00:00.000,"A Strange Wedding, ABSL, Anetha, Less Distress, Mac Declos, Shaven, UFO95, VEL (3), X CLUB., Baraka, DASCO, IN2STELLAR, Surf 2 Glory",RSO.BERLIN,/events/1878754,1600
Klubnacht,2024-04-20T00:00:00.000,2024-04-20T23:59:00.000,2024-04-22T07:00:00.000,"Terence Fixmer, Aurora Halal, Don Williams, Efdemin, GiGi FM, Kwartz, Mary Yuzovskaya, Rødhåd, Frits Wentink, Luzie, Mr. Tophat, Mystery Affair, nd_baumecker, Violetta (DE), Yamour, Mathew Jonson",Berghain | Panorama Bar | Säule,/events/1853375,201
Sound System Culture: As it Sounds Conference & Festival,2024-04-18T00:00:00.000,2024-04-18T17:00:00.000,2024-04-21T20:00:00.000,"Infinite Livez, Rafush, Richard Akingbehin, Sarah Farina, Matwe, Nina Pixel",Kunstquartier Bethanien,/events/1891935,126
FULL CIRCLE,2024-04-20T00:00:00.000,2024-04-20T22:00:00.000,2024-04-21T23:59:00.000,"Caleesi, Sarah Kreis, Ruede Hagelstein, Sydka, meera (NO), Nacho Isa, Justin Marchacos, Thor Rixon, Milio, Gina Sabatini, LENI, bawab, Mira",Kater Blau,/events/1889849,99
Playground,2024-04-21T00:00:00.000,2024-04-21T20:00:00.000,2024-04-22T09:00:00.000,"Lola Haro, Robin Ordell, Dyed Soundorom, Shonky",Hoppetosse,/events/1859219,60
Music 4 Palestine Fundraiser,2024-04-21T00:00:00.000,2024-04-21T15:00:00.000,2024-04-21T23:00:00.000,"DJ Lentil, jivi2mebaby, klu (US)",Mena Berlin,/events/1908803,24
lazy.subday mit Pyrame & friends,2024-04-21T00:00:00.000,2024-04-21T18:00:00.000,2024-04-22T04:00:00.000,Pyrame,Minimal Bar,/events/1882490,18
House Party with Visionskultur Residents,2024-04-21T00:00:00.000,2024-04-21T18:00:00.000,2024-04-21T23:59:00.000,"Kosmovision, Loutouse, Manta, NoSpice, Qualia Trax",Crack Bellmer,/events/1897818,17
Nachspiel,2024-04-21T00:00:00.000,2024-04-21T08:00:00.000,2024-04-21T17:30:00.000,,KitKatClub,/events/1869731,16
Unclub #1,2024-04-21T00:00:00.000,2024-04-21T13:00:00.000,2024-04-21T20:30:00.000,"Softmatter, TUFI, Isaka, ABADIR",Panke,/events/1905274,11
Somnambul BLN,2024-04-21T00:00:00.000,2024-04-21T22:00:00.000,2024-04-22T07:00:00.000,"Baud, BEEAST",KitKatClub,/events/1890941,7
"Beate Barfuß with zhart, Padouc *live, DJ Balaton, anahï",2024-04-21T00:00:00.000,2024-04-21T17:00:00.000,2024-04-22T04:00:00.000,anahï,Beate Uwe,/events/1859622,6
Qweer Spring Market,2024-04-21T00:00:00.000,2024-04-21T12:00:00.000,2024-04-21T20:00:00.000,,TBA,/events/1905399,4
transformuse Ecstatic LIVE Concert & Ecstatic Dance DJ,2024-04-21T00:00:00.000,2024-04-21T17:00:00.000,2024-04-21T21:30:00.000,,Studio dB,/events/1900516,3
SINGULARITY MONDAY RAVE,2024-04-22T00:00:00.000,2024-04-22T23:00:00.000,2024-04-23T09:00:00.000,"Alexander Kowalski, Inverse Element, Philipp Drube, Ewa Nomad",Renate,/events/1876272,215
"Spiral by YEAR0001 with Provoker, RIP Swirl, Naemi",2024-04-22T00:00:00.000,2024-04-22T20:00:00.000,2024-04-23T00:00:00.000,"RIP Swirl, Exael",Lark,/events/1878076,28
manic.monday mit _____.neo,2024-04-22T00:00:00.000,2024-04-22T18:00:00.000,2024-04-23T04:00:00.000,_____.neo,Minimal Bar,/events/1882585,22
Electric Monday,2024-04-22T00:00:00.000,2024-04-22T22:00:00.000,2024-04-23T06:00:00.000,"Harris, Frankie Flowerz",KitKatClub,/events/1876064,38
[CANCELLED] Cotonete *live,2024-04-22T00:00:00.000,2024-04-22T19:30:00.000,2024-04-22T23:00:00.000,Cotonete,Gretchen,/events/1844449,18
encore.une.fois / TUESDAY TECHNO RAVE,2024-04-23T00:00:00.000,2024-04-23T23:00:00.000,2024-04-24T09:00:00.000,"Deepneue, BLACK ANTHEM RESTORE, Pascal Hetzel, Jai Juu",OXI,/events/1874600,207
