SUNGAZER *live // SOLD OUT,2023-11-18T00:00:00.000,2023-11-18T19:30:00.000,2023-11-18T23:00:00.000,,Gretchen,/events/1743462,128
AWAY x Lyric present Willow & Bas Mooy,2023-11-18T00:00:00.000,2023-11-18T22:00:00.000,2023-11-19T10:00:00.000,"Willow, Bas Mooy, Ruede Hagelstein, Julius Steinhoff, Hitam, Lyric, Eluzid, Rill",://about blank,/events/1783275,121
DAY TO NIGHT ROOFTOP PARTY - Noire Berlin,2023-11-18T00:00:00.000,2023-11-18T16:00:00.000,2023-11-18T23:59:00.000,"Ede, Aimé You",Amano East-Side,/events/1796193,115
20 Jahre Ostfunk,2023-11-18T00:00:00.000,2023-11-18T23:59:00.000,2023-11-19T10:00:00.000,"Kai Tracid, Simina Grigoriu, Martin Books, Daniel Boon, Basstronauten, Phuture Traxx, Patrick Scuro, Kanzler & Wischnewski, 2ContexX",Kesselhaus,/events/1766516,113
"Sinxergy: Origins - Olivia Mendez, Lenny Posso, Dinamite, TEHOTU  Atonism T-RAIL Marina George ",2023-11-18T00:00:00.000,2023-11-18T23:00:00.000,2023-11-19T08:00:00.000,"Olivia Mendez, Lenny Posso, Marina George, Dinamite, TEHOTU, Atonism, T-RAIL",OXI,/events/1803849,108
"Sen·so·ri·um: Morion, Allexandra, RJT, SYNEK",2023-11-18T00:00:00.000,2023-11-18T23:00:00.000,2023-11-19T09:00:00.000,"Morion, Allexandra, RJT (1), ONIT",AVA Club,/events/1795511,94
Tresor meets Silent Servant,2023-11-18T00:00:00.000,2023-11-18T23:00:00.000,2023-11-19T12:00:00.000,"HVL, Laura BCR, Nicole., Broken English Club, Chloe Lula, Kris Baha, Silent Servant",Tresor / Globus,/events/1784572,89
Balls Baile pres. A Black and White Flamboyant Ball [The Last Baile],2023-11-18T00:00:00.000,2023-11-18T23:30:00.000,2023-11-19T06:30:00.000,"bw (AR), Gina Demarchi, Juan Bermúdez, Palma (PT), Takt",Untertage Berlin,/events/1719185,85
intaresu,2023-11-18T00:00:00.000,2023-11-18T21:00:00.000,2023-11-19T06:00:00.000,"Isaac Elejalde, Mandarin, Utip, vault., Hypnoize",60 Hz,/events/1806566,78
HITZE,2023-11-18T00:00:00.000,2023-11-18T23:00:00.000,2023-11-19T08:00:00.000,"Carlo & Selma, Irem Tanriverdi, Raleigh, Severja",Fitzroy,/events/1794683,75
MATÄHA,2023-11-18T00:00:00.000,2023-11-18T23:00:00.000,2023-11-19T10:00:00.000,"Al Aslan, DJ Saunameister, Grillac, G.SCHEPPERT, Nizo, No.TFS, saHHar, Stanislawa, Omar.D",TBA,/events/1794845,66
Raw Industries x Future East: live hardware techno,2023-11-18T00:00:00.000,2023-11-18T23:00:00.000,2023-11-19T06:00:00.000,"Sam Eyvaz, Josef Kunz, Sarah Sommers, Frank Funke, Shersh, Barbad",TBA - Secret Location,/events/1803870,63
Body Language - Re:mise CLOSING,2023-11-18T00:00:00.000,2023-11-18T23:00:00.000,2023-11-19T12:00:00.000,"131bpm, Camilla Rae, Devoye, karete bu, Lovefoxy, Maryisonacid, Sekucci, Souci, Stella Zekri",Re:mise,/events/1804963,63
Supernature - Queer Solidarity Rave - Day Event,2023-11-18T00:00:00.000,2023-11-18T14:00:00.000,2023-11-18T22:00:00.000,"Belén Zer, cristian zanotti, OCD, sk.mize",://about blank,/events/1796884,55
MESS,2023-11-18T00:00:00.000,2023-11-18T23:59:00.000,2023-11-19T12:00:00.000,"Hyperaktivist, AMORAL, MDSM, acidheaven",OHM,/events/1806736,51
3000 Grad,2023-11-18T00:00:00.000,2023-11-18T22:00:00.000,2023-11-19T09:00:00.000,"Andy's Echo, Mollono.Bass, Mehr is Mehr, Luna City Express, Green Lake Project, Arne Schattenberg, POPHOP, Bonfante, LEENI, Danilo Kupfernagel, lievar, Lisa Thaens, Funkenstrøm, d.otter, nøvae, Rn86, Tobias Sommer",Ritter Butzke,/events/1724442,41
"angelic milk, Sacred Buzz, Lazy Giants",2023-11-18T00:00:00.000,2023-11-18T20:00:00.000,2023-11-19T01:00:00.000,,Urban Spree,/events/1796071,38
Aktion Party,2023-11-18T00:00:00.000,2023-11-18T23:00:00.000,2023-11-19T08:00:00.000,"Jacky Ickx, Krash Cora, Nanno, ZOEVITA, alemiko, dj_kareless, jojogigirl, Nail on the Hat",Humboldthain Club,/events/1800837,36
Half Baked,2023-11-18T00:00:00.000,2023-11-18T22:00:00.000,2023-11-19T14:00:00.000,,ZENNER,/events/1721143,35
"House in Harmony: Casa Marrone, Charlie Starter, Chris Exotiq, Club Jérôme, Fast & More",2023-11-18T00:00:00.000,2023-11-18T23:00:00.000,2023-11-19T06:00:00.000,"Chris Exotiq, Club Jerome, Fast (DE), Léontine",Bulbul Berlin,/events/1794137,33
LANGSTRECKE 3,2023-11-18T00:00:00.000,2023-11-18T22:00:00.000,2023-11-20T02:00:00.000,"Luise, Gwen Wayne, André Hommen, Coss, Dave Dinger",Kater Blau,/events/1798602,31
Tanzen Hilft ,2023-11-18T00:00:00.000,2023-11-18T23:00:00.000,2023-11-19T12:00:00.000,Morris Fitch,Der Weiße Hase,/events/1794797,30
THERAPY SESSIONS XIII with Hallucinator,2023-11-18T00:00:00.000,2023-11-18T23:00:00.000,2023-11-19T07:00:00.000,"Section 63, Upzet, Aynaet",Void Club,/events/1791610,22
HEYDAY,2023-11-18T00:00:00.000,2023-11-18T23:30:00.000,2023-11-19T08:00:00.000,"Najeh, Lenard Klein, MA.RVN",Lark,/events/1798700,22
HAVE A NICE DANCE w/Castro&Nemo (Sound Metaphors),2023-11-18T00:00:00.000,2023-11-18T23:59:00.000,2023-11-19T10:00:00.000,"Sound Metaphors Djs, Castro Moore",TBA - Secret Location,/events/1803922,19
Sweaty House,2023-11-18T00:00:00.000,2023-11-18T22:00:00.000,2023-11-19T06:00:00.000,Gabs Leyton,Paloma,/events/1788147,18
Gentle Chaos,2023-11-18T00:00:00.000,2023-11-18T23:00:00.000,2023-11-19T06:00:00.000,"Otto Vlotto, Shuv, DJ STRAIGHT GIRL",Privatclub,/events/1804444,17
NachtiGeil,2023-11-18T00:00:00.000,2023-11-18T23:00:00.000,2023-11-19T10:00:00.000,"DJ Jordan, Jason Lemm, Epicx, Till Krimsen, Daora",M-BIA,/events/1749197,16
"Explorers with Akaj, Nitka",2023-11-18T00:00:00.000,2023-11-18T22:00:00.000,2023-11-19T06:00:00.000,,Crack Bellmer,/events/1804952,14
Fantastic Friends + Afterhour,2023-11-17T00:00:00.000,2023-11-17T23:59:00.000,2023-11-18T23:59:00.000,"Primãrie, Cora M., JoweL, Nicolas Duvoisin, Nils Twachtmann, Giorgio Maulini",Golden Gate,/events/1798621,12
"Kinktastisch! Free your kinks, Dance & Play ;)",2023-11-18T00:00:00.000,2023-11-18T22:00:00.000,2023-11-19T06:00:00.000,,Insomnia,/events/1792871,11
BRENN. invites... Winterwunderland,2023-11-18T00:00:00.000,2023-11-18T16:00:00.000,2023-11-18T22:00:00.000,"Caro Vola, AZIEZ, LOOPA (2)",Gestrandet An Der Jannowitzbrücke,/events/1798581,11
Quirk,2023-11-18T00:00:00.000,2023-11-18T23:00:00.000,2023-11-19T11:00:00.000,"Baloo (SA), Galo (2), Henriku, Alexander Skancke",Hoppetosse,/events/1796318,9
Dial Radio Launch,2023-11-18T00:00:00.000,2023-11-18T15:00:00.000,2023-11-18T22:00:00.000,Arnaud Denzler,Zönotéka,/events/1804481,7
CLUBNIGHT: Yosa Peit (Live) + Robert Bergman + Eylül Deniz + Ozan Maral,2023-11-18T00:00:00.000,2023-11-18T22:00:00.000,2023-11-19T06:00:00.000,"Yosa Peit, Robert Bergman, Ozan Maral",arkaoda Berlin,/events/1808635,7
Proggynation with LSDirty,2023-11-18T00:00:00.000,2023-11-18T23:00:00.000,2023-11-19T09:00:00.000,"Momentune, Affection",Recede Club Berlin,/events/1805930,6
EISDISKO,2023-11-18T00:00:00.000,2023-11-18T18:00:00.000,2023-11-18T22:00:00.000,"Barbara Preisinger, Mark Reeder, Markus Sommer, Filippo Moscatello",ZENNER,/events/1808696,6
friends.zone mit Flip Marlou & Aramis,2023-11-18T00:00:00.000,2023-11-18T18:00:00.000,2023-11-19T06:00:00.000,Flip Marlou,Minimal Bar,/events/1777866,5
Highly Addictive,2023-11-18T00:00:00.000,2023-11-18T23:59:00.000,2023-11-19T15:00:00.000,"Oliver Dollar, Samuel Fach, Ian Mint, Slurm McKenzie",Golden Gate,/events/1798624,5
"TOP90s: 90s Pop, Eurodance, Trash *GLITZER & KONFETTI SPECIAL*",2023-11-18T00:00:00.000,2023-11-18T23:30:00.000,2023-11-19T06:00:00.000,,Badehaus Berlin,/events/1799516,5
"Smells with Anna Hjalmarsson, River Yarra, Niklas Wandt",2023-11-18T00:00:00.000,2023-11-18T22:00:00.000,2023-11-19T07:00:00.000,"Anna Hjalmarsson, River Yarra, Niklas Wandt",Sameheads,/events/1802344,5
Thee Church Ov Acid House,2023-11-18T00:00:00.000,2023-11-18T23:30:00.000,2023-11-19T08:00:00.000,Jörn Elling Wuttke,Paloma,/events/1785341,4
V-Time All Night,2023-11-18T00:00:00.000,2023-11-18T22:30:00.000,2023-11-19T06:00:00.000,V-Time,Old CCCP,/events/1802764,4
Critical Sound presents: Brighton,2023-11-18T00:00:00.000,2023-11-18T23:00:00.000,2023-11-19T06:00:00.000,"Calyx, Kasra, Mantmast, Cadence (1), Overproof",Volksbühne,/events/1809844,4
Emergent Berlin 10th Anniversary + Milonaut record release,2023-11-18T00:00:00.000,2023-11-18T21:00:00.000,2023-11-19T04:00:00.000,"Soulski, Femdelic, Cronam",Panke,/events/1796940,3
Beate Uwe feiert Geburtstag,2023-11-18T00:00:00.000,2023-11-18T23:00:00.000,2023-11-19T05:00:00.000,"Nora Wolkenstein, Blunaa",Beate Uwe,/events/1800733,2
Egos at Notagallery,2023-11-18T00:00:00.000,2023-11-18T19:30:00.000,2023-11-18T23:59:00.000,ATŌMI,Notagallery,/events/1804423,2
Käptens Club Party - Disco pur,2023-11-18T00:00:00.000,2023-11-18T21:00:00.000,2023-11-19T05:00:00.000,,Hafenbar Berlin,/events/1806141,2
Techno Moon Night - Saturday,2023-11-18T00:00:00.000,2023-11-18T22:00:00.000,2023-11-19T06:00:00.000,Paul Wolf,Soda Club,/events/1788770,1
"FERNAB ÜBER DEN DÄCHERN w. Robin Dey, Borella, Flieder DJ-Set, Body Electric, Ninsn",2023-11-18T00:00:00.000,2023-11-18T18:00:00.000,2023-11-19T03:00:00.000,"Flieder, Borella, ninsn, Robin Dey, Body Electric",Klunkerkranich,/events/1810437,1
Sky-Bar Warmup - feat. Rik Verweyen,2023-11-18T00:00:00.000,2023-11-18T18:30:00.000,2023-11-19T02:00:00.000,,Solar,/events/1810564,0
Laser Lemon with UMA and DJ RBB,2023-11-18T00:00:00.000,2023-11-18T21:00:00.000,2023-11-19T02:00:00.000,DJ RBB,Orangerie Neukölln,/events/1811482,0
"RSO YEAR TWO with Oscar Mulero, Bambounou, Laure Croft b2b Lacchesi, Lena Willikens, Matrixxman",2023-11-18T00:00:00.000,2023-11-18T23:59:00.000,2023-11-20T12:00:00.000,"Adriana Lopez, CONCEPTUAL, Frederic., DJ Hyperdrive, Laure Croft, Lorenzo Lacchesi, Lacchesi, Lawrence Lee, Mohajer, Lewis Fautzi, Matrixxman, Oscar Mulero, Ribé, UFO95, Bambounou, Jesse G, Lena Willikens, Pariah, Mor Elian",RSO.BERLIN,/events/1791342,2305
Club Heart Broken (Daytime Rave),2023-11-19T00:00:00.000,2023-11-19T14:00:00.000,2023-11-20T02:00:00.000,"DCHM, evin, ferrari rot, MALUGI, Marlon Hoffstadt, Sedaction, Surf 2 Glory",Watergate,/events/1794728,1741
Re:mise Closing Weekend,2023-11-16T00:00:00.000,2023-11-16T23:00:00.000,2023-11-21T09:00:00.000,"Nothing Left, Axciid, Pomah, Lis Absoluta, PSMT, Tinco, MSKD, Alhena_, Karashò, Neoma, Morion, Joe Shmoo, Bélavie, KLOE, ONNY CHO, Stef de Haan, Cybersex, Zoanthropiia, Anterist, Jeffrey (DE), DJ Saunameister, Neri J, Tilman Riddelt, D-JIL, 131bpm, Camilla Rae, Devoye, karete bu, Lovefoxy, Maryisonacid, Sekucci, Stella Zekri, Acidfinky, DJ HENTAI, Ott (DE), H369, Indigo Plateaux, Multifun, SACID, Opium Hum, Trancemaster Krause, Alexander Kowalski, BLACK ANTHEM RESTORE, Esther Dune, WAYNETTE",Re:mise,/events/1799865,681
Klubnacht,2023-11-18T00:00:00.000,2023-11-18T23:59:00.000,2023-11-20T08:00:00.000,"Terence Fixmer, Barker, Chami, DJ Red, Fadi Mohem, Nihad Tule, The Lady Machine, Volvox, CYRK, Eris Drew, Nick Höppner, Norman Nodge, Ogazón, Sedef Adasï, Virginia, KiNK",Berghain | Panorama Bar | Säule,/events/1764235,314
"This is Techno Jazz: Lyder (Live), Tereza (DJ Set)",2023-11-19T00:00:00.000,2023-11-19T19:00:00.000,2023-11-19T23:00:00.000,"Lyder, Tereza",Kantine am Berghain,/events/1799035,177
TAKUYA KURODA *live,2023-11-19T00:00:00.000,2023-11-19T19:30:00.000,2023-11-19T23:00:00.000,,Gretchen,/events/1754676,122
MOVING THE NEEDLE,2023-11-19T00:00:00.000,2023-11-19T14:00:00.000,2023-11-19T23:59:00.000,"Aino, Anna Schreit, Black Mirror Park, DJ Pete, Finn Johannsen, Mascha, Ori Raz, Nako, Resom, SAM (9), Sevensol, 41ISSA, O-Wells",://about blank,/events/1808745,85
Somnambul BLN,2023-11-19T00:00:00.000,2023-11-19T22:00:00.000,2023-11-20T07:00:00.000,"Darin Epsilon, Manu Strasse, Markus Klee",KitKatClub,/events/1795374,38
LANGSTRECKE 3,2023-11-18T00:00:00.000,2023-11-18T22:00:00.000,2023-11-20T02:00:00.000,"Luise, Gwen Wayne, André Hommen, Coss, Dave Dinger",Kater Blau,/events/1798602,31
Hissy Fit presents Hissy Hoe Down,2023-11-19T00:00:00.000,2023-11-19T17:00:00.000,2023-11-20T04:00:00.000,"Gothmom, Hääää, Otto Vlotto, DJ SALEM, Tutti Frutti (2)",Zur Klappe,/events/1800948,30
Perfumed Sundays: Perfumed Freedom Record Release Party,2023-11-19T00:00:00.000,2023-11-19T20:00:00.000,2023-11-20T09:00:00.000,"Thomas Melchior, Felix Hk, Foehn & Jerome, Mathew Jonson, Jay Medvedeva",Hoppetosse,/events/1799953,26
Agent Side Grinder + Desolation Colony + Carmilla Sioux ,2023-11-19T00:00:00.000,2023-11-19T20:00:00.000,2023-11-20T02:00:00.000,Carmilla Sioux,Urban Spree,/events/1750786,26
KATER ON STAGE,2023-11-19T00:00:00.000,2023-11-19T19:00:00.000,2023-11-19T23:00:00.000,,Kater Blau,/events/1783470,24
BABYCAKES,2023-11-19T00:00:00.000,2023-11-19T16:00:00.000,2023-11-20T02:00:00.000,"jpeg.love, Angel Rider, XD Erica",Panke,/events/1807304,16
Radical Sounds Latin America 2023 (Opening Concert),2023-11-19T00:00:00.000,2023-11-19T18:30:00.000,2023-11-20T01:30:00.000,dj latinchat,arkaoda Berlin,/events/1799471,8
lazy.sunday mit Matteo Gamba,2023-11-19T00:00:00.000,2023-11-19T18:00:00.000,2023-11-20T04:00:00.000,Matteo Gamba,Minimal Bar,/events/1777869,7
Rafiki Day Party,2023-11-19T00:00:00.000,2023-11-19T15:00:00.000,2023-11-19T22:00:00.000,"Anele, Njeri, Katerinha, Khadija (DE)",Paloma,/events/1800653,6
Beate Barfuß,2023-11-19T00:00:00.000,2023-11-19T17:00:00.000,2023-11-20T05:00:00.000,"Corios, tadoh",Beate Uwe,/events/1792773,3
Black Hole Gallery + Art-Bar Night,2023-11-19T00:00:00.000,2023-11-19T10:00:00.000,2023-11-19T22:00:00.000,Lorem,P61 Gallery,/events/1795804,3
Stage X Change: Music & Poetry Showcase,2023-11-19T00:00:00.000,2023-11-19T12:00:00.000,2023-11-19T19:00:00.000,,TBA - Hotel Continental 87 Elsenstrasse,/events/1808493,3
MOVING THE NEEDLE,2023-11-19T00:00:00.000,2023-11-19T14:00:00.000,2023-11-19T23:59:00.000,"Aino, Anna Schreit, Black Mirror Park, DJ Pete, Finn Johannsen, Mascha, Ori Raz, Nako, Resom, SAM (9), Sevensol, 41ISSA, O-Wells",://about blank,/events/1808735,3
! flying objekts 006,2023-11-19T00:00:00.000,2023-11-19T20:00:00.000,2023-11-20T04:00:00.000,"Danielle Nicole, Nicolas Duvoisin",Repeat,/events/1803847,2
Re:mise Closing Weekend,2023-11-16T00:00:00.000,2023-11-16T23:00:00.000,2023-11-21T09:00:00.000,"Nothing Left, Axciid, Pomah, Lis Absoluta, PSMT, Tinco, MSKD, Alhena_, Karashò, Neoma, Morion, Joe Shmoo, Bélavie, KLOE, ONNY CHO, Stef de Haan, Cybersex, Zoanthropiia, Anterist, Jeffrey (DE), DJ Saunameister, Neri J, Tilman Riddelt, D-JIL, 131bpm, Camilla Rae, Devoye, karete bu, Lovefoxy, Maryisonacid, Sekucci, Stella Zekri, Acidfinky, DJ HENTAI, Ott (DE), H369, Indigo Plateaux, Multifun, SACID, Opium Hum, Trancemaster Krause, Alexander Kowalski, BLACK ANTHEM RESTORE, Esther Dune, WAYNETTE",Re:mise,/events/1799865,681
SINGULARITY MONDAY RAVE / Re:mise CLOSING / 2 Floors / tickets at the door ,2023-11-20T00:00:00.000,2023-11-20T23:00:00.000,2023-11-21T09:00:00.000,"Alexander Kowalski, DJ Pete, Substance, Esther Dune, BLACK ANTHEM RESTORE, Inverse Element, WAYNETTE",Re:mise,/events/1799775,283
Electric Monday,2023-11-20T00:00:00.000,2023-11-20T22:00:00.000,2023-11-21T07:00:00.000,"Ele Luz, ECE EKREN, Frankie Flowerz",KitKatClub,/events/1792189,52
Black Hole Gallery + Art-Bar Night,2023-11-20T00:00:00.000,2023-11-20T12:00:00.000,2023-11-20T20:00:00.000,Lorem,P61 Gallery,/events/1795807,8
manic.monday mit Pablo Cornejo (Chile),2023-11-20T00:00:00.000,2023-11-20T18:00:00.000,2023-11-21T04:00:00.000,Pablo Cornejo,Minimal Bar,/events/1777870,7
[CANCELLED] KOKOKO! *live,2023-11-20T00:00:00.000,2023-11-20T19:30:00.000,2023-11-20T23:00:00.000,KOKOKO!,Gretchen,/events/1744134,43
encore.une.fois / TUESDAY TECHNO RAVE ,2023-11-21T00:00:00.000,2023-11-21T23:00:00.000,2023-11-22T09:00:00.000,"Alex.Do, Emmanuel, BLACK ANTHEM RESTORE, Tøtal",OXI,/events/1799918,174
SMASH ! / hardest rave every tuesday,2023-11-21T00:00:00.000,2023-11-21T23:00:00.000,2023-11-22T09:00:00.000,,Der Weiße Hase,/events/1794807,52
THE UNKNOWN,2023-11-21T00:00:00.000,2023-11-21T22:00:00.000,2023-11-22T04:00:00.000,"Nikklaas, Dicso_Muzek",Süss War Gestern,/events/1791639,29
GABI HARTMANN *live,2023-11-21T00:00:00.000,2023-11-21T19:30:00.000,2023-11-21T23:00:00.000,,Gretchen,/events/1722888,16
ILLUSION at KitKat Club,2023-11-21T00:00:00.000,2023-11-21T22:00:00.000,2023-11-22T06:00:00.000,"Elmar Strathe, Sherafatis, Achilles",KitKatClub,/events/1801596,12
Black Hole Gallery + Art-Bar Night,2023-11-21T00:00:00.000,2023-11-21T12:00:00.000,2023-11-21T20:00:00.000,Lorem,P61 Gallery,/events/1795809,11
go.play mit Pyrame,2023-11-21T00:00:00.000,2023-11-21T18:00:00.000,2023-11-22T04:00:00.000,Pyrame,Minimal Bar,/events/1781180,10
Disco & House trip,2023-11-21T00:00:00.000,2023-11-21T22:00:00.000,2023-11-22T01:00:00.000,Blachord,Cosmic Kaspar,/events/1813719,5
WEDNESDAY hosted by Origin,2023-11-22T00:00:00.000,2023-11-22T18:00:00.000,2023-11-23T06:00:00.000,"DJ Zurückbleiben Bitte, HEAR, Enzo Cenci, Peppe Way",Crack Bellmer,/events/1802402,118
Techno Mittwoch: TURBINE/TUNNEL,2023-11-22T00:00:00.000,2023-11-22T23:00:00.000,2023-11-23T09:00:00.000,"Downwell, Mova, Diana May, Ellen Trenn",AVA Club,/events/1778660,82
RIBBXN presents: Kelora / DJ H / t0ni live,2023-11-22T00:00:00.000,2023-11-22T20:00:00.000,2023-11-23T00:00:00.000,"Kelora, DJ Heroin, t0ni",arkaoda Berlin,/events/1795750,42
Tresor New Faces hosted by SUBVERTED,2023-11-22T00:00:00.000,2023-11-22T23:00:00.000,2023-11-23T09:00:00.000,"JASSASS, Substencia, X Tin",Tresor / Globus,/events/1784573,41
Symbiotikka at KitKat Club,2023-11-22T00:00:00.000,2023-11-22T22:00:00.000,2023-11-23T07:00:00.000,"Grace Thompson, Sebastian Ludvig, DJ Jordan",KitKatClub,/events/1792559,32
Rave am Mittwoch,2023-11-22T00:00:00.000,2023-11-22T23:00:00.000,2023-11-23T07:00:00.000,"L.A.E.R.M, Lolo (2), DJ.11R",M-BIA,/events/1800511,27
"Rocket Expedition: Smote (UK) / Flowers Must Die (Swe) / OCH (Swe) at Kulturhaus Insel, Berlin",2023-11-22T00:00:00.000,2023-11-22T19:00:00.000,2023-11-22T23:00:00.000,,Insel der Jugend,/events/1779520,15
"DANZA MECCANICA with Amato & Adriani, Franz Scala",2023-11-22T00:00:00.000,2023-11-22T22:00:00.000,2023-11-23T05:00:00.000,"Amato & Adriani, Franz Scala",Sameheads,/events/1809915,11
mittendrin mit Georg Hekt,2023-11-22T00:00:00.000,2023-11-22T18:00:00.000,2023-11-24T04:00:00.000,Georg Hekt,Minimal Bar,/events/1777871,6
Black Hole Gallery + Art-Bar Night,2023-11-22T00:00:00.000,2023-11-22T12:00:00.000,2023-11-22T20:00:00.000,Lorem,P61 Gallery,/events/1795828,4
Nightcaps all night long,2023-11-22T00:00:00.000,2023-11-22T21:00:00.000,2023-11-23T01:30:00.000,Jen UFO,Repeat,/events/1808239,4
RTS.FM Berlin,2023-11-22T00:00:00.000,2023-11-22T19:00:00.000,2023-11-22T23:59:00.000,De:tronique,Mena Berlin,/events/1812812,4
Sky-Bar Warmup - Free Entrance - feat. Bestworks,2023-11-22T00:00:00.000,2023-11-22T18:30:00.000,2023-11-23T01:00:00.000,,Solar,/events/1810567,2
"DUALISM x KOMPRESSOR w/ ÅMRTÜM, Lucinee, Herton, Sylvie Maziarz, Initial Code",2023-11-23T00:00:00.000,2023-11-23T23:00:00.000,2023-11-24T09:00:00.000,"AMRTUM, Lucinee, Herton, Sylvie Maziarz, Initial Code",://about blank,/events/1704459,462
"Wired: Kontravoid, GHOSTS IN THE MACHIИE, NeuRomancer, A Black Rainbow",2023-11-23T00:00:00.000,2023-11-23T22:00:00.000,2023-11-24T06:00:00.000,"Kontravoid, Kris Baha, Neu-Romancer",Urban Spree,/events/1780105,173
Renate X BSTHP X PP,2023-11-23T00:00:00.000,2023-11-23T23:00:00.000,2023-11-24T08:00:00.000,"Plette, justUS, Vemativ, Ninalacool, Snooks, Leon Licht",Renate,/events/1779505,147
Bloom,2023-11-23T00:00:00.000,2023-11-23T23:00:00.000,2023-11-24T09:00:00.000,,Watergate,/events/1787824,68
"SOILSEEK with Maquis Son Sistèm (live), Jan Loup & Melocoton",2023-11-23T00:00:00.000,2023-11-23T21:30:00.000,2023-11-24T04:00:00.000,"Jan Loup, Maquis Son Sistèm, Lohrkraut",Fitzroy,/events/1804526,38
d.OHA!se / thürsday teschnö,2023-11-23T00:00:00.000,2023-11-23T23:00:00.000,2023-11-24T09:00:00.000,"Bin Okin, DAV3, Salvo Salvatore",Der Weiße Hase,/events/1794815,37
Oroko Radio,2023-11-23T00:00:00.000,2023-11-23T22:00:00.000,2023-11-24T03:00:00.000,"DEKKAPA, Fiyahdred, MONEYAMA, Nala Brown",Berghain | Panorama Bar | Säule,/events/1764246,29
"schwach&eklektisch: Infamous Ali, fredinstabile, Seitenwind",2023-11-23T00:00:00.000,2023-11-23T23:00:00.000,2023-11-24T05:00:00.000,"Infamous Ali, Vøskij, Seitenwind",Bulbul Berlin,/events/1794142,26
Globus Invites…hosted by Echocord,2023-11-23T00:00:00.000,2023-11-23T23:00:00.000,2023-11-24T09:00:00.000,"Christine Benz, benz, Kenneth Christiansen",Tresor / Globus,/events/1784575,21
THE UNKNOWN,2023-11-23T00:00:00.000,2023-11-23T22:00:00.000,2023-11-24T02:00:00.000,Olivér (Arg),Zu Mir Oder Zu Dir,/events/1791635,21
"Keyi Magazine x Sameheads with David Carretta, Yami Speechie Berlin Bunny b2b Paty Vapor + more",2023-11-23T00:00:00.000,2023-11-23T22:00:00.000,2023-11-24T05:00:00.000,"David Carretta, Yami Spechie, Paty Vapor, Berlin Bunny, Eyesdice",Sameheads,/events/1801219,21
5 Years Somatic Rituals,2023-11-23T00:00:00.000,2023-11-23T23:00:00.000,2023-11-24T05:00:00.000,"CEM, Atrice, Kombé, Mafou, MSJY",OHM,/events/1808073,21
Electronic.thursday mit D A Z A  & Freunde,2023-11-23T00:00:00.000,2023-11-23T18:00:00.000,2023-11-24T06:00:00.000,"DAZA, Cocogorl, ROM 3Ø3, Daniel Jaramillo",Minimal Bar,/events/1777872,17
Nivhek (Grouper/Liz Harris): ENGINE,2023-11-23T00:00:00.000,2023-11-23T20:00:00.000,2023-11-23T22:00:00.000,Nivhek,Silent Green,/events/1767476,16
"Jurema Blätter with URUBU Marinka, Miss Kitchen,Anzen, Caapi El Mesti",2023-11-23T00:00:00.000,2023-11-23T22:00:00.000,2023-11-24T06:00:00.000,"URUBU Marinka, Miss Kitchen, Caapi El Mesti",Crack Bellmer,/events/1807904,16
"Thor Rixon, Em Oshan, Alexander Alien | 'Nawti Volcano Spider' Release Party",2023-11-23T00:00:00.000,2023-11-23T20:00:00.000,2023-11-24T02:00:00.000,Thor Rixon,Sonnenraum,/events/1809620,9
Flitzer Skalitzer,2023-11-23T00:00:00.000,2023-11-23T22:00:00.000,2023-11-24T06:00:00.000,Daniel Wang,Paloma,/events/1785328,8
mittendrin mit Georg Hekt,2023-11-22T00:00:00.000,2023-11-22T18:00:00.000,2023-11-24T04:00:00.000,Georg Hekt,Minimal Bar,/events/1777871,6
B2B at Cookies Bar,2023-11-23T00:00:00.000,2023-11-23T22:00:00.000,2023-11-24T03:00:00.000,"Marie Lung, Matthias Reiling",Cookies Cream,/events/1813396,6
K3LLR,2023-11-23T00:00:00.000,2023-11-23T20:00:00.000,2023-11-24T02:00:00.000,"Leyda Isasso, Electric Visionary",Lauschangriff,/events/1797979,5
Donnerdogge,2023-11-23T00:00:00.000,2023-11-23T23:59:00.000,2023-11-24T13:00:00.000,"Marko Nastic, Scoopsi, RifRaf",Golden Gate,/events/1798628,5
Radical Sounds Latin America 2023 (Morphine Raum Concert),2023-11-23T00:00:00.000,2023-11-23T20:00:00.000,2023-11-23T22:30:00.000,Maria Chavez,Morphine Raum,/events/1799479,3
Humbi Kult Session#28 Dub Space Nine with Dub Taylor & Monday Edition,2023-11-23T00:00:00.000,2023-11-23T19:00:00.000,2023-11-24T04:00:00.000,"Dub Taylor, Monday Edition",Humboldthain Club,/events/1800031,3
Kashual Plastik: Omen + Jacob Stoy & Crude Fact,2023-11-23T00:00:00.000,2023-11-23T21:00:00.000,2023-11-24T01:00:00.000,Jacob Stoy,arkaoda Berlin,/events/1808232,3
Chantals House of Shame,2023-11-23T00:00:00.000,2023-11-23T23:00:00.000,2023-11-24T07:00:00.000,,Lokschuppen Berlin,/events/1813533,3
Black Hole Gallery + Art-Bar Night,2023-11-23T00:00:00.000,2023-11-23T12:00:00.000,2023-11-23T20:00:00.000,Lorem,P61 Gallery,/events/1795832,2
Tausend ELECTRONICA - HADA,2023-11-23T00:00:00.000,2023-11-23T21:00:00.000,2023-11-24T04:00:00.000,,Tausend,/events/1800397,2
RISE NIGHTS,2023-11-23T00:00:00.000,2023-11-23T20:00:00.000,2023-11-24T02:00:00.000,Nahgoe,Repeat,/events/1804094,2
"Meet Me, or Die w/Saumeth + AIKU",2023-11-23T00:00:00.000,2023-11-23T19:00:00.000,2023-11-23T22:00:00.000,Saumeth,Astral Junction,/events/1807226,1
Sky-Bar Warmup - Free Entrance - feat. Valis,2023-11-23T00:00:00.000,2023-11-23T18:30:00.000,2023-11-24T01:00:00.000,,Solar,/events/1810569,1
Tresor meets Resident Advisor,2023-11-24T00:00:00.000,2023-11-24T23:00:00.000,2023-11-25T12:00:00.000,"Jossy Mitsu, DJ Fart in the Club, Radical Softness, LYDO, Sunil Sharpe, X CLUB.",Tresor / Globus,/events/1786976,1234
Suara XV x INHERIT ,2023-11-24T00:00:00.000,2023-11-24T23:00:00.000,2023-11-25T11:00:00.000,"Remco Beekwilder, Introversion, Coyu, Flug, Isaiah (NL), MYRA (NL), Specific Objects, Caniche, Marsch, Olorr, Bacch, Daniel Heinrich",OST,/events/1769749,558
Betriebsfeier,2023-11-24T00:00:00.000,2023-11-24T23:59:00.000,2023-11-26T12:00:00.000,"BioN, Click | Click, Coco, Cosmokat, David Dorad, David Gtronic, Discult Soundsystem, eliXenia, Empro, Erhardt Schuster, Gunnar Stiller, Hilu, Roni Amitai, Josephine Wedekind, Lewin Paul, See Bastian, Tobi Dei (DE)",Hoppetosse,/events/1795758,418
"W21 YEARS PRESENTS: Kevin de Vries, Denis Horvat, Annett Gapstream, CENKK, Skatman",2023-11-24T00:00:00.000,2023-11-24T23:00:00.000,2023-11-25T11:00:00.000,"Kevin de Vries, Denis Horvat, Annett Gapstream, CENKK, Skatman",Watergate,/events/1799222,417
"[IL]LEGAL w/ WarinD, Nikolina & ROÜGE",2023-11-24T00:00:00.000,2023-11-24T23:00:00.000,2023-11-25T11:00:00.000,"WarinD, Nikolina, ROÜGE, Dominik Pazzer, Cara Elizabeth, DMZ (1), cell1",Anomalie Art Club,/events/1723862,388
KLAMINKA x PARIDES COLLECTIVE,2023-11-24T00:00:00.000,2023-11-24T23:00:00.000,2023-11-25T08:00:00.000,"DJ SWISHERMAN, acidheaven, Christa K, Montezuma (DE), MIO (ES), Beqqi",ÆDEN,/events/1803182,288
Disco Tehran,2023-11-24T00:00:00.000,2023-11-24T23:59:00.000,2023-11-25T07:00:00.000,"Moji, Track Advisor, Mona Pirzad",Gretchen,/events/1799982,241
FYEMA Vol. 5,2023-11-24T00:00:00.000,2023-11-24T23:00:00.000,2023-11-25T11:00:00.000,"AISHA, Charley Bolton, Shaven, TOCZ, vizionn, DJ Reiz",RSO.BERLIN,/events/1787605,239
Mitmischen,2023-11-24T00:00:00.000,2023-11-24T23:00:00.000,2023-11-25T11:00:00.000,"0megavybe, Arkan, BBetriebswirt, Carl Hang, Freya K., Hello Sasy, ÜBERKIKZ, ogtrues, tōrso (DE)",OXI,/events/1796746,222
