Refuse Records 25th Anniversary Fest – Day 1,2018-06-08T00:00:00.000,2018-06-08T16:00:00.000,2018-06-09T00:00:00.000,Odd Man Out,Cassiopeia,/events/1090496,1
Electro Party with Žagar & Freakin' Disco at Rules Festival Day 5,2018-06-08T00:00:00.000,2018-06-08T21:00:00.000,2018-06-09T01:00:00.000,,CHB - Collegium Hungaricum Berlin,/events/1121837,0
Otrantos.Music.Zone mit Bruno Otranto & Friends,2018-06-08T00:00:00.000,2018-06-08T19:00:00.000,2018-06-09T07:00:00.000,Bruno Otranto,Minimal Bar,/events/1098692,22
Nacht der Nacht,2018-06-08T00:00:00.000,2018-06-08T23:00:00.000,2018-06-09T09:00:00.000,,Der Stall / Schöna-Kolpien,/events/1084356,4
Steve Bug presents Play #7,2018-06-09T00:00:00.000,2018-06-09T16:00:00.000,2018-06-10T10:00:00.000,"Miss Kittin, Steve Bug, Frankey & Sandrino, Joyce Muniz, youANDme, Lele Sacchi, Patlac, Heimlich Knüller, Chris Hanke",[ipsə],/events/1084092,356
24/7 Berlin,2018-06-09T00:00:00.000,2018-06-09T23:59:00.000,2018-06-10T23:59:00.000,"Clara 3000, DJ Masda, Dresvn, Félicia Atkinson, Hodge, Resom, Karizma, KRN, Oliver Hafenbauer, Pessimist, Proc Fiskal, Rebekah, Silvia Kastel, Timecop, Wilted Woman, Youngsta, Zaltan, DJ Detweiler, FJAAK",://about blank,/events/1096586,335
"Griessmuehle x Diversity with Vakula, Mark Grusane, Anja Zaube, Mareena, Daniel Wang, Stratos",2018-06-09T00:00:00.000,2018-06-09T22:00:00.000,2018-06-10T22:00:00.000,"Vakula, Anja Zaube, Mareena, Knigi, Adlas, DJ Ion, Mark Grusane, Stratos, Kyros, Arara, Daniel Wang, Doc Sleep",Griessmuehle,/events/1109592,185
Summernight Openair + Club. with Lexer,2018-06-09T00:00:00.000,2018-06-09T23:59:00.000,2018-06-10T10:00:00.000,"Lexer, Dapayk, DJ Jauche, Mr.Schug, Alexander Lorz, vom Feisten, Markus Klee, ALXJ",Lokschuppen Berlin,/events/1111301,143
"Sushitech Pres. Fluere with Delano Smith, Steve O'Sullivan, Thomas Melchior & More",2018-06-09T00:00:00.000,2018-06-09T23:59:00.000,2018-06-10T12:00:00.000,"Delano Smith, Steve O'Sullivan, Thomas Melchior, Russ Gabriel, Yossi Amoyal, XDB, Janeret, Oshana, Roger Gerressen",Renate,/events/1112927,142
Planet Birgit with Javier Logares & Criminal Bassline (Day2),2018-06-09T00:00:00.000,2018-06-09T23:00:00.000,2018-06-10T10:00:00.000,"Broschek, Danito San, Amin (DE), Javier Logares, Lucas Mezian, Mike Book, Daniel Jaeger, Dole & Kom, Andi de Luxe",Birgit,/events/1092949,129
Klubnacht,2018-06-09T00:00:00.000,2018-06-09T23:59:00.000,2018-06-11T06:00:00.000,"Andrea, Answer Code Request, Dax J, Oliver Deutschmann, Ron Albrecht, Skee Mask, Stenny, Zenker Brothers, Efdemin, Hannah Holland, Lawrence, Nick Höppner, Virginia, Eris Drew, Justin Cudmore, Mike Servito",Berghain | Panorama Bar | Säule,/events/1111330,117
Kaleidoskop Pres. Martin Patiño Live,2018-06-09T00:00:00.000,2018-06-09T23:00:00.000,2018-06-10T09:00:00.000,"Martin Patino, Beddermann & Dahlmann, Bruno Otranto, Pysh",Diskothek Melancholie 2,/events/1113530,95
"Clubnight with Paranoid London, Markus Kavka, Local Suicide & Sofia Kourtesis",2018-06-09T00:00:00.000,2018-06-09T20:00:00.000,2018-06-10T10:00:00.000,"Paranoid London, Local Suicide, Sofia Kourtesis, Studio Barnhus",Chalet,/events/1118306,77
Tresor.Klubnacht,2018-06-09T00:00:00.000,2018-06-09T23:59:00.000,2018-06-10T12:00:00.000,"Roman Lindau, Natascha Kann, Cari Lekebusch, Roberto, Fossil Archive",Tresor / Globus,/events/1111924,65
Colours Afterhour (all day),2018-06-09T00:00:00.000,2018-06-09T10:00:00.000,2018-06-09T22:00:00.000,"Elias Reissner, Karschau, Minijob, Purita D, Tymotica",Griessmuehle,/events/1115106,48
Π35 (22 Hours) - Garden (After Hours),2018-06-09T00:00:00.000,2018-06-09T09:00:00.000,2018-06-09T21:30:00.000,"Bill Kouligas, Steve Summers, ANFS, 3.14, Devika",://about blank,/events/1107083,47
Natural Selections with Francis Inferno Orchestra & Nummer,2018-06-09T00:00:00.000,2018-06-09T23:00:00.000,2018-06-10T09:00:00.000,"Francis Inferno Orchestra, Nummer",OHM,/events/1110058,47
Sasomo - Pillow Talk / No Regular Play / Adam Port / Hyenah / The Sorry Entertainer / Mimi Love,2018-06-09T00:00:00.000,2018-06-09T23:59:00.000,2018-06-11T12:00:00.000,"The Sorry Entertainers, No Regular Play, Reznik, Adam Port, Hyenah, The Cheapers, MDVS, Mimi Love, Dave Dinger",Kater Blau,/events/1103383,35
"Savour The Moment's Party Brunch with Dj Gigola, Ennio, Marlon Hoffstadt & More",2018-06-09T00:00:00.000,2018-06-09T11:00:00.000,2018-06-10T00:00:00.000,"DJ Gigola, ENNIO, Marlon Hoffstadt, Zola, Elisa Elisa",Else,/events/1118404,29
Back to the Future - Cluny's Geburtstag,2018-06-09T00:00:00.000,2018-06-09T22:00:00.000,2018-06-10T14:00:00.000,"Leon Licht, Ferdinand Dreyssig, Raphael Hofman, Marvin Hey, Luis Hill, Mehr is Mehr, Martin Ka, Memo., Saphear, rusky, Manel Cluny",Burg Schnabel,/events/1108644,22
Good Taste x Disco Jones: Summer Kick-off,2018-06-09T00:00:00.000,2018-06-09T20:00:00.000,2018-06-10T06:00:00.000,"Danni B, Tyler Brunton, JTL, Margot LOX, The Relative Zero, Creti, OutOu, Andreas König, Kudeki",Crack Bellmer,/events/1111533,22
Cases of Madness,2018-06-09T00:00:00.000,2018-06-09T23:59:00.000,2018-06-10T08:00:00.000,,Arena Club,/events/1117477,21
SOWASVON Responsive #6,2018-06-09T00:00:00.000,2018-06-09T22:30:00.000,2018-06-10T07:00:00.000,"Biesmans, kuprion, DJ Jetski, Steven Maff, TAUBE",Anita Berber,/events/1113065,19
Tryland,2018-06-09T00:00:00.000,2018-06-09T23:59:00.000,2018-06-10T12:00:00.000,"Carlo Lio, The Reason Y, Marcus Meinhardt, BEC, Alexander Aurel, Rene Bourgeois, Joyhauser",Watergate,/events/1113099,18
Sisyphos,2018-06-08T00:00:00.000,2018-06-08T23:59:00.000,2018-06-11T09:00:00.000,Michael Placke,Sisyphos,/events/1121936,13
&friends,2018-06-09T00:00:00.000,2018-06-09T23:59:00.000,2018-06-10T14:15:00.000,"David Pher, Lee Davon, Raysoo, Daniel.fx",Golden Gate,/events/1086183,12
All Night Long with David Roeglin & Amuse,2018-06-09T00:00:00.000,2018-06-09T19:00:00.000,2018-06-10T07:00:00.000,"Amuse, ROEGLIN",Promenaden Eck,/events/1118565,11
Cyberbay-Night Meets Ménage A Trois,2018-06-09T00:00:00.000,2018-06-09T23:00:00.000,2018-06-10T09:00:00.000,"Annechoic, David Vicuña, Skinny Duchamp, Ivar Dreieck",Void Club,/events/1119117,10
Nautilus im 8. Stock,2018-06-09T00:00:00.000,2018-06-09T14:00:00.000,2018-06-10T04:00:00.000,"Friedrich Raphael, Ionah Inept, Ivanovna, Scarlet, SV3N",Greenhouse Berlin,/events/1112336,9
We are Tofu with Jens Mahlstedt,2018-06-09T00:00:00.000,2018-06-09T23:00:00.000,2018-06-10T07:00:00.000,"Jens Mahlstedt, Sean Patrick",Bohnengold,/events/1088258,9
Everyone A Nice Time,2018-06-09T00:00:00.000,2018-06-09T22:00:00.000,2018-06-10T06:00:00.000,Max Ulis,Farbfernseher,/events/1100349,8
Roche Madame,2018-06-09T00:00:00.000,2018-06-09T12:00:00.000,2018-06-10T06:00:00.000,"Cesar Merveille, Herck, Robin Ordell, Vendi",Club der Visionaere,/events/1118858,8
Witches Are Back / DJ set / 100% Grrrlz,2018-06-09T00:00:00.000,2018-06-09T23:00:00.000,2018-06-10T10:00:00.000,"Suit Kei, Mäi",AVA Club,/events/1115174,5
Drift Ashore,2018-06-08T00:00:00.000,2018-06-08T17:00:00.000,2018-06-09T23:30:00.000,"Basco, Philipp Olf",Festsaal Kreuzberg,/events/1117753,5
Torstraßen Festival 2018,2018-06-09T00:00:00.000,2018-06-09T14:00:00.000,2018-06-10T06:00:00.000,"Albertine Sarges, André Uhl, Andrea Belfi, Catnapp, Cuntroaches, Daniel Haaksman, Deena Abdelwahed, Kaukolampi, Keyzuz, Lucrecia Dalt, Tropikal Camel, Soft As Snow, Tellavision, Wilted Woman",Acud Macht NEU,/events/1118357,5
"Kellergedeck: Christian Kuhlmann, Kamyar Keramati",2018-06-09T00:00:00.000,2018-06-09T22:00:00.000,2018-06-10T07:00:00.000,"Christian Kuhlmann, Kamyar Keramati",Kultstätte Keller,/events/1120022,5
Hektik [ Meets Tooman Records ],2018-06-09T00:00:00.000,2018-06-09T22:00:00.000,2018-06-10T04:00:00.000,"Quadrakey, Georg Hekt",Repeat,/events/1120062,5
A Bass Odyssey - Festival,2018-06-08T00:00:00.000,2018-06-08T23:00:00.000,2018-06-10T08:00:00.000,"Egoless, Compa, Phantom Warrior, Genys, Goosensei, Migz, Tommy Lexxus, Jimi Handtrix",Mensch Meier,/events/1121367,5
Polygon Invites - Day & Night (Open Air & Indoor),2018-06-09T00:00:00.000,2018-06-09T14:00:00.000,2018-06-10T10:00:00.000,"Julien Sandre, Visionquest, Lorenzo Chiabotti, Monika Ross, Ed Herbst",Polygon Club,/events/1120653,4
Interkosmos Fest III,2018-06-09T00:00:00.000,2018-06-09T17:00:00.000,2018-06-10T04:30:00.000,,Urban Spree,/events/1113758,3
We Got Soul,2018-06-09T00:00:00.000,2018-06-09T22:00:00.000,2018-06-10T07:00:00.000,"Caribou, Hendrik Irmscher",Musik & Frieden,/events/1116696,3
"Mtmu Invites Arno Lemons, Kamal Naeem & Mculo",2018-06-09T00:00:00.000,2018-06-09T23:00:00.000,2018-06-10T06:00:00.000,"Arno Lemons, Kamal Naeem, Mculo",TBA - Berlin,/events/1118004,3
Süsses mit Freunden,2018-06-09T00:00:00.000,2018-06-09T20:00:00.000,2018-06-10T08:00:00.000,"Maximilian Stolze, Funkwerkstatt",Süss War Gestern,/events/1119741,3
I Love Engtanz,2018-06-09T00:00:00.000,2018-06-09T22:00:00.000,2018-06-10T06:00:00.000,Eliahh,Ritter Butzke,/events/1120287,3
Free,2018-06-09T00:00:00.000,2018-06-09T16:00:00.000,2018-06-10T14:00:00.000,,Hier Am Containerbahnhof 1 (Ganz Hinten),/events/1122252,3
Holotropical Sounds,2018-06-09T00:00:00.000,2018-06-09T23:00:00.000,2018-06-10T08:00:00.000,"Moji, Rosi",Beate Uwe,/events/1118266,2
Tkno #5 Pres. Grace Thompson,2018-06-09T00:00:00.000,2018-06-09T23:59:00.000,2018-06-10T09:00:00.000,"Grace Thompson, Freulein P., Electrooney, DAV3",Der Weiße Hase,/events/1121728,2
Tempest Fugit,2018-06-09T00:00:00.000,2018-06-09T23:00:00.000,2018-06-10T08:00:00.000,,Kulturhaus Kili,/events/1090181,2
Refuse Records 25th Anniversary Fest – Day 2,2018-06-09T00:00:00.000,2018-06-09T16:00:00.000,2018-06-10T23:00:00.000,,Cassiopeia,/events/1090501,2
Untitled: René Löwe & Arthur,2018-06-09T00:00:00.000,2018-06-09T23:00:00.000,2018-06-10T07:00:00.000,Arthur (DE),Paloma,/events/1251267,1
"La Bomba Cumbia Party w Feierabend Poetic Cumbia, Fehla Nito & Dagvii",2018-06-09T00:00:00.000,2018-06-09T22:00:00.000,2018-06-10T05:00:00.000,"Fehla Nito, DAGVII",Slaughterhouse am Kulturfabrik Moabit,/events/1107771,1
Einfach Draussen Feiern,2018-06-09T00:00:00.000,2018-06-09T16:00:00.000,2018-06-09T23:59:00.000,Chris Flowers,Waldbad Tröstau,/events/1112328,1
High Fidelity Club,2018-06-09T00:00:00.000,2018-06-09T23:00:00.000,2018-06-10T06:00:00.000,"DJ SOLO, Match Hoffman",Soda Club,/events/1112395,1
Secrets - Kinky Party - Hedonistic Cult,2018-06-09T00:00:00.000,2018-06-09T22:00:00.000,2018-06-10T06:00:00.000,,Insomnia,/events/1115870,1
Popoff Kitchen Does Berlin,2018-06-09T00:00:00.000,2018-06-09T22:00:00.000,2018-06-10T04:00:00.000,Kirill Shapovalov,Ficken 3000,/events/1118225,1
Sweet Disasters,2018-06-09T00:00:00.000,2018-06-09T23:00:00.000,2018-06-10T06:00:00.000,DJ Parker Lewis,Cassiopeia,/events/1119337,1
Panke.Gallery Sound Night 05,2018-06-09T00:00:00.000,2018-06-09T22:00:00.000,2018-06-10T02:00:00.000,NFNR,Panke,/events/1119411,1
Saucy Punchline ,2018-06-09T00:00:00.000,2018-06-09T23:00:00.000,2018-06-10T06:00:00.000,,Bricks Berlin,/events/1120156,1
Urban Botanic Grooves,2018-06-09T00:00:00.000,2018-06-09T16:00:00.000,2018-06-10T00:00:00.000,Dieta Berliner,Darwin's Lab im Bikini Berlin,/events/1120551,1
New Ambient Berlin,2018-06-09T00:00:00.000,2018-06-09T18:00:00.000,2018-06-10T03:00:00.000,,Solar,/events/1120697,1
Psychotropica Prog/Psytrance & Techno,2018-06-09T00:00:00.000,2018-06-09T23:00:00.000,2018-06-10T23:00:00.000,"Portal - ZA, MARCEL db, Benno Hoffmann",M-BIA,/events/1120832,1
Brudi Love - Open air Edition Again,2018-06-09T00:00:00.000,2018-06-09T16:00:00.000,2018-06-10T00:00:00.000,Rudolph Beuys,Festsaal Kreuzberg,/events/1122199,1
one.Night.Allone mit Made IN 87,2018-06-09T00:00:00.000,2018-06-09T19:00:00.000,2018-06-10T07:00:00.000,Made In 87,Minimal Bar,/events/1104641,20
P<arty,2018-06-09T00:00:00.000,2018-06-09T23:59:00.000,2018-06-10T09:00:00.000,,Deep Loft,/events/1082826,2
24/7 Berlin,2018-06-09T00:00:00.000,2018-06-09T23:59:00.000,2018-06-10T23:59:00.000,"Clara 3000, DJ Masda, Dresvn, Félicia Atkinson, Hodge, Resom, Karizma, KRN, Oliver Hafenbauer, Pessimist, Proc Fiskal, Rebekah, Silvia Kastel, Timecop, Wilted Woman, Youngsta, Zaltan, DJ Detweiler, FJAAK",://about blank,/events/1096586,335
"Kompakt Open Air /w. Michael Mayer, Reinhard Voigt, Thomas Fehlmann",2018-06-10T00:00:00.000,2018-06-10T14:00:00.000,2018-06-11T06:00:00.000,"Michael Mayer, Reinhard Voigt, Thomas Fehlmann, ANII, Denis Stockhausen, Flexonaut, Terranova",Else,/events/1107307,309
"Griessmuehle x Diversity with Vakula, Mark Grusane, Anja Zaube, Mareena, Daniel Wang, Stratos",2018-06-09T00:00:00.000,2018-06-09T22:00:00.000,2018-06-10T22:00:00.000,"Vakula, Anja Zaube, Mareena, Knigi, Adlas, DJ Ion, Mark Grusane, Stratos, Kyros, Arara, Daniel Wang, Doc Sleep",Griessmuehle,/events/1109592,185
Klubnacht,2018-06-09T00:00:00.000,2018-06-09T23:59:00.000,2018-06-11T06:00:00.000,"Andrea, Answer Code Request, Dax J, Oliver Deutschmann, Ron Albrecht, Skee Mask, Stenny, Zenker Brothers, Efdemin, Hannah Holland, Lawrence, Nick Höppner, Virginia, Eris Drew, Justin Cudmore, Mike Servito",Berghain | Panorama Bar | Säule,/events/1111330,117
"Sonntags Unfug with Spektre, Juliet Fox, Superstrobe uvm",2018-06-10T00:00:00.000,2018-06-10T23:00:00.000,2018-06-11T10:00:00.000,"Spektre, Juliet Fox, Superstrobe, Dominik Vaillant, Oliver Klostermann, Mongroove, Hartojo",Lokschuppen Berlin,/events/1086163,70
Stil Vor Talent On Vacation - Open Air Berlin,2018-06-10T00:00:00.000,2018-06-10T14:00:00.000,2018-06-11T10:00:00.000,"Oliver Koletzki, Andhim, Niko Schwind, Boy Next Door, Sam Shure, Jiggler, Björn Störig, Christopher Breuer",[ipsə],/events/1100573,54
Herrensauna,2018-06-10T00:00:00.000,2018-06-10T21:00:00.000,2018-06-11T12:00:00.000,"Giant Swan, Cadency, Misonica, Skander, MCMLXXXV",Tresor / Globus,/events/1118499,49
Oh Damit - Heat Rave - We Are On Fire,2018-06-10T00:00:00.000,2018-06-10T18:00:00.000,2018-06-11T08:00:00.000,,Griessmuehle,/events/1119380,46
Sasomo - Pillow Talk / No Regular Play / Adam Port / Hyenah / The Sorry Entertainer / Mimi Love,2018-06-09T00:00:00.000,2018-06-09T23:59:00.000,2018-06-11T12:00:00.000,"The Sorry Entertainers, No Regular Play, Reznik, Adam Port, Hyenah, The Cheapers, MDVS, Mimi Love, Dave Dinger",Kater Blau,/events/1103383,35
the Volks,2018-06-10T00:00:00.000,2018-06-10T12:00:00.000,2018-06-11T06:00:00.000,"Onur Özer, Bruno Schmidt, Velv.93, Majkel, Vlada",Club der Visionaere,/events/1113498,25
Lazy.Sunday mit Georg Hekt,2018-06-10T00:00:00.000,2018-06-10T21:00:00.000,2018-06-11T03:00:00.000,Georg Hekt,Minimal Bar,/events/1092211,21
Sonntagsklub mit Zoned-Recordings,2018-06-10T00:00:00.000,2018-06-10T23:00:00.000,2018-06-11T10:00:00.000,"Marco Tegui, Marco Wellisch",AVA Club,/events/1117863,17
Sisyphos,2018-06-08T00:00:00.000,2018-06-08T23:59:00.000,2018-06-11T09:00:00.000,Michael Placke,Sisyphos,/events/1121936,13
Pollywood' - Sunday Deep&house Open Air,2018-06-10T00:00:00.000,2018-06-10T14:00:00.000,2018-06-10T22:00:00.000,"2FARO, KH38, Lukas Meunier, Thomas Maschitzke, Brett Knacksen",Polygon Club,/events/1113688,6
Absolem Rondo - Summer Edition - Open Air,2018-06-10T00:00:00.000,2018-06-10T14:00:00.000,2018-06-10T23:00:00.000,"Ring & Dorf, Lee Jokes",Lokschuppen Berlin,/events/1120940,3
Nachspiel Sunday-Night-Club,2018-06-10T00:00:00.000,2018-06-10T23:00:00.000,2018-06-11T08:00:00.000,John Kotti,KitKatClub,/events/1117240,2
Independent Label Market Berlin 2018,2018-06-10T00:00:00.000,2018-06-10T12:00:00.000,2018-06-10T18:00:00.000,,Volksbühne,/events/1118366,2
Refuse Records 25th Anniversary Fest – Day 2,2018-06-09T00:00:00.000,2018-06-09T16:00:00.000,2018-06-10T23:00:00.000,,Cassiopeia,/events/1090501,2
GMF 0610,2018-06-10T00:00:00.000,2018-06-10T23:00:00.000,2018-06-11T06:00:00.000,,GMF,/events/1112143,1
Sunday Selection,2018-06-10T00:00:00.000,2018-06-10T23:00:00.000,2018-06-11T06:00:00.000,,Cassiopeia,/events/1113019,1
House Of Coito // Summer EDT,2018-06-10T00:00:00.000,2018-06-10T22:00:00.000,2018-06-11T06:00:00.000,Jungle Mind,Ficken 3000,/events/1118019,1
Super Sunday,2018-06-10T00:00:00.000,2018-06-10T19:00:00.000,2018-06-10T23:59:00.000,,Volksbühne,/events/1118374,1
Concert: District 99 Orchestra,2018-06-10T00:00:00.000,2018-06-10T19:30:00.000,2018-06-11T21:00:00.000,,Ev. Kirchengemeinde Heilig Kreuz Passion,/events/1119086,1
Psychotropica Prog/Psytrance & Techno,2018-06-09T00:00:00.000,2018-06-09T23:00:00.000,2018-06-10T23:00:00.000,"Portal - ZA, MARCEL db, Benno Hoffmann",M-BIA,/events/1120832,1
The Lillingtons,2018-06-10T00:00:00.000,2018-06-10T20:00:00.000,2018-06-10T23:00:00.000,,Cassiopeia,/events/1090503,1
The Red Iguana,2018-06-10T00:00:00.000,2018-06-10T23:00:00.000,2018-06-11T05:00:00.000,,Jerry's House,/events/1096093,1
Garten mit Wuza,2018-06-10T00:00:00.000,2018-06-10T09:00:00.000,2018-06-11T10:00:00.000,"Xique Xique, Raphael Hofman, Mehr is Mehr",Mensch Meier,/events/1122120,0
Electric Monday,2018-06-11T00:00:00.000,2018-06-11T23:00:00.000,2018-06-12T07:00:00.000,"David Delgado, Rik Laren, Frankie Flowerz",KitKatClub,/events/1107188,47
House of Waxx,2018-06-11T00:00:00.000,2018-06-11T23:59:00.000,2018-06-12T09:00:00.000,"Cinthie, Môme, Robert Drewek",Tresor / Globus,/events/1108683,46
"Hallo Montag - Open Air #07 with Till Von Sein, Pablo Mateo, Meggy and More",2018-06-11T00:00:00.000,2018-06-11T14:00:00.000,2018-06-12T02:00:00.000,"Till von Sein, Meggy, Pablo Mateo",[ipsə],/events/1073743,33
Nice One,2018-06-11T00:00:00.000,2018-06-11T20:00:00.000,2018-06-12T06:00:00.000,Allidé,Crack Bellmer,/events/1121711,10
Monday Mood,2018-06-11T00:00:00.000,2018-06-11T20:00:00.000,2018-06-12T04:00:00.000,,Süss War Gestern,/events/1106412,8
Dunkle Dummies Meets Vayvay,2018-06-11T00:00:00.000,2018-06-11T15:00:00.000,2018-06-12T06:00:00.000,"Andrea Ferlin, Saša, Chris Cutter, serdal",Club der Visionaere,/events/1118580,4
Wavves,2018-06-11T00:00:00.000,2018-06-11T20:00:00.000,2018-06-11T23:00:00.000,,Cassiopeia,/events/1090506,2
Suck my Needle,2018-06-11T00:00:00.000,2018-06-11T22:00:00.000,2018-06-12T02:00:00.000,Mirnha,Mein Haus Am See,/events/1098555,1
Concert: District 99 Orchestra,2018-06-10T00:00:00.000,2018-06-10T19:30:00.000,2018-06-11T21:00:00.000,,Ev. Kirchengemeinde Heilig Kreuz Passion,/events/1119086,1
Meth,2018-06-11T00:00:00.000,2018-06-11T20:00:00.000,2018-06-12T00:00:00.000,,Loophole,/events/1122447,1
Manic.Monday mit Wunderbrumme,2018-06-11T00:00:00.000,2018-06-11T19:00:00.000,2018-06-12T06:00:00.000,,Minimal Bar,/events/1104647,16
Encore.une.Fois *Smash Invaders* Open Air all Night Long,2018-06-12T00:00:00.000,2018-06-12T23:59:00.000,2018-06-13T12:00:00.000,"Smash TV, Phonique, Lars Moston, Philippe Autuori",Lokschuppen Berlin,/events/1112823,82
Bellmeria w. Nikklaas & John Tale,2018-06-12T00:00:00.000,2018-06-12T20:00:00.000,2018-06-13T06:00:00.000,"Nikklaas, John Tale",Crack Bellmer,/events/1104292,33
"The Divine Comedy W/ Juliet Fox, Neil Barber and More TBA",2018-06-12T00:00:00.000,2018-06-12T23:59:00.000,2018-06-13T10:00:00.000,"Juliet Fox, Ryan Davis",Chalet,/events/1122243,21
Sol Asylum,2018-06-12T00:00:00.000,2018-06-12T15:00:00.000,2018-06-13T06:00:00.000,"Miss Jools, Pressure Point, Julie Marghilano",Club der Visionaere,/events/1103995,15
Open Decks & Tischtennis / Open Air & Indoor,2018-06-12T00:00:00.000,2018-06-12T20:00:00.000,2018-06-13T04:00:00.000,,Humboldthain Club,/events/1119003,11
Tuesday Tales,2018-06-12T00:00:00.000,2018-06-12T20:00:00.000,2018-06-13T05:00:00.000,,Süss War Gestern,/events/1110116,10
Anna Calvi,2018-06-12T00:00:00.000,2018-06-12T20:00:00.000,2018-06-13T23:00:00.000,Planningtorock,Berghain | Panorama Bar | Säule,/events/1111350,6
Super Tuesday,2018-06-12T00:00:00.000,2018-06-12T23:30:00.000,2018-06-13T06:00:00.000,,Cassiopeia,/events/1113001,2
The Unknown presents Call me Faba,2018-06-12T00:00:00.000,2018-06-12T22:00:00.000,2018-06-13T02:00:00.000,,Mein Haus Am See,/events/1101407,21
"go.Play mit Rich (Vergissmiennicht, Pour La Vie) und Special Guest: Felix (Welter Records)",2018-06-12T00:00:00.000,2018-06-12T19:00:00.000,2018-06-13T05:00:00.000,Rich & Maroq,Minimal Bar,/events/1104650,15
Planet 9,2018-06-13T00:00:00.000,2018-06-13T22:00:00.000,2018-06-14T08:00:00.000,"Deadbeat, Edward, Samuel Rohrer, Tyler Friedman, Nathalie Seres, Jon Starks, Cem Orlow",://about blank,/events/1097103,66
Tresor New Faces,2018-06-13T00:00:00.000,2018-06-13T23:59:00.000,2018-06-14T10:00:00.000,"Hector MAD, Dinamite",Tresor / Globus,/events/1109265,45
Alva Noto + Ryuichi Sakamoto: Two,2018-06-13T00:00:00.000,2018-06-13T18:30:00.000,2018-06-13T22:00:00.000,"Alva Noto, Ryuichi Sakamoto",Funkhaus Berlin,/events/1083030,41
"All Nighter: Dino Sabatini, Intro: Juerga",2018-06-13T00:00:00.000,2018-06-13T23:59:00.000,2018-06-14T06:00:00.000,"Dino Sabatini, Juerga",Griessmuehle,/events/1122099,31
Mittwoch: Tieffrequent,2018-06-13T00:00:00.000,2018-06-13T23:59:00.000,2018-06-14T10:00:00.000,"Demuja, Jan Ketel, Siggatunez, Ruff Stuff",Watergate,/events/1108592,26
Techno Mittwoch,2018-06-13T00:00:00.000,2018-06-13T23:00:00.000,2018-06-14T10:00:00.000,"Modular Systems, Behrooz Moosavi, DJ Vela, miKech",AVA Club,/events/1115183,26
"The Unknown presents Fabu, Voxal & Marcolinyo",2018-06-13T00:00:00.000,2018-06-13T20:00:00.000,2018-06-14T05:00:00.000,"Fabu, Marcolinyo",Süss War Gestern,/events/1100725,20
Rituals Hosted by Female:Pressure & Strictly Forbidden,2018-06-13T00:00:00.000,2018-06-13T23:59:00.000,2018-06-14T10:00:00.000,"Falling Apart, DJ Spit, Kyoso, Forrest",Lokschuppen Berlin,/events/1109681,18
Flauschige Mittwochsrunde mit Freunden,2018-06-13T00:00:00.000,2018-06-13T20:00:00.000,2018-06-14T03:00:00.000,"K.EULE, Mr. Propellerhead, Techno Jesus",Liquid Sky Berlin - #LSB02,/events/1122707,11
Kiernan and Kamal Play The Hits,2018-06-13T00:00:00.000,2018-06-13T23:00:00.000,2018-06-14T05:00:00.000,"Kiernan Laveaux, Kamal Naeem",Farbfernseher,/events/1117534,9
Sudan Archives,2018-06-13T00:00:00.000,2018-06-13T20:00:00.000,2018-06-13T23:59:00.000,Sudan Archives,YAAM Berlin,/events/1094155,8
Anna Calvi,2018-06-12T00:00:00.000,2018-06-12T20:00:00.000,2018-06-13T23:00:00.000,Planningtorock,Berghain | Panorama Bar | Säule,/events/1111350,6
Outer Place,2018-06-13T00:00:00.000,2018-06-13T15:00:00.000,2018-06-14T06:00:00.000,"DJ Tree, Reedale Rise, Ma.to",Club der Visionaere,/events/1114315,6
Hölle IV Broken Equinox,2018-06-13T00:00:00.000,2018-06-13T18:00:00.000,2018-06-14T04:00:00.000,"Opioid Slot Machine, Cocktail Party Effect, Dirty Daddy Don, Igor Girio",Loophole,/events/1120116,3
Symbiotikka,2018-06-13T00:00:00.000,2018-06-13T23:00:00.000,2018-06-14T07:00:00.000,"Daniel Jaeger, Unerhört",KitKatClub,/events/1113669,2
❀ Slowmotor ❀ with Muno & Lotte Ahoi,2018-06-13T00:00:00.000,2018-06-13T20:00:00.000,2018-06-14T06:00:00.000,"Muno, Lotte Ahoi",Crack Bellmer,/events/1121714,2
Concrete BLN,2018-06-13T00:00:00.000,2018-06-13T23:00:00.000,2018-06-14T06:15:00.000,Phantom Warrior,Cassiopeia,/events/1119357,1
Down By the River & By the Lake Party,2018-06-13T00:00:00.000,2018-06-13T22:00:00.000,2018-06-14T04:00:00.000,"Heidi, Opium Hum",Paloma,/events/1120652,1
Cosmic Vibes,2018-06-13T00:00:00.000,2018-06-13T18:00:00.000,2018-06-14T02:00:00.000,Dj Malloy,Solar,/events/1120698,1
Turkish Rakı Meze and Music Night / Kabus Kerim & Çerikunda,2018-06-13T00:00:00.000,2018-06-13T18:00:00.000,2018-06-14T03:00:00.000,,arkaoda Berlin,/events/1122429,1
Goa & Techno Nacht,2018-06-13T00:00:00.000,2018-06-13T23:00:00.000,2018-06-14T08:45:00.000,Blackice,Der Weiße Hase,/events/1123005,1
Mittendrin mit Katjakrause,2018-06-13T00:00:00.000,2018-06-13T19:00:00.000,2018-06-14T06:00:00.000,,Minimal Bar,/events/1104654,16
Expeditions N002,2018-06-14T00:00:00.000,2018-06-14T23:59:00.000,2018-06-15T10:00:00.000,"Michal Jablonski, Fidelity Kastrow, Marion Cobretti, COBRETTI, Zusan, Annie O",://about blank,/events/1062495,210
"Sleepless with Kaiser Souzai, Sokool, Cromby and More",2018-06-14T00:00:00.000,2018-06-14T20:00:00.000,2018-06-15T10:00:00.000,"Kaiser Souzai, Sokool, Cromby",Chalet,/events/1119423,45
Olympe X Griessmuehle,2018-06-14T00:00:00.000,2018-06-14T23:59:00.000,2018-06-15T08:00:00.000,"Peter Invasion, Pardon Moi, Carolain Luf",Griessmuehle,/events/1109076,34
Field Records: Future History,2018-06-14T00:00:00.000,2018-06-14T22:00:00.000,2018-06-15T06:00:00.000,"Cyspe, Sébastien Robert, Jo Johnson, Stone Edge",OHM,/events/1085505,31
The Unknown presents Pavlova,2018-06-14T00:00:00.000,2018-06-14T20:00:00.000,2018-06-15T03:00:00.000,Pavlova,Zu Mir Oder Zu Dir,/events/1100717,20
No Pressure,2018-06-14T00:00:00.000,2018-06-14T15:00:00.000,2018-06-15T06:00:00.000,"Bill Patrick, Ryan Crosson, Shaun Reeves, Vinyl Speed Adjust",Club der Visionaere,/events/1114782,20
Donnerdogge,2018-06-14T00:00:00.000,2018-06-14T23:59:00.000,2018-06-15T12:00:00.000,"Bongo & Pusk, Jacob Phono, Edgar Peng",Golden Gate,/events/1115447,20
Säule XIV,2018-06-14T00:00:00.000,2018-06-14T22:00:00.000,2018-06-15T05:00:00.000,"Essaie Pas, Afrodeutsche, IMOGEN",Berghain | Panorama Bar | Säule,/events/1111333,17
Step Higher (Drum & Bass / Psytrance),2018-06-14T00:00:00.000,2018-06-14T23:00:00.000,2018-06-15T07:00:00.000,Upzet,Void Club,/events/1108375,16
Moist Liquid Sunrise,2018-06-14T00:00:00.000,2018-06-14T23:00:00.000,2018-06-15T06:00:00.000,"DJ Fett Burger, SJ Tequilla",Paloma,/events/1106380,15
DIE Jungen Wilden,2018-06-14T00:00:00.000,2018-06-14T23:00:00.000,2018-06-15T10:00:00.000,"Sebastian Kremer, Techno Jesus, SPNYRD",AVA Club,/events/1115207,13
Thank you Thursday,2018-06-14T00:00:00.000,2018-06-14T20:00:00.000,2018-06-15T06:00:00.000,,Süss War Gestern,/events/1110117,11
Thursdate,2018-06-14T00:00:00.000,2018-06-14T23:59:00.000,2018-06-15T11:00:00.000,"Kiasmos, Matthew Dekay",Watergate,/events/1117365,10
