"TRY LAND: Anfisa Letyago, Gregor Tresher, The Reason Y, Colambo",2021-10-22T00:00:00.000,2021-10-22T23:59:00.000,2021-10-23T12:00:00.000,"Anfisa Letyago, Gregor Tresher, The Reason Y, Leon Licht, Casimir von Oettingen",Watergate,/events/1467949,88
Vitus' Curse x Entourage Concept,2021-10-22T00:00:00.000,2021-10-22T22:00:00.000,2021-10-23T05:00:00.000,"Egotot, Antic Soul, Black Mirror Park, Kalte Liebe, Lostbutfollowed, Dj Iryna",Bulbul Berlin,/events/1469811,58
Futura Sound Observations: Jessica Ekomane - DJ Saliva - Luz,2021-10-22T00:00:00.000,2021-10-22T22:00:00.000,2021-10-23T05:00:00.000,"Jessica Ekomane, Dj Saliva",arkaoda Berlin,/events/1471277,56
"DJ Pete, Marie Midori, Benji DF",2021-10-22T00:00:00.000,2021-10-22T22:00:00.000,2021-10-23T08:00:00.000,"DJ Pete, Marie Midori, Benji DF, Sameed",Paloma,/events/1466226,36
Sun Sad Instore,2021-10-21T00:00:00.000,2021-10-21T19:00:00.000,2021-10-22T22:00:00.000,Lucas Brell,Sound Metaphors,/events/1472792,31
"Proxima with Freestyler, Mdsm, Sabu! and Zips",2021-10-22T00:00:00.000,2021-10-22T23:00:00.000,2021-10-23T08:00:00.000,"MDSM, Zips",Void Club,/events/1470577,26
BRO Spreestunde,2021-10-22T00:00:00.000,2021-10-22T17:00:00.000,2021-10-23T02:00:00.000,,Sage Beach Berlin,/events/1470712,25
Monkey Safari “Love Will set you free” – Album Release Party,2021-10-22T00:00:00.000,2021-10-22T23:00:00.000,2021-10-23T09:00:00.000,Monkey Safari,Ritter Butzke,/events/1472036,24
Tehran Contemporary Sounds Festival 2021,2021-10-22T00:00:00.000,2021-10-22T16:00:00.000,2021-10-24T23:59:00.000,"9T Antiope, Running Pine, Sahar Homami, Soheil Shayesteh, Ali Phi, Behrooz Moosavi, ArtSaves, Sote",Kunstquartier Bethanien,/events/1470636,22
"Birgits Clubnacht with Iorie, Bonnie Ford & Lichtalben",2021-10-22T00:00:00.000,2021-10-22T22:00:00.000,2021-10-23T08:00:00.000,"Iorie, Bonnie Ford, thea, Steven Shade",Birgit,/events/1473224,20
Techno Spirit /// Fhainest,2021-10-22T00:00:00.000,2021-10-22T23:00:00.000,2021-10-23T10:00:00.000,"Pakko, florii, Louis Harshman, Uzhas38, Corios, Sebastian Ludvig, Jafunk, Nein oh Nein, Nein oh Nein",Der Weiße Hase,/events/1474143,18
4x4=party,2021-10-22T00:00:00.000,2021-10-22T23:59:00.000,2021-10-23T13:00:00.000,"Redshape, Don Williams, Anette Party, Sirko Müller, Exildiscount",Golden Gate,/events/1472581,15
Parallelwelt x Æden,2021-10-22T00:00:00.000,2021-10-22T17:00:00.000,2021-10-23T02:00:00.000,,ÆDEN,/events/1461432,9
Forsythe / Eyal,2021-10-22T00:00:00.000,2021-10-22T19:30:00.000,2021-10-22T21:30:00.000,,Staatsoper Berlin,/events/1462312,9
"M_dokumente, all About Mania D., MALARIA!, Matador",2021-10-21T00:00:00.000,2021-10-21T18:00:00.000,2021-10-24T23:00:00.000,"Gudrun Gut, Anika, Midori Hirano, Pilocka Krach, Mark Reeder",Silent Green,/events/1470742,8
Verrücktentzückt,2021-10-22T00:00:00.000,2021-10-22T23:00:00.000,2021-10-23T08:00:00.000,Iva Bodul,Beate Uwe,/events/1470834,6
The Golden Night,2021-10-22T00:00:00.000,2021-10-22T22:00:00.000,2021-10-23T06:00:00.000,"Dennis Beutler, Fab Massimo",Bohnengold,/events/1471305,6
The Sound of Distance,2021-10-22T00:00:00.000,2021-10-22T19:00:00.000,2021-10-22T21:15:00.000,"Anthea, Mouse On Mars",Haus Der Kulturen Der Welt,/events/1468603,4
Psychedelic Cumbia Party - La Cumbia es Amor -,2021-10-22T00:00:00.000,2021-10-22T23:00:00.000,2021-10-23T05:00:00.000,,Privatclub,/events/1469183,4
Unser Wochenende mit Caren Callas & Magdita,2021-10-22T00:00:00.000,2021-10-22T19:00:00.000,2021-10-23T06:00:00.000,"Caren Callas, MagDita, Wewerka",Promenaden Eck,/events/1473895,4
Flashback Friday,2021-10-22T00:00:00.000,2021-10-22T22:00:00.000,2021-10-23T06:00:00.000,Diana May,Insomnia,/events/1466502,4
Support United,2021-10-22T00:00:00.000,2021-10-22T21:00:00.000,2021-10-23T06:00:00.000,"Ener & Pils, Hanna Baertig",Crack Bellmer,/events/1472782,3
"60 Hz Week 01 with Jus Ed, Hajdar Berisha",2021-10-22T00:00:00.000,2021-10-22T20:00:00.000,2021-10-23T06:00:00.000,"Jus-Ed, Hajdar Berisha",60 Hz,/events/1473905,3
Aerobics @Old Cccp BAR,2021-10-22T00:00:00.000,2021-10-22T21:00:00.000,2021-10-23T06:00:00.000,Oliver Raumklang,Old CCCP,/events/1473915,3
Easy_easy Feat. Symbiz Sound,2021-10-22T00:00:00.000,2021-10-22T21:00:00.000,2021-10-23T05:00:00.000,"Ladybird, Symbiz",Panke,/events/1473109,2
Sturmfrei mit Simonk & Friends,2021-10-22T00:00:00.000,2021-10-22T18:00:00.000,2021-10-23T05:00:00.000,,Minimal Bar,/events/1467218,1
Ladies Night,2021-10-22T00:00:00.000,2021-10-22T21:00:00.000,2021-10-23T06:00:00.000,,Soda Club,/events/1467522,1
Whity,2021-10-22T00:00:00.000,2021-10-22T18:00:00.000,2021-10-23T01:00:00.000,,House of Gin,/events/1469406,1
Konzert Yuriy Gurzhy & Katya Tasheva,2021-10-22T00:00:00.000,2021-10-22T20:00:00.000,2021-10-22T22:00:00.000,,Kaho,/events/1470722,1
Disconnekt,2021-10-23T00:00:00.000,2021-10-23T23:00:00.000,2021-10-24T06:00:00.000,"Ansome, Bas Mooy, Flavia Laus, Ø [Phase], Stallo, Bongsy",Anomalie Art Club,/events/1467550,1292
Stil vor Talent,2021-10-23T00:00:00.000,2021-10-23T23:00:00.000,2021-10-24T08:00:00.000,"pølaroit, Oliver Koletzki, Caleesi, Sarah Kreis, Sam Shure, Daniele Di Martino, Deer Jade, Elfenberg, Elif, Fabian Krooss",Ritter Butzke,/events/1468743,986
"Charlton, Kassem Mosse, Kendal, Lux",2021-10-23T00:00:00.000,2021-10-23T22:00:00.000,2021-10-24T12:00:00.000,"Charlton, Dasha Redkina, False Witness, Franz Scala, Hara Katsiki, Kassem Mosse, Kendal, Lux., Sebastian Voigt",Renate,/events/1472583,667
"Thrust X Sys.Ex with Tim Tama, CLTX, Projekt Gestalten, LOLSNAKE, No Intellectual Property, Kal",2021-10-23T00:00:00.000,2021-10-23T22:00:00.000,2021-10-24T09:00:00.000,"Tim Tama, CLTX, Projekt Gestalten, LOLSNAKE, No Intellectual Property, Kalte Liebe, Lostbutfollowed",Köpenicker Strasse 18,/events/1471263,396
Klubnacht,2021-10-23T00:00:00.000,2021-10-23T23:59:00.000,2021-10-25T04:00:00.000,"Boris, Efdemin, LSDXOXO, Partok, Sugar, Wallis, Call Super, Cromby, Honey Dijon, Roza Terenzi, Ryan Elliott, Sally C",Berghain | Panorama Bar | Säule,/events/1467154,307
"Æ Samstag: Mama Snake, CEM, X-Coast, Tenaga",2021-10-23T00:00:00.000,2021-10-23T22:00:00.000,2021-10-24T09:00:00.000,"Mama Snake, CEM, X-Coast",ÆDEN,/events/1469489,250
Endless W/ Lino Fuso Live,2021-10-23T00:00:00.000,2021-10-23T23:00:00.000,2021-10-24T12:00:00.000,"Lino Fuso, SYM, Luke Atom",AVA Club,/events/1465817,124
"Wenn's Knallt, Dann Knallt's! Klappe die 1. & Perlen für die Katz",2021-10-22T00:00:00.000,2021-10-22T23:59:00.000,2021-10-24T18:00:00.000,"Marvin Jam, MUKKIMIAU, Ena Lind, Annett Gapstream, Marcus Meinhardt, Franca, Sarah Wild, Ricoloop, Peter Schumann, Kotelett, Rydim, Handmade, Janosch Ulm, Norman Weber, Mira",Kater Blau,/events/1472456,89
"Birgits Clubnacht with Nusha, Baime, Stefanie Raschke & More",2021-10-23T00:00:00.000,2021-10-23T22:00:00.000,2021-10-24T08:00:00.000,"Baime, Stefanie Raschke, Nusha, Daniel Boon, Kevin Wimmer, SKALA",Birgit,/events/1473236,78
✦✦✦ Berlin Techno with Torsten Kanzler ✦✦✦ Tickets AT The Door ✦✦✦,2021-10-23T00:00:00.000,2021-10-23T22:00:00.000,2021-10-24T06:00:00.000,"Torsten Kanzler, Freulein P., Techno Jesus, Max Lindemann",ASeven,/events/1464556,61
"On Board x Refuge Worldwide: Scion Versions, Paul St. Hilaire aka Tikiman",2021-10-23T00:00:00.000,2021-10-23T22:00:00.000,2021-10-24T06:00:00.000,"Tikiman, Laura BCR, JAXX TMS, SLIC Unit, ophélie, Richard Akingbehin, No Plastic",arkaoda Berlin,/events/1472085,62
𝙀𝙈𝙋𝙃𝘼(𝙎𝙄𝙎) - 𝘿𝙚𝙚𝙥 𝘿𝙖𝙣𝙘𝙚 𝙋𝙖𝙧𝙩𝙮,2021-10-23T00:00:00.000,2021-10-23T22:00:00.000,2021-10-24T08:00:00.000,"human margareeta, Kotoe, NÚRIA (DE), Ukik",Anita Berber,/events/1472700,42
"Rebel Rave: Damian Lazarus, Dennis Cruz, Amémé, Tibi Dabo",2021-10-23T00:00:00.000,2021-10-23T23:59:00.000,2021-10-24T12:00:00.000,"Damian Lazarus, Dennis Cruz, Joplyn, Kristin Velvet, Tibi Dabo",Watergate,/events/1469817,33
Exit Love 'Back for Bad',2021-10-23T00:00:00.000,2021-10-23T23:00:00.000,2021-10-24T06:00:00.000,"Maltitz, Ion Vulcan, People Talking, Triqi",Loophole,/events/1469304,28
Nice 4 What // Paloma Bar,2021-10-23T00:00:00.000,2021-10-23T22:00:00.000,2021-10-24T06:00:00.000,"Anna Malysz, I$A, NAITWA",Paloma,/events/1465659,24
Tehran Contemporary Sounds Festival 2021,2021-10-22T00:00:00.000,2021-10-22T16:00:00.000,2021-10-24T23:59:00.000,"9T Antiope, Running Pine, Sahar Homami, Soheil Shayesteh, Ali Phi, Behrooz Moosavi, ArtSaves, Sote",Kunstquartier Bethanien,/events/1470636,22
Friend Zone,2021-10-23T00:00:00.000,2021-10-23T23:00:00.000,2021-10-24T10:00:00.000,"LYZA, Montero, Trans Timmermans",TBA - Berlin,/events/1470480,18
"Ιπταμενοσ Δισκοtek with Italo Brutalo, Local Suicide & T.Raumschmiere",2021-10-23T00:00:00.000,2021-10-23T22:00:00.000,2021-10-24T06:00:00.000,"Italo Brutalo, Local Suicide",Urban Spree,/events/1471690,16
Parallelwelt x Osthafen,2021-10-23T00:00:00.000,2021-10-23T15:00:00.000,2021-10-24T02:00:00.000,,OST,/events/1461434,15
Shot of Sued/Acido Night,2021-10-23T00:00:00.000,2021-10-23T23:30:00.000,2021-10-24T07:00:00.000,"Dynamo Dreesen, SVN, SJ Tequilla",Paloma,/events/1465676,14
Dejawie,2021-10-23T00:00:00.000,2021-10-23T22:30:00.000,2021-10-24T07:00:00.000,"Nanno, Frida Carlo, Bonzo, Jack Morris",Kulturhaus Kili,/events/1472460,13
DJ Gedöns,2021-10-23T00:00:00.000,2021-10-23T22:00:00.000,2021-10-24T05:00:00.000,,Monarch,/events/1467122,8
"M_dokumente, all About Mania D., MALARIA!, Matador",2021-10-21T00:00:00.000,2021-10-21T18:00:00.000,2021-10-24T23:00:00.000,"Gudrun Gut, Anika, Midori Hirano, Pilocka Krach, Mark Reeder",Silent Green,/events/1470742,8
Phonik & Friends - Back to the Dancefloor,2021-10-23T00:00:00.000,2021-10-23T22:00:00.000,2021-10-24T06:00:00.000,"International Mac, reusbi, Yoshitaca",Crack Bellmer,/events/1472114,8
Hertzschlag,2021-10-23T00:00:00.000,2021-10-23T21:30:00.000,2021-10-24T08:00:00.000,"Zig Wolf, Goli, Adrian Ernst",Süss War Gestern,/events/1472978,8
Iconic Mirage at Christa Kupfer,2021-10-23T00:00:00.000,2021-10-23T22:00:00.000,2021-10-24T06:00:00.000,"Beryll, Jenson",Christa Kupfer,/events/1470998,7
Spaceship,2021-10-23T00:00:00.000,2021-10-23T14:00:00.000,2021-10-23T22:00:00.000,,Mensch Meier,/events/1471757,7
Klubnacht,2021-10-23T00:00:00.000,2021-10-23T23:59:00.000,2021-10-24T13:00:00.000,Cotumo,Golden Gate,/events/1472584,7
Circus Bizarre,2021-10-23T00:00:00.000,2021-10-23T22:00:00.000,2021-10-24T06:00:00.000,,Insomnia,/events/1468795,6
Techno Spirit,2021-10-23T00:00:00.000,2021-10-23T23:00:00.000,2021-10-24T10:00:00.000,"Chroma, DonTom",Der Weiße Hase,/events/1474322,9
Vinyl.Zone mit Benjamin Fehr & Freunde,2021-10-23T00:00:00.000,2021-10-23T18:00:00.000,2021-10-24T05:00:00.000,Benjamin Fehr,Minimal Bar,/events/1467219,4
Klangsubstanz im Beate Uwe,2021-10-23T00:00:00.000,2021-10-23T23:00:00.000,2021-10-24T08:00:00.000,"Marc Eisenberg, Anna Schreit",Beate Uwe,/events/1471656,4
Dirty Disco,2021-10-23T00:00:00.000,2021-10-23T20:00:00.000,2021-10-23T23:00:00.000,,Dirty Velvet Drinkery,/events/1472339,4
"Unser Wochenende mit DJ Malloy, Soulspy",2021-10-23T00:00:00.000,2021-10-23T19:00:00.000,2021-10-24T06:00:00.000,Dj Malloy,Promenaden Eck,/events/1473897,4
Urban String Berlin »zeitknick«,2021-10-23T00:00:00.000,2021-10-23T19:30:00.000,2021-10-23T21:30:00.000,Paul Frick,Spreehalle Berlin,/events/1462936,4
The Sound of Distance,2021-10-23T00:00:00.000,2021-10-23T19:00:00.000,2021-10-23T21:00:00.000,"Anthea, Mouse On Mars, Stephen O'Malley",Haus Der Kulturen Der Welt,/events/1466514,4
Haito,2021-10-23T00:00:00.000,2021-10-23T18:00:00.000,2021-10-24T01:00:00.000,Haito,House of Gin,/events/1469408,1
Bopp Kogn Festival Birthday Party,2021-10-23T00:00:00.000,2021-10-23T21:00:00.000,2021-10-24T01:00:00.000,,Panke,/events/1472914,1
Dora PAN Inseedance,2021-10-23T00:00:00.000,2021-10-23T21:00:00.000,2021-10-24T06:00:00.000,Dora Pan,Old CCCP,/events/1473918,1
Harnessing Control,2021-10-23T00:00:00.000,2021-10-23T19:00:00.000,2021-10-23T22:00:00.000,Mobilegirl,Park Center Treptow,/events/1474630,1
Last Saturdays...,2021-10-23T00:00:00.000,2021-10-23T18:00:00.000,2021-10-24T06:00:00.000,Stipe,Club der Visionaere,/events/1474935,1
"Magnetism with Stanislav Tolkachev, Desroi, CONCEPTUAL, Hekum, D-Leria and Pigreko",2021-10-23T00:00:00.000,2021-10-23T23:00:00.000,2021-10-24T09:00:00.000,"Stanislav Tolkachev, Desroi, CONCEPTUAL, Hekum, D-Leria, Pigreko",Lokschuppen Berlin,/events/1468222,158
Gegen Freedom,2021-10-24T00:00:00.000,2021-10-24T18:00:00.000,2021-10-25T07:00:00.000,"Space Exile, Stephanie Sykes, Ancient Methods, Samantha Togni, Lee Ann Roberts, Metaraph, Sanni Est, Sherø, DJ City",TBA - Berlin,/events/1471774,451
Klubnacht,2021-10-23T00:00:00.000,2021-10-23T23:59:00.000,2021-10-25T04:00:00.000,"Boris, Efdemin, LSDXOXO, Partok, Sugar, Wallis, Call Super, Cromby, Honey Dijon, Roza Terenzi, Ryan Elliott, Sally C",Berghain | Panorama Bar | Säule,/events/1467154,307
BCCO Indoor,2021-10-24T00:00:00.000,2021-10-24T14:00:00.000,2021-10-25T08:00:00.000,"Marcus L, Alarico, Phil Berg, Radical Softness, Alva, Kashpitzky, Quelza",ÆDEN,/events/1471348,272
Tactics Nine (Pres. by Concrete & Rausch und Flausch),2021-10-24T00:00:00.000,2021-10-24T20:00:00.000,2021-10-25T06:00:00.000,"Charlie Sparks, ØTTA, PLEXØS, Hundertvierzig, FLUCC, Cøunts, LØUS",OST,/events/1466222,154
"Wenn's Knallt, Dann Knallt's! Klappe die 1. & Perlen für die Katz",2021-10-22T00:00:00.000,2021-10-22T23:59:00.000,2021-10-24T18:00:00.000,"Marvin Jam, MUKKIMIAU, Ena Lind, Annett Gapstream, Marcus Meinhardt, Franca, Sarah Wild, Ricoloop, Peter Schumann, Kotelett, Rydim, Handmade, Janosch Ulm, Norman Weber, Mira",Kater Blau,/events/1472456,89
Hasenbau with Lewis Fautzi & Michael Klein,2021-10-24T00:00:00.000,2021-10-24T23:00:00.000,2021-10-25T09:00:00.000,"Bolster, Lewis Fautzi, marberg., Michael Klein, Parand, vauna",Lokschuppen Berlin,/events/1467947,80
Pan-Pot,2021-10-24T00:00:00.000,2021-10-24T22:00:00.000,2021-10-25T06:00:00.000,"Pan-Pot, Charly Schaller, Patrick Milaa",Watergate,/events/1470183,69
Pressure Traxx,2021-10-24T00:00:00.000,2021-10-24T20:00:00.000,2021-10-25T09:00:00.000,"Cap, Suciu, Amir Javasoul, Arno aka Einzelkind",Hoppetosse,/events/1468192,36
Tehran Contemporary Sounds Festival 2021,2021-10-22T00:00:00.000,2021-10-22T16:00:00.000,2021-10-24T23:59:00.000,"9T Antiope, Running Pine, Sahar Homami, Soheil Shayesteh, Ali Phi, Behrooz Moosavi, ArtSaves, Sote",Kunstquartier Bethanien,/events/1470636,22
Berlin Modular Society - Undead,2021-10-24T00:00:00.000,2021-10-24T19:00:00.000,2021-10-25T00:00:00.000,"Schreibmaschine, 3rd Party Influence, drusnoise",Loophole,/events/1471311,15
"M_dokumente, all About Mania D., MALARIA!, Matador",2021-10-21T00:00:00.000,2021-10-21T18:00:00.000,2021-10-24T23:00:00.000,"Gudrun Gut, Anika, Midori Hirano, Pilocka Krach, Mark Reeder",Silent Green,/events/1470742,8
"Beate Barfuß with Pshiuu, Marlon Looney, Lars Kracht, Musiphile",2021-10-24T00:00:00.000,2021-10-24T17:00:00.000,2021-10-25T04:00:00.000,"pshiuu, Kracht, Musiphile",Beate Uwe,/events/1472200,2
Forsythe / Eyal,2021-10-24T00:00:00.000,2021-10-24T16:00:00.000,2021-10-24T18:00:00.000,,Staatsoper Berlin,/events/1462313,2
Lazy.Sunday mit Deacon Frost Jr.,2021-10-24T00:00:00.000,2021-10-24T18:00:00.000,2021-10-25T03:00:00.000,,Minimal Bar,/events/1467226,1
The Sound of Distance,2021-10-24T00:00:00.000,2021-10-24T19:00:00.000,2021-10-24T20:30:00.000,Anthea,Haus Der Kulturen Der Welt,/events/1468956,1
"Slumberland (Live), Et Kin (Live)",2021-10-24T00:00:00.000,2021-10-24T20:00:00.000,2021-10-24T23:00:00.000,,arkaoda Berlin,/events/1473641,1
Electric Monday @Kitkat Club,2021-10-25T00:00:00.000,2021-10-25T22:00:00.000,2021-10-26T06:00:00.000,"Sylvie Maziarz, Frankie Flowerz",KitKatClub,/events/1470364,24
Manic.Monday mit Sciarada,2021-10-25T00:00:00.000,2021-10-25T18:00:00.000,2021-10-26T03:00:00.000,Sciarada,Minimal Bar,/events/1467231,12
The Unknown,2021-10-26T00:00:00.000,2021-10-26T22:00:00.000,2021-10-27T04:00:00.000,Aris (DE),Süss War Gestern,/events/1464002,21
The Alchemist (Producer/DJ Set),2021-10-26T00:00:00.000,2021-10-26T20:00:00.000,2021-10-26T23:59:00.000,"The Alchemist, Marc Hype",Panke,/events/1473112,7
test,2021-10-26T00:00:00.000,2021-10-26T22:45:00.000,2021-10-27T04:30:00.000,,TBA - Berlin,/events/1472769,2
go.Play mit Celeste Conde,2021-10-26T00:00:00.000,2021-10-26T18:00:00.000,2021-10-27T03:00:00.000,Celeste Conde,Minimal Bar,/events/1467235,1
Ichiko Aoba,2021-10-27T00:00:00.000,2021-10-27T21:00:00.000,2021-10-27T23:00:00.000,,arkaoda Berlin,/events/1468403,191
Techno Mittwoch,2021-10-27T00:00:00.000,2021-10-27T22:00:00.000,2021-10-28T10:00:00.000,,AVA Club,/events/1462539,41
Symbiotikka / Halloween Special,2021-10-27T00:00:00.000,2021-10-27T22:00:00.000,2021-10-28T07:00:00.000,"Anubix, vom Feisten, RSRRCT, RSRRCT",KitKatClub,/events/1469966,36
The Unknown,2021-10-27T00:00:00.000,2021-10-27T22:00:00.000,2021-10-28T01:00:00.000,,Mein Haus Am See,/events/1460241,17
Süßer Mittwoch,2021-10-27T00:00:00.000,2021-10-27T22:30:00.000,2021-10-28T03:00:00.000,"Colsen, G.oss, LeoSkiDj",Süss War Gestern,/events/1475886,9
Mittendrin mit Deniz Arslan,2021-10-27T00:00:00.000,2021-10-27T18:00:00.000,2021-10-28T03:00:00.000,,Minimal Bar,/events/1467239,5
Tight Opening Party Part 1 with Paolo Di Nola and Dickey (Doo),2021-10-27T00:00:00.000,2021-10-27T22:00:00.000,2021-10-28T06:00:00.000,Paolo Di Nola,Beate Uwe,/events/1473445,5
Zumi Wednesday,2021-10-27T00:00:00.000,2021-10-27T19:00:00.000,2021-10-28T01:00:00.000,Rasmus Damkier,Zu Mir Oder Zu Dir,/events/1499819,0
OG Bunker Rave 09 - UV Halloween Edition (2G),2021-10-28T00:00:00.000,2021-10-28T20:00:00.000,2021-10-29T04:00:00.000,"Mad Hattress, Yami, Just Mo, ABuDi",Salzclub,/events/1473881,89
Donnerdogge Meets Lets Discult,2021-10-28T00:00:00.000,2021-10-28T23:59:00.000,2021-10-29T13:00:00.000,"Politics Of Dancing, Ollie Drummond, Denise Bauer, Discult Soundsystem",Golden Gate,/events/1474152,57
Association of Unison - Nacht,2021-10-28T00:00:00.000,2021-10-28T22:00:00.000,2021-10-29T05:00:00.000,"Natt A Regular Guy, Millie Forsberg, Bonq, Dojas, Parisha, Scoopsi",Bulbul Berlin,/events/1474220,45
Lotic presents Water & M.E.S.H.,2021-10-28T00:00:00.000,2021-10-28T21:00:00.000,2021-10-28T23:00:00.000,"Lotic, M.E.S.H.",Volksbühne,/events/1465161,27
Raumvier 1.1,2021-10-28T00:00:00.000,2021-10-28T22:00:00.000,2021-10-29T07:00:00.000,"Sven von Thülen, Der Würfler",KitKatClub,/events/1471497,22
Audiovisionen: Deadbeat & Tikiman,2021-10-28T00:00:00.000,2021-10-28T20:00:00.000,2021-10-28T22:00:00.000,"Deadbeat, Tikiman",Kulturraum Zwingli Kirche e.V.,/events/1471646,20
The Unknown,2021-10-28T00:00:00.000,2021-10-28T22:00:00.000,2021-10-29T02:00:00.000,,Zu Mir Oder Zu Dir,/events/1463997,17
Kalipo/ 'Happy Little Accidents' Releaseparty / Berlin / 28.10.2021 / Crack Bellmer,2021-10-28T00:00:00.000,2021-10-28T22:00:00.000,2021-10-29T05:00:00.000,"Kalipo, Isabeau Fort, Local Suicide",Crack Bellmer,/events/1469144,17
Hedomanie: Play Party,2021-10-28T00:00:00.000,2021-10-28T20:00:00.000,2021-10-29T06:00:00.000,"Dr Double U, Achilles",Insomnia,/events/1474717,14
Picket Fancy presents Issa Salliander From Strange Glue Studios // Vernissage & Party,2021-10-28T00:00:00.000,2021-10-28T18:00:00.000,2021-10-29T02:00:00.000,"Cosmic Cherry, JANE RYSE, Sonic Paradise, Bizzarro Universe",Anomalie Art Club,/events/1472872,13
Live.Loop,2021-10-28T00:00:00.000,2021-10-28T19:00:00.000,2021-10-29T23:59:00.000,"Wowa Effect, Moe Nagasi, Evalyn",Loophole,/events/1472078,9
A Night with Doom Chakra Tapes 6,2021-10-28T00:00:00.000,2021-10-28T22:00:00.000,2021-10-29T06:00:00.000,Giraffi Dog,Paloma,/events/1472122,8
Picket Fancy presents Issa Salliander From Strange Glue Studios // Vernissage & Party,2021-10-28T00:00:00.000,2021-10-28T18:00:00.000,2021-10-29T02:00:00.000,"Cosmic Cherry, JANE RYSE, Bizzarro Universe",Anomalie Art Club,/events/1472531,5
Electronic.Thursday mit Georg Hekt,2021-10-28T00:00:00.000,2021-10-28T18:00:00.000,2021-10-29T04:00:00.000,Georg Hekt,Minimal Bar,/events/1467243,4
The Techno Spot,2021-10-28T00:00:00.000,2021-10-28T22:00:00.000,2021-10-29T06:00:00.000,,The Liberate,/events/1471336,3
United Techno Night,2021-10-28T00:00:00.000,2021-10-28T23:00:00.000,2021-10-29T06:00:00.000,"ROGEVAR, GNSR, GNSR, i_dancewithdevil, Andrew Moore, Metaraph",ASeven,/events/1476109,3
Jungle Mind - Möbel Ölfe,2021-10-28T00:00:00.000,2021-10-28T21:00:00.000,2021-10-29T03:00:00.000,Jungle Mind,Möbel-Olfe,/events/1473099,2
Funky Disko Donnerstag,2021-10-28T00:00:00.000,2021-10-28T19:00:00.000,2021-10-29T03:00:00.000,,Promenaden Eck,/events/1475335,2
Plenty,2021-10-28T00:00:00.000,2021-10-28T18:00:00.000,2021-10-29T03:00:00.000,"Jana Falcon, Ban2",MUENZE,/events/1476392,2
Da Kinky Koala at Solar,2021-10-28T00:00:00.000,2021-10-28T20:00:00.000,2021-10-29T01:00:00.000,Marcel da Kinky Koala,Solar,/events/1469293,1
Deck 2 Deck // All Night Long,2021-10-28T00:00:00.000,2021-10-28T19:00:00.000,2021-10-29T04:00:00.000,"Dj Quien, redblunted, Wan.illa NICE",Panke,/events/1474656,1
Week 02 with Per Hammar & Olga Korol,2021-10-28T00:00:00.000,2021-10-28T20:00:00.000,2021-10-29T06:00:00.000,"Per Hammar, Olga Korol",60 Hz,/events/1476323,1
Boiler Room: Berlin,2021-10-29T00:00:00.000,2021-10-29T23:59:00.000,2021-10-30T12:00:00.000,"Bambounou, CCL, Coco Cobra, DJ Fart in the Club, Elissa Suckdog, GiGi FM, Gramrcy, Katiusha, Kilbourne, Marie Montexier, Melis, PLO Man, Tigerhead, Vladimir Ivkovic",Anomalie Art Club,/events/1453624,3583
SYNOID Weekender,2021-10-29T00:00:00.000,2021-10-29T23:00:00.000,2021-11-01T06:00:00.000,"Acierate, AnD, Cecilia Tosh, CALLUSH, Daria Kolosova, François X, Headless Horseman, hybral, Inhalt der Nacht, Parallx, SHDW, Shlømo, SNTS, Tham, Xiorro, Alva, Echoes Of October, Frank Heise, Philipp Drube, Introversion, HKKPTR, JANEIN, JKS, Minimal Violence, Raven (CA)",MUENZE,/events/1470821,2759
"Crude with DJ G2G, DJ Hyperdrive, Araknyl, Psicotek Live",2021-10-29T00:00:00.000,2021-10-29T23:00:00.000,2021-10-30T10:00:00.000,"dj g2g, DJ Hyperdrive, Araknyl, PSICOTEK",Köpenicker Strasse 18,/events/1385659,224
"Inherencia IV / Vinicius Honorio, Any Mello, Lukr Range, Amadeus Joseph, Lucas Vazz",2021-10-29T00:00:00.000,2021-10-29T23:00:00.000,2021-10-30T09:00:00.000,"Vinicius Honorio, Any Mello, Lukr Range, Amadeus Joseph, Lucas Vazz, Tini Weng, Marie Midori, Dj Rafael, Mr. Down",Lokschuppen Berlin,/events/1471746,212
"Birgits Clubnacht with Miyagi, Peer Kusiv, A.D.H.S. and More",2021-10-29T00:00:00.000,2021-10-29T22:00:00.000,2021-10-30T08:00:00.000,"Miyagi, RSRRCT, A.D.H.S., Leon Licht",Birgit,/events/1474370,98
"The Spell: HOSH, Bondi, Madmotormiquel, Sven Dohse, David Dorad",2021-10-29T00:00:00.000,2021-10-29T23:59:00.000,2021-10-30T12:00:00.000,"HOSH, Madmotormiquel, SAGAN, Bondi (DE), Sven Dohse, David Dorad, Mila Stern",Watergate,/events/1473620,41
Elysion - Techno Meets House,2021-10-29T00:00:00.000,2021-10-29T23:00:00.000,2021-10-30T09:00:00.000,"Daweed, Nanno, Kotti Carsten, Danny Subsonic, Naked Nils",Humboldthain Club,/events/1473746,41
Foursome - Renaissance,2021-10-29T00:00:00.000,2021-10-29T22:00:00.000,2021-10-30T06:00:00.000,"Robert Owens, Lowfeli, Mad Shivers, Tartineur, Die Ragazzi, DJ Optimal 1",Anita Berber,/events/1469161,35
Choke II,2021-10-29T00:00:00.000,2021-10-29T22:00:00.000,2021-10-30T07:00:00.000,,Urban Spree,/events/1472778,34
Trashera Synthesis,2021-10-29T00:00:00.000,2021-10-29T21:00:00.000,2021-10-30T22:00:00.000,"Akkamiau, ARIESFALLENANGEL, Cali Rose, Carmen 16, Dirty Daddy Don, Dmitra, The Hacker, Katya Kóv, ketia, Radical Softness, Sado Opera, X Tin",Renate,/events/1474867,33
A Night In The Basement Part 12,2021-10-29T00:00:00.000,2021-10-29T22:00:00.000,2021-10-30T07:00:00.000,"DJ Fett Burger, Double Dancer",Sameheads,/events/1470808,31
Dominik Eulberg “Avichrom” Album Release Show at Ritter Butzke,2021-10-29T00:00:00.000,2021-10-29T23:00:00.000,2021-10-30T08:00:00.000,"Dominik Eulberg, Re.You, 1979, FrauPfau",Ritter Butzke,/events/1474512,31
"Paloma invites Sarah Farina b2b LeFeu, Claire, Cheng Nwsh B2B DJ Carlita",2021-10-29T00:00:00.000,2021-10-29T22:00:00.000,2021-10-30T08:00:00.000,"Sarah Farina, cheng nwsh, DJ Carlita, Minijob, Gigi Giornalisti, young oldmann",Paloma,/events/1466232,30
Art Bei Ton: Private 4 (29.10.21),2021-10-29T00:00:00.000,2021-10-29T23:45:00.000,2021-10-30T08:00:00.000,"Milena Glowacka, Justine Perry, Petit Astronaute, Valentin Ginies, Aconite",TBA - Berlin,/events/1476477,28
"Æ Freitag: Keith Carnal, Irakli, Carmen Electro, Veiled Soundsystem",2021-10-29T00:00:00.000,2021-10-29T23:00:00.000,2021-10-30T09:00:00.000,"Keith Carnal, Irakli, Carmen Electro, Veiled",ÆDEN,/events/1474812,25
Tortura vol. 1 - Halloween Party,2021-10-29T00:00:00.000,2021-10-29T21:00:00.000,2021-10-30T06:00:00.000,"t0ni, DJ Hristos, DJ GHEPARD, BLK SLK, Dj Hot Bitch",Tennis Bar Neukölln,/events/1472120,22
[canceled] Parallelwelt x Sage,2021-10-29T00:00:00.000,2021-10-29T17:00:00.000,2021-10-30T02:00:00.000,,Sage Beach Berlin,/events/1461440,20
Absurd Dub Lustre Vol. 4,2021-10-29T00:00:00.000,2021-10-29T23:59:00.000,2021-10-30T12:00:00.000,"Audio Werner, Deadbeat, Tikiman, Sa Pa",Hoppetosse,/events/1473533,15
"CODEX CLUB x Panke: Ossia, ABADIR, Wilted Woman, Leila Hassan, Chago",2021-10-29T00:00:00.000,2021-10-29T21:00:00.000,2021-10-30T06:00:00.000,"Ossia, ABADIR, Wilted Woman",Panke,/events/1474517,14
Live.Loop,2021-10-28T00:00:00.000,2021-10-28T19:00:00.000,2021-10-29T23:59:00.000,"Wowa Effect, Moe Nagasi, Evalyn",Loophole,/events/1472078,9
The Very Polish Cut Outs Showcase,2021-10-29T00:00:00.000,2021-10-29T22:00:00.000,2021-10-30T05:00:00.000,"DJ Duch, Zambon, Jerson",arkaoda Berlin,/events/1471226,8
