Disconnekt x Griessmuehle,2018-01-26T00:00:00.000,2018-01-26T22:00:00.000,2018-01-27T22:00:00.000,"Makaton, Dimi Angelis, Reflec, Gaja, Francesco De Luca, Christian Rütz, MXM, Juerga, TRACKs, Cristian Marras, Hannah Addams, Stallo",Griessmuehle,/events/1050905,84
CTM 2018 - Caustic / Cohesion,2018-01-26T00:00:00.000,2018-01-26T23:00:00.000,2018-01-27T11:00:00.000,"Celestial Trax, Nene H, Borusiade, Boys Noize, JASSS, Elena Colombi, Esa, RAMZi, Uta",Berghain | Panorama Bar | Säule,/events/1051722,84
Tresor.Klubnacht,2018-01-26T00:00:00.000,2018-01-26T23:59:00.000,2018-01-27T12:00:00.000,"Claro Intelecto, J.C., SV3N, Manuela Mayoral, Samuli Kemppi, Svreca, Mischa",Tresor / Globus,/events/1052119,58
"Henriette House /w. Gerd, Hugo Mendez, Lola Luc & More",2018-01-26T00:00:00.000,2018-01-26T23:59:00.000,2018-01-27T12:00:00.000,"Gerd, Lola Luc, Hugo Mendez, Charlie Smooth",Renate,/events/1051312,43
Eulennest #4,2018-01-26T00:00:00.000,2018-01-26T23:59:00.000,2018-01-27T08:00:00.000,"Solvane, Kikimike, Dachgeschoss, Edward Ean, Maurice Mino, Mr. Propellerhead, K.EULE, Better Call Paul, Aamcee",Burg Schnabel,/events/1049591,42
A Tribe Called Kotori,2018-01-26T00:00:00.000,2018-01-26T23:59:00.000,2018-01-27T10:00:00.000,"Mira, Be Svendsen, Niko Schwind, Wide Awake, Midas 104, Sam Shure, Aparde, Kuriose Naturale, Christopher Breuer",Mensch Meier,/events/1046462,35
Hairsweethair Music - Marcus Meinhardt / Empro / Jama / Stan Starry / Chris Schwarzwälder,2018-01-26T00:00:00.000,2018-01-26T23:59:00.000,2018-01-27T12:00:00.000,"Marcus Meinhardt, Empro, Stan Starry, Jama Deejay, Bud Dancer, Chris Schwarzwälder, Mia Kaltes",Kater Blau,/events/1047937,35
About:United,2018-01-26T00:00:00.000,2018-01-26T22:00:00.000,2018-01-27T10:00:00.000,"Anja Zaube, Filiz, Silva Rymd, Natascha Kann, Sevensol, Smilla",://about blank,/events/1053969,34
Turmoil Excess_ Vorspiel / Transmediale & CTM,2018-01-26T00:00:00.000,2018-01-26T20:00:00.000,2018-01-28T00:00:00.000,"Samin Son, Lvis Mejía, astvaldur",Modular+,/events/1059990,26
Friends.Zone mit Saša & AKIOKI,2018-01-26T00:00:00.000,2018-01-26T19:00:00.000,2018-01-27T06:00:00.000,"Saša, AKIOKI",Minimal Bar,/events/1041080,26
Duat,2018-01-26T00:00:00.000,2018-01-26T22:00:00.000,2018-01-27T06:00:00.000,"Franz Scala, Egyptian Lover",Anita Berber,/events/1046143,19
Random Repeat The Vfmm X lofile Edition,2018-01-26T00:00:00.000,2018-01-26T22:00:00.000,2018-01-27T07:00:00.000,"Marbod, Kai von Glasow",Paloma,/events/1048464,19
"Hainmat with Oscar OZZ, Paale, Schnurrsen & Compress, Centraz",2018-01-26T00:00:00.000,2018-01-26T23:59:00.000,2018-01-27T10:00:00.000,"Oscar OZZ, Schnurrsen",AVA Club,/events/1051157,17
Bold,2018-01-26T00:00:00.000,2018-01-26T23:59:00.000,2018-01-27T10:00:00.000,"Errorbeauty, Sabine Hoffmann",Lokschuppen Berlin,/events/1042373,17
Kookoo Feat. Rabih Beaini (Morphine),2018-01-26T00:00:00.000,2018-01-26T22:00:00.000,2018-01-27T07:00:00.000,"Rabih Beaini, Mieko Suzuki",OHM,/events/1036501,15
Infected - Drum & Bass / Techno feat. Commix (UK),2018-01-26T00:00:00.000,2018-01-26T23:00:00.000,2018-01-27T08:00:00.000,"Commix, Upzet, Honschu Lee",Void Club,/events/1059215,14
Eton Messy + Zimmer,2018-01-26T00:00:00.000,2018-01-26T23:30:00.000,2018-01-27T08:00:00.000,"Eton Messy, Delfonic",Gretchen,/events/1046935,11
Disco Spektrum with Kava,2018-01-26T00:00:00.000,2018-01-26T20:00:00.000,2018-01-27T06:00:00.000,,Crack Bellmer,/events/1059341,11
Tekno Repression,2018-01-26T00:00:00.000,2018-01-26T23:00:00.000,2018-01-27T08:00:00.000,"Ixindamix, Crystal Distortion, Jeff23, Circuit Element, Salvatore Foglia, Libere, Libere",Köpi,/events/1041555,10
BBB,2018-01-26T00:00:00.000,2018-01-26T23:00:00.000,2018-01-27T06:00:00.000,"Electrosexual, La Schmock",Untertage Berlin,/events/1056393,9
ein Freitag mit WE Are Now & Melon(Amsterdam),2018-01-26T00:00:00.000,2018-01-26T23:00:00.000,2018-01-27T07:00:00.000,Melon,Farbfernseher,/events/1056466,9
Acid Washed Opens Your Mind,2018-01-26T00:00:00.000,2018-01-26T23:00:00.000,2018-01-27T07:00:00.000,Acid Washed,Bohnengold,/events/1057501,9
"High On. with Markus Klee, Dj Lion",2018-01-26T00:00:00.000,2018-01-26T23:00:00.000,2018-01-27T06:00:00.000,"Markus Klee, Karel Nine",Weekend,/events/1052065,8
Highly Addictive,2018-01-26T00:00:00.000,2018-01-26T23:59:00.000,2018-01-27T10:00:00.000,"Ferdinand Dreyssig, Slurm McKenzie",Golden Gate,/events/1052342,7
Süss mit Tom Nowa; Marie Midori & Thomas Haak,2018-01-26T00:00:00.000,2018-01-26T19:00:00.000,2018-01-27T09:00:00.000,"Tom Nowa, Marie Midori, Thomas Haak",Süss War Gestern,/events/1062915,7
Johnny's Diggers Club,2018-01-26T00:00:00.000,2018-01-26T21:00:00.000,2018-01-27T04:00:00.000,Yan Kaylen,Repeat,/events/1063549,7
Tanzen ist Auch Sport,2018-01-26T00:00:00.000,2018-01-26T19:00:00.000,2018-01-27T08:00:00.000,"Mondee, David Silver, Davide Piras",Promenaden Eck,/events/1054172,6
Corrado Maria De Santis - Live,2018-01-26T00:00:00.000,2018-01-26T20:30:00.000,2018-01-26T22:00:00.000,Corrado Maria De Santis,Gelegenheiten,/events/1053468,5
Improvisational Synth Collective presents Jam & Solo Performance,2018-01-26T00:00:00.000,2018-01-26T20:00:00.000,2018-01-27T06:00:00.000,Bassinfected,Liquid Sky Berlin - #LSB02,/events/1055731,5
The Submarine Rave with Oliver Raumklang,2018-01-26T00:00:00.000,2018-01-26T23:59:00.000,2018-01-27T04:00:00.000,Oliver Raumklang,Cosmic Kaspar,/events/1060260,5
Leihhaus w/ Prins Emanuel & DJ Vegetable,2018-01-26T00:00:00.000,2018-01-26T23:00:00.000,2018-01-27T07:00:00.000,"Prins Emanuel, DJ Vegetable, Vio DJ",TBA - Berlin,/events/1058938,4
Don't Let Your Mother Know,2018-01-26T00:00:00.000,2018-01-26T22:00:00.000,2018-01-27T05:00:00.000,"Abribass, André Yenski, Ruman, Guillermo Monedero",Sauer Mutter,/events/1063678,4
Automaticamore,2018-01-26T00:00:00.000,2018-01-26T23:00:00.000,2018-01-27T07:00:00.000,"Octave, Cmd Tulch, Hank Clap",Beate Uwe,/events/1060422,3
Spacemountain,2018-01-26T00:00:00.000,2018-01-26T22:00:00.000,2018-01-27T06:00:00.000,,Paloma,/events/1063062,3
Vintage Session: Sraunus Live,2018-01-26T00:00:00.000,2018-01-26T17:00:00.000,2018-01-26T19:00:00.000,,Humana,/events/1041940,3
Plastic,2018-01-26T00:00:00.000,2018-01-26T23:00:00.000,2018-01-27T08:00:00.000,"Prosumer, Paolo Di Nola, Shingo Suwa, Rui Ho, Tchuani",Schwuz,/events/1058525,2
Kairòs,2018-01-26T00:00:00.000,2018-01-26T22:00:00.000,2018-01-27T07:00:00.000,"Assal, KAYYAK",60 Hz,/events/1060840,2
Ladies Night,2018-01-26T00:00:00.000,2018-01-26T23:00:00.000,2018-01-27T06:00:00.000,"Paul Wolf, Till Krimsen",Soda Club,/events/1050759,1
Angel-in-Bondage,2018-01-26T00:00:00.000,2018-01-26T22:00:00.000,2018-01-27T06:00:00.000,,Insomnia,/events/1060154,1
Forever Young,2018-01-26T00:00:00.000,2018-01-26T23:00:00.000,2018-01-27T06:00:00.000,,Cassiopeia,/events/1061374,1
Erik Cohen,2018-01-26T00:00:00.000,2018-01-26T20:00:00.000,2018-01-27T22:00:00.000,,Cassiopeia,/events/1061379,1
Mila Stern Jubilee Tummetott Olmost&bene Sudden Beach,2018-01-26T00:00:00.000,2018-01-26T23:00:00.000,2018-01-27T08:00:00.000,"Mila Stern, Tummetott, Sudden Beach",Kultstätte Keller,/events/1062532,1
Station Paradox Opening,2018-01-26T00:00:00.000,2018-01-26T19:00:00.000,2018-01-26T23:00:00.000,,Kunstquartier Bethanien,/events/1064194,1
CTM Festival 2019 – Persistence,2018-01-25T00:00:00.000,2018-01-25T20:00:00.000,2018-02-03T23:59:00.000,"700 BLISS, 9T Antiope, Rainer, Actress, Colin Self, Dj Haram, Eartheater, Gazelle Twin, Kai Whiston, Lotic, Rabih Beaini, Temp-Illusion, Thomas Ankersmit, Tirzah, Yves Tumor",TBA - Berlin,/events/1183691,1
No Tek No Caribbean Soli Bass Party,2018-01-26T00:00:00.000,2018-01-26T22:00:00.000,2018-01-27T07:00:00.000,"MOR0, Mobilegirl, Lamin Fofana, DJ Zhao",Panke,/events/1062381,0
"Music Lab with Eagles & Butterflies, Justin Massei & More",2018-01-26T00:00:00.000,2018-01-26T23:59:00.000,2018-01-27T10:00:00.000,"Eagles & Butterflies, Justin Massei, Ma.to, Chris Knipp, Martin Ka, Dojas",Chalet,/events/1051336,82
Pornceptual Magazine Launch #3,2018-01-27T00:00:00.000,2018-01-27T21:00:00.000,2018-01-28T06:00:00.000,"Projekt Gestalten, Sciarada",Humboldt Terrassen,/events/1048474,344
Stil Vor Talent's Winter Warmer,2018-01-27T00:00:00.000,2018-01-27T23:00:00.000,2018-01-28T10:00:00.000,"Oliver Koletzki, Super Flu, Frankey & Sandrino, Secret Cinema, KlangKuenstler, Teenage Mutants, Fideles, Yetti Meißner, Channel X, Several Definitions, Björn Störig, Marc Holstege",Ritter Butzke,/events/1046535,301
Klubnacht,2018-01-27T00:00:00.000,2018-01-27T23:59:00.000,2018-01-29T06:00:00.000,"Fiedel, Boris, Electric Indigo, Espen Lauritzen, Jay Clarke, Ron Albrecht, rRoxymore, Stefan Rein, Leo Pol, Âme, Alinka, Heidi, Honey Dijon, Maya Jane Coles, Nick Höppner, Roi Perez",Berghain | Panorama Bar | Säule,/events/1047387,187
Exquisite Feierei,2018-01-27T00:00:00.000,2018-01-27T23:59:00.000,2018-01-28T15:00:00.000,"Derek Plaslaiko, Ewan Pearson, Ian Pooley, Lilly Deupré, Magda El Bayoumi, Michael Placke, Robert Owens",Lokschuppen Berlin,/events/1044146,158
CTM Festival 2018,2018-01-26T00:00:00.000,2018-01-26T21:00:00.000,2018-02-04T23:59:00.000,"Amenra, Cevdet Erek, DJ Panic, Rashad Becker, Pan Daijing, Ian Helliwell, Jace Clayton, Jana Rush, Kablam, Medusa's Bed, Nadah El Shazly, Schwefelgelb, Swan Meat, Boys Noize, George E. Lewis, Scott Kelly, Antwood, Bad Gyal, Batu, Cuntroaches, Errorsmith, HAJ300, Hanin Elias, HDMIRROR, Hyph11E, Jason Hou, JASSS, Kilbourne, Lakuti, Marc Acardipane, Marcus Schmickler, NAKED (UK), Nene H, Nihiloxica, Okkyung Lee, Olivia, Perel, Pixelord, RoxXxan, Sounds of Sisso, Borusiade, Celestial Trax, Colleen, Recondite, Occult, Drew McDowall, Elena Colombi, Esa, Holly Herndon, James Ferraro, Jessica Ekomane, Jlin, Lotic, Lucrecia Dalt, Perera Elsewhere, Special Request, Uta, Wixapol S.A., Equiknoxx, Shanique Marie, Hitmakerchinx, Hunni'd Jaws, Albertine Sarges, DJ Heroin, houaïda, Josa Peit, Lamin Fofana, Laurel Halo, Marshall Vincent, RAMZi, 33EMYBW, Born in Flamez, FAKA, Flava D, DJ Storm, COUCOU CHLOE, Shygirl, Sega Bodega, Soda Plains, DAF, Bestial Mouths, GAIKA, John Connell, Lawrence Lek, ZULI, Kangding Ray",TBA - Berlin,/events/1032695,105
"Fier 1 // Mark Fell Live, Black Merlin, Orson Wells, DJ Swagger",2018-01-27T00:00:00.000,2018-01-27T23:59:00.000,2018-01-28T12:00:00.000,"Mark Fell, Merlin, DJ Swagger, Chino, Essika, Monsanto High, DJ Fart in the Club",://about blank,/events/1053436,100
Staub,2018-01-27T00:00:00.000,2018-01-27T10:00:00.000,2018-01-27T22:00:00.000,,://about blank,/events/1044072,91
Disconnekt x Griessmuehle,2018-01-26T00:00:00.000,2018-01-26T22:00:00.000,2018-01-27T22:00:00.000,"Makaton, Dimi Angelis, Reflec, Gaja, Francesco De Luca, Christian Rütz, MXM, Juerga, TRACKs, Cristian Marras, Hannah Addams, Stallo",Griessmuehle,/events/1050905,84
"Schnabelhaft with Dole & Kom, Asem Shama, Lars Moston, A.D.H.S uvm",2018-01-27T00:00:00.000,2018-01-27T23:59:00.000,2018-01-28T12:00:00.000,"Dole & Kom, Asem Shama, Lars Moston, Schmitzkatzki",Burg Schnabel,/events/1052796,59
"DUAT West Berlin Rave with Lady Starlight, DJ Deep, Christopher Rau",2018-01-27T00:00:00.000,2018-01-27T23:00:00.000,2018-01-28T15:00:00.000,"Lady Starlight, DJ Deep, Christopher Rau, Amin Fallaha, Andrejko, R100, Paralysis",Ku'damm Karree,/events/1057620,57
"Griessmuehle w./ Dexter, Gene Hunt, Elbee BaD, Suerte & More",2018-01-27T00:00:00.000,2018-01-27T22:00:00.000,2018-01-28T18:00:00.000,"Gene Hunt, Elbee Bad, Attila, Tomtomgroove, Dexter, Suerte, Prantel, Guim Lebowski, Guim, -nico-, RNXRX",Griessmuehle,/events/1053170,43
"Oben Unten Überall /w. Aera, A Sagittariun, Manamana & More",2018-01-27T00:00:00.000,2018-01-27T23:59:00.000,2018-01-28T12:00:00.000,"A Sagittariun, Jamaica Suk, Sabine Hoffmann, Aera, Manamana, Kris Baha, Toby Tobias, Soft Rocks, Pellegrino",Renate,/events/1050860,41
Tresor Meets Cabinet,2018-01-27T00:00:00.000,2018-01-27T23:59:00.000,2018-01-28T12:00:00.000,"Cab Drivers, DJ Honesty, Nick Beringer, Ed Herbst, Cari Lekebusch, Dinamite, TAG",Tresor / Globus,/events/1051844,40
Eastenderz - East End Dubs / Priku / Georgia Girl / Alexi Delano / Dada Disco / GummiHz,2018-01-27T00:00:00.000,2018-01-27T23:59:00.000,2018-01-29T23:00:00.000,"Georgia Girl, East End Dubs, Priku, Mental Carnival, Mimi Love, Tom Clark, Riko Forinson, Daniel Dreier, Guido Schneider, Miro Pajic, Alex Monster, Alexi Delano, Rollover Djs, Dada Disco, Mutlu, Fanfarrosa, Heimlich Knüller, The Sorry Entertainers, Mona Moore, Chus Jodar, Carlo, GummiHz",Kater Blau,/events/1051862,34
Khwat خوات ‎: A Benefit for our Queer Family in Egypt,2018-01-27T00:00:00.000,2018-01-27T20:00:00.000,2018-01-28T23:59:00.000,"Colin Self, La Fraicheur, Ady Toledano, AUCO",Renate,/events/1060450,27
Sturmfrei mit Rodrigo (Porridge Hilton) & Freunde,2018-01-27T00:00:00.000,2018-01-27T19:00:00.000,2018-01-28T06:00:00.000,,Minimal Bar,/events/1041081,27
Turmoil Excess_ Vorspiel / Transmediale & CTM,2018-01-26T00:00:00.000,2018-01-26T20:00:00.000,2018-01-28T00:00:00.000,"Samin Son, Lvis Mejía, astvaldur",Modular+,/events/1059990,26
Rise,2018-01-27T00:00:00.000,2018-01-27T23:59:00.000,2018-01-28T11:00:00.000,"Rancido, Hyenah, Pablo Fierro, MoBlack, Dede, MINCO, Mista Wallizz",Watergate,/events/1049612,24
Redlight Night,2018-01-27T00:00:00.000,2018-01-27T20:00:00.000,2018-01-28T06:00:00.000,"Javier Logares, Denite, Marc Brauner",Crack Bellmer,/events/1062049,22
Deja Groove Nº2,2018-01-27T00:00:00.000,2018-01-27T23:59:00.000,2018-01-28T10:00:00.000,"LtDan, Moji Taali, Moji, Olsvangèr, Oska, Tropikal Camel",Mensch Meier,/events/1048386,21
Free Party - Drum & Bass / Techno,2018-01-27T00:00:00.000,2018-01-27T23:00:00.000,2018-01-28T08:00:00.000,"Upzet, Yves Meyer, Modulatos, Tomax",Void Club,/events/1059216,17
Power House,2018-01-27T00:00:00.000,2018-01-27T23:30:00.000,2018-01-28T07:00:00.000,"Boris Dlugosch, Finn Johannsen",Paloma,/events/1052289,15
Bar Noir with Franz Scala,2018-01-27T00:00:00.000,2018-01-27T23:00:00.000,2018-01-28T07:00:00.000,Franz Scala,Bohnengold,/events/1053229,12
Carlos de Brito Invites...Gunther,2018-01-27T00:00:00.000,2018-01-27T23:00:00.000,2018-01-28T07:00:00.000,"Gunther, Monday Edition, Carlos de Brito",Farbfernseher,/events/1056463,11
Der Osten Ist Rot - a Tribute to Holger Czukay,2018-01-27T00:00:00.000,2018-01-27T20:00:00.000,2018-01-28T06:00:00.000,"Sheldon Drake, HprScl3, Dr Walker",Liquid Sky Berlin - #LSB02,/events/1055729,10
"Süss mit Diana May, Ksenia Kamikaza, Karsten Schmidt & fujiKATO",2018-01-27T00:00:00.000,2018-01-27T19:00:00.000,2018-01-28T09:00:00.000,"Diana May, fujiKATO, Karsten Schmidt, Ksenia Kamikaza",Süss War Gestern,/events/1062917,8
Skalar - Art Exhibition,2018-01-27T00:00:00.000,2018-01-27T13:00:00.000,2018-01-27T23:00:00.000,Kangding Ray,Kraftwerk Berlin,/events/1064243,8
All Night with Andi de Luxe and Relent,2018-01-27T00:00:00.000,2018-01-27T19:00:00.000,2018-01-28T08:00:00.000,"Andi de Luxe, Relent",Promenaden Eck,/events/1054173,7
Kellergedeck with Compañero Carlo and Habla De Mi En presente,2018-01-27T00:00:00.000,2018-01-27T20:45:00.000,2018-01-28T07:00:00.000,"Mirco Niemeier, BOHO, Seyed Key",Kultstätte Keller,/events/1054458,7
Gimme Moritz 2018 - Queer Wedding Subculture,2018-01-27T00:00:00.000,2018-01-27T23:59:00.000,2018-01-28T09:00:00.000,Haddock,Humboldthain Club,/events/1055870,7
"Acud Club with Mai Nestor, Ron van de Kerkhof, Jeroen Vermandere, Imbet, J. Eickhoff",2018-01-27T00:00:00.000,2018-01-27T22:00:00.000,2018-01-28T05:00:00.000,,Acud Macht NEU,/events/1057529,6
BASTA! Party,2018-01-27T00:00:00.000,2018-01-27T23:00:00.000,2018-01-28T05:00:00.000,Tapes,Sameheads,/events/1047586,5
Moles,2018-01-27T00:00:00.000,2018-01-27T10:00:00.000,2018-01-27T23:59:00.000,"Tom Eichhagen, Tino Tranquilo",Golden Gate,/events/1056621,5
Fish 'n' Slips,2018-01-27T00:00:00.000,2018-01-27T23:59:00.000,2018-01-28T10:00:00.000,The Chosen Two,Golden Gate,/events/1056623,4
Janis / Hakim Guelmi - Vernissage by Adèle Simon,2018-01-27T00:00:00.000,2018-01-27T20:30:00.000,2018-01-28T06:00:00.000,"Janis Plasmatik, Hakim Guelmi",HRD Bar,/events/1059358,4
Sowasvon Responsive #4,2018-01-27T00:00:00.000,2018-01-27T23:00:00.000,2018-01-28T08:00:00.000,"TAUBE, DJ Jetski, Decalculator, Steven Maff",Anita Berber,/events/1059889,4
MONOM x SSI x CTM 2018 Pres. Noqturnl (German Premiere),2018-01-27T00:00:00.000,2018-01-27T22:00:00.000,2018-01-28T07:30:00.000,John Connell,MONOM,/events/1048538,3
Vintage Session: Sraunus Live,2018-01-27T00:00:00.000,2018-01-27T17:00:00.000,2018-01-27T19:00:00.000,,Humana Second Hand Frankfurter Tor,/events/1041943,3
Balearic Beats Berlin,2018-01-27T00:00:00.000,2018-01-27T18:00:00.000,2018-01-28T03:00:00.000,,Solar,/events/1056315,2
Proxi Club,2018-01-27T00:00:00.000,2018-01-27T23:00:00.000,2018-01-28T08:00:00.000,"Daito, Balas",Schwuz,/events/1058522,2
Disordered with Sven Sossong,2018-01-27T00:00:00.000,2018-01-27T23:59:00.000,2018-01-28T10:00:00.000,"Sven Sossong, Tom Marten, Klangpusch, LEX RAM, Vanice",Der Weiße Hase,/events/1059790,2
Eclectic Culture presents Nouvelle Ambiance Labelnight,2018-01-27T00:00:00.000,2018-01-27T22:00:00.000,2018-01-28T06:00:00.000,"Hugo Mendez, DJ Nomad, Nikos",Panke,/events/1062753,2
Dirty Reggae & Dub Alnighter,2018-01-27T00:00:00.000,2018-01-27T22:00:00.000,2018-01-28T03:00:00.000,Bebek,Schillingbar,/events/1063060,2
High Fidelity Club,2018-01-27T00:00:00.000,2018-01-27T23:00:00.000,2018-01-28T06:00:00.000,MARCEL db,Soda Club,/events/1050768,1
Frrruity#6 by The Real Housewives of Neukölln,2018-01-27T00:00:00.000,2018-01-27T23:00:00.000,2018-01-28T07:00:00.000,Collapsella,Rosi's,/events/1051805,1
#Gönndir with Manu Crook$ (AUS) & Fruchtmax Live,2018-01-27T00:00:00.000,2018-01-27T23:00:00.000,2018-01-28T07:00:00.000,Raw D,Musik & Frieden,/events/1056778,1
Dominique's Birthday Bizarre,2018-01-27T00:00:00.000,2018-01-27T22:00:00.000,2018-01-28T06:00:00.000,,Insomnia,/events/1060156,1
Erik Cohen,2018-01-26T00:00:00.000,2018-01-26T20:00:00.000,2018-01-27T22:00:00.000,,Cassiopeia,/events/1061379,1
Wolf City Winter Fest,2018-01-27T00:00:00.000,2018-01-27T14:00:00.000,2018-01-28T02:00:00.000,,Cassiopeia,/events/1061382,1
Open Your Mind,2018-01-27T00:00:00.000,2018-01-27T23:00:00.000,2018-01-28T07:00:00.000,C.K,Paloma,/events/1063160,1
Koalafied Sounds,2018-01-27T00:00:00.000,2018-01-27T22:00:00.000,2018-01-28T03:00:00.000,Marcel da Kinky Koala,Apartment Bar,/events/1064798,1
After Party Shred Expo,2018-01-27T00:00:00.000,2018-01-27T21:30:00.000,2018-01-28T06:15:00.000,Phat Beat,Neues Schauspiel Leipzig,/events/1065586,1
CTM Festival 2019 – Persistence,2018-01-25T00:00:00.000,2018-01-25T20:00:00.000,2018-02-03T23:59:00.000,"700 BLISS, 9T Antiope, Rainer, Actress, Colin Self, Dj Haram, Eartheater, Gazelle Twin, Kai Whiston, Lotic, Rabih Beaini, Temp-Illusion, Thomas Ankersmit, Tirzah, Yves Tumor",TBA - Berlin,/events/1183691,1
Vinyl Rarities by Pakalolo Soundlab,2018-01-27T00:00:00.000,2018-01-27T21:00:00.000,2018-01-28T01:00:00.000,"Dieta Berliner, Frau Rossi",Sofitel Kurfürstendamm,/events/1100660,1
Walter Glasshouse – Detroit-Special,2018-01-27T00:00:00.000,2018-01-27T22:00:00.000,2018-01-28T06:00:00.000,Walter Glasshouse,Eschschloraque,/events/1056713,0
"Clubnight with Dinky, Lowris, Sofia Kourtesis & More",2018-01-27T00:00:00.000,2018-01-27T23:59:00.000,2018-01-28T10:00:00.000,"Dinky, Lowris, Sofia Kourtesis, Studio Barnhus, Dario (DE), Andrea Di Rocco, Ianic",Chalet,/events/1055358,70
Klubnacht,2018-01-27T00:00:00.000,2018-01-27T23:59:00.000,2018-01-29T06:00:00.000,"Fiedel, Boris, Electric Indigo, Espen Lauritzen, Jay Clarke, Ron Albrecht, rRoxymore, Stefan Rein, Leo Pol, Âme, Alinka, Heidi, Honey Dijon, Maya Jane Coles, Nick Höppner, Roi Perez",Berghain | Panorama Bar | Säule,/events/1047387,187
CTM Festival 2018,2018-01-26T00:00:00.000,2018-01-26T21:00:00.000,2018-02-04T23:59:00.000,"Amenra, Cevdet Erek, DJ Panic, Rashad Becker, Pan Daijing, Ian Helliwell, Jace Clayton, Jana Rush, Kablam, Medusa's Bed, Nadah El Shazly, Schwefelgelb, Swan Meat, Boys Noize, George E. Lewis, Scott Kelly, Antwood, Bad Gyal, Batu, Cuntroaches, Errorsmith, HAJ300, Hanin Elias, HDMIRROR, Hyph11E, Jason Hou, JASSS, Kilbourne, Lakuti, Marc Acardipane, Marcus Schmickler, NAKED (UK), Nene H, Nihiloxica, Okkyung Lee, Olivia, Perel, Pixelord, RoxXxan, Sounds of Sisso, Borusiade, Celestial Trax, Colleen, Recondite, Occult, Drew McDowall, Elena Colombi, Esa, Holly Herndon, James Ferraro, Jessica Ekomane, Jlin, Lotic, Lucrecia Dalt, Perera Elsewhere, Special Request, Uta, Wixapol S.A., Equiknoxx, Shanique Marie, Hitmakerchinx, Hunni'd Jaws, Albertine Sarges, DJ Heroin, houaïda, Josa Peit, Lamin Fofana, Laurel Halo, Marshall Vincent, RAMZi, 33EMYBW, Born in Flamez, FAKA, Flava D, DJ Storm, COUCOU CHLOE, Shygirl, Sega Bodega, Soda Plains, DAF, Bestial Mouths, GAIKA, John Connell, Lawrence Lek, ZULI, Kangding Ray",TBA - Berlin,/events/1032695,105
Eastenderz - East End Dubs / Priku / Georgia Girl / Alexi Delano / Dada Disco / GummiHz,2018-01-27T00:00:00.000,2018-01-27T23:59:00.000,2018-01-29T23:00:00.000,"Georgia Girl, East End Dubs, Priku, Mental Carnival, Mimi Love, Tom Clark, Riko Forinson, Daniel Dreier, Guido Schneider, Miro Pajic, Alex Monster, Alexi Delano, Rollover Djs, Dada Disco, Mutlu, Fanfarrosa, Heimlich Knüller, The Sorry Entertainers, Mona Moore, Chus Jodar, Carlo, GummiHz",Kater Blau,/events/1051862,34
Sonntagsinstitut x Delusion,2018-01-28T00:00:00.000,2018-01-28T10:00:00.000,2018-01-28T20:00:00.000,"Reasnd, Scripted, Stefan Tews, Lupaal",Arena Club,/events/1055952,31
Lazy.Sunday mit Ian Fog,2018-01-28T00:00:00.000,2018-01-28T19:00:00.000,2018-01-29T05:00:00.000,,Minimal Bar,/events/1041083,28
Khwat خوات ‎: A Benefit for our Queer Family in Egypt,2018-01-27T00:00:00.000,2018-01-27T20:00:00.000,2018-01-28T23:59:00.000,"Colin Self, La Fraicheur, Ady Toledano, AUCO",Renate,/events/1060450,27
Wild at Gate - Afterhours and More,2018-01-28T00:00:00.000,2018-01-28T10:00:00.000,2018-01-28T23:59:00.000,"Chorris, Suit Kei, Black Lotus, Lilithh, Arkadia Alpha",Golden Gate,/events/1048407,25
Sunday Groove with Tobi Soul,2018-01-28T00:00:00.000,2018-01-28T19:00:00.000,2018-01-29T04:00:00.000,Tobi Soul,Promenaden Eck,/events/1053834,7
Nachspiel Sunday-Night-Club,2018-01-28T00:00:00.000,2018-01-28T23:00:00.000,2018-01-29T08:00:00.000,LadyBird aka C.J. Parker,KitKatClub,/events/1048576,4
Beate Barfuß,2018-01-28T00:00:00.000,2018-01-28T18:00:00.000,2018-01-29T04:00:00.000,"Luis Rosenberg, ZUURB",Beate Uwe,/events/1057212,4
Skalar - Art Exhibition,2018-01-28T00:00:00.000,2018-01-28T13:00:00.000,2018-01-28T23:00:00.000,Kangding Ray,Kraftwerk Berlin,/events/1064521,4
Music & Art in Techno we Trust # 1,2018-01-28T00:00:00.000,2018-01-28T23:00:00.000,2018-01-29T10:00:00.000,"Nicorus, Shlomsen",Lokschuppen Berlin,/events/1065497,3
Roller Disco Café,2018-01-28T00:00:00.000,2018-01-28T14:00:00.000,2018-01-28T19:00:00.000,Rollers HiFi,Wonder Ballroom,/events/1059511,2
GMF 0128,2018-01-28T00:00:00.000,2018-01-28T23:00:00.000,2018-01-29T06:00:00.000,Larry Tee,GMF,/events/1058756,1
Sunday Selection,2018-01-28T00:00:00.000,2018-01-28T23:30:00.000,2018-01-29T06:00:00.000,,Cassiopeia,/events/1061386,1
SYN by Anna Stereopoulou - Berlin Premiere,2018-01-28T00:00:00.000,2018-01-28T19:00:00.000,2018-01-28T21:00:00.000,Anna Stereopoulou,"Ohrenhoch, der Geräuschladen",/events/1064065,1
House Of Coito - The Fruit Of Desire,2018-01-28T00:00:00.000,2018-01-28T22:30:00.000,2018-01-29T06:30:00.000,Jungle Mind,Ficken 3000,/events/1064089,1
Dub Isotope: Low Kinetic,2018-01-28T00:00:00.000,2018-01-28T21:00:00.000,2018-01-29T00:30:00.000,Dub Isotope,Wendel,/events/1065421,1
CTM Festival 2019 – Persistence,2018-01-25T00:00:00.000,2018-01-25T20:00:00.000,2018-02-03T23:59:00.000,"700 BLISS, 9T Antiope, Rainer, Actress, Colin Self, Dj Haram, Eartheater, Gazelle Twin, Kai Whiston, Lotic, Rabih Beaini, Temp-Illusion, Thomas Ankersmit, Tirzah, Yves Tumor",TBA - Berlin,/events/1183691,1
CTM Festival 2018,2018-01-26T00:00:00.000,2018-01-26T21:00:00.000,2018-02-04T23:59:00.000,"Amenra, Cevdet Erek, DJ Panic, Rashad Becker, Pan Daijing, Ian Helliwell, Jace Clayton, Jana Rush, Kablam, Medusa's Bed, Nadah El Shazly, Schwefelgelb, Swan Meat, Boys Noize, George E. Lewis, Scott Kelly, Antwood, Bad Gyal, Batu, Cuntroaches, Errorsmith, HAJ300, Hanin Elias, HDMIRROR, Hyph11E, Jason Hou, JASSS, Kilbourne, Lakuti, Marc Acardipane, Marcus Schmickler, NAKED (UK), Nene H, Nihiloxica, Okkyung Lee, Olivia, Perel, Pixelord, RoxXxan, Sounds of Sisso, Borusiade, Celestial Trax, Colleen, Recondite, Occult, Drew McDowall, Elena Colombi, Esa, Holly Herndon, James Ferraro, Jessica Ekomane, Jlin, Lotic, Lucrecia Dalt, Perera Elsewhere, Special Request, Uta, Wixapol S.A., Equiknoxx, Shanique Marie, Hitmakerchinx, Hunni'd Jaws, Albertine Sarges, DJ Heroin, houaïda, Josa Peit, Lamin Fofana, Laurel Halo, Marshall Vincent, RAMZi, 33EMYBW, Born in Flamez, FAKA, Flava D, DJ Storm, COUCOU CHLOE, Shygirl, Sega Bodega, Soda Plains, DAF, Bestial Mouths, GAIKA, John Connell, Lawrence Lek, ZULI, Kangding Ray",TBA - Berlin,/events/1032695,105
Electric Monday,2018-01-29T00:00:00.000,2018-01-29T23:00:00.000,2018-01-30T07:00:00.000,Frankie Flowerz,KitKatClub,/events/1043801,36
Eastenderz - East End Dubs / Priku / Georgia Girl / Alexi Delano / Dada Disco / GummiHz,2018-01-27T00:00:00.000,2018-01-27T23:59:00.000,2018-01-29T23:00:00.000,"Georgia Girl, East End Dubs, Priku, Mental Carnival, Mimi Love, Tom Clark, Riko Forinson, Daniel Dreier, Guido Schneider, Miro Pajic, Alex Monster, Alexi Delano, Rollover Djs, Dada Disco, Mutlu, Fanfarrosa, Heimlich Knüller, The Sorry Entertainers, Mona Moore, Chus Jodar, Carlo, GummiHz",Kater Blau,/events/1051862,34
