POSTPONED! Hedomanie: An Adult Playground: Hedonistic Playparty,2021-10-14T00:00:00.000,2021-10-14T20:00:00.000,2021-10-15T06:00:00.000,"Dr Double U, BEXA, Deaf Can Dance, Martin Fuego",Insomnia,/events/1470329,6
KMRU,2021-10-14T00:00:00.000,2021-10-14T20:00:00.000,2021-10-14T21:30:00.000,KMRU,Volksbühne,/events/1463619,6
Move Forward,2021-10-14T00:00:00.000,2021-10-14T22:00:00.000,2021-10-15T06:00:00.000,"Dugong, Walden S",Paloma,/events/1466207,4
Unter Uns #2,2021-10-14T00:00:00.000,2021-10-14T21:00:00.000,2021-10-15T04:30:00.000,"Ramî, Jay Jory",Repeat,/events/1470969,2
Disko Donnerstag im Promenaden Eck,2021-10-14T00:00:00.000,2021-10-14T21:00:00.000,2021-10-15T04:00:00.000,Alexander Paulski,Promenaden Eck,/events/1471858,2
Electronic.Thursday mit Wojtech,2021-10-14T00:00:00.000,2021-10-14T18:00:00.000,2021-10-15T04:00:00.000,,Minimal Bar,/events/1467241,1
Konzert The Disorientalists: Who Was Essad Bey,2021-10-14T00:00:00.000,2021-10-14T20:00:00.000,2021-10-14T22:00:00.000,,Kaho,/events/1470721,1
Berlin Vienna Connection,2021-10-14T00:00:00.000,2021-10-14T21:00:00.000,2021-10-15T05:00:00.000,,Old CCCP,/events/1471881,1
"Voxnox with Tommy Four Seven, RIKHTER, Kaiser, Alva b2b Lucinee, Sept b2b DLV, Quelza",2021-10-15T00:00:00.000,2021-10-15T23:00:00.000,2021-10-16T12:00:00.000,"Tommy Four Seven, RIKHTER, Kaiser (K S R), Sept, DLV, Alva, Lucinee, Melanie Havens, Quelza, Reka Zalan, future.666, Not Modest",Anomalie Art Club,/events/1466994,1465
"Ryan James Ford, IDA, Mountain People, Fantastic Man",2021-10-15T00:00:00.000,2021-10-15T22:00:00.000,2021-10-16T10:00:00.000,"Ady Toledano, Ethel, Fantastic Man, IDA, Michal Zietara, Mountain People, Ryan James Ford, Tapefeed, Telephones",Renate,/events/1471229,584
Girls Town - After Work Pride,2021-10-15T00:00:00.000,2021-10-15T17:00:00.000,2021-10-16T00:30:00.000,,Sage Beach Berlin,/events/1462229,477
Signals Festival 2021,2021-10-15T00:00:00.000,2021-10-15T14:00:00.000,2021-10-17T02:00:00.000,"Alys, Appleblim, BoLs/sLoB, elisanyhm, Emme.XM, Gina Lo, Felipe Vareschi, Alessandro Adriani, MISTICA, Menion, Gina Lo, Felipe Vareschi, Gisèle, Pablo Diserens, Peter Kirn, Akkamiau",Funkhaus Berlin,/events/1467007,198
"DURCH x 740 with Haedes, Métaraph, hybral, Aneed, Ecstasya & Karl Schwarz",2021-10-15T00:00:00.000,2021-10-15T22:00:00.000,2021-10-16T10:00:00.000,"Karl Schwarz, Ecstasya, Aneed, Metaraph, hybral",Köpenicker Strasse 18,/events/1467664,187
"Daemon + False Prpht, Bungalovv, I-VYE",2021-10-15T00:00:00.000,2021-10-15T20:00:00.000,2021-10-16T02:00:00.000,Bungalovv,Trauma Bar und Kino,/events/1470548,168
OG Psytrance x DnB Rave 04 (2G),2021-10-15T00:00:00.000,2021-10-15T21:00:00.000,2021-10-16T05:00:00.000,"Mad Hattress, Yami, Just Mo, ABuDi",Jockel Biergarten,/events/1469481,124
Trnsm:n Berlin #21,2021-10-15T00:00:00.000,2021-10-15T23:00:00.000,2021-10-16T09:00:00.000,"Artik, BEXA, Exterminador, Francesco Di Marco, Slak",Lokschuppen Berlin,/events/1470677,124
Awkwardly Social // Awk003 Record Release Party,2021-10-15T00:00:00.000,2021-10-15T23:00:00.000,2021-10-16T08:00:00.000,"Blume, Elke, J.Wiltshire, Lårry, cheng nwsh",Fitzroy,/events/1468559,97
The Disco Express: Berlin,2021-10-15T00:00:00.000,2021-10-15T20:00:00.000,2021-10-16T03:00:00.000,"Bustin' Loose, Eva Crystaltips, Nephews",Repeat,/events/1460064,96
Fred Frith & Anıl Eraslan Duo Richard Scott,2021-10-15T00:00:00.000,2021-10-15T20:00:00.000,2021-10-16T04:00:00.000,,arkaoda Berlin,/events/1469869,71
"Birgits Clubnacht with Kaufmann, Namito & More",2021-10-15T00:00:00.000,2021-10-15T22:00:00.000,2021-10-16T08:00:00.000,"maltech, OELEX, Namito, Kaufmann, Kaspar Krug",Birgit,/events/1471361,63
Borderless Pres. Berlin X São Paulo,2021-10-15T00:00:00.000,2021-10-15T22:00:00.000,2021-10-16T08:00:00.000,"Mau Mau, Renato Cohen, Nina Berg, TIKOA, ANAKLAV, Stephan Licha",AVA Club,/events/1471174,49
Namaka @Metropol,2021-10-15T00:00:00.000,2021-10-15T18:00:00.000,2021-10-17T10:00:00.000,"Bäggy, Carina Posse, Fabian Vieregge, Giovanna, Intaktogene, Jaamann, Ju/lien, Katzengold, Katzengold, Louis Harshman, maltech, Maurice Mino, Millie Forsberg, Bonq, Mona Moore, No.TFS, OELEX, PaKKo&Joy, Pakko, Pascale Voltaire, Sambaké, Sarah Hauser, Sebastian Ludvig, Solink, Son of Adria, Steven Shade, Till Antonio, Uzhas38, Forma Tenebra, San Regret, Yetti Meißner",Metropol,/events/1463014,49
Roof Booking Berlin,2021-10-15T00:00:00.000,2021-10-15T23:59:00.000,2021-10-16T12:00:00.000,"Enrica Falqui, Max Vaahs, Quest",Hoppetosse,/events/1470995,35
hra x Sektgarten,2021-10-15T00:00:00.000,2021-10-15T18:00:00.000,2021-10-15T22:00:00.000,"Anterist, piater., Whitley",://about blank,/events/1471630,31
Space Olympics - Earth Edition,2021-10-15T00:00:00.000,2021-10-15T22:00:00.000,2021-10-16T08:00:00.000,"DJ Jetski, Magic Nenio, Phil Paruschke, SUONI CHIARI, SELESSA T., Space Cabaret, Straight Marvin, TAUBE",Anita Berber,/events/1468983,30
"Nachtklub: Mathew Jonson, Robag Wruhme, Eluize, Dani Ramos, Lewin Paul",2021-10-15T00:00:00.000,2021-10-15T23:59:00.000,2021-10-16T12:00:00.000,"Mathew Jonson, Robag Wruhme, Eluize, Dani Ramos, Lewin Paul",Watergate,/events/1469640,28
Lexer at Ritter Butzke,2021-10-15T00:00:00.000,2021-10-15T23:00:00.000,2021-10-16T07:00:00.000,"Lexer, Julian Wassermann, Stefanie Raschke, Pascale Voltaire",Ritter Butzke,/events/1470779,25
"Æ Freitag: Skudge (Live), Lily Ackerman, Stojche, Oskar",2021-10-15T00:00:00.000,2021-10-15T22:00:00.000,2021-10-16T08:00:00.000,"Skudge, Lily Ackerman, Stojche, OSKAR.",ÆDEN,/events/1470371,22
"Druffaloma - Blood, Sweat & Beers",2021-10-15T00:00:00.000,2021-10-15T22:00:00.000,2021-10-16T07:00:00.000,"Filippo Moscatello, Finn Johannsen",Paloma,/events/1465291,18
"Tom Invites Victor, MAENDI",2021-10-15T00:00:00.000,2021-10-15T22:00:00.000,2021-10-16T08:00:00.000,"MAENDI, Victor (DE), Tom.",Paloma,/events/1468655,16
Italo Disco - 4th Anniversary,2021-10-15T00:00:00.000,2021-10-15T22:00:00.000,2021-10-16T08:00:00.000,"Jungle Mind, Maltitz, mybachdisco",Ficken 3000,/events/1469377,16
"Smerz, Vilde Tuv",2021-10-15T00:00:00.000,2021-10-15T21:00:00.000,2021-10-15T22:30:00.000,,Volksbühne,/events/1463589,12
Finster/Doll,2021-10-15T00:00:00.000,2021-10-15T23:00:00.000,2021-10-16T06:00:00.000,"Tvísker, katerpan",Beate Uwe,/events/1466543,10
The Herbaliser / Cancelled,2021-10-15T00:00:00.000,2021-10-15T19:30:00.000,2021-10-15T23:30:00.000,The Herbaliser,Gretchen,/events/1406569,8
Highly Addictive,2021-10-15T00:00:00.000,2021-10-15T23:59:00.000,2021-10-16T13:00:00.000,"Matthias Meyer, Livaton, Slurm McKenzie",Golden Gate,/events/1471720,8
"Which way to the Stars? with Danny Russell, Turk & Fin and Boogiemann",2021-10-15T00:00:00.000,2021-10-15T22:00:00.000,2021-10-16T06:00:00.000,"Danny Russell, Turk & Fin, Boogiemann",Crack Bellmer,/events/1469040,7
x Change,2021-10-15T00:00:00.000,2021-10-15T22:00:00.000,2021-10-16T06:00:00.000,"Juan Ramos, Stella Zekri, Marlene Stark, Mat Fink",Christa Kupfer,/events/1471102,7
Ttnotdb Release Party with Jo Bubbles,2021-10-15T00:00:00.000,2021-10-15T21:00:00.000,2021-10-16T04:00:00.000,"Jo Bubbles, Behrang Mohammadi",La Côte,/events/1466818,7
Tropical Goth Records Various Artists,2021-10-15T00:00:00.000,2021-10-15T17:00:00.000,2021-10-16T01:00:00.000,"makadam, Chris Video, Shredder (1)",Chausseestrasse 131,/events/1469295,4
Privat Privat Berlin,2021-10-15T00:00:00.000,2021-10-15T21:00:00.000,2021-10-16T05:00:00.000,"DAZA, Daniel Jaramillo",TBA - Berlin,/events/1472053,3
Forsythe / Eyal,2021-10-15T00:00:00.000,2021-10-15T19:30:00.000,2021-10-15T21:30:00.000,,Staatsoper Berlin,/events/1462309,3
Che Per Crew mit Jim und Nick,2021-10-15T00:00:00.000,2021-10-15T18:00:00.000,2021-10-16T01:00:00.000,,House of Gin,/events/1469402,2
Early Heat (2G),2021-10-15T00:00:00.000,2021-10-15T18:00:00.000,2021-10-15T22:00:00.000,,Pala,/events/1470849,2
CyberBay records Label Night Berlin,2021-10-15T00:00:00.000,2021-10-15T23:00:00.000,2021-10-16T08:00:00.000,,Kulturhaus Kili,/events/1471076,2
Friends.Zone mit Rics. & Stan Starry,2021-10-15T00:00:00.000,2021-10-15T18:00:00.000,2021-10-16T05:00:00.000,"Rics., Stan Starry",Minimal Bar,/events/1467216,1
Kinky Session,2021-10-15T00:00:00.000,2021-10-15T19:00:00.000,2021-10-16T01:00:00.000,Marcel da Kinky Koala,Solar,/events/1467678,1
Eck Echo Jimmy Trash present: DJ Sabroso (Peru/Sonido Inca) Special Guests,2021-10-15T00:00:00.000,2021-10-15T22:00:00.000,2021-10-16T04:00:00.000,,Urban Spree,/events/1471286,1
Eck Echo + Jimmy Trash present: DJ Sabroso (Peru/Sonido Inca) + Special Guests,2021-10-15T00:00:00.000,2021-10-15T22:00:00.000,2021-10-16T04:00:00.000,,Urban Spree,/events/1471291,1
Sound Check by Denis Kaznacheev,2021-10-15T00:00:00.000,2021-10-15T21:00:00.000,2021-10-16T06:00:00.000,Denis Kaznacheev,Old CCCP,/events/1472623,1
Concrete at Air-Raid Shelter,2021-10-16T00:00:00.000,2021-10-16T22:00:00.000,2021-10-17T08:00:00.000,"Basswell, OPOSITION, Daniella da Silva, DMCG, Stevyl, Jonathan Apelbaum",TBA - Berlin,/events/1466231,1827
Nautilus x Concrete at Air-Raid Shelter,2021-10-16T00:00:00.000,2021-10-16T14:00:00.000,2021-10-17T08:00:00.000,"Lauer, Rhode & Brown, Benjamin Fröhlich, Sara Miller, Friedrich Raphael",TBA - Berlin,/events/1468696,1621
"Blazej Malinowski, Oskar Offermann, S.A.M., Mehmet Aslan",2021-10-16T00:00:00.000,2021-10-16T22:00:00.000,2021-10-17T12:00:00.000,"Blazej Malinowski, Exildiscount, Homeboy, Laura BCR, Mary Yuzovskaya, Mehmet Aslan, Oskar Offermann, Ozan Maral, S.A.M.",Renate,/events/1471230,711
Klubnacht,2021-10-16T00:00:00.000,2021-10-16T23:59:00.000,2021-10-18T04:00:00.000,"Claire Morgan, FJAAK, Freddy K, Lokier, Randomer, SPFDJ, VTSS, Âme, Sound Metaphors Djs, Castro Moore, Or:la, Omer (DE), Terr",Berghain | Panorama Bar | Säule,/events/1467153,555
NAKT Rave,2021-10-16T00:00:00.000,2021-10-16T23:00:00.000,2021-10-17T18:00:00.000,"Echoes Of October, KØZLØV, Nick Moody, YÅ, Schering, NIKOLINA_, Sergey Maslikov, YESNT",Anomalie Art Club,/events/1467628,351
"re:flect with beatrice, Marsch, Ræza, technoslave_69 & More",2021-10-16T00:00:00.000,2021-10-16T23:00:00.000,2021-10-17T09:00:00.000,"ciaocacao, Marsch, RÆZA, RÆZA",Kulturhaus Kili,/events/1469229,247
"Burial Soil - Zeta Reticula, Sync24, Projekt Gestalten and More",2021-10-16T00:00:00.000,2021-10-16T23:00:00.000,2021-10-17T09:00:00.000,"Sync 24, Projekt Gestalten, Marlene Stark, Ravn Jonassen",Lokschuppen Berlin,/events/1464802,208
Signals Festival 2021,2021-10-15T00:00:00.000,2021-10-15T14:00:00.000,2021-10-17T02:00:00.000,"Alys, Appleblim, BoLs/sLoB, elisanyhm, Emme.XM, Gina Lo, Felipe Vareschi, Alessandro Adriani, MISTICA, Menion, Gina Lo, Felipe Vareschi, Gisèle, Pablo Diserens, Peter Kirn, Akkamiau",Funkhaus Berlin,/events/1467007,198
"Æ Samstag: Esther Duijn, Fiedel, Paul Omen",2021-10-16T00:00:00.000,2021-10-16T22:00:00.000,2021-10-17T08:00:00.000,"Esther Duijn, Fiedel, Omen",ÆDEN,/events/1470815,147
"Birgits Clubnight with Dachgeschoss, Najeh & More",2021-10-16T00:00:00.000,2021-10-16T22:00:00.000,2021-10-17T08:00:00.000,"Dachgeschoss, Schmitzkatzki, Anja Augner, Steve Hope",Birgit,/events/1471366,140
"Bubble Bath with Cyan85, Binary Digit (Live), DJ Fuckoff",2021-10-16T00:00:00.000,2021-10-16T23:00:00.000,2021-10-17T10:00:00.000,"Cyan85, DJ Fuckoff, Binary Digit, Ott (DE), Zephyr",Köpenicker Strasse 18,/events/1467208,100
"Wintergarten Saturday with Marc Romboy, David Hasert, Maurice Mino & Coramøøn",2021-10-16T00:00:00.000,2021-10-16T16:00:00.000,2021-10-17T04:00:00.000,"Maurice Mino, Marc Romboy, David Hasert, Coramøøn",Sage Beach Berlin,/events/1471671,77
"Rave with Matrixxman, Cecilia Tosh, Egotot, Alarico, Lask, Mikal Ostin",2021-10-16T00:00:00.000,2021-10-16T14:00:00.000,2021-10-17T02:00:00.000,"Alarico, Egotot, Cecilia Tosh, Lask, Matrixxman, Mikal Ostin",CURA Berlin,/events/1467407,52
Namaka @Metropol,2021-10-15T00:00:00.000,2021-10-15T18:00:00.000,2021-10-17T10:00:00.000,"Bäggy, Carina Posse, Fabian Vieregge, Giovanna, Intaktogene, Jaamann, Ju/lien, Katzengold, Katzengold, Louis Harshman, maltech, Maurice Mino, Millie Forsberg, Bonq, Mona Moore, No.TFS, OELEX, PaKKo&Joy, Pakko, Pascale Voltaire, Sambaké, Sarah Hauser, Sebastian Ludvig, Solink, Son of Adria, Steven Shade, Till Antonio, Uzhas38, Forma Tenebra, San Regret, Yetti Meißner",Metropol,/events/1463014,49
Ava Indoor & Outdoor Rave,2021-10-16T00:00:00.000,2021-10-16T21:00:00.000,2021-10-17T09:00:00.000,"Elternhouse, Dirty Frequenz",AVA Club,/events/1465224,44
"RISE: Super Flu, Hyenah Feat. King Owusu, DJEFF, JAMIIE, Cincity",2021-10-16T00:00:00.000,2021-10-16T23:59:00.000,2021-10-17T12:00:00.000,"Super Flu, Hyenah, DJEFF, JAMIIE, Cincity, Atsou, Walter Griot",Watergate,/events/1468234,41
"Thomas Lizzara´s Birthday Berlin, Pretty Pink, Nico Pusch, David K",2021-10-16T00:00:00.000,2021-10-16T16:00:00.000,2021-10-17T06:00:00.000,"Thomas Lizzara, Pretty Pink, Nico Pusch, Patrick Bell, Thies Dry",OST,/events/1467727,36
Marek Hemmann @ Ritter Butzke,2021-10-16T00:00:00.000,2021-10-16T23:00:00.000,2021-10-17T08:00:00.000,"Marek Hemmann, Jan Oberlaender, Niko Schwind, Mila Stern",Ritter Butzke,/events/1468751,35
Aller Ende Anfang x Sektgarten,2021-10-16T00:00:00.000,2021-10-16T12:00:00.000,2021-10-16T22:00:00.000,"Coco Cobra, Hanna Baertig, Leeza (2), Leeza, Solaris",://about blank,/events/1465148,31
OG Double Trouble - Quench Your Indoor Rave with Vreunde (2G),2021-10-16T00:00:00.000,2021-10-16T22:00:00.000,2021-10-17T06:00:00.000,"Mad Hattress, Yami, Just Mo, ABuDi, Balkhausen",Bulbul Berlin,/events/1472487,26
Love Letters From Oslo,2021-10-16T00:00:00.000,2021-10-16T23:59:00.000,2021-10-17T12:00:00.000,"Dorian Paic, Federico Molinari, Nekes, Robin Ordell",Hoppetosse,/events/1469788,24
Paloma Invites,2021-10-16T00:00:00.000,2021-10-16T22:00:00.000,2021-10-17T08:00:00.000,"Antikkka, Trujillo, Autre, Two Thou",Paloma,/events/1466213,23
Zosse Hotbox with Alison Swing,2021-10-16T00:00:00.000,2021-10-16T23:59:00.000,2021-10-17T10:00:00.000,Alison Swing,Fitzroy,/events/1469827,18
Rtk's Studio 54 Feat. Cindys Käferstündchen Part II,2021-10-16T00:00:00.000,2021-10-16T23:00:00.000,2021-10-17T08:00:00.000,"Le Stephane, Andreas Rauscher, Soul Bait",Beate Uwe,/events/1470429,6
Absurd Lustre: Ships & Shores (Vessel),2021-10-16T00:00:00.000,2021-10-16T22:00:00.000,2021-10-17T05:00:00.000,"Christine Benz, Tammo Hesselink, Sa Pa",arkaoda Berlin,/events/1470620,6
Magnetic Void Open Air / Sa,2021-10-16T00:00:00.000,2021-10-16T14:00:00.000,2021-10-16T22:00:00.000,"Honschu Lee, Der Eggert, Modulatos",Void Club,/events/1470833,6
Klubnacht,2021-10-16T00:00:00.000,2021-10-16T23:59:00.000,2021-10-17T13:00:00.000,"Peter Schumann, Jakob Seidensticker",Golden Gate,/events/1471724,6
Stellar Systems / Day & Night,2021-10-16T00:00:00.000,2021-10-16T13:30:00.000,2021-10-17T06:00:00.000,"Cleymoore, Stereociti, Atree",Crack Bellmer,/events/1471280,4
Casual Friday am Samstag,2021-10-16T00:00:00.000,2021-10-16T23:30:00.000,2021-10-17T07:00:00.000,"A.N.I.C.E., BI:NÆRY",Süss War Gestern,/events/1472140,4
Park & Rave // Free Open Air,2021-10-16T00:00:00.000,2021-10-16T12:00:00.000,2021-10-16T22:00:00.000,"Boxenschlampe, Paul Polter",Park & Ride Heinersdorf,/events/1472169,4
"60 Hz Opening - Dana Ruh, Alessia Ceruti & Alexander Skancke",2021-10-16T00:00:00.000,2021-10-16T21:00:00.000,2021-10-17T06:00:00.000,"Dana Ruh, Alessia Ceruti, Alexander Skancke",60 Hz,/events/1472807,4
Odete,2021-10-16T00:00:00.000,2021-10-16T21:30:00.000,2021-10-16T23:30:00.000,Odete,Volksbühne,/events/1463819,4
Friends.Zone mit Jørnemann & Freunde,2021-10-16T00:00:00.000,2021-10-16T18:00:00.000,2021-10-17T05:00:00.000,Jørnemann,Minimal Bar,/events/1467217,3
BPM Chemistry,2021-10-16T00:00:00.000,2021-10-16T21:00:00.000,2021-10-17T03:00:00.000,Dub Isotope,Wendel,/events/1472450,3
Kinktastisch Halloween Style,2021-10-16T00:00:00.000,2021-10-16T22:00:00.000,2021-10-17T06:00:00.000,Miss Sunshine,Insomnia,/events/1466965,2
Sippin & Dippin Reopening,2021-10-16T00:00:00.000,2021-10-16T22:00:00.000,2021-10-17T05:00:00.000,Femdelic,Monarch,/events/1467120,2
Jan Pyroman,2021-10-16T00:00:00.000,2021-10-16T18:00:00.000,2021-10-17T01:00:00.000,Jan Pyroman,House of Gin,/events/1469403,2
Antrieb bei Volume Berlin Records & Deep Frequencies,2021-10-16T00:00:00.000,2021-10-16T23:00:00.000,2021-10-17T09:00:00.000,"Shadym, Felix Reichelt, Simon Stiglmeier, Marcus Meya, Sebastian Hansen, Cat Vermillion",Der Weiße Hase,/events/1471450,2
The Shredder,2021-10-16T00:00:00.000,2021-10-16T21:00:00.000,2021-10-17T06:00:00.000,The Shredder,Old CCCP,/events/1472625,2
Sodalicious,2021-10-16T00:00:00.000,2021-10-16T21:00:00.000,2021-10-17T06:00:00.000,,Soda Club,/events/1467530,1
Harel Shachal & Tomer Moked,2021-10-16T00:00:00.000,2021-10-16T20:00:00.000,2021-10-16T23:30:00.000,,Framed,/events/1470100,1
Rap4revolution,2021-10-16T00:00:00.000,2021-10-16T16:00:00.000,2021-10-17T03:00:00.000,"Danielle Arielli, Doshy",Prachtwerk Berlin,/events/1472160,1
Disco Bizarre,2021-10-16T00:00:00.000,2021-10-16T23:00:00.000,2021-10-17T08:00:00.000,Brian Ring,KitKatClub,/events/1472988,1
OG Double Trouble - Indoor Rave (2G),2021-10-16T00:00:00.000,2021-10-16T22:00:00.000,2021-10-17T06:00:00.000,"Mad Hattress, Yami, Just Mo, ABuDi, Balkhausen",Bulbul Berlin,/events/1470173,35
Klubnacht,2021-10-16T00:00:00.000,2021-10-16T23:59:00.000,2021-10-18T04:00:00.000,"Claire Morgan, FJAAK, Freddy K, Lokier, Randomer, SPFDJ, VTSS, Âme, Sound Metaphors Djs, Castro Moore, Or:la, Omer (DE), Terr",Berghain | Panorama Bar | Säule,/events/1467153,555
"X By Room Trax with Stef Mendesidis, Arthur Robert, BLANKA, The Lady Machine & More…",2021-10-17T00:00:00.000,2021-10-17T20:00:00.000,2021-10-18T10:00:00.000,"Arthur Robert, BLANKA, ciaocacao, Decka, nkx, Olivia Mendez, Slone, Stef Mendesidis, The Lady Machine",Anomalie Art Club,/events/1463219,442
Tactics Nine (Pres. by Concrete & Rausch und Flausch),2021-10-17T00:00:00.000,2021-10-17T20:00:00.000,2021-10-18T06:00:00.000,"Trym, CARAVEL, UFO95, UNCNSRD, Kø:lab, Haram Groove",OST,/events/1466221,233
://Whatever x Sektgarten,2021-10-17T00:00:00.000,2021-10-17T12:00:00.000,2021-10-17T22:00:00.000,"Gwen Wayne, Kwaint, Strongrain",://about blank,/events/1467623,60
Obxene,2021-10-17T00:00:00.000,2021-10-17T06:30:00.000,2021-10-18T07:00:00.000,"Omon Breaker, RXZN, Alex Friday, K1KO, infrequenz, infrequenz, PHLOXO, PHLOXO",Kulturhaus Kili,/events/1471083,44
Perfect Sundays::...,2021-10-17T00:00:00.000,2021-10-17T20:00:00.000,2021-10-18T09:00:00.000,"Cesar Merveille, Daniel Bell, Fumiya Tanaka, Maayan Nidam",Hoppetosse,/events/1470931,28
NAKT Rave,2021-10-17T00:00:00.000,2021-10-17T08:00:00.000,2021-10-17T18:00:00.000,"Echoes Of October, KØZLØV, Nick Moody, YÅ, Schering, NIKOLINA_, Sergey Maslikov, YESNT",Anomalie Art Club,/events/1468627,17
Lazy.Sunday mit Javier Anxiety,2021-10-17T00:00:00.000,2021-10-17T18:00:00.000,2021-10-18T03:00:00.000,Javier Anxiety,Minimal Bar,/events/1467225,7
"Beate Barfuß with Lemonella, Élaa, Aaandscha, Moå",2021-10-17T00:00:00.000,2021-10-17T17:00:00.000,2021-10-18T04:00:00.000,Lemonella,Beate Uwe,/events/1470131,6
Electric Monday @Kitkat Club,2021-10-18T00:00:00.000,2021-10-18T22:00:00.000,2021-10-19T06:00:00.000,"Micha Stahl, Frankie Flowerz",KitKatClub,/events/1470363,41
Manic.Monday mit DJ Jan Tonic,2021-10-18T00:00:00.000,2021-10-18T18:00:00.000,2021-10-19T03:00:00.000,DJ Jan Tonic,Minimal Bar,/events/1467230,1
Mulatu Astatke,2021-10-18T00:00:00.000,2021-10-18T19:30:00.000,2021-10-18T23:00:00.000,Mulatu Astatke,Metropol,/events/1370873,106
The Unknown,2021-10-19T00:00:00.000,2021-10-19T22:00:00.000,2021-10-20T03:00:00.000,,Süss War Gestern,/events/1464001,16
Forsythe / Eyal,2021-10-19T00:00:00.000,2021-10-19T19:30:00.000,2021-10-19T21:30:00.000,,Staatsoper Berlin,/events/1462311,8
METRO DRIVE 001,2021-10-19T00:00:00.000,2021-10-19T19:00:00.000,2021-10-19T22:00:00.000,"Turk & Fin, VIDO",Mein Haus Am See,/events/1473142,3
go.Play mit Clemente (CH),2021-10-19T00:00:00.000,2021-10-19T18:00:00.000,2021-10-20T03:00:00.000,,Minimal Bar,/events/1467234,2
Techno Mittwoch,2021-10-20T00:00:00.000,2021-10-20T22:00:00.000,2021-10-21T10:00:00.000,,AVA Club,/events/1462538,36
Symbiotikka,2021-10-20T00:00:00.000,2021-10-20T22:00:00.000,2021-10-21T07:00:00.000,"Dirty Doering, Flanko",KitKatClub,/events/1469963,33
Berlin Atonal & Julia Stoschek Foundation present: Caner Teker presents Kirkpinar,2021-10-20T00:00:00.000,2021-10-20T20:00:00.000,2021-10-20T23:59:00.000,,Kraftwerk Berlin,/events/1463088,21
The Unknown,2021-10-20T00:00:00.000,2021-10-20T22:00:00.000,2021-10-21T01:00:00.000,,Mein Haus Am See,/events/1460240,15
Mittendrin mit Ele Luz,2021-10-20T00:00:00.000,2021-10-20T18:00:00.000,2021-10-21T03:00:00.000,Ele Luz,Minimal Bar,/events/1467238,2
Música Dispersa,2021-10-20T00:00:00.000,2021-10-20T22:00:00.000,2021-10-21T06:00:00.000,Señora,Crack Bellmer,/events/1471390,2
OG Bunker Rave 08 (Nur Geimpft & Genesen / Only Vaccinated & Recovered),2021-10-21T00:00:00.000,2021-10-21T20:00:00.000,2021-10-22T04:00:00.000,"Mad Hattress, Yami, Just Mo, ABuDi",Salzclub,/events/1472111,121
"Metabolic Rift Concert V - Light-Years presents: Caterina Barbieri, Bendik Giske, Nkisi & MFO",2021-10-21T00:00:00.000,2021-10-21T20:00:00.000,2021-10-21T23:59:00.000,"Caterina Barbieri, Bendik Giske, Nkisi",Kraftwerk Berlin,/events/1463090,106
Rhys Fulber (Front Line Assembly) + Spit Mask Live,2021-10-21T00:00:00.000,2021-10-21T20:00:00.000,2021-10-22T02:00:00.000,"Rhys Fulber, Philipp Strobel, Rangelova",Urban Spree,/events/1470219,97
Deep Trouble,2021-10-21T00:00:00.000,2021-10-21T22:00:00.000,2021-10-22T06:00:00.000,"Jesse G, RJ Sturm, Smitti91",Paloma,/events/1466312,36
"Sonic Ground with Emme Live (Workshop, Performance), Debbie Chia",2021-10-21T00:00:00.000,2021-10-21T20:00:00.000,2021-10-22T03:00:00.000,"Emme.XM, Debbie Chia, Oblique",arkaoda Berlin,/events/1399506,34
Sun Sad Instore,2021-10-21T00:00:00.000,2021-10-21T19:00:00.000,2021-10-22T22:00:00.000,Lucas Brell,Sound Metaphors,/events/1472792,31
Paradisco Autumn Affair,2021-10-21T00:00:00.000,2021-10-21T22:30:00.000,2021-10-22T06:00:00.000,"Eva Crystaltips, Triqi, Imad",Crack Bellmer,/events/1472167,19
Donnerdogge,2021-10-21T00:00:00.000,2021-10-21T23:59:00.000,2021-10-22T13:00:00.000,"Per Hammar, Olga Korol, Flo Pirke, Edgar Peng",Golden Gate,/events/1472574,19
The Unknown,2021-10-21T00:00:00.000,2021-10-21T22:00:00.000,2021-10-22T02:00:00.000,Kareem K,Zu Mir Oder Zu Dir,/events/1463996,15
The Sound of Distance,2021-10-21T00:00:00.000,2021-10-21T16:00:00.000,2021-10-21T21:30:00.000,"Anthea, Mouse On Mars, Oren Ambarchi, Stephen O'Malley",Haus Der Kulturen Der Welt,/events/1466506,10
"M_dokumente, all About Mania D., MALARIA!, Matador",2021-10-21T00:00:00.000,2021-10-21T18:00:00.000,2021-10-24T23:00:00.000,"Gudrun Gut, Anika, Midori Hirano, Pilocka Krach, Mark Reeder",Silent Green,/events/1470742,8
Glor1a,2021-10-21T00:00:00.000,2021-10-21T20:00:00.000,2021-10-21T22:00:00.000,GLOR1A,Volksbühne,/events/1463821,4
Disko Donnerstag mit Dickey Doo,2021-10-21T00:00:00.000,2021-10-21T19:00:00.000,2021-10-22T03:00:00.000,,Promenaden Eck,/events/1473618,3
Electronic.Thursday mit Kat Kat Tat,2021-10-21T00:00:00.000,2021-10-21T18:00:00.000,2021-10-22T04:00:00.000,Kat Kat Tat,Minimal Bar,/events/1467242,2
Unknown VOL.3,2021-10-21T00:00:00.000,2021-10-21T21:00:00.000,2021-10-22T06:00:00.000,Elle B,Old CCCP,/events/1473914,2
"60 Hz Week 01 with Dana Ruh, Amir Javasoul",2021-10-21T00:00:00.000,2021-10-21T20:00:00.000,2021-10-22T06:00:00.000,"Dana Ruh, Amir Javasoul",60 Hz,/events/1473904,1
STIMULATION,2021-10-22T00:00:00.000,2021-10-22T22:00:00.000,2021-10-23T10:00:00.000,"Brecc, Human Experiments, madwoman, Sicion, WNDRLST",OST,/events/1467296,1133
"What..? with Dan Ghenacia, Eduardo de la Calle, Henning Baer, Janina",2021-10-22T00:00:00.000,2021-10-22T22:00:00.000,2021-10-23T12:00:00.000,"Bruno Curtis, Dan Ghenacia, DeWalta, DJ Valis, Eduardo de la Calle, Franky Greiner, Giuliano Lomonte, Henning Baer, Janina, Olga Korol",Renate,/events/1472582,652
"SYXTSRS with Setaoc Mass, MARRØN, MZR///, KETCH, Hitam & More [3G]",2021-10-22T00:00:00.000,2021-10-22T23:00:00.000,2021-10-23T09:00:00.000,"Setaoc Mass, MARRØN, Hitam, KETCH, Hypnotic Black Magic",Lokschuppen Berlin,/events/1466900,499
A Live Jazz Band Playing the Music of Erykah Badu,2021-10-22T00:00:00.000,2021-10-22T18:00:00.000,2021-10-22T22:00:00.000,Sameed,Badehaus Berlin,/events/1460218,340
Weeeirdos,2021-10-22T00:00:00.000,2021-10-22T23:00:00.000,2021-10-23T09:00:00.000,"Evita Manji, LOLSNAKE, ace of demons, DJ Lentil",Fitzroy,/events/1470150,279
"Æ Freitag: Narciss, Rove Ranger, Beatrice, KTK b2b Toni Ba",2021-10-22T00:00:00.000,2021-10-22T22:00:00.000,2021-10-23T08:00:00.000,"TONI BA, Narciss, Rove Ranger",ÆDEN,/events/1472862,143
"Jealous, Gym Tonic, CV Vision Odd Couple DJ Set",2021-10-22T00:00:00.000,2021-10-22T20:00:00.000,2021-10-23T04:00:00.000,,Urban Spree,/events/1471237,142
Borderless Pres. Berlin X Argentina Two Floors,2021-10-22T00:00:00.000,2021-10-22T22:00:00.000,2021-10-23T09:00:00.000,"Lolu Menayed, Sol Ortega, Manuela Mayoral, Sofi Lucius, Javier Anxiety, Hypnoize",AVA Club,/events/1471916,96
Soul Train Feelings,2021-10-22T00:00:00.000,2021-10-22T23:00:00.000,2021-10-23T08:00:00.000,"Anele, AUCO, Ban2, Indigo Plateaux, J.City",Badehaus Berlin,/events/1470318,95
"Wenn's Knallt, Dann Knallt's! Klappe die 1. & Perlen für die Katz",2021-10-22T00:00:00.000,2021-10-22T23:59:00.000,2021-10-24T18:00:00.000,"Marvin Jam, MUKKIMIAU, Ena Lind, Annett Gapstream, Marcus Meinhardt, Franca, Sarah Wild, Ricoloop, Peter Schumann, Kotelett, Rydim, Handmade, Janosch Ulm, Norman Weber, Mira",Kater Blau,/events/1472456,89
