"KOFFÄIN Weekender | Saturday Backyard Open Air: Folamour, Lea Lisa, Lis Sarroca, Soela, Khadija",2023-07-22T00:00:00.000,2023-07-22T16:00:00.000,2023-07-23T06:00:00.000,"Folamour, Lea Lisa, Lis Sarroca, Soela, Khadija (DE), Nahomi",Prince Charles,/events/1726449,1107
Herrensauna Pridefest ,2023-07-22T00:00:00.000,2023-07-22T23:59:00.000,2023-07-24T09:00:00.000,"Akua, Nene H, Anetha, BEARCAT, Cashu, CEM, Dj Saliva, JASSS, DJ Pete, DJ Spit, ENNIO, ferrari rot, Madalba, Oldyungmayn, Onio (PT), JOVENDELAPERLA, Sausha, softchaos, SPFDJ, MCMLXXXV",RSO.BERLIN,/events/1722688,1046
Golosa Bubbles CSD RAVE,2023-07-22T00:00:00.000,2023-07-22T22:00:00.000,2023-07-23T22:00:00.000,"2FARO, Amperia, Cristian Marras, Daniel Wang, Dgeral, Farhan, KH38, MELATRONIX, Reverso, Sherø, Sky Deep, Sparkling Water Dreams, Sparkly Pony, ZENO (2)",://about blank,/events/1646003,1020
RAVEMORE BERLIN CSD SPECIAL,2023-07-22T00:00:00.000,2023-07-22T22:00:00.000,2023-07-23T11:00:00.000,"Alex Friday, ROJI, Andrew Moore, Echoes Of October, Foreign Guest, HKKPTR, Punktmidi, Kamafaka, OUTOFORDERB2B, PLATTER",OST,/events/1728679,778
CSD Klubnacht,2023-07-22T00:00:00.000,2023-07-22T23:59:00.000,2023-07-24T12:00:00.000,"Blasha & Allatt, Boris, Jennifer Cardini, Luigi Di Venere, Nymed, Partok, Phase Fatale, Sedef Adasï, Steffi, Virginia, Avalon Emerson, BASHKKA, Chris Cruse, Kim Anh, Massimiliano Pagliara, Mike Starr, nd_baumecker, Ouissam, Roi Perez, The Carry Nation, Cormac, fka.m4a, Lakuti, Tama Sumo, Hard Ton",Berghain | Panorama Bar | Säule,/events/1709096,478
Particles,2023-07-22T00:00:00.000,2023-07-22T14:00:00.000,2023-07-22T22:00:00.000,"Jane Fitz, Marco Shuttle",gART.n,/events/1728657,383
"EROTIC 3 Floors In & Outdoor CSD Afterparty with Consumed, TRIS Shadylines, A.N.I",2023-07-22T00:00:00.000,2023-07-22T23:00:00.000,2023-07-23T10:00:00.000,"A.N.I., TRIS, babyheat, DJ Botanika, Dexy's Midnight, L-AUX, Amphetamax, ROGEVAR, Chachacharly, MONTGOMERY, XHOUSTED, Acid Mo",Lokschuppen Berlin,/events/1737160,369
Nation of Gondwana Festival 2023,2023-07-21T00:00:00.000,2023-07-21T15:00:00.000,2023-07-23T21:00:00.000,"300km/h, UNORDNUNGSAMT, AceMoMA, Akua, Alexa D!saster, Anetha, Barbara Hofmann, BASHKKA, Ben Klock, Beste Hira, Caleesi, Sarah Kreis, CARISTA, Ciel, Cinthie, Cotumo, Der Dritte Raum, DJ Fuckoff, Narciss, em.ævi, Epikur, Felde, ferrari rot, Franziska Berns, Frivolous, Galcher Lustwerk, Gina Sabatini, Helena Hauff, I$A, THC, ISAbella, JakoJako, Jennifer Loveless, Johan Kaseta, DJ Assam, Kalipo, Kiddy Smile, Miss Kittin, Mareena, Menqui, Midas 104, Murat Önen, Naomi (DE), Natalie Robinson, OK Williams, Rafush, Randweg, Regularfantasy, Resom, Rifts, Rødhåd, Roi Perez, Roman Flügel, SHIKOBA, Sportbrigade Sparwasser, Suse, Sven Dohse, The Honey Tapes, TSHA, Van Anh, Volvox, Wellen.Brecher, Yobovski, Zombies In Miami","Schönwalde-Glien, Grünefeld bei Berlin, Germany",/events/1677036,369
ASTRA: Día del Amigo,2023-07-22T00:00:00.000,2023-07-22T23:00:00.000,2023-07-23T05:00:00.000,,Astra Kulturhaus,/events/1726858,344
MESS x MARICAS - Lesbiannale,2023-07-22T00:00:00.000,2023-07-22T14:00:00.000,2023-07-23T10:00:00.000,"Cali Rose, DJ Fart in the Club, D. Tiffany, Hyperaktivist, ISAbella, JASSS, Mama Snake, MDSM, Mohajer, Roza Terenzi, THC, Mama Yha Yha",Else,/events/1736392,316
"LUNCHBOX CANDY - THE KET GALA, CSD Weekend Special",2023-07-22T00:00:00.000,2023-07-22T16:00:00.000,2023-07-23T12:00:00.000,"Katerinha, Njeri, Estée Louder, ADAM MUNNINGS, Elninodiablo, Sudha, Kirill Shapovalov, DJ Petite",ÆDEN,/events/1725692,277
CSDissident - The Hanky Hoedown ✿ Garden & Indoor ✿,2023-07-22T00:00:00.000,2023-07-22T14:00:00.000,2023-07-23T06:00:00.000,"131bpm, Cáit, Carly Zeng, Eoin DJ, Joe Delon, Merve, Miss Twink USA, Regularfantasy, Special Guest DJ, Venetta",OXI,/events/1728281,230
Tresor meets 012 w/ DJ Nobu,2023-07-22T00:00:00.000,2023-07-22T23:00:00.000,2023-07-23T12:00:00.000,"Galcher Lustwerk, Hypoestes, Kodemul, Aksamit, DJ Nobu, Claudio PRC, Forest On Stasys",Tresor / Globus,/events/1720132,226
UNORDNUNGSAMT // CSD Afterparty,2023-07-22T00:00:00.000,2023-07-22T23:00:00.000,2023-07-23T08:00:00.000,"Keisuke, Ben Sleia, Juan Neira",Fitzroy,/events/1739313,166
"Renate CSD with Juan Ramos, DJ BONEY S, Sparkly Pony, Lucas Abadi",2023-07-22T00:00:00.000,2023-07-22T23:00:00.000,2023-07-23T10:00:00.000,"CHRISPY, DJ BONEY S, zikade, Dgeral, Sparkly Pony, DJ Luv You, Juan Ramos, Lucas Abadi, Lunchbox Geoff",Renate,/events/1728194,156
"Birgits Open Air & Clubnight with Gunnar Stiller, Aio, Lusatia x Pachamama, Wald & Wiese, uvm",2023-07-21T00:00:00.000,2023-07-21T22:00:00.000,2023-07-23T08:00:00.000,"Fergii, Elie Eidelman, Simon Stiglmeier, Marvin Hey, Oscar Wandel, Maria Theresia von Eberg, Caapi El Mesti, Arnau Amatista, JANSN, Max Wide, BECKSHAM, Aio, Gunnar Stiller, Skober",Birgit,/events/1713660,134
"Nachtklub: Tiga, Tony y Not, Ede, Anatole Serret, Barbara Bös b2b Schiela, Lewin Paul",2023-07-22T00:00:00.000,2023-07-22T23:00:00.000,2023-07-23T10:00:00.000,"Tiga, Tony y Not, Ede, Barbara Bös, Schiela, Lewin Paul",Watergate,/events/1728051,131
"Klubnacht with DE.fine, Herrmess, D3VAN, Ageved, Hausbrand, Bloodkedelic",2023-07-22T00:00:00.000,2023-07-22T23:00:00.000,2023-07-23T10:00:00.000,"DE.fine, D3VAN, Herrmess, Ageved, Hausbrand, Bloodkedelic",AVA Club,/events/1726200,113
TONIGHT x Homo Nation - CSD After Party - In & Outdoor - Anomalie Art Club,2023-07-22T00:00:00.000,2023-07-22T22:00:00.000,2023-07-23T10:00:00.000,"YA Z AN, Marc Moeller, DAZA, Jiggler, Kaminka Merel, Nat SuPrise, David Zikarsky",Anomalie Art Club,/events/1733660,106
CSD Beach Rave,2023-07-22T00:00:00.000,2023-07-22T15:00:00.000,2023-07-23T06:00:00.000,,Sage Beach Berlin,/events/1721493,87
HOMEOSTAT x KANVAS,2023-07-22T00:00:00.000,2023-07-22T19:00:00.000,2023-07-23T10:00:00.000,"Adrian Sand, Allexandra, alemiko, ZOEVITA, Balkhausen, UNYCA, Eyad, SaltySis, A.N.I., JĀST, Ramol K., ORBAS, X:RA, Vivi Wahnsinn, Josiane, LEYLA\ /NOUHEYLA, Sabrina Komm, Michael Gubaew",TBA,/events/1740462,77
Spectrum of Love,2023-07-22T00:00:00.000,2023-07-22T23:00:00.000,2023-07-30T12:00:00.000,"Beka, GEMO, CLEMSON, MARHOLZ, Mutualism (DE)",Mensch Meier,/events/1738353,71
Klaminka,2023-07-21T00:00:00.000,2023-07-21T18:00:00.000,2023-07-23T09:00:00.000,"Sebastian der Saubere, Hypnosta, kies, ogtrues, MIO (ES), Beqqi, Montezuma (DE)",ÆVE,/events/1741452,69
Bi*licious Truck CSD Berlin 2023,2023-07-22T00:00:00.000,2023-07-22T12:00:00.000,2023-07-23T00:00:00.000,"Rick.O, Match Hoffman, Anna Schreit, Soul Bait, NILU",Straße des 17. Juni,/events/1683557,66
BHALABASA After CSD Parade,2023-07-22T00:00:00.000,2023-07-22T22:00:00.000,2023-07-23T09:00:00.000,"Patrick Scuro, DIVISIO, Momentune, John Kotti",M-BIA,/events/1737482,62
DURCH wishes u a happy pride. everywhere. love,2023-07-21T00:00:00.000,2023-07-21T23:59:00.000,2023-07-22T23:59:00.000,,TBA,/events/1647411,62
"HyperPop CSD Aftershow Party / 10 live acts, 1 DJ",2023-07-22T00:00:00.000,2023-07-22T21:00:00.000,2023-07-23T04:00:00.000,,"TBA - Reuterstraße 63, 12047 Berlin / BISPÄTER",/events/1730458,57
"The Disco Express: Arnaud Denzler, Emanuele Barilli, Eva Crystaltips, Marco Ohboy, Tatiana",2023-07-22T00:00:00.000,2023-07-22T23:00:00.000,2023-07-23T06:00:00.000,"Arnaud Denzler, Emanuele Barilli, Eva Crystaltips, Marco Ohboy, Tatiana",Bulbul Berlin,/events/1722047,56
House of pride,2023-07-22T00:00:00.000,2023-07-22T22:00:00.000,2023-07-23T09:00:00.000,"Anri, AVO2X, Bertolt Meyer, Coco, Deepneue, RQVX, Dornika, Katy Bähm, Marc Miroir, Shamsa, Prismode, Solvane, Stinny Stone, Tom Peters",Ritter Butzke,/events/1634165,55
"Holiday Bambule (House & Techno, Hip Hop, 80s 90s & Pop)",2023-07-22T00:00:00.000,2023-07-22T23:00:00.000,2023-07-23T06:00:00.000,"Ele Luz, Rock-A-Benni, AWSM",Cassiopeia,/events/1731238,43
r:nøcturn / RAW Techno,2023-07-22T00:00:00.000,2023-07-22T23:00:00.000,2023-07-23T12:00:00.000,"Daniel Boon, Felix Reichelt, DAV3",Der Weiße Hase,/events/1739084,46
Odyssey,2023-07-22T00:00:00.000,2023-07-22T23:00:00.000,2023-07-23T06:00:00.000,"CinnamonSpice, Jai Khanna",Marie Antoinette,/events/1736545,35
RBL goes to Crack Bellmer,2023-07-22T00:00:00.000,2023-07-22T22:00:00.000,2023-07-23T06:00:00.000,"Flaaviø, Frau Braun, Goldie Palm, Isa Enes, High Pitch Control",Crack Bellmer,/events/1736382,34
KATERRAMA,2023-07-21T00:00:00.000,2023-07-21T23:00:00.000,2023-07-23T22:00:00.000,"David Bucka, DIEGÖ, MANTi, Bonjour Ben, Nixe, Intaktogene, Paul Traeumer, Mona Moore, caipora, Mehr is Mehr, Lagomo, , Stan Starry, Ukiyo (Music), nøvae, Ezgi, Unders",Kater Blau,/events/1729846,33
...is serving PRIDE,2023-07-22T00:00:00.000,2023-07-22T23:59:00.000,2023-07-23T10:00:00.000,"CRYME, Primal State, Miro Von Berlin, Marsch, Black Mirror Park, Black Peters",OHM,/events/1720214,32
PULZAR VA002 Record Release Party,2023-07-22T00:00:00.000,2023-07-22T23:00:00.000,2023-07-23T07:00:00.000,"LASERBOY, Zenit, earcandy, zwyrg, Inside Blur, Helen Schwarzweiß",Zur Klappe,/events/1730014,32
CSD AFTER RAVE - Indoor & Outdoor Area,2023-07-22T00:00:00.000,2023-07-22T22:00:00.000,2023-07-23T10:00:00.000,"Bianka Banks, BROTECH, Natt A Regular Guy, Nat SuPrise, Fergii, Beron",ÆVE,/events/1736017,32
Bird House: CSD Edition,2023-07-22T00:00:00.000,2023-07-22T23:30:00.000,2023-07-23T06:00:00.000,"Javier Anxiety, Moehecan, KANA, Bibi Blocksberg",Badehaus Berlin,/events/1743424,31
SCHALL + RAUSCH,2023-07-22T00:00:00.000,2023-07-22T23:00:00.000,2023-07-23T06:00:00.000,"TERRA TWIINS, Hypnosta",Humboldthain Club,/events/1742660,27
"Einhundert w/ Dis Fig, ARAKAZA",2023-07-22T00:00:00.000,2023-07-22T23:00:00.000,2023-07-23T08:00:00.000,"41ISSA, KANUCIA, Aryu Jassika, ARAKAZA, Collo Awata, Dis Fig, Junior M (US), False Witness, Kissen, Nico Adomako, San Farafina",Re:mise,/events/1732744,26
BASS PLUS,2023-07-22T00:00:00.000,2023-07-22T23:00:00.000,2023-07-23T06:00:00.000,"Ome (1), 2krazy, Dub Isotope, TMSN",Void Club,/events/1736827,24
Pillow Princess Garden Takeover CSD daytime rave ★,2023-07-22T00:00:00.000,2023-07-22T12:00:00.000,2023-07-22T23:00:00.000,"B.Silber, Digital KitKat, Freaky Emo, ilbroccolovolante, Kidcat, Djé Djé from the block",Tante Frizzante,/events/1724625,23
aftertaste,2023-07-22T00:00:00.000,2023-07-22T12:00:00.000,2023-07-23T00:00:00.000,"Anthea, Locky Mazzucchelli, Sibil (1), Gabarda, VSAN",TBA,/events/1740975,20
ULT - Benefiz Open Air „TECHNO SCHAFFT BILDUNG' pres. by OPERATOR,2023-07-22T00:00:00.000,2023-07-22T12:00:00.000,2023-07-22T22:00:00.000,"Benleh, Bombata, Dennis Beutler, Jens Schwan, justUS, Chris Plettenberg, Katzenohr, Lotte LAUT, Peet Flower, Seccoboi, TraumaMia",Gestrandet An Der Jannowitzbrücke,/events/1729464,19
Saturday Aperitivo ,2023-07-22T00:00:00.000,2023-07-22T21:00:00.000,2023-07-23T03:00:00.000,Aziz H,Mena Berlin,/events/1743527,18
Italian Dance Wave,2023-07-22T00:00:00.000,2023-07-22T18:00:00.000,2023-07-23T05:00:00.000,"Acid Gymnastics, Audio Vacanze, Eyesdice, Claudio Chinotto, Italian Dance Wave, Paty Vapor",Urban Spree,/events/1737169,16
PRIDE Colourful #loveislove // FUX & HASE // Louis Garcia,2023-07-22T00:00:00.000,2023-07-22T22:00:00.000,2023-07-23T08:00:00.000,,BUSCHE Club,/events/1711581,16
Behind the Barricades Garten Session,2023-07-22T00:00:00.000,2023-07-22T16:00:00.000,2023-07-23T02:00:00.000,ADHSMR,Zukunft am Ostkreuz,/events/1743078,15
Sound Metaphors Music Club,2023-07-22T00:00:00.000,2023-07-22T23:00:00.000,2023-07-23T06:00:00.000,"Warehouse Preservation Society, DJ Aficionado",arkaoda Berlin,/events/1739136,14
Saturdays::,2023-07-22T00:00:00.000,2023-07-22T12:00:00.000,2023-07-23T08:00:00.000,"André Galluzzi, David Delgado, Mayell, Tomas Station, Dandy Jack",Club der Visionaere,/events/1742832,12
Benjamin Fehr & Freunde,2023-07-22T00:00:00.000,2023-07-22T18:00:00.000,2023-07-24T06:00:00.000,Benjamin Fehr,Minimal Bar,/events/1717966,11
Lovegroud Berlin ,2023-07-22T00:00:00.000,2023-07-22T12:00:00.000,2023-07-22T23:59:00.000,"KI/KA, Enrica Hz, Ladagoje, Valverde, Audri, Cape",,/events/1734513,10
"TAKSEER with Liliane Chlela, Dakn, abu muhammad, Sabine Salame",2023-07-22T00:00:00.000,2023-07-22T21:00:00.000,2023-07-23T06:00:00.000,"Liliane Chlela, Abu Mhd, Taradud",Panke,/events/1740938,10
Baergarten Invites: Sonar Kollektiv,2023-07-22T00:00:00.000,2023-07-22T14:00:00.000,2023-07-23T02:00:00.000,"Eva Be, Hollis P. Monroe, Ken Okuda, MINCO, Marian Tone, Markus Tone",Revier Südost,/events/1742607,10
friends.zone mit Benjamin Fehr & Freunde,2023-07-22T00:00:00.000,2023-07-22T18:00:00.000,2023-07-23T06:00:00.000,Benjamin Fehr,Minimal Bar,/events/1723251,9
Circus Bizarre - Pride Month Special,2023-07-22T00:00:00.000,2023-07-22T22:00:00.000,2023-07-23T06:00:00.000,Waikiki,Insomnia,/events/1729829,8
Picnic concert #2: Daniela Huerta x Hanno Leichtmann & Valerio Tricoli // sound installation,2023-07-22T00:00:00.000,2023-07-22T17:00:00.000,2023-07-22T21:30:00.000,"Hanno Leichtmann, Valerio Tricoli",Silent Green,/events/1731429,6
Queerheadz,2023-07-22T00:00:00.000,2023-07-22T23:00:00.000,2023-07-23T07:00:00.000,Cherry Core,Void Hall,/events/1737211,6
Satur-Day-Care - AllesAndereIsMusik,2023-07-22T00:00:00.000,2023-07-22T13:00:00.000,2023-07-23T05:00:00.000,,Otto (Container Village at Haus der Statistik),/events/1738089,6
Klubnacht,2023-07-22T00:00:00.000,2023-07-22T23:59:00.000,2023-07-23T12:00:00.000,"youANDme, Ocean Lam, Patrick Zigon, Slurm McKenzie",Golden Gate,/events/1738090,6
"Obscure Obsession - Raphael Kosmos, Lovatron, Фраєр²",2023-07-22T00:00:00.000,2023-07-22T22:30:00.000,2023-07-23T06:00:00.000,"Raphael Kosmos, Artem Ikra, Garçon Gaston, Lovatron",Loophole,/events/1741088,6
Dark Matter Sommerlights TENSOR,2023-07-22T00:00:00.000,2023-07-22T20:00:00.000,2023-07-23T00:00:00.000,Akiko Haruna,Dark Matter Berlin,/events/1730678,4
"Crépite. with Antaares, bawab and Farn",2023-07-22T00:00:00.000,2023-07-22T20:00:00.000,2023-07-23T03:00:00.000,"bawab, Farn",Klunkerkranich,/events/1736873,4
The Movement by Mindscape,2023-07-22T00:00:00.000,2023-07-22T21:00:00.000,2023-07-23T03:00:00.000,"Alex Iso, Kat Polar",Flutgraben,/events/1737341,4
Bollywood & Tollywood Night - Berlin,2023-07-22T00:00:00.000,2023-07-22T22:00:00.000,2023-07-23T04:00:00.000,,Beate Uwe,/events/1734702,3
Unser Samstag mit Tho7 & Yo-Gurt,2023-07-22T00:00:00.000,2023-07-22T20:00:00.000,2023-07-23T06:00:00.000,,Promenaden Eck,/events/1738478,3
Wilde Herzen • Die Indie Pop Party mit deutschen Texten,2023-07-22T00:00:00.000,2023-07-22T23:59:00.000,2023-07-23T06:00:00.000,,Lido Berlin,/events/1722693,2
RUDE AWAKENING,2023-07-22T00:00:00.000,2023-07-22T19:00:00.000,2023-07-22T23:00:00.000,,Loophole,/events/1731611,2
Blaq Numbers Label Night,2023-07-22T00:00:00.000,2023-07-22T23:00:00.000,2023-07-23T07:00:00.000,"J Nuggetz, Sam Paradise, Matthias Fiedler",Paloma,/events/1737234,2
Soup after party,2023-07-16T00:00:00.000,2023-07-16T20:00:00.000,2023-07-23T03:00:00.000,rabiatch,Repeat,/events/1741953,2
RIGHT ON! Soul Brothers and Sisters,2023-07-22T00:00:00.000,2023-07-22T23:00:00.000,2023-07-23T04:30:00.000,,Monarch,/events/1727258,1
SUMMER SOUNDS BERLIN 2023,2023-07-22T00:00:00.000,2023-07-22T19:00:00.000,2023-07-22T23:00:00.000,,TBA - Berliner Berg Brauerei,/events/1727401,1
[WATCH] Sound of Freedom (2023) FullMovie Online at Home,2023-07-22T00:00:00.000,2023-07-22T23:00:00.000,2023-07-23T06:00:00.000,Spencer Parker,Ä,/events/1742077,1
Techno Moon Night - Saturday,2023-07-22T00:00:00.000,2023-07-22T22:00:00.000,2023-07-23T06:00:00.000,Paul Wolf,Soda Club,/events/1736165,0
Ecstatic Dance with DJ Intiche & Mantra Concert with Sri,2023-07-22T00:00:00.000,2023-07-22T19:00:00.000,2023-07-22T22:30:00.000,,Green Yoga SEZ,/events/1736368,0
Thian & Friends,2023-07-22T00:00:00.000,2023-07-22T22:00:00.000,2023-07-23T05:00:00.000,"der KØCH, Thian",Old CCCP,/events/1736512,0
Ibizasoulon Berlin,2023-07-22T00:00:00.000,2023-07-22T19:00:00.000,2023-07-23T02:00:00.000,,Solar,/events/1741216,0
CSD Party,2023-07-22T00:00:00.000,2023-07-22T23:00:00.000,2023-07-23T06:00:00.000,,Pappelallee 65,/events/1742670,0
Käptens Club Party,2023-07-22T00:00:00.000,2023-07-22T21:00:00.000,2023-07-23T05:00:00.000,,Hafenbar Berlin,/events/1743618,0
mittendrin mit Pablo Cornejo (Chile),2023-07-22T00:00:00.000,2023-07-22T18:00:00.000,2023-07-23T05:00:00.000,Pablo Cornejo,Minimal Bar,/events/1743765,0
Pappel-la-papp club,2023-07-22T00:00:00.000,2023-07-22T23:00:00.000,2023-07-23T06:00:00.000,Humanoid,DAS Institut,/events/1744690,0
Pappel-la-papp club,2023-07-22T00:00:00.000,2023-07-22T23:00:00.000,2023-07-23T06:00:00.000,Humanoid,DAS Institut,/events/1744692,0
Life is Good Festival,2023-07-21T00:00:00.000,2023-07-21T19:00:00.000,2023-07-23T22:00:00.000,,House of Weekend,/events/1744761,0
Ayo Festival Club Night,2023-07-22T00:00:00.000,2023-07-22T22:00:00.000,2023-07-23T06:00:00.000,SALIMATA,Haubentaucher,/events/1744908,0
"KOFFÄIN Weekender | Sunday Open Air: Folamour, Barry Can't Swim, Black Loops, Sandilé ",2023-07-23T00:00:00.000,2023-07-23T14:00:00.000,2023-07-24T05:00:00.000,"Folamour, Barry Can't Swim, Black Loops, Sandilé, Sophie McAlister, Nephews, Turkish",Else,/events/1728254,1482
Herrensauna Pridefest ,2023-07-22T00:00:00.000,2023-07-22T23:59:00.000,2023-07-24T09:00:00.000,"Akua, Nene H, Anetha, BEARCAT, Cashu, CEM, Dj Saliva, JASSS, DJ Pete, DJ Spit, ENNIO, ferrari rot, Madalba, Oldyungmayn, Onio (PT), JOVENDELAPERLA, Sausha, softchaos, SPFDJ, MCMLXXXV",RSO.BERLIN,/events/1722688,1046
Golosa Bubbles CSD RAVE,2023-07-22T00:00:00.000,2023-07-22T22:00:00.000,2023-07-23T22:00:00.000,"2FARO, Amperia, Cristian Marras, Daniel Wang, Dgeral, Farhan, KH38, MELATRONIX, Reverso, Sherø, Sky Deep, Sparkling Water Dreams, Sparkly Pony, ZENO (2)",://about blank,/events/1646003,1020
CSD Klubnacht,2023-07-22T00:00:00.000,2023-07-22T23:59:00.000,2023-07-24T12:00:00.000,"Blasha & Allatt, Boris, Jennifer Cardini, Luigi Di Venere, Nymed, Partok, Phase Fatale, Sedef Adasï, Steffi, Virginia, Avalon Emerson, BASHKKA, Chris Cruse, Kim Anh, Massimiliano Pagliara, Mike Starr, nd_baumecker, Ouissam, Roi Perez, The Carry Nation, Cormac, fka.m4a, Lakuti, Tama Sumo, Hard Ton",Berghain | Panorama Bar | Säule,/events/1709096,478
Nation of Gondwana Festival 2023,2023-07-21T00:00:00.000,2023-07-21T15:00:00.000,2023-07-23T21:00:00.000,"300km/h, UNORDNUNGSAMT, AceMoMA, Akua, Alexa D!saster, Anetha, Barbara Hofmann, BASHKKA, Ben Klock, Beste Hira, Caleesi, Sarah Kreis, CARISTA, Ciel, Cinthie, Cotumo, Der Dritte Raum, DJ Fuckoff, Narciss, em.ævi, Epikur, Felde, ferrari rot, Franziska Berns, Frivolous, Galcher Lustwerk, Gina Sabatini, Helena Hauff, I$A, THC, ISAbella, JakoJako, Jennifer Loveless, Johan Kaseta, DJ Assam, Kalipo, Kiddy Smile, Miss Kittin, Mareena, Menqui, Midas 104, Murat Önen, Naomi (DE), Natalie Robinson, OK Williams, Rafush, Randweg, Regularfantasy, Resom, Rifts, Rødhåd, Roi Perez, Roman Flügel, SHIKOBA, Sportbrigade Sparwasser, Suse, Sven Dohse, The Honey Tapes, TSHA, Van Anh, Volvox, Wellen.Brecher, Yobovski, Zombies In Miami","Schönwalde-Glien, Grünefeld bei Berlin, Germany",/events/1677036,369
XTROB CSD Techno Queer Open Air,2023-07-23T00:00:00.000,2023-07-23T15:00:00.000,2023-07-23T22:00:00.000,"BIXBITA, Zomkrad, Juan Cernadas",Re:mise,/events/1738049,289
Aurora.Ambient,2023-07-23T00:00:00.000,2023-07-23T17:30:00.000,2023-07-24T01:00:00.000,"Grand River, JacqNoise, M.E.S.H., Perila, .VRIL, Yanling",TBA - Kantstrasse 7 - across the street,/events/1731596,159
Deestricted: Sunday Breaker,2023-07-23T00:00:00.000,2023-07-23T22:00:00.000,2023-07-24T08:00:00.000,"Julie Desire, SITSOPE, Cadih, Tahl (US)",OXI,/events/1724714,147
"cLaTTeR Night Open Air w/ Esther Duijn, Nina Berg, WLLKR",2023-07-23T00:00:00.000,2023-07-23T23:00:00.000,2023-07-24T10:00:00.000,"Esther Duijn, Nina Berg, WLLKR, Arctosa",Lokschuppen Berlin,/events/1694838,144
Bjarki & THOMAS PRESENT: RAVE DADDY IN BERLIN,2023-07-23T00:00:00.000,2023-07-23T18:00:00.000,2023-07-24T08:00:00.000,"Árni, Bjarki, mx.pinky",Renate,/events/1742191,108
Hoe__mies: Daydreamers PRIDE Edition,2023-07-23T00:00:00.000,2023-07-23T14:00:00.000,2023-07-24T02:00:00.000,"HALF QUEEN, Litney, Meg10, Baran Kok, Sherryaeri, Von Di",OST,/events/1730544,96
Spectrum of Love,2023-07-22T00:00:00.000,2023-07-22T23:00:00.000,2023-07-30T12:00:00.000,"Beka, GEMO, CLEMSON, MARHOLZ, Mutualism (DE)",Mensch Meier,/events/1738353,71
VESELKA X CSD: Sunday Open Air,2023-07-23T00:00:00.000,2023-07-23T13:30:00.000,2023-07-23T22:00:00.000,"Cheriii, Vani Vachi, Koloah, Rakans, Omon Breaker, Supergloss, Ruslan Mays, Rachel Noon",OXI,/events/1739625,69
Horse Meat Disco Berlin,2023-07-23T00:00:00.000,2023-07-23T14:00:00.000,2023-07-24T08:00:00.000,"Fancy Shews, James Hillard, Luke Howard, Kiddy Smile, Mez, David Elimelech",Prince Charles,/events/1727807,55
Italo Sundaze,2023-07-23T00:00:00.000,2023-07-23T14:00:00.000,2023-07-23T22:00:00.000,"Maltitz, Philipp Schultheis, wannadosomething?, Selina (DE)",Revier Südost,/events/1728556,36
KATERRAMA,2023-07-21T00:00:00.000,2023-07-21T23:00:00.000,2023-07-23T22:00:00.000,"David Bucka, DIEGÖ, MANTi, Bonjour Ben, Nixe, Intaktogene, Paul Traeumer, Mona Moore, caipora, Mehr is Mehr, Lagomo, , Stan Starry, Ukiyo (Music), nøvae, Ezgi, Unders",Kater Blau,/events/1729846,33
Let's Kick,2023-07-23T00:00:00.000,2023-07-23T15:00:00.000,2023-07-24T03:00:00.000,"Ascion, Madalba",Watergate,/events/1740746,18
SIP! curated by ZENNER,2023-07-23T00:00:00.000,2023-07-23T14:00:00.000,2023-07-23T22:00:00.000,"Kieran Behan, Poly-Ritmo, robbin",ZENNER,/events/1729350,16
Somnambul BLN,2023-07-23T00:00:00.000,2023-07-23T22:00:00.000,2023-07-24T07:00:00.000,"Ben Tov, DOBE",KitKatClub,/events/1731126,13
Sundays::,2023-07-23T00:00:00.000,2023-07-23T12:00:00.000,2023-07-24T09:00:00.000,"Cabanne, Dorian Paic, Gianni, Luc Ringeisen, Lorenzo Chiabotti, A Guy Called Gerald, Matt Foley",Club der Visionaere,/events/1742860,12
BeFruity – Garden Of Delights,2023-07-23T00:00:00.000,2023-07-23T14:00:00.000,2023-07-23T22:00:00.000,"Najesh & Artišoko, Seyde, zhart (BeYond), Rakäthe",gART.n,/events/1739533,11
Benjamin Fehr & Freunde,2023-07-22T00:00:00.000,2023-07-22T18:00:00.000,2023-07-24T06:00:00.000,Benjamin Fehr,Minimal Bar,/events/1717966,11
lazy.sunday mit SUNRISE_GROOVE,2023-07-23T00:00:00.000,2023-07-23T18:00:00.000,2023-07-24T04:00:00.000,SUNRISE_GROOVE,Minimal Bar,/events/1723253,9
Dark Matter Sommerlights TENSOR,2023-07-23T00:00:00.000,2023-07-23T20:00:00.000,2023-07-24T00:00:00.000,Akiko Haruna,Dark Matter Berlin,/events/1730697,9
Sonntagstanz Open Air + Arts Exhibition,2023-07-23T00:00:00.000,2023-07-23T14:00:00.000,2023-07-23T22:00:00.000,,Fitzroy,/events/1742305,9
New Beat Sunday,2023-07-23T00:00:00.000,2023-07-23T18:00:00.000,2023-07-24T02:00:00.000,"Marko König, Incendie",Urban Spree,/events/1742175,6
Life is Good Festival,2023-07-21T00:00:00.000,2023-07-21T19:00:00.000,2023-07-23T22:00:00.000,,House of Weekend,/events/1744761,0
SINGULARITY MONDAY RAVE / 2 floors indoor rave + open air area / tickets at the door ,2023-07-24T00:00:00.000,2023-07-24T23:00:00.000,2023-07-25T09:00:00.000,"JANEIN, Aubrey, OCD, BLACK ANTHEM RESTORE, Daniel Berj",Re:mise,/events/1739899,360
Spectrum of Love,2023-07-22T00:00:00.000,2023-07-22T23:00:00.000,2023-07-30T12:00:00.000,"Beka, GEMO, CLEMSON, MARHOLZ, Mutualism (DE)",Mensch Meier,/events/1738353,71
Electric Monday,2023-07-24T00:00:00.000,2023-07-24T22:00:00.000,2023-07-25T07:00:00.000,"Norman Weber, Frankie Flowerz, Ele Luz, AGENT PROVOCATEUR",KitKatClub,/events/1727115,28
manic.monday mit Elise and that guy,2023-07-24T00:00:00.000,2023-07-24T18:00:00.000,2023-07-25T04:00:00.000,Skinny Duchamp,Minimal Bar,/events/1723254,19
Traveling Without Moving,2023-07-24T00:00:00.000,2023-07-24T15:00:00.000,2023-07-25T06:00:00.000,"Katsuya Sano, Caruan, Spacetravel",Club der Visionaere,/events/1742877,8
Festa Junina - Arraia da Bossa,2023-07-24T00:00:00.000,2023-07-24T13:00:00.000,2023-07-24T16:30:00.000,,Festsaal Kreuzberg,/events/1696831,2
Dark Monday,2023-07-24T00:00:00.000,2023-07-24T22:00:00.000,2023-07-25T04:00:00.000,,Dunckerclub,/events/1734528,1
encore.une.fois / indoor rave + open air chill garden / tickets at the door ,2023-07-25T00:00:00.000,2023-07-25T23:00:00.000,2023-07-26T09:00:00.000,"Sven Weisemann, Oliver Rosemann, Nnamael, zikade",OXI,/events/1730370,333
HART,2023-07-25T00:00:00.000,2023-07-25T23:00:00.000,2023-07-26T09:00:00.000,Klangpusch,Der Weiße Hase,/events/1704452,88
Spectrum of Love,2023-07-22T00:00:00.000,2023-07-22T23:00:00.000,2023-07-30T12:00:00.000,"Beka, GEMO, CLEMSON, MARHOLZ, Mutualism (DE)",Mensch Meier,/events/1738353,71
I don't know ambient,2023-07-25T00:00:00.000,2023-07-25T18:00:00.000,2023-07-25T23:00:00.000,"Carmen Villain, Roméo Poirier, Ultrafog, Ulla, Burago",Lobe Block,/events/1740681,54
THE UNKNOWN,2023-07-25T00:00:00.000,2023-07-25T22:00:00.000,2023-07-26T04:00:00.000,"Seemless, Etiennette",Süss War Gestern,/events/1722021,29
System Error,2023-07-25T00:00:00.000,2023-07-25T15:00:00.000,2023-07-26T06:00:00.000,"INGI (1), AIDA (CA), Doxan, Rupert Marnie, ISH, Travis or Alice, ESVEAE",Club der Visionaere,/events/1737385,27
ILLUSION at KitKat Club,2023-07-25T00:00:00.000,2023-07-25T22:00:00.000,2023-07-26T06:00:00.000,"Aaron Suiss, Mark Stanton, Prost!",KitKatClub,/events/1744255,15
go.play mit Aramis,2023-07-25T00:00:00.000,2023-07-25T18:00:00.000,2023-07-26T04:30:00.000,,Minimal Bar,/events/1723255,16
BLAUES STÜNDCHEN w. #ope,2023-07-25T00:00:00.000,2023-07-25T17:00:00.000,2023-07-26T00:00:00.000,,Klunkerkranich,/events/1742672,13
Kennitala Tour Berlin,2023-07-25T00:00:00.000,2023-07-25T20:00:00.000,2023-07-25T22:30:00.000,"Flaaryr, sideproject",Loophole,/events/1738352,10
EXZESSBETREUUNG Berlin,2023-07-25T00:00:00.000,2023-07-25T22:00:00.000,2023-07-26T06:00:00.000,,Georgia Bar,/events/1742996,8
