Shades of Oshu vol. 6 with Dumama + Kechou,2022-05-12T00:00:00.000,2022-05-12T20:00:00.000,2022-05-13T03:00:00.000,,Badehaus Berlin,/events/1531981,0
Drop The Beat,2022-05-11T00:00:00.000,2022-05-11T20:00:00.000,2022-05-12T23:59:00.000,,Wendel,/events/1533772,0
Acid Techno Techno Club,2022-05-13T00:00:00.000,2022-05-13T23:59:00.000,2022-05-14T12:00:00.000,"Derrick Raw, ØTTA, Somniac One, DLV, Blame The Mono, Alva, Pelin Vedis, Diana Azzuz, Rina Priduvalova, ZAGROZA",Anomalie Art Club,/events/1523353,862
Expeditions N030,2022-05-13T00:00:00.000,2022-05-13T23:59:00.000,2022-05-14T10:00:00.000,"Andre Kronert, Any Mello, Edit-Select, Mømentum, Noir, Tripolitan, DJ T., Dana Ruh, Anna Schreit, Glenn Holmes",://about blank,/events/1520934,421
ERRØR with Angykore & Gabriel Padrevita / Xynia / ROJI / Alex Friday / Kø:lab / SACID,2022-05-13T00:00:00.000,2022-05-13T23:00:00.000,2022-05-14T08:00:00.000,"AnGy KoRe, Gabriel Padrevita, Xynia, ROJI, Alex Friday, Kø:lab, SACID, WAYNETTE, KlingundKlang",M-BIA,/events/1519653,387
AWAKE pres. A*S*Y*S,2022-05-13T00:00:00.000,2022-05-13T23:00:00.000,2022-05-14T08:00:00.000,"A.D.H.S., BEC, Raumakustik, ALXJ, Bombata & The Fox",OST,/events/1507822,324
"Self. Control. with Black Spuma, Cardopusher, Das Ding, Fixmer/McCarthy, Giulia Gutterer",2022-05-13T00:00:00.000,2022-05-13T22:00:00.000,2022-05-14T10:00:00.000,"Cardopusher, Fixmer/McCarthy, L.F.T., Mejle, Melanie Havens, Lauer, Fabrizio Mammarella, Das Ding, Franz Scala, Giulia Gutterer",RSO.BERLIN,/events/1532532,170
"ELSI presents Ruf Dug, evin b2b ferrari rot, O.N.A, Triqi",2022-05-13T00:00:00.000,2022-05-13T23:00:00.000,2022-05-14T09:00:00.000,"Ruf Dug, evin, ferrari rot, Triqi, BLVSH",ÆDEN,/events/1523250,163
"InFiné 15YO Berlin : Rone, Deena Abdelwahed, Gaspar Claus, Leonie Pernet, Frieder Nagel",2022-05-13T00:00:00.000,2022-05-13T20:00:00.000,2022-05-14T04:00:00.000,"Rone, Deena Abdelwahed, Léonie Pernet, Bottler, Basile3, Cubenx, Frieder Nagel",ZENNER,/events/1512581,101
"Birgits Clubnight with Tim Etzel, Bee Lincoln, Alan Murphy, Bendtsen, Nico Cabeza ",2022-05-13T00:00:00.000,2022-05-13T22:00:00.000,2022-05-14T08:00:00.000,"Tim Etzel, Bee Lincoln, Nico Cabeza, Mattia Saviolo",Birgit,/events/1528563,76
Mental Power,2022-05-13T00:00:00.000,2022-05-13T23:00:00.000,2022-05-14T10:00:00.000,"Dagga, Damon Wild, DJ Geil, False Witness, Golden Medusa, Souci, Tanith, Young Lychee",Lokschuppen Berlin,/events/1524850,76
"Freitag with DJ Koolt, Iron Curtis, Laura van Hal, Rommek",2022-05-13T00:00:00.000,2022-05-13T23:00:00.000,2022-05-14T06:00:00.000,"DJ Koolt, Frozilla, Ines Cartas, SENERGI, Iron Curtis, Johannes Albert, Laura van Hal, Ōtone, Rommek, Zola",Renate,/events/1531387,74
"Tresor.Klubnacht with Joey Beltram, Daniel Bell, Fireground, Tasha",2022-05-13T00:00:00.000,2022-05-13T23:59:00.000,2022-05-14T12:00:00.000,"Barbara Preisinger, Daniel Bell, Fireground, Fumiya Tanaka, Handmade, Joey Beltram, Tasha, Z.I.P.P.O",Tresor / Globus,/events/1533167,48
10 Years Príncipe,2022-05-13T00:00:00.000,2022-05-13T22:00:00.000,2022-05-14T06:00:00.000,"Dj Danifox, DJ Firmeza, DJ Marfox",Berghain | Panorama Bar | Säule,/events/1521574,46
"Nachtklub - Watergate x Criminal Bassline: Ida Engberg, The Reason Y, KANT, Beth Lydi",2022-05-13T00:00:00.000,2022-05-13T23:59:00.000,2022-05-14T12:00:00.000,"Ida Engberg, The Reason Y, KANT, Beth Lydi, Daniel Jaeger, Mike Book, vom Feisten, Daniel Neuland",Watergate,/events/1523960,43
Wolke Rave,2022-05-13T00:00:00.000,2022-05-13T20:00:00.000,2022-05-15T16:00:00.000,"Amphetamax, LASERBOY, MIAU MIAU, Wachbär, Rocco Arizona, DJ HENTAI, MIAU MIAU, Techno Thomson",H13 Kulturpark,/events/1532901,40
Emergent Bass #4,2022-05-13T00:00:00.000,2022-05-13T19:00:00.000,2022-05-14T08:00:00.000,"Perera Elsewhere, DJ Zhao, DJ Flight, JAXX TMS, SLIC Unit, Detroit In Effect, Coco Cobra, Rudoh, Dede, Nasra",Mensch Meier,/events/1528638,36
Klubnacht / Der Weiße Hase,2022-05-13T00:00:00.000,2022-05-13T23:00:00.000,2022-05-14T10:00:00.000,"TAG, Nadine Fehn",Der Weiße Hase,/events/1530934,41
VF5# Dame Area // Phallucipher,2022-05-13T00:00:00.000,2022-05-13T20:00:00.000,2022-05-13T23:00:00.000,Dame Area,Urban Spree,/events/1528969,34
Borderless Pres. Berlin X Australia,2022-05-13T00:00:00.000,2022-05-13T23:00:00.000,2022-05-15T10:00:00.000,"Eluize, Papa K, Jack Clark, Lask, Matt Lush, laserdong, Kaya Wld",AVA Club,/events/1532918,32
9 Jahre Humboldthain,2022-05-13T00:00:00.000,2022-05-13T22:00:00.000,2022-05-14T09:00:00.000,"Reuse, Kt Zentrum, Blender (2), Marius Reisser, Naks, Menqui, Undermind",Humboldthain Club,/events/1523176,30
Date moved to may ,2022-05-13T00:00:00.000,2022-05-13T21:00:00.000,2022-05-14T11:00:00.000,,TBA - Berlin,/events/1520653,29
Art Bei Ton: Private 7,2022-05-13T00:00:00.000,2022-05-13T23:59:00.000,2022-05-14T08:00:00.000,"Klara Vedis, Mown, Pattrn",TBA - Berlin,/events/1531608,28
EXCiTE - Techno.Pure,2022-05-13T00:00:00.000,2022-05-13T23:00:00.000,2022-05-14T08:00:00.000,"Boudi Boudin & Salomé, Boudi Boudin, Felix Reichelt, Crashkitt, Ida Scheppert",Void Club,/events/1522070,26
Laut&Luise && Feines Tier Showcase,2022-05-13T00:00:00.000,2022-05-13T23:59:00.000,2022-05-14T12:00:00.000,"Dominik Marz, Constantijn Lange, Holger Hecler, Isabeau Fort, Johannes Klingebiel, Kleintierschaukel, Liesa, Philipp Fein",Kater Blau,/events/1528552,25
Weval • Berlin,2022-05-13T00:00:00.000,2022-05-13T19:00:00.000,2022-05-13T23:30:00.000,Weval,Silent Green,/events/1522798,25
"Dojas invites: Martin Dacar, Sauchelli, lievar",2022-05-13T00:00:00.000,2022-05-13T23:00:00.000,2022-05-14T06:00:00.000,"Martin Dacar, Dojas, Sauchelli, lievar",Bulbul Berlin,/events/1526889,24
SUPERBOOTH22,2022-05-12T00:00:00.000,2022-05-12T10:00:00.000,2022-05-14T23:00:00.000,"Eden Grey, Julia Bondar, Maarten Vos, Anton Filatov",FEZ Berlin,/events/1518466,20
Legion II,2022-05-13T00:00:00.000,2022-05-13T23:00:00.000,2022-05-14T10:00:00.000,"VINYA, CALLE, Henriko, Henriko",Re:mise,/events/1529422,15
Defrost pres. Work this Kiki Ball,2022-05-13T00:00:00.000,2022-05-13T17:00:00.000,2022-05-13T22:00:00.000,,Else,/events/1529725,15
Rodriguez Jr. (live) at Kulturgarten Open Air,2022-05-13T00:00:00.000,2022-05-13T18:00:00.000,2022-05-13T22:00:00.000,"Rodriguez Jr., Ralf Kollmann, Gullen",Ritter Butzke,/events/1522871,14
Power House,2022-05-13T00:00:00.000,2022-05-13T23:30:00.000,2022-05-14T08:00:00.000,"Boris Dlugosch, Finn Johannsen",Paloma,/events/1527312,13
Mobilee Showcase,2022-05-13T00:00:00.000,2022-05-13T23:00:00.000,2022-05-14T08:00:00.000,"Rodriguez Jr., Mathias Kaden, Squire, M.E.M.O., NELA, Gullen, Ralf Kollmann",Ritter Butzke,/events/1525188,12
MILK ME / H.L.M. Architecture Compliquée Release Party,2022-05-13T00:00:00.000,2022-05-13T20:00:00.000,2022-05-14T06:00:00.000,"Acid Washed, Billy Idle, Unickue, Scot Dech, Vamparela",Urban Spree,/events/1532603,11
Out Of Line Weekender - Dark'n'electro Edition,2022-05-13T00:00:00.000,2022-05-13T18:00:00.000,2022-05-15T03:00:00.000,"Ashbury Heights, Front 242",Astra Kulturhaus,/events/1455065,11
Micropacer Invites... Jay Shepheard,2022-05-13T00:00:00.000,2022-05-13T22:00:00.000,2022-05-14T06:00:00.000,"Jay Shepheard, Micropacer, Norman Peer",Bohnengold,/events/1529797,10
Smells,2022-05-13T00:00:00.000,2022-05-13T22:30:00.000,2022-05-14T06:00:00.000,"Stella Zekri, annna (2), Niklas Wandt",Sameheads,/events/1530288,8
The Cube,2022-05-13T00:00:00.000,2022-05-13T23:00:00.000,2022-05-14T08:00:00.000,"edgarwilles, CLEMSON, Elle Ell",Kulturhaus Kili,/events/1532556,8
Beschäftigungstherapie - with Manu Strasse & TeamTURBO,2022-05-13T00:00:00.000,2022-05-13T23:00:00.000,2022-05-14T08:00:00.000,"Chris Plettenberg, Manu Strasse, justUS",Beate Uwe,/events/1530357,7
Warmup.berlin,2022-05-13T00:00:00.000,2022-05-13T15:00:00.000,2022-05-14T09:00:00.000,"Brasi, Ernesto Ferreyra, Lee Burton, Nekes",Club der Visionaere,/events/1533751,7
Deep Secrets with Freudenthal (Pardon Moi),2022-05-13T00:00:00.000,2022-05-13T22:00:00.000,2022-05-14T06:00:00.000,Freudenthal,TBA - Berlin,/events/1529630,4
Jamz Supernova + Juba + DEBY CAGE + FEMDELIC,2022-05-13T00:00:00.000,2022-05-13T23:59:00.000,2022-05-14T06:00:00.000,"Jamz Supernova, Juba, Femdelic",Gretchen,/events/1531527,4
Model Pupil,2022-05-13T00:00:00.000,2022-05-13T23:59:00.000,2022-05-14T13:00:00.000,"Diana Rada, Phil2, Edgar Peng",Golden Gate,/events/1531564,4
Master & Servant,2022-05-13T00:00:00.000,2022-05-13T22:00:00.000,2022-05-14T06:00:00.000,,Insomnia,/events/1507996,4
Oliver Sim (The xx) live,2022-05-13T00:00:00.000,2022-05-13T19:00:00.000,2022-05-13T23:00:00.000,,Schwuz,/events/1530274,3
bambule.Berlin mit Oaky und guest Aramis,2022-05-13T00:00:00.000,2022-05-13T18:00:00.000,2022-05-14T06:00:00.000,,Minimal Bar,/events/1521560,3
Psychberg Affairs presents: Black Maracas and KeyM'Pi,2022-05-13T00:00:00.000,2022-05-13T20:30:00.000,2022-05-14T05:00:00.000,,Loophole,/events/1523385,3
Random Mind State Labelnight,2022-05-13T00:00:00.000,2022-05-13T22:00:00.000,2022-05-14T06:00:00.000,Júlio Cruz,Paloma,/events/1526513,3
Unser Freitag im Promenaden Eck,2022-05-13T00:00:00.000,2022-05-13T19:00:00.000,2022-05-14T06:00:00.000,,Promenaden Eck,/events/1530437,2
CALENTURA AT FRITZROY,2022-05-13T00:00:00.000,2022-05-13T22:00:00.000,2022-05-14T07:00:00.000,acidheaven,Fitzroy,/events/1533786,2
Funky Friday,2022-05-13T00:00:00.000,2022-05-13T18:00:00.000,2022-05-14T01:00:00.000,Minigram,Solar,/events/1530838,1
La Bomba with Feierabend Poetic Cumbia,2022-05-13T00:00:00.000,2022-05-13T21:00:00.000,2022-05-14T04:00:00.000,,Badehaus Berlin,/events/1531984,1
Lebenslange Synthhaft,2022-05-13T00:00:00.000,2022-05-13T23:59:00.000,2022-05-15T06:00:00.000,,Zur Klappe,/events/1532750,1
Beryll,2022-05-13T00:00:00.000,2022-05-13T18:00:00.000,2022-05-14T01:00:00.000,Beryll,House of Gin,/events/1530909,0
"No Label / w. Kleineskind, Stefano Aluzzi & King Sleepy",2022-05-13T00:00:00.000,2022-05-13T21:00:00.000,2022-05-14T04:00:00.000,Flight Mode (DE),Barbox by Generator,/events/1532990,0
Evopool Update,2022-05-13T00:00:00.000,2022-05-13T14:00:00.000,2022-05-13T16:00:00.000,Chris Maico Schmidt,Evosonic Radio,/events/1534069,0
CAVE NOIR,2022-05-13T00:00:00.000,2022-05-13T22:00:00.000,2022-05-14T06:00:00.000,,The Pearl,/events/1535295,0
R.O.I. - ANLAGEBERATUNG,2022-05-13T00:00:00.000,2022-05-13T22:00:00.000,2022-05-14T06:00:00.000,,arkaoda Berlin,/events/1535371,0
TYPE Records presents: Deep Electronica,2022-05-13T00:00:00.000,2022-05-13T21:00:00.000,2022-05-14T01:00:00.000,Minigram,Solar,/events/1535494,0
Porn by Pornceptual,2022-05-14T00:00:00.000,2022-05-14T23:00:00.000,2022-05-15T12:00:00.000,"Stephanie Sykes, DJ Gigola, Cressida, Blasha & Allatt, The Lady Machine, marum, Rakans, Projekt Gestalten, Mister Willis, Dirty Daddy Don, Radical Softness",MUENZE,/events/1522909,2088
We Are Not Alone,2022-05-14T00:00:00.000,2022-05-14T23:59:00.000,2022-05-16T06:00:00.000,"Ellen Allien, Adriana Lopez, Alex Wilcox, Andrew Moore, DJ T-1000, Hemka, Maxime IKO, Niki Istrefi, Philipp Gorbachev, Ryan James Ford, Rosa Anschütz, Shaleen, Somewhen, Tensal, UVB",RSO.BERLIN,/events/1527085,1331
Horse Meat Disco,2022-05-14T00:00:00.000,2022-05-14T23:00:00.000,2022-05-15T12:00:00.000,"James Hillard, Michelle Manetti, Trent",Prince Charles,/events/1525224,1078
"Else : Claire Morgan, Ina Kacz, Magna Pia, Rrose, Shifted, SHXCXCHCXSH (LIVE)",2022-05-14T00:00:00.000,2022-05-14T14:00:00.000,2022-05-15T06:00:00.000,"Claire Morgan, Ina Kacz, Magna Pia, Rrose, Shifted, SHXCXCHCXSH",Else,/events/1532040,336
Staub,2022-05-14T00:00:00.000,2022-05-14T10:00:00.000,2022-05-14T22:00:00.000,,://about blank,/events/1472998,327
"ROOM w/ Jonas Kopp, Holden Federico",2022-05-14T00:00:00.000,2022-05-14T23:00:00.000,2022-05-15T13:00:00.000,"Jonas Kopp, Holden Federico, Angioma, Ben Reymann, BLANKA, DARK-307, Mod.1, nkx, Reka Zalan",Anomalie Art Club,/events/1506688,273
OXInacht,2022-05-14T00:00:00.000,2022-05-14T23:59:00.000,2022-05-15T12:00:00.000,"Air Max '97, ERAM (BR), DJ LAG, Nosedrip, DJ Plead, DJ Sundae, x3butterfly",OXI,/events/1528135,192
Vertere Berlin: Strictly Dancefloor Business,2022-05-14T00:00:00.000,2022-05-14T17:00:00.000,2022-05-15T09:00:00.000,"Alex Kassian, BAUGRUPPE90, Neri J, VSSR, MOREL (DE), Basic Instinct, Jana Falcon",ÆDEN,/events/1530484,170
"TRI:CEPTION (Techno, Psytrance, DNB) :Start 11pm",2022-05-14T00:00:00.000,2022-05-14T23:00:00.000,2022-05-15T09:00:00.000,"Mike Väth, Der Eggert, Chris-A-Nova, Upzet",Void Club,/events/1530743,158
Klubnacht,2022-05-14T00:00:00.000,2022-05-14T23:59:00.000,2022-05-16T06:00:00.000,"Alinka, Floorplan, Mike Starr, Steffi, Tijana T, TITIA, Virginia, Len Faki, Marcel Dettmann, Nathalie Seres",Berghain | Panorama Bar | Säule,/events/1521575,122
"Samstag with Aerea Negrot, Elise Massoni, Monty Luke, Oracy",2022-05-14T00:00:00.000,2022-05-14T23:00:00.000,2022-05-15T12:00:00.000,"Aerea Negrot, Elise Massoni, Industrial Romantico, Monty Luke, Monibi, Oracy, Olin",Renate,/events/1532531,104
SNAX Club,2022-05-14T00:00:00.000,2022-05-14T23:00:00.000,2022-05-15T12:00:00.000,"Alex Levin, Boris, Yonti, Cormac, Luigi Di Venere, Massimiliano Pagliara",Berghain | Panorama Bar | Säule,/events/1512420,88
5 Jahre KlangSubsTanz & 8 Jahre FBB,2022-05-14T00:00:00.000,2022-05-14T22:00:00.000,2022-05-15T10:00:00.000,"WIEK, Mina da Lua, Flow (2), AHAB",TBA - Berlin,/events/1508060,83
Sven Väth - Catharsis World Tour 2022,2022-05-14T00:00:00.000,2022-05-14T23:59:00.000,2022-05-15T13:00:00.000,"Sven Vath, Maurizio Schmitz, JAMIIE, Ede",Watergate,/events/1525279,74
"Tresor.Klubnacht with Bjarki, Max Durante, Paàl b2b IMOGEN, Slikback live",2022-05-14T00:00:00.000,2022-05-14T23:59:00.000,2022-05-15T12:00:00.000,"Bjarki, Isabassi, Jesse G, Max Durante, Paàl, IMOGEN, Shapednoise, Simon Kaiser, Slikback, Uta",Tresor / Globus,/events/1533172,57
Dessert,2022-05-14T00:00:00.000,2022-05-14T23:30:00.000,2022-05-15T10:00:00.000,"Ignez, Carsten Jost, WINDFUHR, Miro Von Berlin, Téo Dréan, Rancido, Just Lauren, Marc Miroir, Tom Peters",://about blank,/events/1516861,57
Golosa x BRENN. x Genderlich,2022-05-14T00:00:00.000,2022-05-14T23:00:00.000,2022-05-15T11:00:00.000,"Séxstasy, Sherø, FLEMISH FETISH, Tini Weng, Andre Fau, Mars Antrax, KH38",Lokschuppen Berlin,/events/1528505,49
Nachtcrew,2022-05-14T00:00:00.000,2022-05-14T23:00:00.000,2022-05-15T09:00:00.000,"DINA, DJ KOWBOJ, My Gander, Marilao",Re:mise,/events/1526304,48
"weeeirdos w// LOLSNAKE, Riotbutt, Cunt Remember, DJ Skin",2022-05-14T00:00:00.000,2022-05-14T23:00:00.000,2022-05-15T09:00:00.000,"DJ SKIN, LOLSNAKE",Fitzroy,/events/1526074,47
Recycle presents: LTJ Bukem + RUTHLESS MC,2022-05-14T00:00:00.000,2022-05-14T23:59:00.000,2022-05-15T06:30:00.000,"LTJ Bukem, Ladybird, SHU (2)",Gretchen,/events/1517796,42
Wolke Rave,2022-05-13T00:00:00.000,2022-05-13T20:00:00.000,2022-05-15T16:00:00.000,"Amphetamax, LASERBOY, MIAU MIAU, Wachbär, Rocco Arizona, DJ HENTAI, MIAU MIAU, Techno Thomson",H13 Kulturpark,/events/1532901,40
"NADIR X with Cryptofauna, strictly strictly [takeover], Hanna Baertig, Salomon",2022-05-14T00:00:00.000,2022-05-14T23:59:00.000,2022-05-15T08:00:00.000,"Cryptofauna, Hanna Baertig, Salomon (2), Klex, RomanGHB, Jana Falcon",Humboldthain Club,/events/1529117,37
"Berlin Techno with Pappenheimer, Dachgeschoss, Jordan, Freulein P  ",2022-05-14T00:00:00.000,2022-05-14T22:00:00.000,2022-05-15T06:00:00.000,"Dachgeschoss, Schmitzkatzki, Freulein P., Perthil",ASeven,/events/1502736,36
Borderless Pres. Berlin X Australia,2022-05-13T00:00:00.000,2022-05-13T23:00:00.000,2022-05-15T10:00:00.000,"Eluize, Papa K, Jack Clark, Lask, Matt Lush, laserdong, Kaya Wld",AVA Club,/events/1532918,32
The Risky Sets / Westbam & Thomas Lizzara,2022-05-14T00:00:00.000,2022-05-14T22:00:00.000,2022-05-15T09:00:00.000,"Westbam, Thomas Lizzara, MARCEL db, JayKosy",ORWO Haus,/events/1520683,32
MITMISCHEN INVITES,2022-05-14T00:00:00.000,2022-05-14T22:00:00.000,2022-05-15T06:00:00.000,"CRYME, Supergloss, Spacer Woman, BBetriebswirt",Crack Bellmer,/events/1529343,28
Klubnacht/ Open Air,2022-05-14T00:00:00.000,2022-05-14T23:00:00.000,2022-05-15T10:00:00.000,"Zoe Palace, Kobzev, Michail Konstantinidis, Bekuchi, Aimé You",AVA Club,/events/1532920,27
SaSo with Yør Kultura / Elfenberg / doob / Foolik / Coss / Jane Ulé / Elizen the Emperor,2022-05-14T00:00:00.000,2022-05-14T12:00:00.000,2022-05-15T12:00:00.000,"doob, Yør Kultura, Elfenberg, Foolik, Coss, Fabian Krooss, Judith van Waterkant, ELIZEN THE EMPEROR",Kater Blau,/events/1530755,26
Innellea Distorted Youth Tour Berlin – CANCELLED,2022-05-14T00:00:00.000,2022-05-14T23:00:00.000,2022-05-15T08:00:00.000,"Innellea, Konstantin Sibold, Magit Cacoon, SAGAN",TBA - Berlin,/events/1527320,26
Sexy Döner Rave Open Air,2022-05-14T00:00:00.000,2022-05-14T12:00:00.000,2022-05-14T22:00:00.000,"Danito San, C'mon, Boxenschlampe",Bagdad Imbiss,/events/1534850,25
Hedomanie: Hedonistic Dance Party,2022-05-14T00:00:00.000,2022-05-14T22:00:00.000,2022-05-15T07:00:00.000,"Pettø., Heretix, Wiebe Roose",Insomnia,/events/1506682,25
Celestial Festival,2022-05-14T00:00:00.000,2022-05-14T14:00:00.000,2022-05-16T05:00:00.000,"Pooja B, BB Deng, Coco Cobra",Fiese Remise,/events/1526792,24
"SLiDE: Soundstream b2b Snow, 1-800-Disco, Fellagha, Zapata, palle, Brink",2022-05-14T00:00:00.000,2022-05-14T23:00:00.000,2022-05-15T06:00:00.000,"Soundstream, Snow (DE), 1-800-Disco, Fellagha, Zapata, palle, Brink (US)",Bulbul Berlin,/events/1526892,24
Mole Market x Tale of Bus,2022-05-14T00:00:00.000,2022-05-14T12:00:00.000,2022-05-14T22:00:00.000,"rubi*, Gnarly J, Daan Donk, Alfret",,/events/1533804,20
SUPERBOOTH22,2022-05-12T00:00:00.000,2022-05-12T10:00:00.000,2022-05-14T23:00:00.000,"Eden Grey, Julia Bondar, Maarten Vos, Anton Filatov",FEZ Berlin,/events/1518466,20
Trommel,2022-05-14T00:00:00.000,2022-05-14T23:00:00.000,2022-05-15T12:00:00.000,"Edward, Markus Sommer, Spacetravel, Topper",Hoppetosse,/events/1526929,20
Ceremony - Palomar Edition,2022-05-14T00:00:00.000,2022-05-14T23:00:00.000,2022-05-15T10:00:00.000,"Joan Bernat, Nirel Nica, Llupe, Rafa (ES)",TBA - Berlin,/events/1528330,19
RAVE! the Rabbit,2022-05-14T00:00:00.000,2022-05-14T23:00:00.000,2022-05-15T10:00:00.000,"Rick.O, Michael Gubaew, Julian Theisen, Balkhausen",Der Weiße Hase,/events/1533247,24
"MUSAR x arkaoda w/ Nightwave, Hoshina Anniversary, SG, J.Wiltshire & Dweedo",2022-05-14T00:00:00.000,2022-05-14T20:00:00.000,2022-05-15T06:00:00.000,"Nightwave, Hoshina Anniversary, J.Wiltshire, Dweedo",arkaoda Berlin,/events/1529313,16
"PSSST! LTMD Gestrandet with SoKool, Max Joni, Tanzklar, Pierre Remy",2022-05-14T00:00:00.000,2022-05-14T14:00:00.000,2022-05-14T22:00:00.000,"Sokool, Max Joni, Pierre Remy, Lotte LAUT",Gestrandet An Der Jannowitzbrücke,/events/1533286,16
"Süss mit Nikklaas, Better Call Paul, Anne Hou, fujiKATO, Ken, Die.Feder",2022-05-14T00:00:00.000,2022-05-14T19:00:00.000,2022-05-15T07:00:00.000,"Nikklaas, Better Call Paul, Anne Hou, fujiKATO",Süss War Gestern,/events/1534136,15
Paradisco Spring Fling,2022-05-14T00:00:00.000,2022-05-14T22:00:00.000,2022-05-15T05:00:00.000,"Imad, Triqi",Monarch,/events/1523916,14
"Leon Licht, Kaufmann, Maurice Mino & Sin:port at Garten der Nacht",2022-05-14T00:00:00.000,2022-05-14T23:00:00.000,2022-05-15T07:00:00.000,"Maurice Mino, Sin:port, Kaufmann, Leon Licht",Ritter Butzke,/events/1531496,12
Small Circles,2022-05-14T00:00:00.000,2022-05-14T12:00:00.000,2022-05-15T08:00:00.000,"Innershades, International Mac, Tau Car, Intheismah, Lawrence Asher",Club der Visionaere,/events/1533171,11
Honey Loops,2022-05-14T00:00:00.000,2022-05-14T22:00:00.000,2022-05-15T05:00:00.000,"FABIE.MUSIC, Lasha Guruli, Sikha, Lena Brumby",Paloma,/events/1488736,11
Out Of Line Weekender - Dark'n'electro Edition,2022-05-13T00:00:00.000,2022-05-13T18:00:00.000,2022-05-15T03:00:00.000,"Ashbury Heights, Front 242",Astra Kulturhaus,/events/1455065,11
Pretty Nasty,2022-05-14T00:00:00.000,2022-05-14T23:00:00.000,2022-05-15T07:00:00.000,"Nasty King Kurl, Meg10",Sameheads,/events/1533626,9
Barnacht with Kotelett & Jan Mir,2022-05-14T00:00:00.000,2022-05-14T20:00:00.000,2022-05-15T06:00:00.000,"Kotelett&Zadak, Kotelett, Jan Mir",Marktlokal Klub,/events/1530118,8
JUICY,2022-05-14T00:00:00.000,2022-05-14T23:00:00.000,2022-05-15T08:00:00.000,"Faul, Isabeau Fort, Gwen Wayne, Naomi Dasmoe",Mensch Meier,/events/1528575,7
Andreas Henneberg & Joseph Disco at Kulturgarten Open Air,2022-05-14T00:00:00.000,2022-05-14T18:00:00.000,2022-05-14T22:00:00.000,"Andreas Henneberg, Joseph Disco",Ritter Butzke,/events/1531446,7
"Goanautika w./ Oxidaksi, Symphonix and many more",2022-05-14T00:00:00.000,2022-05-14T23:00:00.000,2022-05-15T10:00:00.000,"Enantion, Vater",Ost Hafen Berlin,/events/1533695,7
Nightshade Family,2022-05-14T00:00:00.000,2022-05-14T23:59:00.000,2022-05-15T13:00:00.000,"Audio Werner, Nils Ohrmann, Frieder Klaris",Golden Gate,/events/1531566,6
friends.zone mit Daza & Jaramillo,2022-05-14T00:00:00.000,2022-05-14T18:00:00.000,2022-05-15T06:00:00.000,"DAZA, Daniel Jaramillo",Minimal Bar,/events/1520709,5
Confusion is next to Happiness,2022-05-14T00:00:00.000,2022-05-14T23:59:00.000,2022-05-15T07:00:00.000,"Mark Knekelhuis, Lucas Brell",Zur Klappe,/events/1532204,4
Bar & Club Night: Robert Drewek (Rawax) Dada Disco (Bar25) & More,2022-05-14T00:00:00.000,2022-05-14T22:00:00.000,2022-05-15T06:00:00.000,"Robert Drewek, Dada Disco, Mr. Fonk",Christa Kupfer,/events/1534062,4
Eclectique,2022-05-14T00:00:00.000,2022-05-14T23:59:00.000,2022-05-15T10:00:00.000,,://about blank,/events/1535136,4
SAFT: Pomelo x TRUST,2022-05-14T00:00:00.000,2022-05-14T23:30:00.000,2022-05-15T08:00:00.000,"Dan Lodig, DJ Glow",Paloma,/events/1526631,4
Local Suicide at TBA,2022-05-14T00:00:00.000,2022-05-14T23:00:00.000,2022-05-15T06:00:00.000,,TBA - Berlin,/events/1535085,3
DE FEO x Old CCCP invites VIKTOR KAMPF,2022-05-14T00:00:00.000,2022-05-14T22:00:00.000,2022-05-15T05:00:00.000,"DE FEO, Viktor Kampf",Old CCCP,/events/1527130,3
After Dark with Boogiemann,2022-05-14T00:00:00.000,2022-05-14T22:00:00.000,2022-05-15T06:00:00.000,Boogiemann,TBA - Berlin,/events/1529616,2
Unser Samstag im Promenaden Eck,2022-05-14T00:00:00.000,2022-05-14T19:00:00.000,2022-05-15T06:00:00.000,,Promenaden Eck,/events/1530438,2
Isa Wolff,2022-05-14T00:00:00.000,2022-05-14T18:00:00.000,2022-05-15T01:00:00.000,Isa Wolff,House of Gin,/events/1530914,1
Lebenslange Synthhaft,2022-05-13T00:00:00.000,2022-05-13T23:59:00.000,2022-05-15T06:00:00.000,,Zur Klappe,/events/1532750,1
Golden Times Special,2022-05-14T00:00:00.000,2022-05-14T23:59:00.000,2022-05-15T13:00:00.000,Livaton,Golden Gate,/events/1535024,1
Dornika // One Drip Two Drip - Release & After Party,2022-05-14T00:00:00.000,2022-05-14T23:00:00.000,2022-05-15T06:00:00.000,"LINNÉA, Hanaby, Sherø, Dornika",Acud Macht NEU,/events/1535365,1
"Sweet Spot x LTMD Showcase with Kaiser KuBa, MUKKIMIAU, Fonzy, Ligal Tamir",2022-05-14T00:00:00.000,2022-05-14T23:00:00.000,2022-05-15T08:00:00.000,"MUKKIMIAU, Fonzy, Ligal Tamir",Beate Uwe,/events/1524736,1
Format Analog,2022-05-14T00:00:00.000,2022-05-14T18:00:00.000,2022-05-15T02:00:00.000,,Solar,/events/1530840,0
CAVE NOIR,2022-05-14T00:00:00.000,2022-05-14T22:00:00.000,2022-05-15T06:00:00.000,,The Pearl,/events/1535296,0
The Future Light Show,2022-05-14T00:00:00.000,2022-05-14T22:00:00.000,2022-05-15T03:00:00.000,disco darnowski,Zu Mir Oder Zu Dir,/events/1535528,0
Dessert,2022-05-14T00:00:00.000,2022-05-14T23:30:00.000,2022-05-15T10:00:00.000,Téo Dréan,://about blank,/events/1516860,0
Years Of Denial (Live),2022-05-15T00:00:00.000,2022-05-15T19:00:00.000,2022-05-16T02:00:00.000,"Years of Denial, Rangelova, Philipp Strobel",Urban Spree,/events/1524858,66
We Are Not Alone,2022-05-14T00:00:00.000,2022-05-14T23:59:00.000,2022-05-16T06:00:00.000,"Ellen Allien, Adriana Lopez, Alex Wilcox, Andrew Moore, DJ T-1000, Hemka, Maxime IKO, Niki Istrefi, Philipp Gorbachev, Ryan James Ford, Rosa Anschütz, Shaleen, Somewhen, Tensal, UVB",RSO.BERLIN,/events/1527085,1331
16 hrs - Bottom Topixxx - (In-& Outdoor),2022-05-15T00:00:00.000,2022-05-15T14:00:00.000,2022-05-16T06:00:00.000,"MCMLXXXV, S-candalo, Lawrence Lee, Tred, CRYME, LYZA, Selected, sanguinica, Jango S, NOËL, DJ KILLING",ÆDEN,/events/1529728,284
Klubnacht,2022-05-14T00:00:00.000,2022-05-14T23:59:00.000,2022-05-16T06:00:00.000,"Alinka, Floorplan, Mike Starr, Steffi, Tijana T, TITIA, Virginia, Len Faki, Marcel Dettmann, Nathalie Seres",Berghain | Panorama Bar | Säule,/events/1521575,122
[CANCELLED] HEX Live concert in Berlin,2022-05-15T00:00:00.000,2022-05-15T19:00:00.000,2022-05-16T06:00:00.000,"Zanias, Lorenzo Raganzini, Paolo Ferrara",Anomalie Art Club,/events/1528618,68
"Birgits Sunday Open Air w/ Aio, Acado & Nikklaas",2022-05-15T00:00:00.000,2022-05-15T14:00:00.000,2022-05-15T22:00:00.000,"Aio, Acado, Nikklaas",Birgit,/events/1528565,66
Frequency Control pres. Sunday Leisure Club,2022-05-15T00:00:00.000,2022-05-15T12:00:00.000,2022-05-15T22:00:00.000,"Alessia Ceruti, bevtelli, Jacøb, Rudolf C, VIDO",Fitzroy,/events/1530559,63
Knock Knock Secret Garden,2022-05-15T00:00:00.000,2022-05-15T14:00:00.000,2022-05-16T00:00:00.000,"Or/Khan, Luli Panasci, DJ.P, Alek Sis",Treehouse,/events/1532529,48
"Else : Anastasia Kristensen, IDA, Madam X, Rhyw, Sebastian Voigt",2022-05-15T00:00:00.000,2022-05-15T14:00:00.000,2022-05-16T06:00:00.000,"Anastasia Kristensen, IDA, Madam X, Rhyw, Sebastian Voigt",Else,/events/1532573,39
Celestial Festival,2022-05-14T00:00:00.000,2022-05-14T14:00:00.000,2022-05-16T05:00:00.000,"Pooja B, BB Deng, Coco Cobra",Fiese Remise,/events/1526792,24
A,2022-05-15T00:00:00.000,2022-05-15T22:00:00.000,2022-05-16T07:00:00.000,,KitKatClub,/events/1522661,22
Bloc Party,2022-05-15T00:00:00.000,2022-05-15T20:00:00.000,2022-05-15T23:00:00.000,Bloc Party,Tempodrom,/events/1497729,12
