No Friction,2024-11-22T00:00:00.000,2024-11-22T22:00:00.000,2024-11-23T10:00:00.000,"Kuriose Naturale, Phauna, Sascha Cawa, Johannes Albert, Katie Drover, Meat, Robert Drewek",Kater Blau,/events/2026549,125
BEATE'S BAMBULE,2024-11-22T00:00:00.000,2024-11-22T23:00:00.000,2024-11-23T08:00:00.000,"- C2C -, die Rote Dora, Flvgmodvs, Ronny Pepper",Beate Uwe,/events/2027061,104
From Berlin with Love - Soli Rave,2024-11-22T00:00:00.000,2024-11-22T23:00:00.000,2024-11-23T07:00:00.000,"Intaktogene, Mehr is Mehr, Rosa Kante, Tante Emma, Thomas Koob",://about blank,/events/2024533,107
"Iterations: TSUNIMAN, DJ SKIN, ISA, Mademoisel, Okouru, Salty DJ",2024-11-22T00:00:00.000,2024-11-22T22:00:00.000,2024-11-23T08:00:00.000,"ISA (ES), DJ SKIN, TSUNIMAN, Okouru, Mademoisel, Salty DJ",TBA - Berlin Secret Location,/events/2024297,97
Tresor meets Acid Bunker,2024-11-22T00:00:00.000,2024-11-22T23:00:00.000,2024-11-23T09:00:00.000,"Data Plan, Ireen Amnes, Martyn, Esther Dune, Ian Martin, Naks",Tresor / Globus,/events/2014475,78
Pillow Princess Klubnacht Vol 2,2024-11-22T00:00:00.000,2024-11-22T23:00:00.000,2024-11-23T07:00:00.000,"James Lotion, Ahni, Pepiita",Zur Klappe,/events/2026408,72
"925 Collective - Season Finale: anna G, Lobo, Monsai, Yasoda ",2024-11-22T00:00:00.000,2024-11-22T23:00:00.000,2024-11-23T06:00:00.000,"anna G, Lobo (DE), Monsai, Yasoda",Bulbul Berlin,/events/2015971,73
Terrasse - Rooftop Party - heated and covered,2024-11-22T00:00:00.000,2024-11-22T18:30:00.000,2024-11-22T23:59:00.000,"REMEN, Jana Nova",Amano East-Side,/events/2044389,77
HOT CUES,2024-11-22T00:00:00.000,2024-11-22T22:00:00.000,2024-11-23T04:00:00.000,"TERRA TWIINS, DJ OFFICESLUT, Tschstin, DJ ABIBALL",Acud Macht NEU,/events/2008110,69
Radical Sounds Latin America (OHM Closing Club Night),2024-11-22T00:00:00.000,2024-11-22T23:59:00.000,2024-11-23T07:30:00.000,"Edna Martinez, Parzubanil, Bclip, Toccororo, AMANTRA",OHM,/events/2018826,62
LIBIDOH,2024-11-22T00:00:00.000,2024-11-22T22:00:00.000,2024-11-23T06:00:00.000,"BELLA X, Erebos, MARRE, Patrik Widmer",Insomnia,/events/1978257,55
HIBRATION,2024-11-22T00:00:00.000,2024-11-22T22:00:00.000,2024-11-23T08:00:00.000,"DJ T-1000, Bailey Brown, 369 (GER), cliff, Eric Brwn, RED FEM, Sandilé",Maaya,/events/2036842,43
Dirty Doering and the OX Gang,2024-11-22T00:00:00.000,2024-11-22T22:00:00.000,2024-11-23T09:00:00.000,"Dirty Doering, Niconé, GIGEE, Marius Drescher, Steve Stix, Sunlast",Ritter Butzke,/events/2013409,37
DUTY FREE MERGER,2024-11-22T00:00:00.000,2024-11-22T23:00:00.000,2024-11-23T08:00:00.000,"Josey Rebelle, Vera Dvale, Arthur (DE), Carl Luis, Giouann",Aktionshaus,/events/2023838,40
Olsvangèr Invites: Running Hot,2024-11-22T00:00:00.000,2024-11-22T20:00:00.000,2024-11-23T03:00:00.000,"Running Hot, Olsvangèr",Orangerie Neukölln,/events/2025203,33
Upstairs Basement,2024-11-22T00:00:00.000,2024-11-22T23:00:00.000,2024-11-23T12:00:00.000,"Calcium Channel, zunz, Raël",TBA - One Big Bathroom,/events/2030686,29
Fem-All / techno,2024-11-22T00:00:00.000,2024-11-22T23:00:00.000,2024-11-23T11:00:00.000,"Nat SuPrise, Maze DK, Babxi, Dydaa Forne, DarK LiZZ",Der Weiße Hase,/events/2028160,26
Hybrid w/ Luis Martinez,2024-11-22T00:00:00.000,2024-11-22T23:00:00.000,2024-11-23T09:00:00.000,"Luis Martinez, DJ Jordan, Segun, Emma (8), Epicx, Yves Meyer, Gerrit X",M-BIA,/events/2032487,34
SENSUS at Humboldthain Club,2024-11-22T00:00:00.000,2024-11-22T23:00:00.000,2024-11-23T07:00:00.000,"TOXIMAMI, EUROBABES, DJ Buona Sara",Humboldthain Club,/events/2036151,27
PEELING,2024-11-22T00:00:00.000,2024-11-22T23:00:00.000,2024-11-23T06:00:00.000,"Alys, iced lattina, Jonas Friedlich, con can",Fitzroy,/events/2027015,21
DAZA & freunde,2024-11-22T00:00:00.000,2024-11-22T18:00:00.000,2024-11-23T06:00:00.000,"DAZA, Daniel Jaramillo, Martinii",Minimal Bar,/events/2010080,19
MIND7 x LAYERS apero,2024-11-22T00:00:00.000,2024-11-22T19:00:00.000,2024-11-23T00:00:00.000,"FRÆNZ:, apkvp",Giri,/events/2041798,34
Dance to the Underground - Queer Punk and Goth Night: Berlin Debut Extravaganza,2024-11-22T00:00:00.000,2024-11-22T23:30:00.000,2024-11-23T05:00:00.000,,Reset - Live Club Berlin Kreuzberg,/events/2025308,16
MIKRO + Afterhour,2024-11-22T00:00:00.000,2024-11-22T23:59:00.000,2024-11-23T23:59:00.000,"Audio Werner, Lucas Hulan, Dona, Schneider Lounge, Stessie Tfgn, Enzo Muro, Flo Pirke",Golden Gate,/events/2034204,16
"Safety Net vol. 2 with Alto Aria (live), FREE JIMI, Olmatri, OSAYA (hybrid), suvelina, t0ni",2024-11-22T00:00:00.000,2024-11-22T20:00:00.000,2024-11-23T03:00:00.000,"FREE JIMI, Olmatri, suvelina, t0ni",Kwia,/events/2043963,16
"Chloe Lula: Oneiris Record Release with Nexcyia, Rami Abi Rafi",2024-11-22T00:00:00.000,2024-11-22T20:00:00.000,2024-11-22T23:00:00.000,"Chloe Lula, Nexcyia, Rami Abi Rafi",Morphine Raum,/events/2044512,15
"Diskomo Anti-Social Club with Loud-E, Rena Volvo, Benji DF",2024-11-22T00:00:00.000,2024-11-22T22:30:00.000,2024-11-23T07:00:00.000,"Loud E, Benji DF",Sameheads,/events/2021449,12
Disco Electronica,2024-11-22T00:00:00.000,2024-11-22T22:00:00.000,2024-11-23T05:00:00.000,,Dunckerclub,/events/2003254,10
The Playhouse: The Dream Playground,2024-11-22T00:00:00.000,2024-11-22T19:30:00.000,2024-11-24T09:00:00.000,,TBA - Secret Location,/events/2022104,9
Free Your Fox,2024-11-22T00:00:00.000,2024-11-22T21:00:00.000,2024-11-23T06:00:00.000,"Bliz Nochi, Marisa Lia, Da Simurgh, Lukas Endhardt",Crack Bellmer,/events/2035167,7
Paloma Invites,2024-11-22T00:00:00.000,2024-11-22T22:00:00.000,2024-11-23T06:00:00.000,Gabs Leyton,Paloma,/events/2015433,6
CHARLIE with sianza + Benny Röder,2024-11-22T00:00:00.000,2024-11-22T22:00:00.000,2024-11-23T06:00:00.000,"sianza, Benjamin Roeder",Paloma,/events/2030344,6
"Club Furia & Sad Prompt Engineering: ZULI, Rama, Mensik, Méxtasis + more",2024-11-22T00:00:00.000,2024-11-22T21:00:00.000,2024-11-23T06:00:00.000,"ZULI, Rama (2), Mensik, pobrediabla, Méxtasis, CÁRPATOS, Artur M Puga, baby ganoush, Mvd0ae",Panke,/events/2046808,11
Double Floor Madness: Hits/90s/80s/HipHop & Electro,2024-11-22T00:00:00.000,2024-11-22T19:00:00.000,2024-11-23T05:00:00.000,,Promenaden Eck,/events/2031730,5
Wilde Herzen • Die Indie Pop Party mit deutschen Texten • Berlin,2024-11-22T00:00:00.000,2024-11-22T23:59:00.000,2024-11-23T05:00:00.000,,Lido Berlin,/events/1985608,5
Treffpunkt w David Hausdorf,2024-11-22T00:00:00.000,2024-11-22T21:00:00.000,2024-11-23T06:00:00.000,"David Hausdorf, Maksym Tkach, Mike Trofimov",Repeat,/events/2043915,5
Clarissa Connelly + Fine – cancelled! –,2024-11-22T00:00:00.000,2024-11-22T20:00:00.000,2024-11-22T22:00:00.000,Fine (UK),Silent Green,/events/2013352,3
Fluffy Clouds,2024-11-22T00:00:00.000,2024-11-22T21:00:00.000,2024-11-22T23:30:00.000,Jewel,Sha-La Studio Xberg,/events/2028498,3
ELECTRO VIBEZ,2024-11-22T00:00:00.000,2024-11-22T22:00:00.000,2024-11-23T05:00:00.000,DJ DRECKISCH,TBA,/events/2030269,3
Midnight Pulse,2024-11-22T00:00:00.000,2024-11-22T20:00:00.000,2024-11-23T04:00:00.000,"OM (COL), dOctOr doms, Roslyn, Westside Bass, Espressivo",Upgrade Bar,/events/2048080,9
"Skaftien #6 / Bana ba Baloyi? (Sorcerer's Children?), Side A",2024-11-22T00:00:00.000,2024-11-22T20:00:00.000,2024-11-22T21:30:00.000,,Haus Der Kulturen Der Welt,/events/2038499,2
Neumatic Parlo + Zukunft at Kulturhaus Insel,2024-11-22T00:00:00.000,2024-11-22T19:00:00.000,2024-11-22T23:59:00.000,,Insel der Jugend,/events/2042005,2
Italo Disco Sprizz con Audio Vacanze,2024-11-22T00:00:00.000,2024-11-22T20:00:00.000,2024-11-23T03:00:00.000,Audio Vacanze,Marmorbar,/events/2047080,3
Techno Friday,2024-11-22T00:00:00.000,2024-11-22T23:00:00.000,2024-11-23T06:00:00.000,"Felix Herrmann, Kennysutra, mølly (on molly)",Recede Club Berlin,/events/2047983,3
Pilar Jordan - Live,2024-11-22T00:00:00.000,2024-11-22T21:00:00.000,2024-11-23T01:00:00.000,Pilar Jordan,House of Gin,/events/2035635,1
TAU „Chants' Release Show,2024-11-22T00:00:00.000,2024-11-22T19:30:00.000,2024-11-23T22:00:00.000,,Panke,/events/2037541,1
Stimmen in Aspik - Die Schlager-Party,2024-11-22T00:00:00.000,2024-11-22T21:00:00.000,2024-11-23T05:00:00.000,,Hafenbar Berlin,/events/2040991,1
Techno Moon Night - Friday,2024-11-22T00:00:00.000,2024-11-22T22:00:00.000,2024-11-23T06:00:00.000,,Soda Club,/events/2023110,0
Retro Future Party,2024-11-22T00:00:00.000,2024-11-22T21:00:00.000,2024-11-23T04:00:00.000,,Eschschloraque,/events/2039268,0
SOUL SISTERS,2024-11-22T00:00:00.000,2024-11-22T23:00:00.000,2024-11-24T06:00:00.000,ECE EKREN,Georgia Bar,/events/2048864,0
Sonic Interventions Album Release 'Do You Remember?',2024-11-23T00:00:00.000,2024-11-23T19:00:00.000,2024-11-24T02:00:00.000,,TBA - near Jannowitzbrüke,/events/2036108,103
"PRXMTY x SPANDAU20 w/ FJAAK, Helena Hauff, Elli Acula, Matrixxman, DJ Fuckoff, DJ AYA, Maara",2024-11-23T00:00:00.000,2024-11-23T23:59:00.000,2024-11-25T08:00:00.000,"Anna Z., Dajusch, Elli Acula, FJAAK, Glaskin, Helena Hauff, J.Manuel, Matrixxman, P.E.A.R.L., DJ AYA, DJ Fuckoff, Maara, Young Lychee",RSO.BERLIN,/events/2011864,1461
"DUALISM with BAUGRUPPE90, KLING&KLANG, Mareike Bautz",2024-11-23T00:00:00.000,2024-11-23T23:00:00.000,2024-11-24T09:00:00.000,"BAUGRUPPE90, KLING&KLANG, Alex.Do, Mareike Bautz, H369, SACID, Sylvie Maziarz, Punani, Nomi Elektra, clju_2k, Zoanthropiia",://about blank,/events/2002222,1152
"Farewell Watergate: Andhim, Henrik Schwarz Live, Vertere Berlin - MORE TICKETS AT THE DOOR",2024-11-23T00:00:00.000,2024-11-23T23:00:00.000,2024-11-24T10:00:00.000,"Andhim, Henrik Schwarz, Fiona Kraft, Wolfram, Marie Lung, Basic Instinct, ZELIA",Watergate,/events/2004392,885
Overdose Berlin // EUPHORIA,2024-11-23T00:00:00.000,2024-11-23T23:00:00.000,2024-11-24T08:00:00.000,"DETOXX, Space Cabaret, Cruxado, PHLOXO, Anubix, Crytech, Sonic Slice, Oscar Diaz",Recede Club Berlin,/events/2044765,637
Township Rebellion,2024-11-23T00:00:00.000,2024-11-23T22:00:00.000,2024-11-24T04:00:00.000,Township Rebellion,Kesselhaus,/events/1934530,521
"Knock Knock 3 Years with Nikolina, OCD, Specific Objects, KK Residents",2024-11-23T00:00:00.000,2024-11-23T22:00:00.000,2024-11-24T10:00:00.000,"NIKOLINA_, Specific Objects, OCD, Indigo Plateaux, Dillon Lucas, Luli Panasci, NIØ (DE), DJ.P, Aamun Koi, Dirty Runners, B.A.O., KLEA",TBA - secret Bunker Alexanderplatz ,/events/2023166,386
"WohnzimmerTechno X ONYX w/ Ephy Pinkman, Nonameleft, Mehr is Mehr, Konfusia, Flanko, Techmo",2024-11-23T00:00:00.000,2024-11-23T23:00:00.000,2024-11-24T08:00:00.000,"Ephy Pinkman, Konfusia, Flanko, Mehr is Mehr, Techmo, Ele Luz, Riana Holley, Hurts, dj.da.li, TMR (DE), Upzet",Void Club,/events/2010734,368
Klubnacht,2024-11-23T00:00:00.000,2024-11-23T23:59:00.000,2024-11-25T06:00:00.000,"Stef Mendesidis, Alienata, BLANKA, Chami, François X, Justine Perry, Kr!z, Fadi Mohem, Avalon Emerson, Gallegos, Luzie, Man Power, Nikola, Ogazón, Stella Zekri",Berghain | Panorama Bar | Säule,/events/2015526,329
Candyflip,2024-11-23T00:00:00.000,2024-11-23T23:00:00.000,2024-11-24T10:00:00.000,"TERRA TWIINS, 22 Interns, Montezuma (DE), Zaphy, Maschérie, DJ Flink, HiHat",ÆDEN,/events/1917983,320
ANIMA Records: Label Party (10€),2024-11-23T00:00:00.000,2024-11-23T23:00:00.000,2024-11-24T08:00:00.000,"Blenk, Blue Hour, KHAS, Pierce (GE), DJ ALKARLINE, X-S (DE), Daisy Weweh, ogtrues",Kreuzwerk,/events/2010609,306
EUPHORIK,2024-11-23T00:00:00.000,2024-11-23T23:00:00.000,2024-11-24T09:00:00.000,"Sofie Sapuna, TANJA MIJU, DTEXX, SIKXTO, Trancestrudel, Filialleiter, Ivana Parti, cell1, Ėrrør.A",Lokschuppen Berlin,/events/2036617,202
IN A (LOVELY) MOOD,2024-11-23T00:00:00.000,2024-11-23T23:00:00.000,2024-11-24T07:00:00.000,"Meg10, HEDDA, Aimé, faceblindbabe, DJ Sprudel, lil ja, Mische",Fitzroy,/events/1976683,158
kickin' up dust pres. LOVEDANCIN',2024-11-23T00:00:00.000,2024-11-23T23:00:00.000,2024-11-24T08:00:00.000,"Blaze, Tom Kutsche, Imad, BLVSH, Triqi, Ká (DE), INVERNO, hripsime",OXI,/events/2001898,167
Kater x NEST & Techno Obst,2024-11-23T00:00:00.000,2024-11-23T22:00:00.000,2024-11-24T22:00:00.000,"Jil Tanner, Peter Schumann, Bo Irion, Redshape, Alison Swing, Bent, Dj handbag, Hideto Omura, Qualia Trax, Body Electric, Dave Dinger, lisa luka, Nick Ta Mere, Tom Nowa",Kater Blau,/events/2026711,145
"bounce w/ Jessica Nightlife, berlintrackservant, Michal Zietara a.o",2024-11-23T00:00:00.000,2024-11-23T23:00:00.000,2024-11-24T08:00:00.000,"Jessica Nightlife, Michal Zietara, berlintrackservant, Hannie Phi, SENERGI, Ines Cartas, DJ Volley, DJ Sonallee, THEO (DE)",M01,/events/2032474,127
Klub Sintesi,2024-11-23T00:00:00.000,2024-11-23T23:00:00.000,2024-11-24T10:00:00.000,"Turbine, Lars Hemmerling, Manuel Di Martino, Monotone (2), Davide Brosco, Matteo Gamba",AVA Club,/events/2016635,133
"System Error with Salty DJ, Frozilla, Santa Valentina, Noirnor, Viikatory, Stella Kraft ",2024-11-23T00:00:00.000,2024-11-23T23:00:00.000,2024-11-24T08:00:00.000,"Noirnor, Salty DJ, SOCIAL VLAD, Travis or Alice, Viikatory, Santa Valentina, Frozilla, Yard Customer, Stella Kraft, Robin RB",Renate,/events/1984958,126
Tresor meets Surgeon,2024-11-23T00:00:00.000,2024-11-23T23:00:00.000,2024-11-24T09:00:00.000,"Sven von Thülen, Beatrice (DE), Kerrie, RS Tangent, Surgeon",Tresor / Globus,/events/2014492,91
"CRAZY Vol. 4 pres. BACK to BACK by M-BIA, 24 Artists",2024-11-23T00:00:00.000,2024-11-23T23:00:00.000,2024-11-24T09:00:00.000,"John Kotti, Till Krimsen, Daora, DJ_S.A.I.D, DaSoMaZo, Popsen, 20_5_3_8_14_15, Kopflos, DJ BenGalo, Mikadoo (2), MØABEAT, L X S, Emma (8)",M-BIA,/events/2037908,78
"Cosmic Circuit with Telephones, Maze & More",2024-11-23T00:00:00.000,2024-11-23T23:00:00.000,2024-11-24T07:00:00.000,"Telephones, Maze DJ, Cosmic Cherry, Ansonica, Eclectic Elektra, Jana Falcon",Zur Klappe,/events/2032136,72
Breakfast Club x Dub&Dal Fundraiser,2024-11-23T00:00:00.000,2024-11-23T12:00:00.000,2024-11-23T23:59:00.000,"FridaY (DE), Falyakon, Juba, O.M.Theorem, Notte Infinita, yungfya",Giri,/events/2038523,62
"CLUB DIGITAL 009: Vlada, C3D-E [live], PLO Man",2024-11-23T00:00:00.000,2024-11-23T23:59:00.000,2024-11-24T07:00:00.000,"Vlada, C3D-E, PLO Man",OHM,/events/2040029,61
Slow Life Showcase,2024-11-23T00:00:00.000,2024-11-23T23:00:00.000,2024-11-24T11:00:00.000,"DJ Tree, KINO (UY), Laurine, Cecilio, Paul Kine, S.Moreira",Hoppetosse,/events/2011744,54
SugarCubes Vol.3,2024-11-23T00:00:00.000,2024-11-23T23:00:00.000,2024-11-24T08:00:00.000,"Ash Roy, ALAILA, SAGAN, Bellville",Birgit,/events/2027199,54
Kollektiv Moabeat x SPHYNXCAST,2024-11-23T00:00:00.000,2024-11-23T23:59:00.000,2024-11-24T10:00:00.000,"K-H1, Jan Ritter, Parisha, NIKØ, Latnam",Secret Telegram Location Berlin-Neukölln,/events/2038890,52
Das Vinylwohnzimmer,2024-11-23T00:00:00.000,2024-11-23T23:59:00.000,2024-11-24T04:00:00.000,,Emma Pea,/events/2034322,50
Miezekatze,2024-11-23T00:00:00.000,2024-11-23T15:00:00.000,2024-11-23T20:00:00.000,,Kater Blau,/events/2026707,39
"RAW Bambule (House, Techno, 80s, 90s, Pop & Hip Hop)",2024-11-23T00:00:00.000,2024-11-23T22:00:00.000,2024-11-24T06:00:00.000,"Frau Kaufmann, LIZZN, AWSM, Thomas Haak",Cassiopeia,/events/2034320,37
salute,2024-11-23T00:00:00.000,2024-11-23T20:30:00.000,2024-11-23T23:59:00.000,"salute, SHEE",Prince Charles,/events/2040098,37
"BULBUL'S HOUSE PARTY: Nikklaas b2b Better Call Paul, Club Jerome b2b Fast, maxim_jl",2024-11-23T00:00:00.000,2024-11-23T23:00:00.000,2024-11-24T06:00:00.000,"Nikklaas, Better Call Paul, Club Jerome, Fast (DE), maxim_jl",Bulbul Berlin,/events/2015976,36
K-Tree Session 1,2024-11-23T00:00:00.000,2024-11-23T21:00:00.000,2024-11-24T03:00:00.000,"Bam Bam's Boogie, Paolo Pagani, Al_Massimo, DJ Haribo",Urban Spree,/events/2033269,35
Techno Türken - Dinner & Dance - Raki n Roll',2024-11-23T00:00:00.000,2024-11-23T21:00:00.000,2024-11-24T05:00:00.000,"Mattone, SYMN, MEEMA, Vero Standke, The Sorry Entertainers",Bi Nuu,/events/2029486,37
CloseTogether x Humboldthain,2024-11-23T00:00:00.000,2024-11-23T22:00:00.000,2024-11-24T06:00:00.000,Salamandra,Humboldthain Club,/events/2029841,30
"TAKSEER with Noise Diva, BADER, Sabine Salame & Ebaa Monther",2024-11-23T00:00:00.000,2024-11-23T23:00:00.000,2024-11-24T06:00:00.000,"Noise Diva, BADER, Taradud, Paulawar",Panke,/events/2045121,29
Fejká & Ben Lukas Boysen,2024-11-23T00:00:00.000,2024-11-23T22:00:00.000,2024-11-24T09:00:00.000,Fejká,Ritter Butzke,/events/2013503,28
Power House - The Vocals Matter Edition,2024-11-23T00:00:00.000,2024-11-23T22:00:00.000,2024-11-24T06:00:00.000,"DJ Pete, Finn Johannsen",Paloma,/events/2026472,25
RZ Working Hours,2024-11-23T00:00:00.000,2024-11-23T14:00:00.000,2024-11-24T04:00:00.000,"ATEQ, DJ Pipe, Taslo, Laylla Dane, RZ Music Team, Xena",Sonnenraum,/events/2045609,22
Behind the Groove W/ Bob G,2024-11-23T00:00:00.000,2024-11-23T20:00:00.000,2024-11-24T03:00:00.000,"Bob G, Bijon, Bobby Thorpe, Davy's Locker",Orangerie Neukölln,/events/2039626,18
Succulent City,2024-11-23T00:00:00.000,2024-11-23T14:00:00.000,2024-11-23T22:00:00.000,"Christa Belle, Danny Dimanche, Frau Levi",Crack Bellmer,/events/2039906,18
MIKRO + Afterhour,2024-11-22T00:00:00.000,2024-11-22T23:59:00.000,2024-11-23T23:59:00.000,"Audio Werner, Lucas Hulan, Dona, Schneider Lounge, Stessie Tfgn, Enzo Muro, Flo Pirke",Golden Gate,/events/2034204,16
Silencio Locx,2024-11-23T00:00:00.000,2024-11-23T22:00:00.000,2024-11-24T06:00:00.000,"DISTORT (ES), Morphena, ANGEL (3), EMIR-B, Victor Kubin, Bat (US)",Crack Bellmer,/events/2035180,14
"KABUKI Release Party + Azar Jashn, presented by PEGAH",2024-11-23T00:00:00.000,2024-11-23T20:00:00.000,2024-11-24T04:00:00.000,PEGAH,Mokka Mitte Bar / James Simon Park,/events/2039643,15
Skarabaeus meets V,2024-11-23T00:00:00.000,2024-11-23T21:00:00.000,2024-11-24T06:00:00.000,"Anna Kost, HKKPTR, Havl, klangwergkh, THBX",Acud Macht NEU,/events/2006453,13
Hole,2024-11-23T00:00:00.000,2024-11-23T23:00:00.000,2024-11-24T11:00:00.000,"NONTOX Rabbits, RedtomCat",Der Weiße Hase,/events/2035836,13
"archives sonores with Yuri Urano, Maxim Turbo, Ila Moire",2024-11-23T00:00:00.000,2024-11-23T21:30:00.000,2024-11-24T03:00:00.000,"Yuri Urano, Ila Moire",Studio dB,/events/2036155,11
Colours of the Night,2024-11-23T00:00:00.000,2024-11-23T22:00:00.000,2024-11-24T06:00:00.000,Epicx,Insomnia,/events/2026416,10
friends.zone mit Man-L & freunde,2024-11-23T00:00:00.000,2024-11-23T18:00:00.000,2024-11-24T06:00:00.000,Man-L,Minimal Bar,/events/2010082,9
"Sweet Spot /// Electrosexual, Sherø, & DJ Dickey (Doo)",2024-11-23T00:00:00.000,2024-11-23T23:00:00.000,2024-11-24T08:00:00.000,"Electrosexual, Sherø, DJ Dickey Doo",Beate Uwe,/events/2020529,10
The Playhouse: The Dream Playground,2024-11-22T00:00:00.000,2024-11-22T19:30:00.000,2024-11-24T09:00:00.000,,TBA - Secret Location,/events/2022104,9
Trash/80s/90s/Hip Hop and House on two floors,2024-11-23T00:00:00.000,2024-11-23T19:00:00.000,2024-11-24T05:00:00.000,,Promenaden Eck,/events/2031742,7
Phonique,2024-11-23T00:00:00.000,2024-11-23T22:00:00.000,2024-11-24T09:00:00.000,"Phonique, Calypsis, MINJA, ECE EKREN",Ritter Butzke,/events/2013452,6
BLOSSOM,2024-11-23T00:00:00.000,2024-11-23T23:30:00.000,2024-11-24T08:00:00.000,"jewelry, OLIV, Valeria (DE)",Paloma,/events/2013487,5
Brvtalist Pop Up Shop,2024-11-23T00:00:00.000,2024-11-23T14:00:00.000,2024-11-23T20:00:00.000,"Melanie Havens, Skungal, The Brvtalist",R+,/events/2046518,5
DJ Party,2024-11-23T00:00:00.000,2024-11-23T21:00:00.000,2024-11-24T23:59:00.000,xPOLLYx,TBA,/events/2034219,5
Klubnacht,2024-11-23T00:00:00.000,2024-11-23T23:59:00.000,2024-11-24T13:00:00.000,"Jakob Seidensticker, MELINA (3), Andrea Vier, RifRaf",Golden Gate,/events/2034206,3
Techno Moon Night,2024-11-23T00:00:00.000,2024-11-23T22:00:00.000,2024-11-24T06:00:00.000,,Soda Club,/events/2023119,2
"AFOM presents Mx Sür, Slim Girl Fat, Zozo",2024-11-23T00:00:00.000,2024-11-23T22:30:00.000,2024-11-24T07:00:00.000,"Mx. Sür, Slimgirl fat, Zozo",Sameheads,/events/2038432,2
Dirty Romantics Exhibition: LEOBLU // Mustelide // Living under a rock,2024-11-23T00:00:00.000,2024-11-23T18:00:00.000,2024-11-23T22:00:00.000,"LEOBLU, Mustelide",Donaustr. 40,/events/2046628,2
Jessica Pavone // Matsuno/Parkins/Filippou/Black,2024-11-23T00:00:00.000,2024-11-23T20:30:00.000,2024-11-23T23:59:00.000,PureData,Ausland,/events/2004870,1
Sky-Bar Warmup - Free Entrance - Soulful Electronica,2024-11-23T00:00:00.000,2024-11-23T18:00:00.000,2024-11-24T02:00:00.000,,Solar,/events/2033236,1
TAU „Chants' Release Show,2024-11-22T00:00:00.000,2024-11-22T19:30:00.000,2024-11-23T22:00:00.000,,Panke,/events/2037541,1
Hoch hinaus mit...Afterhour Sounds x Fisaco Kollektiv,2024-11-23T00:00:00.000,2024-11-23T18:00:00.000,2024-11-24T03:00:00.000,"Francesca, Simml, Seebo",Klunkerkranich,/events/2041055,1
"AFTERHOUR SOUNDS x FIASCO KOLLEKTIV w. arkardiusz., bebibelli, francesa, nurmiri, Simml & Seebo",2024-11-23T00:00:00.000,2024-11-23T18:00:00.000,2024-11-24T03:00:00.000,"Arkadiusz Dmytrow, Francesca, Simml, Seebo",Klunkerkranich,/events/2042905,1
'Bass is declared and Rave has come down' – Dub Intervention,2024-11-23T00:00:00.000,2024-11-23T21:00:00.000,2024-11-24T04:00:00.000,ED2000,Eschschloraque,/events/2043815,1
Zu Mir Oder Zu Dir,2024-11-23T00:00:00.000,2024-11-23T19:00:00.000,2024-11-24T04:00:00.000,Champagner.Jannick,Zu Mir Oder Zu Dir,/events/2048769,3
Alonso - Live,2024-11-23T00:00:00.000,2024-11-23T21:00:00.000,2024-11-24T01:00:00.000,,House of Gin,/events/2035637,0
The Serfs - Nylon Club - Schwund,2024-11-23T00:00:00.000,2024-11-23T20:00:00.000,2024-11-24T00:00:00.000,,Neue Zukunft,/events/2038280,0
"Skaftien #6 / Bana ba Baloyi? (Sorcerer's Children?), Side B",2024-11-23T00:00:00.000,2024-11-23T20:00:00.000,2024-11-23T21:30:00.000,,Haus Der Kulturen Der Welt,/events/2038508,0
Shortwave Listening - poems & prophecies - EP release,2024-11-23T00:00:00.000,2024-11-23T18:00:00.000,2024-11-23T23:00:00.000,,TBA -  ARK - Cliftonville Cultural Space,/events/2039395,0
kabuki,2024-11-23T00:00:00.000,2024-11-23T20:00:00.000,2024-11-24T04:00:00.000,PEGAH,Mokka Mitte Bar / James Simon Park,/events/2041779,0
**Chargers vs Bengals Live Streamn On TV,2024-11-23T00:00:00.000,2024-11-23T23:00:00.000,2024-11-24T06:00:00.000,,U,/events/2045265,0
Chargers vs Bengals Live Streamn On TV Nfl Game Today,2024-11-23T00:00:00.000,2024-11-23T23:00:00.000,2024-11-24T06:00:00.000,,Ä,/events/2045269,0
NFL-GAME@Los Angeles Chargers game today LIVE STREAMN,2024-11-23T00:00:00.000,2024-11-23T23:00:00.000,2024-11-24T06:00:00.000,,Freudenzimmer II,/events/2045291,0
TECHNOCUMBIA & GALLINA BLANCA,2024-11-23T00:00:00.000,2024-11-23T20:00:00.000,2024-11-24T01:00:00.000,"orti, Hurtado",Dream Baby Dream,/events/2048599,0
SOUL SISTERS,2024-11-22T00:00:00.000,2024-11-22T23:00:00.000,2024-11-24T06:00:00.000,ECE EKREN,Georgia Bar,/events/2048864,0
Candylicious,2024-11-23T00:00:00.000,2024-11-23T23:00:00.000,2024-11-24T10:00:00.000,"1luu, DJ Achim Feuervogel",OST,/events/2049125,0
"PRXMTY x SPANDAU20 w/ FJAAK, Helena Hauff, Elli Acula, Matrixxman, DJ Fuckoff, DJ AYA, Maara",2024-11-23T00:00:00.000,2024-11-23T23:59:00.000,2024-11-25T08:00:00.000,"Anna Z., Dajusch, Elli Acula, FJAAK, Glaskin, Helena Hauff, J.Manuel, Matrixxman, P.E.A.R.L., DJ AYA, DJ Fuckoff, Maara, Young Lychee",RSO.BERLIN,/events/2011864,1461
POWER – High Voltage Body Movement w/ Very Special Guests,2024-11-24T00:00:00.000,2024-11-24T14:00:00.000,2024-11-25T06:00:00.000,Power Squad,Watergate,/events/2006727,358
Klubnacht,2024-11-23T00:00:00.000,2024-11-23T23:59:00.000,2024-11-25T06:00:00.000,"Stef Mendesidis, Alienata, BLANKA, Chami, François X, Justine Perry, Kr!z, Fadi Mohem, Avalon Emerson, Gallegos, Luzie, Man Power, Nikola, Ogazón, Stella Zekri",Berghain | Panorama Bar | Säule,/events/2015526,329
"Rafiki Daytime Jam w/ Sally C, Jamz Supernova",2024-11-24T00:00:00.000,2024-11-24T14:00:00.000,2024-11-24T23:00:00.000,"Sally C, Jamz Supernova, moe., Khadija (DE), Anele, Njeri, Katerinha",Prince Charles,/events/2007148,161
Kater x NEST & Techno Obst,2024-11-23T00:00:00.000,2024-11-23T22:00:00.000,2024-11-24T22:00:00.000,"Jil Tanner, Peter Schumann, Bo Irion, Redshape, Alison Swing, Bent, Dj handbag, Hideto Omura, Qualia Trax, Body Electric, Dave Dinger, lisa luka, Nick Ta Mere, Tom Nowa",Kater Blau,/events/2026711,145
TRIG,2024-11-24T00:00:00.000,2024-11-24T23:00:00.000,2024-11-25T08:00:00.000,"Camilla Tarantino, EdgE (UK)",AVA Club,/events/2030612,99
Music 4 Lebanon & Palestine,2024-11-24T00:00:00.000,2024-11-24T15:00:00.000,2024-11-25T00:00:00.000,"klu (US), Hanoosh, jivi2mebaby, Aalia Iraki, Arnav",Crack Bellmer,/events/2041002,71
Layang Layang: Kretekklang's Sunday Afternoon,2024-11-24T00:00:00.000,2024-11-24T14:00:00.000,2024-11-24T22:00:00.000,"Mumu, xoxo (2)",OXI,/events/2027993,30
No Input - Pop up,2024-11-24T00:00:00.000,2024-11-24T15:00:00.000,2024-11-24T22:00:00.000,"Waleed, Leone Knight, Dick Jockey, TONE (UK), Tom Kraft",Giri,/events/2041060,31
HEYDAY,2024-11-24T00:00:00.000,2024-11-24T12:00:00.000,2024-11-24T23:59:00.000,"Najeh, Ben Balance, Annyrock, Thabo, Aimé You, MA.RVN",ÆVE,/events/2033680,25
://saunagarten premiere,2024-11-24T00:00:00.000,2024-11-24T14:00:00.000,2024-11-24T22:00:00.000,"Hang Aoki, Ahu, a:tok",://about blank,/events/2046635,27
"Beate Barfuß /// Luca Musto, Mosley Jr, DJ Balaton, Bonjour Ben & Powel",2024-11-24T00:00:00.000,2024-11-24T17:00:00.000,2024-11-25T04:00:00.000,"Luca Musto, Powel, Mosley Jr, Bonjour Ben",Beate Uwe,/events/2020533,22
ÀBÁSE - Awakening - Album Release,2024-11-24T00:00:00.000,2024-11-24T19:30:00.000,2024-11-24T23:00:00.000,,Gretchen,/events/1989883,20
Nachspiel,2024-11-24T00:00:00.000,2024-11-24T08:00:00.000,2024-11-24T17:30:00.000,Daora,KitKatClub,/events/2027924,16
lazy.sunday mit Hypnoize,2024-11-24T00:00:00.000,2024-11-24T18:00:00.000,2024-11-25T05:00:00.000,Hypnoize,Minimal Bar,/events/2010084,11
