Sundays::,2022-05-15T00:00:00.000,2022-05-15T12:00:00.000,2022-05-16T09:00:00.000,"André Galluzzi, Clovis, Marc Schneider, Wareika",Club der Visionaere,/events/1534022,10
Air Trance Communication,2022-05-15T00:00:00.000,2022-05-15T18:00:00.000,2022-05-16T09:00:00.000,"Francesco Farfa, Mattia Lapucci, Domenico Rosa, Bakked, Intheismah, Niff",Hoppetosse,/events/1532118,7
"Beate Barfuß with naroma, Mikal Aton, Tsali, Numeraki",2022-05-15T00:00:00.000,2022-05-15T18:00:00.000,2022-05-16T04:00:00.000,,Beate Uwe,/events/1524739,7
Kitchen Plug,2022-05-15T00:00:00.000,2022-05-15T18:30:00.000,2022-05-16T03:00:00.000,,Repeat,/events/1535012,5
lazy.sunday mit Robot Girl,2022-05-15T00:00:00.000,2022-05-15T18:00:00.000,2022-05-16T06:00:00.000,Robot Girl,Minimal Bar,/events/1525145,5
Zuckerzauber Opening Open Air,2022-05-15T00:00:00.000,2022-05-15T18:00:00.000,2022-05-16T06:00:00.000,"Geju, Monkyman, Arnau Amatista, Arnau",Zuckerzauber,/events/1534042,4
singularity / indoor party + outdoor chill area,2022-05-16T00:00:00.000,2022-05-16T23:00:00.000,2022-05-17T10:00:00.000,"Dave DK, Marc Schneider, Daniela Cast, Mario Worgall",Re:mise,/events/1526596,106
Electric Monday@KitKat,2022-05-16T00:00:00.000,2022-05-16T22:00:00.000,2022-05-17T07:00:00.000,"David Delgado, Frankie Flowerz",KitKatClub,/events/1520967,18
WEM GEHÖRT DIE NACHT,2022-05-16T00:00:00.000,2022-05-16T19:00:00.000,2022-05-16T22:00:00.000,"SENU, SLIC Unit",://about blank,/events/1532176,6
manic.monday mit Vincent Obrien,2022-05-16T00:00:00.000,2022-05-16T18:00:00.000,2022-05-17T06:00:00.000,,Minimal Bar,/events/1521556,4
HERMETO PASCOAL,2022-05-16T00:00:00.000,2022-05-16T19:30:00.000,2022-05-16T22:00:00.000,,Gretchen,/events/1532216,3
Sundowner,2022-05-16T00:00:00.000,2022-05-16T15:00:00.000,2022-05-17T06:00:00.000,"Daan Donk, Frozilla, Ines Cartas, SHAQUE",Club der Visionaere,/events/1535571,2
encore.une.fois,2022-05-17T00:00:00.000,2022-05-17T23:00:00.000,2022-05-18T10:00:00.000,"Sven Weisemann, Sven von Thülen, Magda El Bayoumi, Nina Pixel",ÆDEN,/events/1526740,146
Sevdaliza,2022-05-17T00:00:00.000,2022-05-17T19:30:00.000,2022-05-17T23:00:00.000,Sevdaliza,Metropol,/events/1468265,53
THE UNKNOWN,2022-05-17T00:00:00.000,2022-05-17T22:00:00.000,2022-05-18T04:00:00.000,"Johnny Legato, Fabrikulus",Süss War Gestern,/events/1525344,17
Open Decks & Tischtennis - Open Air & Indoors,2022-05-17T00:00:00.000,2022-05-17T18:00:00.000,2022-05-18T01:00:00.000,,Humboldthain Club,/events/1529399,3
GHOST-NOTE // CANCELLED,2022-05-17T00:00:00.000,2022-05-17T19:30:00.000,2022-05-17T22:00:00.000,,Gretchen,/events/1532220,3
go.play mit Aramis,2022-05-17T00:00:00.000,2022-05-17T18:00:00.000,2022-05-18T06:00:00.000,,Minimal Bar,/events/1521557,3
The Swag Jam: Berlin's finest live hip hop jam session,2022-05-17T00:00:00.000,2022-05-17T20:00:00.000,2022-05-18T03:00:00.000,Otis Mensah,Badehaus Berlin,/events/1532008,2
Deepnosis,2022-05-17T00:00:00.000,2022-05-17T15:00:00.000,2022-05-18T06:00:00.000,"Andrea Ferlin, Claudio PRC, Fabio Caria, Suburbial",Club der Visionaere,/events/1535635,1
TRANNYOKE,2022-05-18T00:00:00.000,2022-05-18T20:00:00.000,2022-05-19T04:00:00.000,,Monster Ronson's Ichiban Karaoke,/events/1521766,92
BLURT (Live) + Primitive Structures (Live),2022-05-18T00:00:00.000,2022-05-18T21:00:00.000,2022-05-18T23:30:00.000,,arkaoda Berlin,/events/1527489,42
Techno Mittwoch,2022-05-18T00:00:00.000,2022-05-18T23:00:00.000,2022-05-19T10:00:00.000,"Basstronauten, TIKOA, Algerics",AVA Club,/events/1525590,35
"Epochē invites Face: Ghini-B, Nicolas Dermen, Kaloustian",2022-05-18T00:00:00.000,2022-05-18T23:00:00.000,2022-05-19T05:00:00.000,"Ghini-B, Nicolas Dermen, Kaloustian",Bulbul Berlin,/events/1526893,29
Symbiotikka at KitKat Club // Marcus Meinhardt / Cotumo,2022-05-18T00:00:00.000,2022-05-18T22:00:00.000,2022-05-19T07:00:00.000,"Marcus Meinhardt, Cotumo, No.TFS",KitKatClub,/events/1527183,29
Pathways X FOAD,2022-05-18T00:00:00.000,2022-05-18T21:00:00.000,2022-05-19T03:00:00.000,"FridaY (DE), Withheld",Repeat,/events/1531421,9
✾ SlowMojo #56 Mattmosphere & Moji ✾,2022-05-18T00:00:00.000,2022-05-18T22:00:00.000,2022-05-19T06:00:00.000,"Moji, Moji Taali",Crack Bellmer,/events/1535461,7
Dulak Showcase 001,2022-05-18T00:00:00.000,2022-05-18T15:00:00.000,2022-05-19T06:00:00.000,"Chak Besh, Christopher Lawrenz, LAWRENZ, Hagel, Pavlicu",Club der Visionaere,/events/1535633,5
mittendrin mit T Kann,2022-05-18T00:00:00.000,2022-05-18T18:00:00.000,2022-05-19T06:00:00.000,,Minimal Bar,/events/1525129,5
BIANCO // PRETTY AVERAGE,2022-05-18T00:00:00.000,2022-05-18T19:00:00.000,2022-05-18T23:59:00.000,,Loophole,/events/1531616,4
Rave am Mittwoch,2022-05-18T00:00:00.000,2022-05-18T23:00:00.000,2022-05-19T06:00:00.000,"DIVISIO, BLUR",M-BIA,/events/1536349,4
IMPULS,2022-05-19T00:00:00.000,2022-05-19T23:59:00.000,2022-05-20T09:00:00.000,"Distant Echoes, Herton, Kim Valmount, Lewis Fautzi, Neele, Sylvie Maziarz",://about blank,/events/1525181,197
Paradise Garage: Reverence,2022-05-19T00:00:00.000,2022-05-19T23:00:00.000,2022-05-20T08:00:00.000,,Renate,/events/1522179,195
Srsq + Riki,2022-05-19T00:00:00.000,2022-05-19T20:00:00.000,2022-05-20T00:00:00.000,,Urban Spree,/events/1494476,120
"Circular Music *Open Air* with Eric D Clark, Nat Wendell, Oliver Raumklang ",2022-05-19T00:00:00.000,2022-05-19T15:00:00.000,2022-05-20T01:00:00.000,"Eric D. Clark, Nat Wendell, Oliver Raumklang, Raphael Kirsch, Paul Hupfer",Sage Beach Berlin,/events/1533742,109
OG Raver - Bunker Rave & Beach Garden,2022-05-19T00:00:00.000,2022-05-19T22:00:00.000,2022-05-20T05:00:00.000,"Mad Hattress, Yami, Just Mo, ABuDi, HiTMiLØW",Salzclub,/events/1522652,76
BDME 2022⎜Berlin Dance Music Event,2022-05-19T00:00:00.000,2022-05-19T00:00:00.000,2022-05-22T23:59:00.000,"Aexhy, Alistair Albrecht, Andreas Henneberg, Baba The Knife, BEC, Bizzarro Universe, Bo (Borzu), C'mon, Catz 'N Dogz, Christian Smith, CIOZ, Dallaniel, Darin Epsilon, Dennis Beutler, Kolter, Dominique Lamee, Einmusik, Elternhouse, Emily Jeanne, Emma Ollivary, Fab Massimo, Felicitas, Frank Heise, Frankyeffe, freedomB, Garance, GiddiBangBang, Glós, Intaktogene, Introversion, Invaria, Jake the Rapper, Joyce Muniz, Katzengold, Kø:lab, Krl Mx, LDS, Local Suicide, Lokier, maltech, Mark Tarmonea, Matchy, Mehr is Mehr, Michael Ritter, Mika Heggemann, Mimi Love, Misanthrop, Namito, Niko Schwind, NÚRIA (DE), OCIN, Otistic, Pazkal, Phace, Philipp Drube, Phineo, Pig&Dan, Punktmidi, Rafael Cerato, Read the News, Robin Schellenberg, Sven Schaller, Teho, Thomas Hoffknecht, Till Antonio, Tim Tama, Timm Schirmer, VABU",TBA - Berlin,/events/1517515,66
PLAYDATE 006 - NOT A NORMAL THURSDAY,2022-05-19T00:00:00.000,2022-05-19T22:00:00.000,2022-05-20T06:00:00.000,"D-JIL, Multifun, SACID, Mavro",Fiese Remise,/events/1531467,63
Berlin Modular Society (live techno),2022-05-19T00:00:00.000,2022-05-19T19:00:00.000,2022-05-20T01:30:00.000,"drusnoise, JacqNoise, Monotrail, Schreibmaschine, Sarah Sommers, Burnside (AU), Optical Collusion",Fitzroy,/events/1528517,47
"Studio with Señora, Esko, Tempestfeather",2022-05-19T00:00:00.000,2022-05-19T18:00:00.000,2022-05-20T04:30:00.000,"Tempestfeather, Señora, Sciarada, Esko",Minimal Bar,/events/1522234,27
"Bulbul - Thursday: Sqim, Benjamin Knows",2022-05-19T00:00:00.000,2022-05-19T23:00:00.000,2022-05-20T05:00:00.000,"Sqim, Benjamin Knows",Bulbul Berlin,/events/1526896,20
Pachamama X Christa Kupfer with Jpattersson LIVE,2022-05-19T00:00:00.000,2022-05-19T22:00:00.000,2022-05-20T04:00:00.000,"Jpattersson, Alma Linda, Audae, Caapi El Mesti, KLAUDIA",Christa Kupfer,/events/1537196,19
Eine Kleine Tanzlustbarkeit,2022-05-19T00:00:00.000,2022-05-19T20:00:00.000,2022-05-20T06:00:00.000,"Eva Be, Clé, Daniel Wang, Martin Landsky, Roland Appel, Rena Volvo, Tiefschwarz, wannadosomething?, Marian Tone",ÆDEN,/events/1529563,16
"Thursdate: Eats Everything pres. Edible Records with Chambray, Maze & Masters",2022-05-19T00:00:00.000,2022-05-19T23:59:00.000,2022-05-20T10:00:00.000,"Eats Everything, Chambray, Maze & Masters",Watergate,/events/1529617,16
Raumvier 4.1,2022-05-19T00:00:00.000,2022-05-19T22:00:00.000,2022-05-20T07:00:00.000,"X.L.V, DJ Aybee, edgarwilles, The Shredder",KitKatClub,/events/1531894,16
SHrooms - Mindful Live Affairs,2022-05-19T00:00:00.000,2022-05-19T18:00:00.000,2022-05-19T23:00:00.000,DJ Lentil,Else,/events/1535655,14
THE UNKNOWN,2022-05-19T00:00:00.000,2022-05-19T22:00:00.000,2022-05-20T02:00:00.000,disco darnowski,Zu Mir Oder Zu Dir,/events/1525362,13
"Latitude of Attitude: Spring Edition with ELIZA, NIKA, HELLY, ANJA",2022-05-19T00:00:00.000,2022-05-19T22:00:00.000,2022-05-20T06:00:00.000,"Eliza (2), Helly",Crack Bellmer,/events/1531536,10
Moist Liquid Sunrise,2022-05-19T00:00:00.000,2022-05-19T23:00:00.000,2022-05-20T05:00:00.000,"DJ Fett Burger, Hashman Deejay",Paloma,/events/1530975,8
Slow Volante with Lowski & Wiek,2022-05-19T00:00:00.000,2022-05-19T20:00:00.000,2022-05-20T04:00:00.000,WIEK,Marktlokal Klub,/events/1528679,5
Donnerdogge,2022-05-19T00:00:00.000,2022-05-19T23:59:00.000,2022-05-20T13:00:00.000,"Per Hammar, Jana Falcon, Kevin Domanski",Golden Gate,/events/1535022,5
No Disco Future,2022-05-19T00:00:00.000,2022-05-19T15:00:00.000,2022-05-20T06:00:00.000,"Olga Korol, Thomas Melchior",Club der Visionaere,/events/1537034,5
"Baby's Berserk *LIVE, Hara Katsiki, Melizards",2022-05-19T00:00:00.000,2022-05-19T21:00:00.000,2022-05-20T04:00:00.000,"Hara Katsiki, Melizards",Sameheads,/events/1534238,4
"Joanne Robertson, Kool Music & Nein Rodere",2022-05-19T00:00:00.000,2022-05-19T20:00:00.000,2022-05-19T23:30:00.000,,arkaoda Berlin,/events/1535373,4
Berlin Play Date,2022-05-19T00:00:00.000,2022-05-19T20:00:00.000,2022-05-20T03:00:00.000,,Insomnia,/events/1532050,3
'I pray that the days will last they went so fast',2022-05-19T00:00:00.000,2022-05-19T22:00:00.000,2022-05-22T06:00:00.000,,Zur Klappe,/events/1536474,2
NATE SMITH + KINFOLK,2022-05-19T00:00:00.000,2022-05-19T19:30:00.000,2022-05-19T22:00:00.000,,Gretchen,/events/1534345,1
Zen Club Night + Cosmic Thursdays,2022-05-19T00:00:00.000,2022-05-19T22:00:00.000,2022-05-22T05:00:00.000,"Marie Chain, Parallel Processing, Elias Goldmund",Süss War Gestern,/events/1537508,1
Tausend Electronica vol. 9 I KC Wray,2022-05-19T00:00:00.000,2022-05-19T21:00:00.000,2022-05-20T04:00:00.000,KC Wray,Tausend,/events/1530361,0
Brazilian Vibes,2022-05-19T00:00:00.000,2022-05-19T18:00:00.000,2022-05-20T01:00:00.000,Dj Malloy,Solar,/events/1530842,0
Liza Dries + Ariel My Friend,2022-05-19T00:00:00.000,2022-05-19T19:00:00.000,2022-05-20T01:00:00.000,,Loophole,/events/1533132,0
Evopool Update,2022-05-19T00:00:00.000,2022-05-19T14:00:00.000,2022-05-19T18:00:00.000,Chris Maico Schmidt,Evosonic Radio,/events/1536421,0
"ANOMALIE - 3 Year Anniversary w/ Boston 168, Remco Beekwilder, Verschwender, Justine Perry,more",2022-05-20T00:00:00.000,2022-05-20T23:00:00.000,2022-05-21T12:00:00.000,"Boston 168, Remco Beekwilder, Verschwender, Sophie Kah, Marhu, VCO, Laura de Vasconcelos, Sherø",Anomalie Art Club,/events/1521872,693
"Planet Pleasure invites Raiders with AUCO, Desyn, DJOKO, Viikatory, Wendy",2022-05-20T00:00:00.000,2022-05-20T23:59:00.000,2022-05-21T11:00:00.000,"Desyn, Kolter, Thalo Santana, Mari.te, Wendy (FR), AUCO, Tamila, Viikatory, Young Lychee, DJ Fucks Himself",RSO.BERLIN,/events/1517017,515
Kulør x Finest Friday,2022-05-20T00:00:00.000,2022-05-20T22:00:00.000,2022-05-21T06:00:00.000,"Courtesy, DJ IBON, Evian Christ, Reece Cox, Salty DJ, Dj Saliva, Gabber Eleganza, JASSS",Berghain | Panorama Bar | Säule,/events/1521576,323
Betriebsfeier,2022-05-20T00:00:00.000,2022-05-20T23:59:00.000,2022-05-22T12:00:00.000,"Annina, CanDJane, Carina Posse, Chickejacke, Coco, Edgar Peng, Empro, Josephine Wedekind, Leon Licht, ma.ksim, Ronald Christoph, SiD, Tante Emma, THE LUMENS, The Reason Y, Thomas Koob",Hoppetosse,/events/1529436,291
Girls Town x LIBERTINE Clubnight,2022-05-20T00:00:00.000,2022-05-20T23:59:00.000,2022-05-21T07:00:00.000,"Hēi project, DJ Vela",Gretchen,/events/1527226,283
"HARD:FLUX-The Brvtalist, Lee Ann Roberts, Nick Moody, Ôneyra",2022-05-20T00:00:00.000,2022-05-20T22:00:00.000,2022-05-21T10:00:00.000,"The Brvtalist, Lee Ann Roberts, Nick Moody, Jack's trip, Ôneyra",Kesselhaus,/events/1527547,208
Tech It Deep with GUZ & DONT BLINK,2022-05-20T00:00:00.000,2022-05-20T22:00:00.000,2022-05-21T10:00:00.000,"DONT BLINK, Dennis Beutler, Francesco Poggi, Elternhouse, Fab Massimo, GiddiBangBang, Vince Versa, Dynamike",OST,/events/1507285,193
"Rauschen: KAS:ST, Hunter/Game, Black Peters, Mona Moore, CENKK",2022-05-20T00:00:00.000,2022-05-20T23:59:00.000,2022-05-21T12:00:00.000,"KAS:ST, Hunter/Game, Black Peters, Mona Moore, Dennis Kuhl, CENKK",Watergate,/events/1529775,130
OXIfreitag,2022-05-20T00:00:00.000,2022-05-20T22:00:00.000,2022-05-21T12:00:00.000,"Bill Mango, DJ Dustin, Lola Haro, Tornado Wallace, Vlada",OXI,/events/1528140,129
HACK TO LIFE 🪓 Goodbye RReality,2022-05-20T00:00:00.000,2022-05-20T22:00:00.000,2022-05-21T22:00:00.000,"Alex.Do, Anja Zaube, Fennypenny, fr. JPLA, Franklin De Costa, Frinda di Lanco, Hendrik Stein, Meat, MINCO, Miriam Schulte, Nick Höppner, Ruede Hagelstein, Snitch, Sportbrigade Sparwasser, Stype, Sven von Thülen, Terr, Tiner, Toxido Mask, Viperflo, .VRIL, Wasn & Wunderwaffel, Wunderwaffel",://about blank,/events/1523121,80
Catz N Dogz & Joyce Muniz,2022-05-20T00:00:00.000,2022-05-20T23:00:00.000,2022-05-21T10:00:00.000,"Catz 'N Dogz, Joyce Muniz, C'mon, Otistic",Ritter Butzke,/events/1503714,78
Birgits Weekender X BDME Festival,2022-05-20T00:00:00.000,2022-05-20T22:00:00.000,2022-05-22T22:00:00.000,"Pazkal, Juli Lee, Mimi Love, Jake the Rapper, Flanko, Daniel Boon, Garance, Teho, CIOZ, Till Antonio, maltech, Mehr is Mehr, NÚRIA (DE), Katzengold, Michael Ritter, Felix E, Intaktogene, Darin Epsilon, Steve Hope, Sin:port, Maurice Mino",Birgit,/events/1528569,71
BDME 2022⎜Berlin Dance Music Event,2022-05-19T00:00:00.000,2022-05-19T00:00:00.000,2022-05-22T23:59:00.000,"Aexhy, Alistair Albrecht, Andreas Henneberg, Baba The Knife, BEC, Bizzarro Universe, Bo (Borzu), C'mon, Catz 'N Dogz, Christian Smith, CIOZ, Dallaniel, Darin Epsilon, Dennis Beutler, Kolter, Dominique Lamee, Einmusik, Elternhouse, Emily Jeanne, Emma Ollivary, Fab Massimo, Felicitas, Frank Heise, Frankyeffe, freedomB, Garance, GiddiBangBang, Glós, Intaktogene, Introversion, Invaria, Jake the Rapper, Joyce Muniz, Katzengold, Kø:lab, Krl Mx, LDS, Local Suicide, Lokier, maltech, Mark Tarmonea, Matchy, Mehr is Mehr, Michael Ritter, Mika Heggemann, Mimi Love, Misanthrop, Namito, Niko Schwind, NÚRIA (DE), OCIN, Otistic, Pazkal, Phace, Philipp Drube, Phineo, Pig&Dan, Punktmidi, Rafael Cerato, Read the News, Robin Schellenberg, Sven Schaller, Teho, Thomas Hoffknecht, Till Antonio, Tim Tama, Timm Schirmer, VABU",TBA - Berlin,/events/1517515,66
Space Trax Label Night,2022-05-20T00:00:00.000,2022-05-20T23:00:00.000,2022-05-21T09:00:00.000,"Xuri, Frank Heise",ÆDEN,/events/1521897,56
Yellow Mellow,2022-05-20T00:00:00.000,2022-05-20T23:00:00.000,2022-05-21T07:00:00.000,"Poly-Ritmo, DJ Regret, St.Eggs",Christa Kupfer,/events/1530853,50
3 Years of Mystic Creatures,2022-05-20T00:00:00.000,2022-05-20T22:00:00.000,2022-05-22T22:00:00.000,"Marcus Meinhardt, Chris Schwarzwälder, Just Emma, Jacob Groening, Mehr is Mehr, Mila Stern, Bonnie Ford, Annett Gapstream, Lotte Ahoi, Niemand & Keiner, EXZ, AndreVictor, Elias Goldmund, Urem, Sahra Bass, BurnTale, Kotoe, Caapi El Mesti, Suzuki Sinclair, firgun, Musiphile, Simml",Mensch Meier,/events/1529307,46
"Freitag with BNJMN, Hara Katsiki, Luvthang, McKenzie",2022-05-20T00:00:00.000,2022-05-20T23:00:00.000,2022-05-21T12:00:00.000,"BNJMN, Hara Katsiki, Hurtado, Luvthang, McKenzie, Rydim, Sauvage World",Renate,/events/1535110,45
"DURCH with Laven, Carmen Electro, ketia, Fluid, OKKOTO, X.I.R.A, Iva Mechkarova, Kerox & Yoni",2022-05-20T00:00:00.000,2022-05-20T23:59:00.000,2022-05-21T11:00:00.000,"Fluid, X.I.R.A, ketia, Iva Mechkarova, Kerox, Carmen Electro",Re:mise,/events/1529091,41
synthetika002,2022-05-20T00:00:00.000,2022-05-20T20:00:00.000,2022-05-21T06:00:00.000,"Elena Barker, Spacer Woman, Fillo Deportaberta, MIO (ES)",Loophole,/events/1531766,40
Perel (live),2022-05-20T00:00:00.000,2022-05-20T20:00:00.000,2022-05-21T02:00:00.000,"Perel, Infamous Ali",ZENNER,/events/1515687,39
Association of Unison House Nacht,2022-05-20T00:00:00.000,2022-05-20T23:00:00.000,2022-05-21T08:00:00.000,"Per Hammar, Peter Schumann, Dojas, Ruben Keyko",Beate Uwe,/events/1530103,33
Elysion - Techno meets Psytrance,2022-05-20T00:00:00.000,2022-05-20T23:00:00.000,2022-05-21T08:00:00.000,"Dexy's Midnight, OTG(1), Nanno",Humboldthain Club,/events/1535930,32
Borderless Pres. Global Underground,2022-05-20T00:00:00.000,2022-05-20T23:00:00.000,2022-05-21T09:00:00.000,"Tomoki Tamura, zodya, Lowfeli, Lukr Range, Mama Yha Yha, NiKi K, AGENT PROVOCATEUR",AVA Club,/events/1535193,29
Simulation 003 by Club Simulator,2022-05-20T00:00:00.000,2022-05-20T22:00:00.000,2022-05-21T12:00:00.000,"3.14, BMSK, Errata Paranoia, GAEL, Jana Woodstock, Kris Baha, Luna Vassarotti, New Frames, OTHR, Swan Meat, Unhuman, Zanias",Lokschuppen Berlin,/events/1529864,28
Motivo Positivo: Hallo MoPo,2022-05-20T00:00:00.000,2022-05-20T23:30:00.000,2022-05-21T08:00:00.000,"Morphena, No Frills, Ori Raz",Paloma,/events/1524123,27
All Cats Are Blue,2022-05-20T00:00:00.000,2022-05-20T23:59:00.000,2022-05-22T18:00:00.000,"Rosa Luxemburg, Sven Dohse, Miyagi, Moji, RAULITO WOLF, Ena Lind, AIKON, Matthias Meyer, Bonjour Ben, Peter Schumann, Guzy, Lisbird, Femalemacho, Yanakuna, Inke",Kater Blau,/events/1532195,24
Behind the Barricades #3,2022-05-20T00:00:00.000,2022-05-20T20:00:00.000,2022-05-21T09:00:00.000,Osmose,Zukunft am Ostkreuz,/events/1535375,23
CryptoDJs X BDME Rave,2022-05-20T00:00:00.000,2022-05-20T23:00:00.000,2022-05-21T06:00:00.000,"Christian Smith, Pig&Dan, Simina Grigoriu, Thomas Hoffknecht",Ritter Butzke,/events/1526041,21
"All Night Long: Rhode & Brown, Bulbul Residents",2022-05-20T00:00:00.000,2022-05-20T23:00:00.000,2022-05-21T06:00:00.000,"Rhode & Brown, Nikklaas, Better Call Paul",Bulbul Berlin,/events/1526899,21
Bassgeflüster / DME Berlin Festival,2022-05-20T00:00:00.000,2022-05-20T23:00:00.000,2022-05-21T10:00:00.000,"Patrik Berg, Dominik Saltevski, Mathias Birnbaum, Honschu Lee, Felidae",Der Weiße Hase,/events/1535142,26
Sober Sensation,2022-05-20T00:00:00.000,2022-05-20T18:00:00.000,2022-05-21T01:00:00.000,,TBA - Berlin,/events/1536765,19
Dark Rave,2022-05-20T00:00:00.000,2022-05-20T23:00:00.000,2022-05-21T09:00:00.000,"Denny Hanson, RXZN, Eyke",M-BIA,/events/1535005,17
ITALO DISCO - AMORE CANNIBALE,2022-05-20T00:00:00.000,2022-05-20T22:00:00.000,2022-05-21T08:00:00.000,"Escapist, Jungle Mind",Ficken 3000,/events/1532025,15
Tresor Klubnacht,2022-05-20T00:00:00.000,2022-05-20T23:59:00.000,2022-05-21T12:00:00.000,"Moritz von Oswald, JP Enfant, Ina Kacz, Ani Kvirkvelia, Ireen Amnes, Reka, Chloe Lula",Tresor / Globus,/events/1537749,14
LEGS,2022-05-20T00:00:00.000,2022-05-20T23:00:00.000,2022-05-21T07:00:00.000,"Eric D. Clark, Maik Gyver",Marktlokal Klub,/events/1530532,12
IPTAMENOS DISCOTEK *Eros Anikate* Album Release Party,2022-05-20T00:00:00.000,2022-05-20T20:00:00.000,2022-05-21T06:00:00.000,"Local Suicide, Kiki, Italo Brutalo, Bijoutiers, Juarés, CEO Of NovaFuture, Lo Stine",Urban Spree,/events/1535231,12
Sobremesa #10,2022-05-20T00:00:00.000,2022-05-20T21:00:00.000,2022-05-21T09:00:00.000,"Jorge Escribano, Hicham (FR), Sugar Free, Ethel, NITKA",Fitzroy,/events/1527737,11
Sleep Is Commercial invites Noctuary,2022-05-20T00:00:00.000,2022-05-20T15:00:00.000,2022-05-21T09:00:00.000,"Andrea Ferlin, Daylomar, Francesco Assenza, Penelope (2), tamer antabi",Club der Visionaere,/events/1535637,9
GEST Invites 003,2022-05-20T00:00:00.000,2022-05-20T23:00:00.000,2022-05-21T07:00:00.000,"Halogenix, Survey",Void Club,/events/1535908,8
Disko International,2022-05-20T00:00:00.000,2022-05-20T22:00:00.000,2022-05-21T06:00:00.000,Marian Tone,Panke,/events/1532498,7
"Maximum Joy with Audrey Danza, Luigi Di Venere, Metro",2022-05-20T00:00:00.000,2022-05-20T22:00:00.000,2022-05-21T07:00:00.000,"Audrey Danza, Luigi Di Venere",Sameheads,/events/1532512,7
"Smoothin Groovin #6 with Delia Tesi, Pat, Leo K, Tru:L",2022-05-20T00:00:00.000,2022-05-20T22:00:00.000,2022-05-21T06:00:00.000,"Pat, TRU:L",Crack Bellmer,/events/1534372,6
poems w/ Special Guest & Antonio,2022-05-20T00:00:00.000,2022-05-20T23:59:00.000,2022-05-21T08:00:00.000,"Antonio (IT), dérive",Zur Klappe,/events/1534833,6
Highly Addictive,2022-05-20T00:00:00.000,2022-05-20T23:59:00.000,2022-05-21T13:00:00.000,"Pauli Pocket, Jiggler, Slurm McKenzie",Golden Gate,/events/1535027,6
The Smile,2022-05-20T00:00:00.000,2022-05-20T20:00:00.000,2022-05-20T23:00:00.000,,Tempodrom,/events/1501149,6
LAB* Europe – Artlake Berlin Sessions,2022-05-20T00:00:00.000,2022-05-20T18:00:00.000,2022-05-20T23:59:00.000,,TBA - Berlin,/events/1513500,6
Slum Village live,2022-05-20T00:00:00.000,2022-05-20T19:00:00.000,2022-05-20T22:00:00.000,,Cassiopeia,/events/1511203,5
Hell Yeah Recordings presents Buena Onda - Balearic Beats,2022-05-20T00:00:00.000,2022-05-20T22:00:00.000,2022-05-21T06:00:00.000,"Chris Coco, Gallo",Paloma,/events/1527249,5
Pep Talk with Karina,2022-05-20T00:00:00.000,2022-05-20T22:00:00.000,2022-05-21T06:00:00.000,Karina,TBA - Berlin,/events/1529720,4
OVERDUE,2022-05-20T00:00:00.000,2022-05-20T22:00:00.000,2022-05-21T06:00:00.000,"Anna Schreit, LUCKER, OCIN",Süss War Gestern,/events/1533780,4
sturmfrei mit Ian Fog & Freunde,2022-05-20T00:00:00.000,2022-05-20T18:00:00.000,2022-05-21T06:00:00.000,,Minimal Bar,/events/1520712,4
unser Freitag im Promenaden Eck,2022-05-20T00:00:00.000,2022-05-20T19:00:00.000,2022-05-21T06:00:00.000,Konstantin Scharf,Promenaden Eck,/events/1530445,3
The Third Half - Das Andere Selbst / Artetetra / Communion Showcase,2022-05-20T00:00:00.000,2022-05-20T20:00:00.000,2022-05-21T08:00:00.000,"Delmore FX, Delmore FX",Backsteinboot,/events/1536773,3
Moonbootica at Kulturgarten Open Air,2022-05-20T00:00:00.000,2022-05-20T18:00:00.000,2022-05-20T23:00:00.000,Moonbootica,Ritter Butzke,/events/1532237,2
GEST INVITES 003: Halogenix,2022-05-20T00:00:00.000,2022-05-20T23:59:00.000,2022-05-22T07:00:00.000,Halogenix,BER,/events/1535926,2
'I pray that the days will last they went so fast',2022-05-19T00:00:00.000,2022-05-19T22:00:00.000,2022-05-22T06:00:00.000,,Zur Klappe,/events/1536474,2
Kiezsalon opening with Tarta Relena & Jason Sharp,2022-05-20T00:00:00.000,2022-05-20T19:00:00.000,2022-05-20T23:00:00.000,,Zionskirche,/events/1526558,2
Chains & Whips,2022-05-20T00:00:00.000,2022-05-20T22:00:00.000,2022-05-21T06:00:00.000,,Insomnia,/events/1529855,1
Sippin & Dippin,2022-05-20T00:00:00.000,2022-05-20T23:00:00.000,2022-05-21T05:00:00.000,"Femdelic, Boogie Dan",Monarch,/events/1533805,1
BERLIN BEACH BASH,2022-05-20T00:00:00.000,2022-05-20T16:00:00.000,2022-05-20T22:00:00.000,,Gestrandet An Der Jannowitzbrücke,/events/1535873,1
Anakonda meets Berlin,2022-05-20T00:00:00.000,2022-05-20T23:00:00.000,2022-05-21T04:00:00.000,"Miguel Silva, Radio Cucu",TBA - Berlin,/events/1536017,1
Zen Club Night + Cosmic Thursdays,2022-05-19T00:00:00.000,2022-05-19T22:00:00.000,2022-05-22T05:00:00.000,"Marie Chain, Parallel Processing, Elias Goldmund",Süss War Gestern,/events/1537508,1
Temporament,2022-05-20T00:00:00.000,2022-05-20T18:00:00.000,2022-05-21T01:00:00.000,,Solar,/events/1530847,0
Che Per Crew mit Nico,2022-05-20T00:00:00.000,2022-05-20T18:00:00.000,2022-05-21T01:00:00.000,,House of Gin,/events/1530917,0
Evopool Update,2022-05-20T00:00:00.000,2022-05-20T14:00:00.000,2022-05-20T18:00:00.000,Chris Maico Schmidt,Evosonic Radio,/events/1536423,0
Cave Noir,2022-05-20T00:00:00.000,2022-05-20T23:00:00.000,2022-05-22T06:00:00.000,,The Pearl,/events/1536814,0
SALI & TABACCHI N°5,2022-05-20T00:00:00.000,2022-05-20T21:00:00.000,2022-05-22T06:00:00.000,BioN,Old CCCP,/events/1537379,0
ANONŸM,2022-05-21T00:00:00.000,2022-05-21T23:00:00.000,2022-05-22T10:00:00.000,"Tim Tama, Krl Mx, Kø:lab, Punktmidi, Dominique Lamee, Der Schaffner, Aexhy, Dallaniel, Timm Schirmer",OST,/events/1509540,854
BCCO Open Air,2022-05-21T00:00:00.000,2022-05-21T14:00:00.000,2022-05-21T22:00:00.000,"Setaoc Mass, future.666, WINDFUHR, BLANKA",Sage Club,/events/1513667,519
PHYSIS,2022-05-21T00:00:00.000,2022-05-21T18:00:00.000,2022-05-22T06:00:00.000,,Trauma Bar und Kino,/events/1532840,317
Betriebsfeier,2022-05-20T00:00:00.000,2022-05-20T23:59:00.000,2022-05-22T12:00:00.000,"Annina, CanDJane, Carina Posse, Chickejacke, Coco, Edgar Peng, Empro, Josephine Wedekind, Leon Licht, ma.ksim, Ronald Christoph, SiD, Tante Emma, THE LUMENS, The Reason Y, Thomas Koob",Hoppetosse,/events/1529436,291
BCCO,2022-05-21T00:00:00.000,2022-05-21T22:00:00.000,2022-05-22T14:00:00.000,"TWR72, Rakans, future.666, CLTX, Delano Legito, Kashpitzky, Arbitrage, ciaocacao, slin",Re:mise,/events/1513668,270
Klubnacht,2022-05-21T00:00:00.000,2022-05-21T23:59:00.000,2022-05-23T06:00:00.000,"Terence Fixmer, Fadi Mohem, Fred Hush, Key Clef, madwoman, Norman Nodge, Phase Fatale, Van Anh, Lakuti, Marie Malarie, Roman Flügel, Ryan Elliott, Sedef Adasï, Ciel, Soundstream",Berghain | Panorama Bar | Säule,/events/1521577,187
El Cumpleañito,2022-05-21T00:00:00.000,2022-05-21T23:59:00.000,2022-05-22T05:00:00.000,,Belushi's Berlin (Mitte),/events/1530080,181
"Machine Hours (Open Air + Indoor) w/ Shed, Introversion, LDS, Emily Jeanne",2022-05-21T00:00:00.000,2022-05-21T15:00:00.000,2022-05-22T10:00:00.000,"Shed, Emily Jeanne, Glós, Introversion, LDS, CRYME, DJ Saunameister, Cryptofauna, N.R.M",ÆDEN,/events/1523337,180
